"Two new members of #TeamPeters helped us out today, my staffer Chris’ sons. Great to have them in the office for… "
.@HistoricVehicle Thanks @senrobportman for joining me in supporting this bill that helps preserve American auto hi… 
.@HistoricVehicle I’m honoring the cultural &amp; economic impact cars have had on America by introducing the bipartisa… 
Stopped by @HistoricVehicle #CarsAtTheCapital to take a look at American auto history like the McGee Roadster 1932… 
This bipartisan bill would require federal agencies to preserve public access to datasets &amp; prevent the removal of existing open datasets
That is why @SenCoryGardner &amp; I have intro’d the Preserving Data in Government Act to protect taxpayer-funded research
"Scientists, farmers and small business owners rely on this data for everything from long-term planning to innovative product development"
Research data that has been collected using taxpayer dollars should be publicly accessible and easily searchable
"Pres @jeffabernathy of my alma mater @almacollege is working w colleges in MI to support veterans seeking degrees,… "
Today is World IP Day- Proud to join @SenatorRisch in protecting small business IP with our Small Business Innovati… 
.@SETCVD_WG Commitment to science is especially critical now as Trump Administration rolls back science based polic… 
Honored to receive the @SETCVD_WG George E. Brown Science Award for my work to advance science &amp; research in the U.… 
Met w @WWP to discuss improving veterans’ access to care. Thank you for your service &amp; for continuing to fight for… 
Congrats to Jadal &amp; Taimor @a2HuronHigh @PTOCouncil for your academic success! Thx for representing MI so well. 
"President Trump said he'd “Buy American, Hire American” but he isn't leading by example  #BrokenPromises "
Great meeting with @michiganstateu Education Policy Fellows who are working to shape the future of education &amp; prep… 
"From meeting w constituents to committee hearings &amp; floor speeches, it was great showing @NickMinock what a day in… "
Had a lively discussion on politics &amp; policy w @CMUniversity students tonight. Future is in good hands w these soon… 
Today we remember the 1.5 million Armenians who were murdered or marched to their death 102 years ago during the Armenian Genocide.
Great discussion w @MichiganIsrael defense trade mission. MI &amp; Israel defense sectors are working together to keep… 
Today on Yom HaShoah we remember the six millions Jews &amp; millions more murdered by the Nazis in the Holocaust. #NeverForget &amp; #NeverAgain
Great to welcome my friend &amp; colleague @SenWarren to MI for @DETROITNAACP Fight for Freedom Fund Dinner! 
Proud to celebrate #EarthDay by fighting for the Great Lakes &amp; standing with the countless Americans who march for… 
"3,500 MI patients are waiting for an organ transplant. You can help by joining the donor registry, visit… "
ICYMI via 9&amp;10 News: “Peters visits Gladwin County dairy farm to better understand the challenges Michigan farms fa… 
Proud to cosponsor bill creating nat’l registry for firefighters suffering from cancer. Data will help ID preventiv… 
Eliminating the Essential Air Service would have disastrous economic effects on rural communities throughout Michig… 
"Airports are critical economic lifelines for rural communities, boosting tourism &amp; allowing people to sell goods &amp; services in more markets"
Congratulations to @MichStatePolice on 100 years of service to our state. Thank you for protecting our communities… 
Proud to cosponsor bill requiring the VA to provide better access to services for women veterans like maternity &amp; n… 
"More women than ever are serving our nation in combat, but the VA is behind in providing services to meet the needs of women veterans."
ICYMI via @wwmtnews: “Peters visits Kalamazoo YWCA to highlight bill protecting woman and pets from domestic violen… 
Trump’s proposed budget includes dangerous cuts to key water infrastructure programs that Michiganders rely on for… 
"Great taking part in @CMUniversity Griffin Policy forum, discussing how to address the challenges we're facing - lo… "
Congratulations to @PAKymWorthy 
I’m working to ensure farmers have access to capital through affordable loan options like the Farm Service Agency’s… 
"The MSU Extension is working w Iciek farm to mentor students, farmers &amp; local businesses who are interested in large-scale dairy operations."
It was great to be at the Iciek Dairy Farm in Gladwin to see firsthand this family-owned dairy operation that helps… 
"I'm committed to fighting a/g closure of EPA Region 5 office, which would threaten Great Lakes &amp; public health in MI "
Happy Easter! Hope all those celebrating are enjoying blessed and special time with family and friends.
Americans' health care should never be used as a political bargaining chip! 
"On this historically significant day for Sikhs, I’m wishing our Sikh American friends &amp; neighbors a happy #Vaisakhi"
It's #NationalParksWeek! Isle Royale is one of the most treasured places in MI. What’s your favorite Isle Royale me… 
Enjoyed seeing MI students' hard work at the @FIRSTweets Robotics State Championships! Great to see young minds int… 
Had the chance to thank and honor some Flint area Vietnam veterans today. Thank you all for your service and sacrif… 
Trump’s refusal to label China a currency manipulator shows he is unwilling to side with American workers against u… 
"From corn to soybeans to cherries, MI’s ag sector generates $100b in economic activity. Great to visit McManus Farm… "
"MI small businesses provide fed’l gov't w/ wide variety of goods &amp; services. My bill helps protect them from scammers, grow their businesses"
Visited @mmexperiences in Lansing to announce my new bill that helps small businesses compete &amp; win fed'l contracts… 
Piping water from the Great Lakes to the Southwest is a misguided idea &amp; should be completely taken off the table! 
MI's defense manufacturers – like General Dynamics – are developing tech to keep our servicemembers safe &amp; creating… 
".@YWCAKalamazoo provides a safe haven for domestic violence victims, children &amp; pets. PAWS act will allow more shel… "
Took part in @GM’s handoff of Chevrolet Colorado ZH2 fuel cell to @TARDEC_PAO – great example of how MI is creating… 
"To Jewish families in Michigan &amp; everywhere else gathering around the Seder table tonight, best wishes for a Happy Passover. Chag Sameach!"
"We must preserve and strengthen Social Security, and I will fight for that everyday I am in the Senate.… "
Too many Americans don't have access to pensions or retirement plans. A secure retirement cannot become a relic of… 
Read my statement on missile strikes in Syria: 
Honored to be recognized by @HumaneSociety &amp; proud to partner with them on important animal protection issues. 
"Proud to stand w MI firefighters against Trump's proposed cuts to FEMA grants, so they can continue to save lives &amp;… "
I am disheartened that Judge Gorsuch often fails to take into account the human face behind each case. 
I find it disheartening that Judge Gorsuch has regularly sided against everyday Americans’ rights 
"@ChelseaClinton @NYPD After 29 days we haven't received an answer from DHS, DOJ or FBI. I, &amp; 99 other Senators, awa… "
Had a great discussion w @MIBldgTrades workers on how we can build an economy where anyone who puts in hard day’s w… 
Judge Gorsuch’s previous rulings indicate he believes that corporations have greater rights than individuals. 
Trump can start keeping his campaign promises to Michigan workers by taking a hard line on trade violations w Chine… 
"Spring interns from my Washington, DC office have worked hard this semester, so it was great to have a chance to th… "
"#OTD in 1949 the NATO treaty was signed. As Russian aggression grows, NATO remains central to countering Putin &amp; ke… "
Joined @SenatorHeitkamp to call for GAO review of Trump hiring freeze to ensure tax dollars are being spent wisely. 
"I’ve loved riding motorcycles since I was a kid, so I’m delighted to join @SenJoniErnst in starting bipartisan Sena… "
"In MI women earn 74 cents for every $1 men earn. #GenderPayGap hurts entire families, affecting retirement, healthc… "
Fun fact: the wood used for the court at tonight's #FinalFour Championship game comes from MI's Upper Peninsula! 
Proud of the members of my DC staff who crushed it at the @CUCB 10 mile run this morning! 
"180,000 Michiganders are living with Alzheimer’s - I am proud to be part of the fight against this devastating dise… "
Intro’d bill to support @NOAA Great Lakes debris cleanup that preserves &amp; protects Great Lakes ecosystem.… 
Every woman has a fundamental right to make her own decisions about reproductive health. The gov't has no right to… 
Joined @SenCoryGardner to intro telehealth bill that expands access to care for seniors in rural &amp; underserved area… 
Had a good meeting with @NFLPA reps to discuss our shared concerns about our criminal justice system and need for r… 
Honored to join my friend @SenCoryGardner in receiving @COSSADC Distinguished Service Award for work in promoting s… 
""
Excited to join @ChrisCoons @SenCapito &amp; @SteveDaines in starting the Senate Chemistry Caucus to support innovation… 
Met w @mippadvocates to let them know I #StandWithPP and the 2.5 million who rely on @PPFA for access to preventati… 
I will vote NO on Judge Neil Gorsuch's nomination to #SCOTUS. Read my full statement: 
Hosted @DHSgov Sec Kelly in Detroit today to discuss ways to improve trade and security on the Northern Border 
"I believe that the time has come to create an independent, nonpartisan commission to fully investigate Russian inte… "
"Happy 24 million people will not lose coverage, but there's still more to do. GOP needs to work w Dems to reduce cost &amp; improve health care."
Had a great meeting with Secretary @madeleine Albright to discuss national security issues and the pressing threat… 
Soon Republicans will vote to raise Medicare premiums for seniors. That’s unacceptable. #ProtectOurCare
The Republican plan will increase Medicare premiums on seniors and make it harder for them to get health care. #ProtectOurCare
"Thanks to my colleagues @BillCassidy, @JohnBoozman, @SenFranken, @RepJaredPolis &amp; @RepTomReed for supporting #MEAA"
Dual &amp; concurrent enrollment &amp; early/middle college programs help students save money and improve graduation rates… 
Proud to reintroduce #MEAA bill to make higher education more affordable &amp; accessible for American students. 
ICYMI via @wzzm13: “Senator Peters Honors West Michigan Vietnam Veterans at Gerald R. Ford Museum” 
".@SenateGOP wants corporations, not consumers, to control personal information. Join me in standing up to protect… "
#OTD in 1941 Tuskegee Airmen began their service. These pioneers like Alexander Jefferson overcame prejudice to def… 
.@mibigshow thanks for having me on! Proud that MI is leading the way in the next generation of auto tech - self driving cars.
Proud to join @SenJoniErnst to relaunch the Albanian Issues Caucus &amp; support the democratic aspirations of Albanian… 
ICYMI via @detroitnews: “Peters: Michigan could be leader in autonomous vehicles” 
Thank you to @SenStabenow who fights for MI farmers on #AgDay and every day as @SenateAgDems Ranking Member
"On #AgDay we celebrate MI’s diverse agriculture sector, which contributes over $100 billion to our economy, employs… "
Glad to announce w @SenStabenow &amp; @RepDanKildee Flint area will receive $5.5 million to expand Early Head Start. 
Michiganders’ premiums will skyrocket and many will lose their coverage if the GOP healthcare plan becomes law. 
Vietnam vets cont’d serving even after the war by fighting for benefits for all vets. Unacceptable some hurt by Age… 
Proud to honor &amp; thank these West Michigan patriots who served U.S. during the Vietnam War as part of the 50th anni… 
Great to announce w @SenStabenow &amp; @RepDanKildee that Flint has been approved for $100 million of federal aid. 
"As if 97% cut to Great Lakes Restoration Initiative weren’t bad enough, Trump now wants to eliminate it entirely. "
"Elimination of fed’l @NIST_MEP funding hurts 345 small &amp; medium manufacturers in MI who created more than 2,000 job… "
Trump budget would eliminate @ARPAE program that @michigantech is using to develop automated vehicle tech &amp; reduce… 
"Rural airports, inc 5 in MI's Upper Peninsula, hit hard in Trump budget w elimination of Essential Airport Service "
"Trump’s budget would do real damage to Michigan families, small businesses &amp; communities and threaten Great Lakes "
"As former Lt. Commander in @navy_reserve, I’m particularly proud to receive @USNavy seal for my office. T/y to all… "
"Slashing @USCG budget would hurt nat'l security. ICYMI @Detroitnews: ""Peters Urges Trump not to cut Coast Guard aid"" "
"@SenStabenow, @RepDanKildee, &amp; I intro’d resolution urging Trump Admin to work w Canada &amp; keep nuclear waste off sh… "
Canada needs to find alternative solution to nuclear waste site that doesn't jeopardize health of Great Lakes 
"During WWII, an American G.I. met a young French woman &amp; fell in love. That women is my mom &amp; today is her birthday… "
"Also congratulations to Isaac Miller, Paden Neely &amp; Stephen Satarino from Milan HS who also placed 2nd w their film on autonomous vehicles."
Congratulations to Jarod Clark &amp; Mary Sier from @royaloakschools for winning first and second place in @StudentCam.
GOP plan raises cost of coverage for older Americans &amp; allows insurers to charge seniors 5X more than younger people 
Always great to see @mayorbliss and hear about what is happening on the ground in Grand Rapids. 
"Nonpartisan CBO: 24 million fewer Americans will have coverage under GOP health care plan by 2026, 14m in 2018 alone "
"GOP’s health care plan would decrease access to coverage, increase costs and reduce quality of coverage. "
Trump’s plan to slash Great Lakes funding by 97% is appalling! I joined a bipartisan letter to Admin expressing ala… 
GOP health care plan will cut coverage for middle &amp; working class families to deliver a big tax cut to the wealthy. 
Congratulations to Dale and Prathusha on representing Michigan as delegates at this year’s @SenateYouth Program. 
Good luck to @msubasketball and @umichbball in today’s @B1GMBBall tournament games! #B1Gtourney
""
The No Heroes Left Untreated Act will create a VA pilot program to use Magnetic e-Resonance Therapy to help treat v… 
Pleased to join @sendavidperdue in an important bill that could help veterans with PTSD. 
"Cuts to @USCG would have grave effects on the safety, health &amp; security of Great Lakes. I joined bipartisan letter… "
Heard from MI Ukrainian community leaders about their concerns w unacceptable Russian aggression in Ukraine. 
Great to see @Proudtomfrinmi Mike Coast &amp; @FullertonTool Patrick Curry today. MMTC is partnering w small/medium man… 
On #IWD2017 we honor women of MI who shaped our country - from Rosie the Riveters to Rosa Parks to female singers o… 
T/y to the wide range of law enforcement &amp; civil rights groups alike who support our National Criminal Justice Comm… 
"Creating the National Criminal Justice Commission is critical step to create fairer criminal justice system, reduce… "
Proud to join @LindseyGrahamSC &amp; @JohnCornyn in introducing the National Criminal Justice Commission Act. 
I will join @MildredGaddis on @am1200wchb around 11:30 a.m. today to discuss the need for a National Criminal Justice Commission. Tune in!
Great to welcome @dstinc1913 from across Michigan today &amp; thank them for their work to support local MI communities. 
Enjoyed seeing such enthusiasm and passion for government &amp; public service from @jmcmsu students I met with today.… 
"Republican health care plan defunds @PPFA &amp; hurts women who need #PlannedParenthood for cancer screenings, mammograms &amp; preventative care"
"GOP healthcare plan would increase costs for seniors, women and individuals w disabilities, &amp; leave many w/o covera… "
.@POTUS wants to slash funding to protect our Great Lakes &amp; MI’s way of life. Tell me what these dangerous cuts wou… 
"All 100 Senators signed our letter - a clear, bipartisan message that Senate stands a/g hate &amp; supports our Jewish… "
T/y to @senrobportman @SenBillNelson @marcorubio who joined me in leading letter urging Trump Admin to protect JCCs. 
""
This @usairforce seal will be a great addition to my office! Glad to honor service of our airmen serving in Michiga… 
Exactly why we need independent investigation on Russian interference in election so we can clear the smoke or find… 
I’ll be on @NewDay @CNN shortly to discuss Russia and threats to our democracy. Tune in!
What a fired up crowd at exciting @mtuhky game tonight. Honored to wear the black &amp; gold of MTU! #FollowtheHuskies 
I just couldn't pass up the chance to drive a snowmobile down the streets of Calumet at the #CopperDog150 last nigh… 
Must stand a/g @NOAA funding cuts that would endanger critical climate research &amp; ability to predict severe weather 
"If you’re ever in MI’s UP, stop by @keewenawNPS sites to see first hand rich history of Copper Country &amp; Keewenaw P… "
Great to be in Copper Country tonight &amp; visit w so many Yoopers at the #CopperDog150! 
There’s nothing like a good Upper Peninsula #SledDog race! Had a blast kicking off the #CopperDog150 in Calumet ton… 
MI is leading the way in developing emerging vehicle tech. I visited @michigantech to see their research in autonom… 
"It was great seeing the amazing work @CalElectronics is doing creating high-velocity, high-performance printed circ… "
Severe cuts to the Great Lakes Restoration fund reported to be in Trump’s budget would have devastating effects. 
"Sessions’ recusal is first step, but special prosecutor is needed to conduct a full investigation of Russian interference in our election."
I am excited to be in the UP this weekend to meet with Yoopers and kick off the CopperDog 150! 
Read my statement on AG Jeff Sessions meeting with the Russian Ambassador: 
Thank you to @sendavidperdue for joining me in introducing the State and Local Cyber Protection Act. 
Cyber threats to state &amp; local gov’ts endangers infrastructure &amp; personal data. My bill will help these gov’ts bett… 
Great to see some of my DC staff giving back &amp; taking the time to speak w undergrads from @UMich who are interested… 
"Thx to the Affordable Care Act more Americans than ever before have health care. We need to improve health care, no… "
Joining Career &amp; Technical Ed Caucus b/c we must invest in ed &amp; workforce development w increasingly dynamic economy 
Happening now: I am Live on Facebook w @TARDEC_PAO Director Dr. Paul Rogers. Tune in: 
We need swift action to protect Great Lakes from spread of Asian carp. Trump Admin should explain delay ASAP &amp; rele… 
"Join me and Dr. Rogers, Director of @TARDEC_PAO at 7:10PM tonight for a #FacebookLIVE discussion. Link: "
Excited to have Dr. Paul Rogers Director of @TARDEC_PAO as my guest for tonight's Joint Session address. Learn more: 
"Visited Onodi Tool &amp; Engineering today, a great example of how Michigan’s defense manufacturing sector is creating… "
Great to hear from local community leaders @SWCRC about what is happening on the ground &amp; discuss how we can suppor… 
Another bomb threat against a MI JCC - this time in Ann Arbor. Continuation of threats is designed to instill fear &amp; cannot be tolerated.
Today I’ll join @CStokesWXYZ on @wxyzdetroit's Spotlight on the News. Tune in at 10am! 
"ICYMI from @saginawnews: ""4 medals, 2 buttons honored to veteran's family by U.S. Senator Gary Peters"" "
"This week is Engineers Week, an opportunity to introduce more young students to engineering. Learn more here: "
"With our universities, auto manufactures &amp; testing facilities, MI is the right place to lead the way in development… "
MI's defense sector is working with our auto industry to develop future tech that will help protect nat’l security… 
MI universities like @michigantech are leading innovation that will shape the future of technology &amp; boost our state's economy.
Congrats to @michigantech Prof. Greg Odegard on being named the lead of @NASA’s Space Technology Research Institute. 
ICYMI from @wilxTV: “Senator Peters honors Vietnam veterans” 
Had a blast stamping labels &amp; working hard @DetroitDenim today! Their products are handmade in Detroit by Detroiters 
All children should have the right to clean air and water! I am proud to earn 100% on #LCVScorecard. 
MI is home to vibrant defense manufacturing sector. Great to see world-class combat vehicle at @BAESystemsplc &amp; hea… 
"Great to see Mayor Browning &amp; other Saginaw officials today, and discuss important issues facing the local communit… "
"As a son of a WWII veteran, it was particularly special to help the family of U.S. Navy Fireman 1st Class Conrad se… "
I visited @MaglineInc to see how small manufacturers are creating jobs for Michiganders and driving local economies. 
"Navy Fireman 1st Class Clifford Conrad risked his life in Pearl Harbor attack to protect others. Today in Saginaw,… "
Planned Parenthood provides access to preventative healthcare for countless women across Michigan and the nation. T… 
"Continued threats, violence against the Jewish community are alarming &amp; have no place in this country. We must stand up to hate &amp; bigotry."
If you are a MI resident who served on active duty during the Vietnam War &amp; want to request a lapel pin click here: 
Honored to present Lansing area Vietnam veterans special lapel pins to honor their service &amp; 50th anniversary of th… 
I will join @DaveAkerlyOnAir on @1320wils around 7:20am. Tune in!
Overwhelming number of scientists agree climate change is a scientific fact! The EPA Administrator should know that… 
Community colleges are a springboard to a brighter future. Great to meet w MI colleges about the importance of qual… 
Someone who does not believe in the EPA’s core mission should not be allowed run the EPA. #PollutingPruitt 
I oppose Pruitt as EPA Admin b/c business interests shouldn’t be put ahead of public good. Why do you stand against… 
Highlight of my day is opportunity to congratulate MI high school students accepted to one of our Service Academies… 
".@MLive: “Michigan Sens. Peters, Stabenow introduce bills to combat outsourcing” "
We need to know where companies’ workers are located before we can hold them accountable for outsourcing American j… 
Flynn resignation only raises more questions on Trump ties to Russia. Discussed need for full investigation w @CNN 
Great visit to @NSF_Intl in Ann Arbor today! They’re working hard to protect Great Lakes from algal blooms &amp; invasi… 
Scientific research shouldn’t be guided by ideology. I support bill to shield scientists from political interference 
More on our efforts to advance self-driving tech from AP: “Senators try to speed up deployment of self-driving cars” 
Our efforts will help ensure rapidly changing self-driving tech - which has potential to save lives - is safely tes… 
Excited to work w @SenJohnThune on joint legislative effort to help advance innovation in self-driving vehicle tech
Mike Ilitch's unwavering love for the City of Detroit will be sincerely missed. My condolences to the Ilitch family.
ICYMI from @upnorthlive: “Advocates back legislation to protect pets of domestic violence survivors” 
I’m renewing my efforts to close the rural broadband gap &amp; urging FCC to provide service  to underserved areas.… 
Tom Price wants to fundamentally change Medicare and Medicaid and implement health reforms that will limit care for… 
In defense of Michigan seniors and working families I will oppose Rep. Price’s nomination for HHS Secretary.
U.S. Justice Dept should uphold Constitution &amp; rule of law - not President’s personal political interests
"U.S. Attorney General must protect civil rights of all Americans, but Sessions' record shows disregard for laws that safeguard civil rights"
"Abusers often exploit emotional attachment victims have with their pets, leaving victims to choose b/n their own sa… "
"Joined @SenDeanHeller, @RepKClark @RosLehtinen to intro PAWS Act to help domestic violence victims &amp; their pets "
Thank you @SenWarren for reading #CorettasWords. Sen Sessions’ civil rights record is an important part of his AG nomination. #LetLizSpeak
Read my op-ed w @RepFredUpton in @thehill: “Self Driving Cars are the Next Frontier of Innovation and Safety” 
I voted #NoOnDeVos because our kids need an experienced champion for their schools and public education. I will keep fighting for them.
"Check out @AirForceMag story celebrating 100 years of Selfridge Air National Guard Base, home of @127Wing. "
The American people are making their voices heard. They are telling the U.S. Senate that Betsy DeVos isn't the righ… 
Caught some @umichbball w my daughter Maddy at Delta Gamma Dad's Weekend 
Tune in to @Flashpointon4 at 10 AM. I will join @DevinScillian to discuss Betsy DeVos' nomination and more. 
"This month, we honor the stories &amp; legacies of the many African American patriots who have helped shape American hi… "
"Hear why Tammy, a teacher from Harrison Public Schools in MI, is standing with me against Betsy DeVos "
Time: “Here's a Look at the Education Questions Betsy DeVos Struggled to Answer” 
