"My commonsense bill, the FAMILY Act, is a REAL paid leave program. So let’s pass it. The time for excuses is over. "
We must not stop until we have full transparency &amp; accountability. That means not voting on FBI Director until Special Prosecutor is named.
This President is creating chaos that doesn’t create a single job or make us safer.
Last night’s report has taken us to a whole new level of abnormal. This is not business as usual.
"Income inequality is a drag on the economy. That’s why we need:

—Paid leave
—A $15 minimum wage
—Equal pay"
"Let me be clear: Affordable, preventive care for women is non-negotiable."
Know who would suffer the most under the House Republicans’ disastrous health bill? Women. Older Americans. Low income Americans.
"When we can support our working moms, we can lift up every family. A great reminder on this Mother’s Day. 
"
"To my mother, who has always been in my corner, and to every mom out there who gives it her all every single day: H… "
"The Senate GOP’s health care bill is being written by 13 men! That’s shocking, even for Washington."
Here’s how you can demand support for an independent investigation into the Trump campaign and Russia. 
"If you plan on running, your reason, your passion, your fire in the belly can make all the difference. "
""
I’m working to help preserve and breathe new life into New York State’s manufacturing sectors. 
This is alarming. We need accountability and transparency on college campuses. We need to pass CASA. 
Deeply disturbing that the Trump administration is investigating the Haitian community with a broad brush. 
Americans want a national paid leave program—and I’m willing to work with anyone for us to get there. 
I voted against Rod Rosenstein's nomination for his refusal to commit to an independent special prosecutor on Day 1.
""
The Senate shouldn't consider a new FBI Director until an independent special prosecutor is appointed to probe the Trump campaign &amp; Russia.
The @HouseGOP health bill is an atrocious piece of legislation. My thoughts on how we can actually help people: 
"Just think of the communities that would be affected.  
"
Because we want real solutions. 
Americans deserve to know the truth. It’s time to raise your voice. 
Trump is throwing our democracy into chaos by trying to shut down an investigation.
AG Sessions lied under oath about meetings with Kislyak. One way to exert control after recusal is by getting rid of FBI Director. Chilling.
No more excuses: We need an independent special prosecutor to investigate the Trump Administration’s ties to Russia.
Something to agree on: Women-owned small businesses should be able compete on a level playing field in this economy. 
We cannot defeat Trumpcare without your voice. I hope you’ll add yours. 
"Pruitt moving to dismiss scientists at the EPA. Absolutely frightening.
"
"My view: When women’s voices are at the table, it makes a difference—especially when it comes to health care. "
"Under #Trumpcare, thousands of families in New York will suffer. We will not let it pass."
"We can make the ACA work better with a not-for-profit public option that
✓Lowers premiums
✓Lowers RX drug costs
✓Lowers out of pocket costs"
"Amen. You’re an inspiration to women everywhere, @ShondaRhimes.
"
The House GOP voted to make it possible for insurance companies to charge you more for coverage just because you’re a woman. It’s not okay.
"ICYMI: This week, House Republicans made it okay for employers to cheat workers out of overtime pay. 
"
We sure will. 
Mark Green's extreme positions disqualified him from his nomination in the first place. 
"With the health care of millions of Americans on the line, we have to speak out as forcefully as we can. "
Thinking about stepping up and running for office? I'm here to help. Here's my first piece of advice. 
"Instead of the passing the horrific House GOP health bill, we should actually help people—or go home. "
""
"By letting bosses deny critical preventative care in the name of religious freedom, @POTUS's Executive Order is an attack on women's health."
A win for New York City and a concrete step toward ending the cycle of pay inequality. Thanks for your hard work on… 
"Keep government out of religion and religion out of government. 
"
""
I'll fight back as hard as I can to defeat this bill—a misguided and purely political effort that will hurt New York families.
"Through higher premiums, less coverage, and millions losing their insurance, Americans lose out with the #AHCA."
The only beneficiaries of the #AHCA are big insurance companies and the wealthiest among us.
Health care shouldn’t be about politics—it's about people. The American Health Care Act would harm people.
The bill to replace Obamacare that passed today in the House is atrocious and must be defeated in the Senate.
""
House Republicans will be voting today on their dangerous health care plan. Raise your voice and fight back: 
"We need to make smart investments in building the middle class, and in building an economy that rewards work."
"When woman with two children can work a full time, minimum wage job and still live below the poverty line, it’s not right. #RaisetheWage"
A federal program for family planning shouldn't be run by a person who doesn’t believe that contraception works. 
"Powerful. Thank you for raising your voice on healthcare, @JimmyKimmel. 
"
No person who works 40 hours a week should still live below the poverty line. It’s time to raise the national minimum wage to $15.
"We need to pass the Military Justice Improvement Act, so our men &amp; women in uniform have a military justice system worthy of their service."
We need a military justice system that allows independent military prosecutors to go after sexual predators who harm our military readiness.
This report doesn't reflect having the good order and discipline that's essential for our military. Congress must take it as a wake-up call.
"The DoD's report shows: 
—a flat overall reporting rate 
—an unacceptable retaliation rate against survivors
—less accountability"
"While the DoD touts progress, the truth is that the scourge of sexual assault in the military remains status quo. "
"Parents across the world share their parental leave stories, and demonstrate why we need #paidleave in this country: "
"Local, small businesses are indispensable to our economy in New York and across the country. Happy… "
Publicly shaming a child over a school lunch is a cruel practice that has to stop. 
"Working families, immigrants, and refugees strengthen our communities. Today, we #RiseUp to celebrate their contributions."
I am working on a bipartisan bill to reform flood insurance and make it more affordable for New Yorkers. 
Learn a bit more about our #FAMILYAct and how you can raise your voice to support it. 
Proud to be in solidarity with those raising their voices and marching for our planet today. #ClimateMarch
#Trump100Days: “a stretch marked by disdain for women’s fair treatment at home and around the globe.” 
@popsugarnews Thanks so much! This was great! #PSNewsChat
"@POPSUGAR A6. Representing your fellow citizens in elected office is worth it. Run. Do it. Once you do, keep at it… "
@popsugarnews @Yale @eleanorslegacy @WCFonline A5. @emilyslist &amp;@EmergeAmerica have great programs too! The experie… 
"@popsugarnews A5. Do a training program! I did programs with Women’s Campaign School @Yale, @EleanorsLegacy, and @WCFonline #PSNewsChat"
"@popsugarnews A4. Grow that thick skin, and know that, in spite of everything, you can do it. #PSNewsChat"
"@popsugarnews A4. People can be mean, your opponents might say horrible things about you. Campaigning can be really tiring. #PSNewsChat"
"@popsugarnews A3. Then think through the issues you care most about. Practice expressing your ideas, sharpen your arguments. #PSNewsChat"
"@popsugarnews A3. Reach out to your networks for advice. Maybe you already know a woman in office, or someone who w… "
"@popsugarnews A3. No one can do it alone, so ask for help. Talk to your family &amp; close friends, those who’ll suppor… "
@popsugarnews A2. Your reason for running will come into focus from your specific background and passion. #PSNewsChat
"@popsugarnews A2. It boils down to that one thing you want to fix, that injustice that makes you so angry you just want to spit. #PSNewsChat"
@popsugarnews A2. I don’t think there’s a set path to public office. We need a diversity of experiences and backgro… 
"@popsugarnews A1. Run. Believe in yourself. Your experience, your background, your passion makes you qualified. #PSNewsChat"
@popsugarnews @emilyslist @PramilaJayapal Hi everyone! Thanks for having me. Very excited to talk shop and help mor… 
""
I think this says everything you need to know about the Trump tax plan. 
""
Congress can no longer turn a blind eye to the epidemic of campus sexual assault. Tell them to take action: 
"Bad move. Rolling back net neutrality rules will stifle business, affect consumers, hamper innovation. "
Continue to speak out. Do not grow tired or weary. Know that this battle is worth fighting. 
"When a tax system allows big corporations and the wealthy to pay little in taxes at the expense of investments in our future, it’s rigged."
"Quick shoutout: great to work with @higherheights, who help #BlackWomenLead from the voting booth to elected office. "
"If a tax plan doesn’t address growing inequality, strengthen the middle class, and reward work, then it’s a failure. "
""
""
"With so many issues that demand immediate action, your advocacy and your talents are desperately needed. Speak out."
"When students and families are burdened with unmanageable student loan debt, they lose out—and our economy loses out."
Thanks @Lin_Manuel for speaking out on just how important @NEArts is to our communities. 
"Agree. Let’s make sure those girls run for office someday! 
"
This is gratifying. Fills me with so much hope. 
"“Push yourself, challenge yourself to do more than you think you can.” 
Congratulations to @AstroPeggy! 
"
Cutting off access to healthcare for women around the world doesn’t look like respect for life to me. 
"On this Yom HaShoah, we must continue to stand strong against all forms of hate and intolerance."
"To mark the centennial of women’s suffrage in NY, I spoke @FDRLibrary about what our founding mothers can teach us.… "
""
Important to invest in New York's infrastructure—including these much-needed repairs to the Holland Tunnel. 
"We only have one earth, so let's keep fighting for it—from protecting our air and water to combatting climate change. Happy #EarthDay!"
""
"Now is the time to keep fighting, in whatever way you can, for the issues you’ve always cared about."
Looks like transparency is something we can all agree on. 
Too many in New York have suffered from the opioid epidemic. We’ll keep fighting for programs that can help. 
"Earlier this week, I asked you where you think more fearless girls are needed. Here’s what you said. Where else do… "
Welcoming and helping those who seek freedom and refuge is an important part of our New York values. 
High-quality child care can lead to better outcomes for children—all families should be able to afford it. 
It is said that budgets reflect priorities. What does it say about the Trump admin when their budget takes aim at vulnerable communities?
"""It's the right thing to do, but it's not a bad business proposition either."" Great to remember as we work toward… "
""
""
The four exceptional organizers of the @womensmarch are on the 2017 #TIME100. It was an honor to write about them.… 
Remember: grassroots advocacy—many people coming together—is far more valuable than any one politician at the podium.
@PiperPerabo Thanks @PiperPerabo. And kudos to you for being vocal about the issues you care about!
@NoamBramson Thank you @NoamBramson. It’s critical to speak out when these cuts could impact our communities—especi… 
"When women take the plunge and run for office, they change outcomes. Great piece featuring our friends… "
Wouldn’t you pay the price of a cup of coffee a week to have the time and flexibility to care for a loved one? 
Too many in Congress seem to have an obsession with destroying Planned Parenthood and taking away access to women's reproductive healthcare.
Inspiring story about female Marines trying to change the service’s culture from the inside out. 
"It's #TaxDay. I posted my tax returns online for the 6th year in a row, and I want to tell you a bit about why. "
Dangerous carcinogens may be hiding in some of your personal care products. @SenSchumer &amp; I want to get rid of them 
Love this. Where do you think we need more fearless girls? I'd say in the House and Senate. And the Pentagon. 
"Our work—our activism—has always been about helping people. If you’re not helping, go home."
"We must work to ensure that every child is given the tools to thrive, regardless of family income or status. "
These cuts shortchange our children &amp; families. After school programs help children to learn and succeed. It’s wrong to gut them.
"Trump’s budget proposes completely eliminating the 21st CLCC grant, which gives $1.2 billion to after school and summer programs."
"From my family to yours, happy #Easter to all who are celebrating! "
This shouldn't be complicated. Americans deserve to know who is entering the White House. Period. 
Change won’t happen unless you speak out. Here’s how you can: 
"Transparency has always been a top priority for me, so I plan to post my tax returns online again next week. @POTUS should too. #TaxMarch"
"When women talk with their doctors, making personal decisions about their health, bodies, and families, Congress should stay out of the way."
ICYMI: I co-wrote a piece with @FaithKWinter to talk about how #paidleave is needed from coast to coast. 
"Here are some good words to live by.
"
Judge Sheila Abdus-Salaam was a true voice for the voiceless. Heartbroken at her passing. Thinking of her family and loved ones.
Congratulations to Officer Brittney Roy for your hard work and service. 
We’re coming together to help prevent opioid addiction. 
"With all of the problems we could try to solve in this country, the President decides to limit women’s access to he… "
"If you don’t become an advocate, things won’t change. 
If you don’t vote, things won’t change. 
If you don’t run, things won’t change."
We’re long overdue for national #paidleave. 
For those who’ve asked: Here are my thoughts on the best ways to get #offthesidelines: 
"It’s important to know more about how such a destabilizing event affects these children. 
"
We’re not giving up. We’ll keep fighting to try to bring justice to survivors of campus sexual assault. More: 
Student loans are both a drag and a drag on the economy. 
Congrats to @NYDailyNews! Well-deserved. 
""
""
"It is not going to be easy. It is not going to be quick. But if you don’t speak up, things will not change. We need you out there."
"If Planned Parenthood can keep fighting for as long as they have, so can we. 
"
""
Continue to speak out. Do not grow tired or weary. Know that this battle is worth fighting for.
+1. No worker should have to choose between a paycheck or caring for a loved one. 
"When you raise your voice, you can change the world. "
I teamed up with @clairecmc and others to forge a path forward for survivors of sexual assault on campuses:… 
Americans need answers frm the Admin abt their plan &amp; how they'll bring coalition partners to the table for a long-term diplomatic solution.
And there is no ‘military only’ solution to the suffering in Syria.
"But the President’s unilateral military action causes grave concern, given no authorization from Congress and no long-term plan."
"The chemical attacks by the Assad regime in Syria are atrocities, a violation of international law that demands a firm response."
""
It's always been about helping people. 
No working parent should have to crowdfund to care for their loved ones. I shared my thoughts on the best solution.… 
Irresponsible for our democracy. 
Gorsuch is the wrong choice for the Supreme Court. I'm voting no on cloture. #StopGorsuch
Republicans' rollback of broadband privacy is dangerous and unwanted. 
Changing the rules for President Trump to get his Supreme Court nominee through is an historic mistake. #StopGorsuch
"Women's voices are needed more than ever. Be bold, never give up! Thanks to @toreyvanoot for making the case "
"Today serves as a call to action for all women: know your worth, ask for it, fight for it. I'll be right there with you. #EqualPayDay"
"Put simply, women and men deserve equal pay for equal work. A shame that, in 2017, we're still not there. #EqualPayDay"
"In the Senate, I'll keep fighting to close that gap, fighting for legislation like the Paycheck Fairness Act."
The data suggests that it would take until 2152 for us to close the gender wage gap. That's not right. We shouldn't have to wait that long.
"As a whole, American women must work 44 days into 2017 in order to make as much as men made in 2016."
The gap for working moms on average is $0.70 to the dollar. They have to work an extra 6 months to make what fathers earn in a year.
"The pay gap for women of color is severe. Black women make just $0.63 for every dollar a white man earns, Hispanic/Latina women earn $0.54."
"Today is #EqualPayDay. I'd like to share some numbers with you, the plain truth about equal pay in this country."
The resistance is based on all of us speaking out in different forms. Here's my advice on how you can do that: 
"Here's how I'm voting this week: No on cloture, no on Gorsuch."
"Spoke to @rtraister about the last few months, about where we're going, about this moment in time.… "
"Amazing work bringing paid leave to Columbus, OH! Elizabeth Brown (@LizforUs) is #offthesidelines, making a HUGE di… "
Insightful look into the political history of the women's movement. 
It’s time for us to confront and fix the toxic environment that many women in the military face. 
Members of Congress need to play by the exact same set of rules as every other American. 
""
"If we're going to resist and protect women's access to healthcare, we must use our talents and raise our voices. To… "
""
"A majority of small businesses support it. Families support it. So let’s work hard to pass it. #paidleave
"
"With so much at stake, I struggle to understand why Republican leaders are fixated on controlling women’s access to basic health care."
"We need to hold up our end of the bargain for graduates who choose to enter public service.
"
""
"Thinking about our mothers, grandmothers, and founding mothers whose shoulders we stand on. #WomensHistoryMonth… "
Unnecessarily high drug prices burden families and diminish quality of life—so we’re doing something about it. 
"The VP was sent to break a tie vote on #TitleX. 

Amazing what GOP leaders will do to make sure women's health cent… "
"We have the power to make a difference, but I'm just a small piece of something larger, and I need your help. "
"Let's fight as hard as we can, as long as we need to, to keep @PPFA's doors open for the 2.5 million who rely on them #IStandWithPP #PinkOut"
Restoring and protecting Long Island Sound is critical to the area’s communities and economic development. 
"If we want to better understand our communities, we can't continue to ignore LGBTQ Americans. "
""
"Let's all speak up, gather strength, and support one another. "
"It's simple: professional women's sports teams deserve the support, resources, and funding given to men's teams. "
"Our country could lead on climate, but instead, President Trump decides to roll back environmental protections. "
I signed the @DCBullyBusters pledge because bullying is unacceptable. Learn more: 
What we must do in the face of hate is stand strong and fight against it. 
"All of us should speak out, wherever we can be heard. Here’s some of my advice on how to do that. "
"Children across NY deserve access to the arts to stimulate learning, regardless of family income or where they live. "
"Marine Pfc. Maria Daume's story is truly inspiring. Congratulations on such a deserved, historic achievement. "
The complete disregard for human health in this decision is astounding. 
It should sadden every New Yorker—and every American—that such acts of racism continue to occur in 2017. 
""
We can't let up now. We fought back today—but we'll need to keep fighting to protect our care.
"This is because of people like you raising your voices, making yourselves heard, and rising up to own our democracy. "
""
One cup of coffee can go a long way. #FAMILYAct 
This is our moment in history. We’re all rising up and owning a place in our democracy.
I voted against this bill—no company should be allowed to sell your personal info to the highest bidder. 
"Women, older Americans, the most vulnerable in our communities have all benefited from the #ACA. It'd be wrong to take it away."
"The #ACA gave women the coverage they need for basic women's health services like birth control, mammograms, HPV testing."
The #ACA gave millions of Americans the health care coverage they need to stay healthy.
"On the 7th anniversary of the #ACA, it’s a shame that the GOP is trying to pass a bill that will kick 24 million off coverage."
I've put together some of my best advice for how you can get #offthesidelines and raise your voice. Get it here: 
“People won’t have to choose between getting paid and supporting loved ones.” Why we need the #FAMILYAct: 
Over a million New York households rely on LIHEAP to help pay heating and cooling bills. Trump's budget will cut it. 
Horrible amendment that makes a bad bill worse. Failure of leadership. 
Americans need #paidleave. It's time to raise our voices and pass the #FAMILYAct. Learn more: 
"If a new mother has no vacation or sick days, she’ll have to choose between caring for her new baby, or the money to feed that baby."
"If a worker can't take time off to care for a sick or dying relative, he'll have to choose between a paycheck or his loved one."
To be clear: I'm voting against Gorsuch's nomination and will insist that it meet the traditional 60 vote threshold.
We can’t have another justice who values corporate rights more than individual workers' rights. Gorsuch cannot be on the Supreme Court.
"The next SCOTUS justice could help decide issues like

→ Voting rights
→ Workers' rights 
→ Women's rights"
Thousands of families in New York will be directly affected by the Supreme Court's decisions in the next few years.
""
"Budgets reflect priorities. The Trump administration’s priorities? Shortchanging women, children, seniors, low income families."
A comprehensive paid leave plan like the #FAMILYAct is good for our workers and for our economy.… 
"When they do things that go against our values, we'll say no. We'll fight back."
"Without #paidleave, we all lose out. "
""
Our college graduates deserve better than this. 
It's clear that Neil Gorsuch's judicial philosophy is outside of the mainstream. 
ICYMI: @SenatorHeitkamp tells us why we all need paid leave. It's time to pass the #FAMILYAct. 
".@NIH does critical research on cancer, heart disease, developmental disorders, and mental illness. We can't let @POTUS ax it."
.@PBS has provided tangible educational benefits to our children and families. We can't let @POTUS ax it.
.@AmeriCorps has established a great tradition of volunteerism and national service for Americans. We can't let @POTUS ax it.
"""The deepest housing cuts since 'Reagan's cuts...ushered in a new age of homelessness.'"" Awful. "
The Trump #budget shortchanges our children. 
Irresponsible cuts to critical programs. @NEAarts and @NEHgov have helped fill big gaps in our early childhood ed.… 
How can you cut nutrition assistance for women and kids? Heartless to let any person—any kid—go hungry in America. 
""
Throwing 24 million people off of coverage is wrong. Charging seniors more for their care is wrong. Defunding @PPFA is wrong. #Trumpcare
".@POTUS's budget makes drastic cuts that'll shortchange middle class New Yorkers, seniors, and students—all while h… "
Military leaders must hold people accountable in the Marine photo scandal. I spoke with @mitchellreports about it. 
The President's travel ban is wrong and goes against everything we value as a country—glad courts have ruled agains… 
Our commanders are falling short on maintaining good order and discipline in our armed forces. Where's the accountability?
More evidence of a toxic climate for our female service members. 
We are the only industrialized country on earth that doesn't guarantee its workers some sort of paid leave. It's ti… 
Our college graduates need to be able to refinance their debt in the same way that our businesses and homeowners do.
"When we price young people out of a college education, we all pay a price. "
"Today, we called on @POTUS to support our #FAMILYAct. American workers deserve affordable, comprehensive #paidleave. "
It's a serious problem when members of our military denigrate female Marines. It undermines good order and discipline. We have to fix it.
Military leadership must take responsibility for a toxic culture that fosters harassment and sexual assault. 
Let's keep our communities safe from gun violence and keep gun silencers out of the hands of criminals. I hope you'll speak out on this.
How can we end violence in our communities if criminals can get easy access to equipment that'd make it hard for police to solve gun crimes?
"When someone gets shot by a gun with a silencer, it's quiet. Witnesses might not hear. Police will be less likely to track down the shooter."
