The GOP budget &amp; tax plan sends America’s budget deficit skyrocketing while leaving our children &amp; grandchildren to… 
I have the privilege of nominating high school students to attend @WestPoint_USMA @NavalAcademy @AF_Academy &amp; Merch… 
Happy #242NavyBday! T/y to those who have served to protect America the world over. Anchors aweigh for the next 242… 
President Trump’s move will devastate middle class families and sick Americans who need care the most
Michiganders shouldn’t have to choose b/n going to the doctor or putting food on the table or facing financial ruin if they get sick
"Trump is playing politics w/ health care, sabotaging markets &amp; sending premiums skyrocketing for working families "
"Happy #NationalFarmersDay to MI’s farmers, who work sunrise to sunset growing our food and our economy "
ICYMI via @HollandSentinel: “Legislation to protect Great Lakes from Algae bloom passes U.S. Senate” 
Great to get a firsthand look at how @MINationalGuard is supporting Liberian military &amp; increasing security in the… 
@Space_Station Events like this help Michigan students build a passion for space and science education
Students from St. Mary Cathedral School in Gaylord were treated to an out of this world video chat w/ astronauts on… 
Proud to celebrate MI’s remarkable manufacturing industry on #MFGDAY17. Making things is in our DNA &amp; we must inspi… 
Wonderful to visit with President Garibaldi and other fellow alumni at last night’s @UDMDetroit Alumni Gathering in… 
We should not wait any longer to provide certainty to the millions of children who depend on CHIP &amp; to the American… 
Outrageous that IRS would spend tax dollars on Equifax contract to protect the identities of taxpayers after compan… 
Today the Senate Commerce Committee unanimously passed my bipartisan bill to help ensure MI will lead the world in… 
""
Congratulations to my friend @JocelynBenson on being named one of @crainsdetroit #40under40 for her great work as… 
"@GrantMeHope1 T/y Helen for your dedication to MI’s foster children, I was proud to nominate you as my @CCAInstitute Angel in Adoption"
Truly moved by the wonderful work West MI native Helen Zeerip is doing to help older foster children find homes thr… 
"Horrified and saddened by the violence in #LasVegas, my heart goes out to the victims and their families of this horrific attack."
Great to be at my alma mater @almacollege for homecoming weekend to visit w/ so many wonderful friends &amp; see… 
"Sec. Price may have resigned, but the American people deserve to know just how much of their tax dollars he and oth… "
Trump Admin Cabinet officials have abused taxpayer dollars &amp; displayed a culture of wasteful spending. 
"I’m working to help companies transition to ESOP models. ESOP are often more productive, grow faster, have less emp… "
"Toured Cambron Engineering in Bay City, a wonderful example of a company that is 100% employee-owned through an Emp… "
Funding for Children’s Health Insurance Program &amp; Community Health Centers runs out this weekend. We must protect t… 
Pleased to partner w/ @SenStabenow to intro a bill that will help small businesses and startups get the resources t… 
"MI is home to more than 856,000 small businesses that rely on access to capital to help them compete, grow &amp; create new jobs"
.@SenJohnThune &amp; I introduced bipartisan legislation that will help ensure Michigan &amp; the US continue to lead the w… 
Self-driving vehicles will completely transform the way we get around &amp; it's vital that public policy keep up w/ th… 
Proud the Senate passed bipartisan bill I helped introduce to protect the Great Lakes from harmful algae blooms 
Glad to have you back 
Joined colleagues in a letter urging POTUS to issue a full disaster declaration &amp; allocate resources to quickly res… 
"As Ranking Member of the Subcommittee that oversees FEMA, I'm extremely concerned by the impact Hurricane Maria has had on Puerto Rico"
Had the pleasure of meeting with @NASSP MI Principal of the Year Lisa Phillips from Cass Tech HS. Congrats on this… 
@CoachJim4UM Want a flag flown over the Capitol like the one @CoachJim4UM got? Find more info &amp; place an order from… 
You’re welcome @CoachJim4UM glad I could honor the occasion! #GoBlue 
"To protect taxpayer dollars, I'm looking into extraordinary &amp; excessive travel expenses by Cabinet officials &amp; urged OMB to investigate"
Every day brings to light new info on Trump Admin abusing taxpayer money w/ private planes &amp; other travel expenses 
"Congrats to Marines graduating as new infantry officers! Incredible to see 1st female graduate, your hard work will… "
It’s time to come together to hold hearings &amp; find bipartisan solutions to lower costs &amp; make health care work better for Michiganders
Thanks to your hard work the latest GOP health care repeal effort is on hold for now! 
No one in this great country of ours should ever go bankrupt because they get sick 
ICYMI via @freep: “Selfridge pitch for F-35 jets could get boost from Sen. Peters' proposal” 
Headed to the floor to speak against #GrahamCassidy repeal bill that rips away health care from MI families. Watch:… 
#GrahamCassidy would allow lifetime caps on coverage and force families to  choose between going w/o health care or huge out of pocket costs
Nobody should go bankrupt because they get sick – must protect families like the Pietrowsksys whose 2 yr old suffer… 
Great day for Ann Arbor &amp; the entire state as @Google opens new Michigan facility that boosts innovation &amp; economic… 
"As Ranking Member of Federal Spending Oversight, I’m urging OMB to explain why taxpayers foot the bill for private… "
"Reports of Sec Price &amp; Trump Cabinet officials abusing taxpayer-funded travel are troubling, signal culture of waste "
NOW:@SenStabenow &amp; I are fighting to stop #GrahamCassidy that will make MI families pay more $ for less care. Watch: 
Great to meet with the many Michigan advocates visiting Washington for #CBCFALC17 this week! Thanks for your hard w… 
Proud to help honor @UMich bicentennial by flying an American flag over @uscapitol for @CoachJim4UM #GoBlue 
Today marks the beginning of @ArtPrize 9! Hope you enjoy this great way to experience incredible art in West MI 
#GrahamCassidy will cut Medicaid funding for the elderly &amp; raise coverage costs for seniors &amp; those w/ pre-existing conditions
"Senate Republicans are rushing to vote on #GrahamCassidy next week to rip health care away from 800,000 Michiganders "
L’Shanah Tovah to Michigan families celebrating #RoshHashanah May the coming year be sweet and filled with joy
"Happy birthday to the love of my life, Colleen. 24 years ago you said yes to marrying me &amp; while I may look older y… "
Proud the Senate passed #NDAA with my provisions to bolster Michigan’s role in our national defense 
@SenWarren @SenatorTomUdall HOTEL Act bars taxpayer dollars for exec branch employee travel from being used at prop… 
I intro’d HOTEL Act w/ @SenWarren &amp; @SenatorTomUdall to use tax dollars wisely &amp; prevent conflicts of interests 
Travel decisions of executive branch employees should not be influenced by potential profit for the President or cabinet members
"Honored to be a part of the promotion ceremony for my defense fellow, Rob, who has served @USArmy for 20 years &amp; to… "
GOP is trying yet again to rip away your health care w/ #GrahamCassidy. Make your voice heard &amp; help stop this bill 
Today @CassiniSaturn ended its 20-year mission studying Saturn. Thanks for fascinating look at this different world 
Pleased to share this #POWMIARecognitionDay story of one MI WWII airman whose remains will finally return home 
This #POWMIARecognitionDay we honor the brave men &amp; women taken prisoner or missing in action while serving our nat… 
Congrats @MonaHannaA: a true hero for Flint families! Proud to partner with you to stand up for Flint 
Pleased to see @FTC will be taking action &amp; investigating #Equifax following my request 
"MI has something for everyone, no matter your interests! Check out this @NatGeo article w/ great places to visit  "
Excited @BlackGirlsCode received $255k from @GM to launch in Detroit &amp; encourage young women to pursue STEM fields 
Happy 70th birthday to @usairforce! I was honored to join in the celebration and have the opportunity to speak with… 
Find out if you were impacted by #Equifax breach &amp; steps you should take to protect your info w/ this @FTC resource: 
#Equifax’s data breach exposed personal info of millions of Americans. I’m urging @FTC to investigate &amp; help protec… 
"When you entrust your personal info to a company, you expect them to take every necessary step to secure &amp; protect your data"
"If your friends &amp; family are in the path of #Irma, this @fema app has resources &amp; safety info that can help "
"September 11th is a day that changed our nation - and our lives – forever, but America arose a stronger &amp; more unit… "
"At Detroit #MarineWeek, humbled to honor memories of those who lost their lives on 9/11 &amp; all who answered the call… "
Protecting survivors of campus sexual assault should be the priority. DeVos' decision only makes students less safe 
@USMC Hope you’ll attend one of over 80 free community events @USMC is hosting in the Detroit metro area 
Excited that Detroit is hosting its first ever #MarineWeek! Great chance for MI to celebrate @USMC service 
You can register for @fema or @SBAgov assistance online at 
"If your Mid-Michigan home or business was damaged by severe flooding in June, you have until Oct 2 to register for… "
.@LCA_Detroit brings another new attraction to boost downtown #Detroit revitalization. Glad to be a part of this ex… 
It's time for Congress to lead and pass comprehensive immigration reform. Read my full statement: 
Immigrants are essential to the fabric of our nation. I strongly disagree with President Trump’s decision to rescin… 
"Wishing everyone a safe &amp; happy holiday, I hope you will join me to honor the legacy &amp; future of MI workers"
Labor Day celebrates the heritage of MI workers who created the middle class &amp; led the fight for workers' rights 
ICYMI via @UPABC10 : “Peters visits Ford Airport to highlight Essential Air Services program” 
Eid Mubarak to Muslims in Michigan and across the country celebrating Eid al-Adha today!
"Harmful algal blooms endanger the Great Lakes, this bill ensures @usioosgov has the tools to combat these threats… "
"The right to vote is the core of our democracy, proud to help ensure every American is heard at the ballot box… "
You can make your voice heard on @USACEHQ plan to block Asian carp from invading the Great Lakes by commenting here… 
"@SBAgov Small businesses are the heart of rural communities, proud to help ensure they can keep benefiting from thi… "
.@SBAgov HUBZone program helps small businesses in rural &amp; economically struggling areas in Northern MI &amp; UP win contracts to sell products
Jud Heathcote was a @MSU_Basketball legend- condolences to his family &amp; MSU community who cherish his lasting impact 
I was proud to help pass the bill that renamed the clinic &amp; honor the sacrifice of this great Michigan hero 
This weekend Traverse City honored Medal of Honor recipient &amp; Northern Michigan native Col. Demas T. Craw by naming a VA Clinic after him
Thankful to MI @USCG personnel heading to TX to assist in #Harvey rescue operations 
"@fema As Ranking Member of the subcommittee that oversees @fema, I will continue to follow rescue &amp; recovery effort… "
@fema This @fema app provides important info on the storm. Please share w/ loved ones who have been affected by… 
.@fema is working around the clock to provide critical emergency response services to the region impacted by #Harvey
Happy 200th birthday @UMich! Proud to honor the grand history of this great university on its bicentennial. #GoBlue 
Instead of divisive actions like the pardon &amp; banning transgender servicemembers POTUS should unify country &amp; address crises like #Harvey
"This is yet another action by POTUS backing racist ideologies &amp; driving our country further apart in the face of serious, immediate threats"
POTUS decision to pardon sheriff who used despicable &amp; racist policies undermines rule of law and faith in justice system
Happy Birthday to @NatlParkService! For the last 101 years they have managed &amp; preserved some of MI’s &amp; America's m… 
"As #Harvey approaches the US, remember to follow @FEMA for important safety updates &amp; emergency information "
My heart goes out to the loved ones of @USNavy sailor Kenneth Smith. His service to our nation will not be forgotten 
@StoryCorps @NolanFinleyDN @SHendersonFreep Refreshing to hear these writers from opposite sides of the political s… 
Check out a great @StoryCorps discussion between @NolanFinleyDN &amp; @SHendersonFreep 
.@LGUS plans to invest $25 million into a new plant in Troy &amp; more Michigan jobs is great news! 
Proud to cosponsor legislation that will expand support services for victims of human trafficking.… 
ICYMI via @wluctv6: “Peters honors Vietnam Veterans in Marquette with Commemorative Lapel Pins” 
"Excited for today’s historic solar eclipse! I hope you get a chance to see this rare event, remember to be safe. "
Devastating to see another tragedy w/ @USNavy. My heart goes out to the families &amp; friends of the sailors of the USS McCain.
"@AirNatlGuard Selfridge is home to @127Wing who have answered the call time &amp; time again, only adding to Selfridge's proud 100-year history"
Congratulations to the entire Selfridge @AirNatlGuard Base community on your 100th birthday! 
.@OfficialWDC celebrates Michigan’s wonderful automotive heritage. What is your favorite classic car? 
Thanks for following my #RideMI Tour! Had a great week meeting w/ Michiganders &amp; riding my @harleydavidson across o… 
I'm committed to ensuring that MI family farmers have access to the capital they need to start &amp; grow new agricultural businesses
"In Oceana Co to see how Herrygers’ Farm is growing corn, peaches, cherries &amp; asparagus on the final stop of this ye… "
""
@BoschGlobal Yesterday I finished the UP part of my #RideMI Tour by crossing the mighty Mackinac Bridge on my way t… 
Rolling out for last day of my #RideMI Tour! Glad to have fellow riders – including some from @BoschGlobal MI – bra… 
Rural airports play a critical role in connecting Michiganders to businesses &amp; travel opportunities around the world
"Day 4 of #RideMI Tour, I visited Ford Airport in Dickinson Co to discuss the importance of Essential Air Services f… "
Saddened by the horrible terror attack in #Barcelona. My thoughts are with the victims and the people of this great city.
Thank you to the members of American Legion Reino Post 21 who joined me yesterday on my #RideMI Motorcycle Tour on… 
"Vern Ehlers was well respected &amp; I was proud to call him my colleague. His public service was exemplary, an example… "
@niupnorth @StormyKromer Proud to say Michigan’s defense sector is helping expand &amp; strengthen our state’s traditio… 
@niupnorth @StormyKromer Met w/ employees of Lake Shore Systems to discuss the importance of creating jobs &amp; growin… 
"@niupnorth @StormyKromer Great to get an inside look at Lake Shore Systems, producer of specialized systems for our… "
"@niupnorth @StormyKromer Next on my #RideMI Tour I headed to a second manufacturer, Lake Shore Systems in Iron River "
"@niupnorth @StormyKromer From paper products and clothing to electronics and autos, Michigan’s manufacturers are th… "
Joined @niupnorth Thanks a Million event w/ Jacquart Fabrics home of @StormyKromer to celebrate $1 million invested… 
On day 3 of my #RideMI Tour I visited two western UP manufacturers in Gogebic &amp; Iron Counties 
This includes a new emergency dept &amp; telehealth services that help Michiganders save time &amp; money by making follow up visits remotely
Toured Aspirus Ontonagon Hospital to get a firsthand look at the innovative ways they are treating patients in rura… 
The President blames 'many sides' but he should know that white supremacists &amp; neo-nazis sow hate &amp; violence and are wrong. It's that simple
@CertainTeed Manufacturing is in Michigan's DNA &amp; plays a critical role in boosting local economies &amp; creating good-paying jobs
"Great to be in L’Anse to meet w/ employees of @CertainTeed, a producer of ceiling tiles &amp; Baraga County’s largest e… "
Enjoyed meeting &amp; getting a chance to go trap &amp; target shooting w/ Ottawa Sports Club members as part of my #RideMI… 
Kicked off Day 1 of my #RideMI Motorcycle Tour! Met with Vietnam veterans in Marquette County &amp; heading to Baraga C… 
If you are a MI resident who served on active duty during the Vietnam War &amp; want to request a lapel pin click here 
Proud to recognize the service of UP Vietnam veterans w/ special lapel pins honoring their service &amp; 50th anniversa… 
Thanks to Mike &amp; Walt for having me on the Sunny Morning Show to discuss my #RideMI Motorcycle Tour taking place ac… 
Marquette Harbor Lighthouse is an icon of the city. I enjoyed touring the lighthouse and meeting with @USCG who hel… 
Racism &amp; hatred displayed in Charlottesville go against our nation's values. We must stand together to condemn these hateful actions
Congrats to Grosse Pointe Woods-Shores Little League team for making it this far &amp; good luck advancing to #LLWS 
@VVAmerica Humbled and honored to be recognized by @VVAmerica as a Legislator of the Year 
Proud to work w/ @VVAmerica to pass #Fairness4Vets to help support our servicemembers suffering from invisible wounds of war
The lasting legacy of Vietnam veterans has been their steadfast commitment and service to our country and to their fellow veterans
Congrats to Lake Linden High School’s eCYBERMISSION team for taking home the national championship! 
I’ll be presenting UP Vietnam veterans w/ 50th anniversary commemorative lapel pins as well as visiting small businesses &amp; community leaders
Excited to announce my 2017 #RideMI Motorcycle Tour that will take me across the UP &amp; West Michigan… 
"ICYMI via @wluctv6: ""Peters visits UP Paper highlighting support for local manufacturers"" "
"From cherries and corn to soybeans and milk, MI agriculture sector is a vital part of our economy employing roughly 1 out of every 4 workers"
Visited MSU UP Extension &amp; Research Center that provides opportunities for beginning farmers to learn about startin… 
"Toured UP Paper, a great example of how investing in manufacturing can lead to good-paying jobs in MI "
Today we remember and honor the sacrifice of the men and women in uniform wounded or killed while serving our natio… 
Pictured Rocks draws thousands of visitors to Alger County &amp; bolsters the economy including local small businesses
Great visit to Pictured Rocks National Lakeshore to check out the breathtaking sights of this wonderful UP treasure… 
"Americans of all faiths should feel safe to worship in peace.
Thankful no one was hurt in this violent attack. "
Stopped by @ThunderBayNMS to get firsthand look at their efforts to preserve &amp; share the maritime history of the Gr… 
Can’t wait to start my #RideMI motorcycle tour this summer! Stay tuned for details on where I’ll be headed soon 
This will help fire departments save taxpayer dollars by promoting experienced part-time firefighters to full-time positions
Glad to see my commonsense provision helping fire departments streamline hiring process passed the Senate 
Happy 227th birthday @USCG! Thank you to the brave Coast Guard men &amp; women who serve &amp; protect our waterways. Sempe… 
ICYMI via @WBKB11: There’s still time to share your thoughts on protecting sanctuaries like @ThunderBayNMS online a… 
Proud Commerce Committee passed my bipartisan bill to modernize these critical maps &amp; keep Great Lakes clean for future generations
Protecting our Great Lakes means having accurate maps of coastal resources that could be impacted by an oil spill o… 
Great to spend some time w/ @usmayors discussing issues that impact our cities. Congrats Rochester Hills… 
FEMA &amp; SBA aid will be available to help mid-Michigan families &amp; businesses hurt by recent flooding. Apply online: 
Thank you @SalineSchools student Melinda McCabe for your hard work as a Senate Page representing Michigan 
Honored to join ceremony inducting Medal of Honor recipient James McCloughan into Pentagon’s Hall of Heroes. A grea… 
Michigan #startups are at the forefront of innovation &amp; job creation in industries from food &amp; retail to tech &amp; hea… 
Today is #StartupDay which celebrates the ingenuity of the startups and entrepreneurs driving America’s future 
McCloughan risked his life to save his fellow soldiers. T/y for your service &amp; congratulations on receiving our nation’s highest honor
Today South Haven’s James McCloughan received the Medal of Honor for his services during the Vietnam War 
ICYMI via @MLive: “Bill would update Great Lakes oil spill response maps” 
There’s still a chance to make your voice heard in the fight to protect &amp; preserve sanctuaries like @ThunderBayNMS… 
Glad to report the public comment period on Trump’s EO that could rollback or eliminate 11 marine sanctuaries &amp; monuments has been extended
Proud to stand up for MI families &amp; cast my “NO” vote against the GOP health care bill alongside @SenJohnMcCain &amp; h… 
"Thanks to the hard work of Michiganders and people across the country, GOP efforts to pass their health care bill f… "
I urge GOP colleagues to think about people who will be hurt by repealing ACA &amp; urge them to work w/ Dems on a bipa… 
Watch video students from Ella M. White Elementary in Alpena made on the dangers of plastics in our Great Lakes 
"In Lake Michigan alone, yearly plastic pollution is equivalent to 100 Olympic sized swimming pools filled w/ plastic bottles"
The Great Lakes are in serious danger from marine debris &amp; plastics that harm ecosystems &amp; disrupt commerce 
There is no room for discrimination in our military. President should focus on plans to address threats from N. Korea &amp; Russian aggression
"We should support every patriotic, qualified &amp; capable person volunteering to serve our country in uniform "
"SOON: Voting against GOP repeal of ACA. Would be devastating to Michiganders, putting affordable health care out of… "
"GOP already trying to make their health care bill worse, now trying to pass provision that rips coverage away from… "
@M_Foresight Manufacturing is key to America’s economic future &amp; I’m working to ensure this high tech industry rema… 
Honored to share my thoughts about the future of manufacturing at the @M_Foresight 2017 National Summit 
"Today Senate GOP voted to set us on a path towards unraveling the American health care system, w/ no plan to put it back together"
SOON: Senate will vote on health care repeal that impacts the lives of millions of Americans w/o even knowing what… 
Honored to join my colleagues in updating G.I. Bill to help veterans access vital educational benefits… 
Happy 316th birthday to the Motor City! 
USS Ford is a wonderful way to honor President Ford’s service as not just President but also an officer in the… 
.@SenStabenow &amp; I are willing to work w/ Trump to promote American manufacturing &amp; stop outsourcing 
ICYMI: Joined @SenJohnThune on @CBSEveningNews to discuss our bipartisan effort to address the future of self-drivi… 
#NetNeutrality helps small businesses compete w/ large corporations on a level playing field 
Proud to intro BRAVE Act w/ @marcorubio. Bill honors our nation’s heroes by updating veterans’ funeral benefits… 
Totally agree! Give American companies a level playing field &amp; they will make the best products every time 
""
"While US believes humans must make battlefield decisions, we must prepare for adversaries who use autonomous weapons "
Thinking of colleague &amp; @SASCMajority chairman @SenJohnMcCain &amp; family.  Hoping to see you back in the Senate soon. 
Repealing the ACA w/o a replacement would be an outright disaster: 32 million will lose care in next 10 yrs &amp; premi… 
Closing @StateDept cyber office weakens our ability to strengthen US cybersecurity &amp; resolve conflicts in cyberspace 
Marine sanctuaries like @ThunderBayNMS drive local economies. Proud to lead a letter urging protection of these cri… 
"Thrilled to be a part of @astrosociety @ISS_CASIS conference discussing investments in space, science &amp; technology "
"We should focus on bipartisan solutions to stabilize market, lower costs &amp; provide Americans w/ affordable care"
"Repeal w/o replacement would devastate MI families, risking coverage &amp; skyrocketing premiums "
Time for GOP to work w/ Democrats to find substantive policies that improve health care &amp; reduce costs for all Amer… 
Looser insurance requirements &amp; less financial assistance for patients in #Trumpcare will put health plans out of r… 
"W/ #Trumpcare vote delayed, GOP should take this time to hold public hearings and get real input from experts &amp; Ame… "
T/y for having me @AutomationAlley - great discussion on the critical role MI is playing in the future of auto tech… 
"Michiganders have a chance to see a space weather event tonight, w/ Northern Lights visible as far south as Detroit! "
Congrats to Midwest Regional @uspto on reaching 5 yrs of supporting small biz &amp; entrepreneurs in metro Detroit 
