"As someone born and raised in ‘upper New York,’ I can tell you that these comments are ignorant. "
I want all transgender service members to know that their fight is our fight. Read more: 
"“The Finger Lakes region is a jewel worthy of national attention.” I agree. 
"
""
"This health care bill is toxic. 
It is horrible. It will harm millions.
Will you fight back?
"
Mark my words: We will not let Congress roll back access to reproductive health care for women and men across the c… 
""
"Maggie, thanks for speaking out on behalf of those who rely on Medicaid. I'll keep fighting for you and for Jake. "
"Health care should be a right.
It should not be a privilege."
""
This new decision is harmful and misguided. It weakens—not strengthens—our military. And I’ll do everything in my power to fight it.
"...only to be told (on Twitter, no less) that their Commander in Chief doesn't want them in any capacity—it's outrageous!"
"This morning, transgender service members put on uniform and showed up to their military duties..."
This is beyond insulting to the brave and honorable service of transgender service members willing to die for this… 
I can promise you that I'll raise my voice against any bill that makes it harder for women to access the health care they need.
""
"Please, keep speaking out. Demand better than a back-room deal that harms those who work so hard to provide for their families."
I am hard-pressed to remember a vote in the U.S. Senate that has treated the American people with less respect. 
"I hope you're making those calls, sharing those articles, letting everyone you know about what's at stake for today's health care vote."
""
"Millions voted to legalize medical marijuana in several states. Now, the DOJ is looking to undermine their will. "
"Whatever issue speaks to you, make your voice heard. I’ll always stand with survivors of sexual assault. "
"I introduced legislation with @SenJohnMcCain to go after a root cause of the opioid epidemic: over-prescription. 
"
"Our fundamental goal around health care should be to ensure everyone can afford coverage as a matter of right, not as a matter of privilege."
@ELF1010leeray @getots Great to meet you yesterday!
"@INDVSBLHarlem That's right, keep speaking out and doing the great work you've been doing! A pleasure to have you yesterday."
@indivisible_bk Thank you for coming!
"Ran into @JoeBiden and @MariaTeresa1 at Ozy Fest in Central Park. Great event, great discussion! "
""
""
Candice Jackson’s remarks about campus sexual assault cases are unworthy of her role at the Department of Ed. She s… 
I voted against John Bush’s nomination to the 6th Circuit Court of Appeals today.
John Bush’s hostility to the LGBTQ community and extreme views on women's rights make him completely unfit to serve… 
Changing open internet rules threatens our freedom of speech. It’s more important than ever to stand up and protect #NetNeutrality.
Young people who have lived in America their whole lives and play by the rules should always be welcome here. We must #DefendDACA.
Proud of my team's work to help bring an important play on the Syrian conflict to @LincolnCenter this week. 
Awful news. Praying for @SenJohnMcCain and his family tonight. Sending heartfelt wishes for a full recovery. 
Confirms what we already know: Repealing Obamacare with no plan to replace it—and leaving millions uninsured—is a h… 
"This so-called election commission is a sham that would do nothing but threaten voting rights.
"
""
"Real change in our communities takes persistence and perseverance, and the will to never, ever give up. It starts with you."
.@SenatorHeitkamp and I discuss how we can end the motherhood penalty through paid family leave and affordable chil… 
It’s disappointing to hear that the President is more interested in the blame game than in trying to improve healthcare for all Americans.
The President and Senate Republicans moving to repeal Obamacare with no plan to replace it is dangerous and irresponsible.
"A win on health care, for now. Your protests, calls, letters, tweets count for something. Stay focused, keep speaking up."
"We’re in public service to help people. If we’re not, we should get out. So #DearBetsy: Who are you serving? "
"#MondayMotivation: Today, let’s do all that we can to own this democracy and fight for what’s right ."
I’m very grateful for all who came out to our town hall in Syracuse. Thanks for speaking out! 
"Meet Maple, the newest member of the Gillibrand family! "
Wishing @SenJohnMcCain a speedy recovery. Glad to hear all is well! 
A #paidleave policy that doesn’t cover all workers is woefully inadequate in my opinion. 
What a great throwback! 
"His wife, Liu Xia, remains under house arrest with no criminal charges. China should immediately free her."
Saddened by the death of Nobel Peace laureate Liu Xiaobo. It's disgraceful that China did this to someone just for speaking his mind.
"I'm counting on you to keep speaking out on health care. Truly, your voice matters. Here's how you can: "
You've spoken out overwhelmingly against this awful bill—so I'm going to do everything in my power to keep it from becoming law.
The Republican health care bill needed a wholesale overhaul. This new proposal continues to turn its back on the mo… 
"I can’t wait to head to Syracuse tomorrow. Hope you’ll join us if you’re in the area!
"
""
""
""
#DearBetsy: I ask you to listen to these survivors—and understand just why we’re in this fight. 
"Let’s not sugarcoat it: Republicans are working to kick 22 million people off of health coverage, all so that the rich can get a tax cut."
"Saddened to hear of this incident that took two lives, including NYS Trooper Davis. Praying for their families. "
Praying for the loved ones of all lost in the military plane accident in MS. Heartbreaking to hear the plane was based at Stewart ANGB.
Officer Familia brings new meaning to being one of New York’s Finest. May she rest in peace. God bless her and her… 
""
An ingenious project! Great to see New Yorkers spreading awareness about food access in their communities. 
It's time for some of my GOP colleagues to recognize that @PPFA helps millions of women in this country—and end their attempts to cut it.
"This week, I worked with @RepTomSuozzi to ensure Title IX protections for U.S. Merchant Marine Academy students. "
"Donna, thank you for sharing your experiences. This is a must read. "
"Today, I got to celebrate the 200th birthday of the Erie Canal—by officially making it a National Historic Landmark! "
"To fix our economy, Congress must work hard to answer this. But I can tell you for sure that cutting SNAP isn’t the way to get there."
The question remains: How do we support our communities while providing a safety net for those who work hard but still need help getting by?
"Budgets reflect priorities. Taking food away from children, seniors, and struggling families shouldn’t be the federal government's priority."
"44 million Americans (3 million NYers) in every kind of community—urban, rural, small town—need SNAP to survive. "
"While it shouldn’t take government assistance for a working parent to buy dinner for their family, it happens more often than we think."
"It’s disturbing to see that the President wants to cut SNAP funding, federal food assistance, by billions of dollars"
"No matter where you live, or what you believe, I think we can all agree that access to healthy food shouldn't be a partisan issue."
"I have so much hope in the women who are stepping up to own our democracy. Thanks for this reminder, @gailcollins. "
We have so much to learn from the unbelievable dedication and wherewithal of the women who came before us. 
Hi @Malala! Hope everyone here will follow such an important and powerful voice. 
.@clairecmc and I called on Betsy DeVos to reverse a decision that could set back investigations into sexual assaul… 
Slow but sure victories for policies that help our families. It’s up to us to pass them nationwide. 
This health care fight isn’t over. Just because the GOP doesn’t have the votes today doesn’t mean that they won’t have them next week.
Congrats to Washington State for becoming the 5th state to pass #paidleave—and hopefully becoming an example for th… 
No parent should be forced to make this choice. I’m fighting to change this terrible rule. 
Officer Familia was a true hero and brings new meaning to being New York's Finest. We cannot tolerate this kind of hate and violence.
"NYPD Officer Miosotis Familia's name translates to “forget me not."" Please read this piece in her memory "
Each dollar from @NYDailyNews's fund will go directly to her kids. Let's stand together to protect those who protect us—and their families
Please join me in making a contribution to support the three children of murdered NYPD officer Miosotis Familia. 
""
"With the health care coverage of millions of Americans on the line, our stories matter. Tell me yours by replying to this tweet."
Horrible news from the Bronx this morning. My prayers are with the family of Officer Miosotis Familia and the rest… 
Had a great time today at the Lake Placid #FourthofJuly parade! 
In the best place to celebrate America's birthday—Lake Placid up in the North Country! Happy #FourthOfJuly to all. 
""
Ramming a health care bill through the Senate without public input or a single public hearing is the height of irresponsibility.
Over a million people in New York rely on LIHEAP. A cruel move by the Trump Administration. 
The Republican health care bill puts the 58 @PPFA centers in my state at risk. Know someone who relies on Planned Parenthood? Tell them.
Millions of women could lose maternity care coverage under the Republican health care bill! Think about that for a second.
"Families need #paidleave throughout their lives—if a plan only serves new parents, it would leave far too many behind."
"The campaign for a woman’s suffrage referendum in New York State began on this day in 1913, with a great wagon call… "
The Senate is careening toward voting for the worst bill for women’s health in a generation. Speak out.
ICYMI: We made ourselves heard on the Senate steps this week. An honor to be part of the moment. 
"We refuse to be a country of hate and fear.
This is not who we are.
Keep telling your stories. You'll be heard.
 
#NoMuslimBanEver"
I'm grateful and extremely proud of the work of all of our first responders. 
There's no credible reason to weaken rules that keep all our flights safe. We owe it to the families of Flight 3407. 
"I opposed this nomination. The CTFC must enact strong rules, oversight, &amp; enforcement to protect Main St &amp; taxpayers "
Here's a good way to spread the word: Tell someone you know (who might not yet know) how they could be affected by the GOP health care bill.
What democracy looks like: Tens of thousands of New Yorkers speaking out to protect the Hudson River. 
Don't believe the cynics. You have the power to change outcomes—get out there and prove them wrong.
"I want all women to know: When you speak out and fight back against @realDonaldTrump, @getOTS will be on your side! "
My colleagues and I wrote to @BetsyDeVos with concerns over the Department of Ed's handling of civil rights cases. 
"Since our President clearly has a problem with women, let's send more to Congress. Women of America, you need to run! "
"This is not okay, Mr. President. "
""
The Senate GOP's health care bill is an insult to the millions of families already struggling to pay for care. We will not accept it.
""
""
Keep calling. 
""
"I’ve said it before, and I’ll say it again: funding for Planned Parenthood is not negotiable. Too many lives would be negatively impacted."
"Introduced a bill to give military families support and flexibility when looking for quality, affordable childcare "
A plan that leaves 22 million uninsured. And it could pass this week. This is not a drill. We must keep fighting ba… 
There wasn’t a single woman in the room when Senate Republicans wrote their health care bill—of course the bill is awful for women's health.
""
Jam the phone lines. March. Raise your voice as loud as you can against this health care bill. Demand accountability.
It’s unconscionable that coverage could be taken away from millions of people—all to save money for the richest among us.
"My best to all celebrating #NYCPride! A wonderful day to celebrate the LGBTQ community in NY, across the country, and around the world."
"We must protect funding for a program that gives healthy, nutritious food to our most vulnerable communities. "
""
A job well done. 
"This was great! 
"
""
"If you thought the House bill was bad, the Senate bill is even worse. "
"This health care bill will harm people. I'll do everything in my power to fight against it, but I need your help. "
I could not think of a more out-of-touch or insulting proposal to working Americans already struggling with the high cost of health care.
You have the power to demand accountability from your representatives. I hope you’ll use it. 
".@CecileRichards knows what it means to help people, to speak out, to resist. A beautiful piece. "
Caught it. #CWSG 
""
I wrote at @getOTS about the results in Georgia and coming #OffTheSidelines to win in 2018. Read and follow to join… 
""
I'm ready to play ball tonight! #CWSG 
How we make change: Compete in all 50 states. Run in tough campaigns. Fight back and raise our voices on everything… 
"In the meantime, don’t lose focus and keep your eyes on the battle ahead: stopping the Republicans’ disastrous health care plan."
"It’s up to Democrats to show up in all 50 states, and I’ll be doing my part to support women candidates through my #offthesidelines program"
"We cannot let losses like last night’s special election discourage us. It’s important to keep going, keep fighting."
""
"The public deserves full transparency around this health care bill. When millions could be affected, there are no excuses. #ShowUsTheBill"
@SherrodBrown Our bill will punish companies that price gouge and reinvest their fines in NIH research. This is com… 
.@SherrodBrown &amp; I are taking on RX companies that spike prices of prescription drugs and pump up profits at the expense of people’s lives.
Will I see you at the Congressional Women’s Softball Game on Wednesday? I’ll be swinging for the fences! 
A reprehensible way to treat a man who put his health on the line for us after 9/11. This is absolutely not okay. 
"With the coverage of millions of Americans on the line in this health care fight, the lack of transparency from Republicans is disturbing."
"No one should ever be penalized for getting sick, for being a woman, for being born with a rare condition. This could happen under Trumpcare"
""
"We celebrate emancipation on this #Juneteenth, recognize the work left to do, and continue our commitment to a more equal future for all."
Troop increases absent strategy are a mistake. Congress must demand accountability and a plan from the President.
The President should never outsource his responsibilities as Commander in Chief. 
"To every woman who dares to make her voice heard: I’m with you. 
"
"Happy #FathersDay. Let’s celebrate all that dads give to our families &amp; keep up the fight for policies that’ll help, like the #FAMILYAct!"
The @FCC is dangerously close to clawing back open internet rules and making a terrible decision for the future of innovation. Speak out.
We'll see about that. 
Military leaders must take cases like Marines United seriously—leniency on those accused of online misconduct will… 
"If you’re around, hope you can make it to @CWSoftballGame next week! "
"13 men writing the Senate’s health care bill behind closed doors, with no accountability to the American people. It's a recipe for disaster."
""
High fives for @JoeCrowleyNY—making all New Yorkers proud tonight! 
"Here to support my colleagues at the Congressional Baseball Game, as we put aside politics and honor the bravery of… "
Studies suggest that marijuana can alleviate many serious symptoms—we owe it to our families to be able to do more scientific research.
Current rules around #medicalmarijuana are a case of outdated ideology getting in the way of helping families that desperately need it.
"Today, we reintroduced the bipartisan CARERS Act to finally modernize our laws around medical marijuana."
"A reminder: Russia news is very important, but don't let it distract you from the secret health care bill that'll kick millions off coverage"
"Beautiful, important words from my friend Gabby. "
"Praying for Rep Scalise, the staff, members and Capitol Hill police at the horrific scene this morning. Bless the police for their bravery."
The time has come for #paidleave—and I'm glad we are finally debating it. But parents-only plans leave far too many… 
"While people watched the Sessions hearing, Senate Republicans worked behind closed doors to pass a disastrous secret health care bill."
AG's refusal to answer oversight questions without executive privilege invoked at today's hearing is outrageous. Americans deserve answers.
.@HouseGOP has voted to take us back to the reckless rules and regulations that resulted in financial collapse. 
A great bit from #TonyAwards2017: Kevin Kline talks about the importance of @NEAarts and @NEHgov to our communities. 
"One year after the horrific Pulse shooting, let's recommit to doing our part to ensure the equality and well being of our LGBTQ community."
The courts are speaking loud and clear on Trump’s unconstitutional travel ban. It's not what our country stands for 
"Someone you should know: @katieporteroc, who’s getting #offthesidelines and running for congress in CA. "
The recent rise in anti-semitism at home and abroad has been alarming. It’s vital to keep up and prioritize the fig… 
Thanks so much for having me! Really enjoyed our chat. 
Great to speak at #PDF17 about the ways we can keep fighting and resisting. (But might need to put some cash in the… 
Looking forward to it! 
"If they were actually doing good work to help people, it wouldn’t need to be hidden from public view. Speak out, demand transparency."
"Senate Republicans are writing a bill to kick millions of people off of health insurance behind closed doors, with no public hearings."
"We must get to the truth, because nobody, including the President, is above the law."
Comey's testimony also raises more questions about the actions of the Attorney General.
That Comey took the President’s comments regarding the Flynn investigation ‘as a direction’ is alarming.
It was also stunning to hear that Comey began writing memos after his first meeting with Trump due to concerns that Trump may lie about it.
"It was stunning to hear James Comey testify under oath that President Trump ‘defamed’ him and the FBI, and that Trump told lies about him."
The pattern of behavior laid out in Comey's prepared testimony is extremely disturbing. Important for him to provide more context today.
"If the Trump Administration lets bosses make birth control decisions for their employees, it could be devastating f… "
Detained immigrants are not receiving the proper medical care that they need. It has to stop. 
"Troubling stats on racial disparities in our military justice system. If we're going to fix this, we must #passMJIA "
"It's clear that we must expand research into #medicalmarijuana. @CoryBooker, @RandPaul and I plan to re-intro a bill for that."
The NE Journal study on cannabidiol and its effects on Dravet Syndrome is a big deal in our fight to help people. 
"For a better, more productive workforce, policies must start reflecting the realities facing working families. "
@JessicaScott09 We’re all stronger than we think we are. #WonderWoman
@JessTroe She is such an inspiration!
@Caley_89 Yes! We should all dream big and see ourselves in our role models.
Harriet Tubman deserves every bit of recognition for her contributions to history.  
"Interesting video about how the bicycle played a small role in the women’s movement. 
"
"Last week, my legislation to help families of first responders get needed survivor benefits was signed into law. Re… "
The scene where she fearlessly led soldiers into battle by taking the oncoming fire with her shield took my breath away!
"If you saw #WonderWoman this past weekend, what was your favorite scene?"
"I love that the new #WonderWoman movie is inspiring girls everywhere to be fearless and fight for justice. 
"
Oversight and accountability are necessary in our constitutional democracy. 
"Horrific, saddening news out of London—my heart is with the victims of these senseless attacks."
Trump’s budget isn't just numbers or charts on a page. It's a proposal to cheat our communities and the most vulnerable among us.
"Birth control is part of basic, preventive care for women. It’s wrong to roll back access. It’s wrong to make women pay more for it."
Tune in if you want to know more! A wonderful chat with the ladies of @TheRivetersPod. 
"@BethBehrs Beth, it was so lovely to meet you too. Thanks for everything you're doing—keep speaking out on the issu… "
New Yorkers will lead on climate and take up the mantle where this administration chooses to fail. It's up to us. 
"As this administration tries to roll back women’s access to contraception, raise your voice and exercise your right… "
"I shudder to think of what future generations will have to deal with as a consequence of this shortsighted, dangero… "
I'm seeing the Wonder Woman movie this summer. Want to join? Be automatically entered to see it with me:… 
Clean air and water shouldn't be up for debate for New York’s families. This decision is awful news for the Capital… 
"Right. That's why @CoryBooker, @RandPaul and I wrote a bill to try to expand research opportunities for medical mar… "
Disturbing that child marriage still happens in this country. I plan to introduce a bill to end this. 
"If you care about our health, our security, and our economy, raise your voice. Speak out against this. #ParisAgreement"
Climate change is real. The question is settled. It'd be catastrophic for the President to cede our leadership on this issue #ParisAgreement
"Withdrawing from the #ParisAgreement would be a complete disaster for our future, an absolute failure of leadership… "
Maybe running for office isn’t for you. Here are some other things you can do to make an impact. 
A woman's boss shouldn't get to decide if she access to birth control. It's wrong—we'll fight back as hard as we can 
"""I wanted to make history...pave the way, if not for me, then for others."" "
"On this Memorial Day, we honor and remember the heroes who sacrificed their lives to protect our freedoms. Grateful to all who've served."
"Ray Pfeifer was a shining light. My love to him, his family, friends, and the entire 9/11 community. "
Taking back the House starts with strong candidates like @HoulahanForPa. I’m all in to support her—hope you can too. 
"""We hold these truths to be self evident that all men—and women—are created equal."" "
""
"Year after year, we shortchange our economy by not giving our workers the time and flexibility to care for their loved ones."
My bill with @SenJoniErnst would ensure our recruits get the training needed to thwart military sexual assault.… 
A victory. This travel ban is wrong and flies against the face of everything we value as a country. 
Our rules around medical marijuana should respect scientific research and respect our families. It’s common sense. 
"Our workers are long overdue for a raise—today, proud to co-sponsor @BernieSanders &amp; @PattyMurray's bill to #RaisetheWage to $15 by 2024."
"A very happy birthday to one of New York City’s most beautiful landmarks.
"
"If the AHCA becomes law, up to 23 million Americans could lose their insurance. Think about that for a second. 

It's unacceptable."
"I think this further confirms just how terrible the AHCA is. 
"
"Cuts to food stamps in Trump’s budget would be devastating. Millions across the country—in small towns, cities—need them to make ends meet."
"How? We’ll  do the work, speak out, and keep fighting for what we’ve always fought for. "
This Administration continues to propose newer and crueler ways to make women’s lives harder. 
How can you care so little for the most vulnerable among us to propose deep cuts to our food stamp program?
This budget is truly immoral and heartless. 
My heart goes out to the victims. We must do everything we can to protect America and our allies. 
Was a pleasure to talk with @DavidAxelrod. Listen to our conversation here. 
ICYMI: Paid leave is not just a women’s issue. It’s a middle-class economic issue. See my speech at @AmProg: 
Any budget cut that cheats our most vulnerable communities must be fought back against. 
"When it comes to our health care, it’s personal. So pick up the phones, go to town halls, march. Tell your stories."
"This is shameful. As elected leaders, we should be trying to help people. This only harms Americans. "
"Making calls? 
At town halls?
Marching? 
Running?

Tell me: How are you getting #offthesidelines? "
Disgraceful. 
Running for office can be tough. My advice? Think of someone who fought long and hard for something that mattered t… 
I just published “No more excuses: America needs a real national paid family and medical leave plan now!” 
This only happened because regular people raised their voices. Advocacy matters.
Important step in the right direction. We need to get to the bottom of this mess. 
"It's an honor to be fighting the fight against hunger with you, @newyorkhunger."
Huge concerns. We need an independent special prosecutor NOW. 
Starting a campaign? You’ll need people in your corner. Don’t be afraid to ask for help. 
