#Trumpcare cuts to Medicaid will limit access to affordable addiction treatment &amp; set back efforts to fight the opi… 
Drug overdoses have increased by 18% in MI &amp; most were related to opioids. 
T/y for stopping by &amp; fighting for clean air for Michigan children! 
Dr. Gilson tells me that cutting Medicaid will not help those suffering from opioid addiction. Watch the full video… 
Medicaid helped Susan get life-saving cancer treatment. We should ensure others have the same option in similar dif… 
T/y @Microsoft for helping to extend broadband service in rural MI. Creative ideas like this will help to close the… 
Electric fuel cell powered @chevrolet Colorado is a great example of innovation coming from MI auto &amp; defense indus… 
We should be working on legislation that will truly improve our health care system by increasing insurance coverage… 
"@SenatorRisch Research shows that Employee Stock Ownership Plan businesses are more productive, grow faster, have h… "
Intro’d bill w/ @SenatorRisch that will help more businesses take advantage of Employee Stock Ownership Plans 
Police Chief Synan warns me #Trumpcare Medicaid cuts will limit tools to fight opioid addiction. Watch more:… 
W/o a free &amp; open internet it will be harder for small businesses &amp; innovative start-ups to share their ideas w/ the world. #NetNeutrality
"Proud to join the day of action to protect #NetNeutrality for small businesses, startups &amp; consumers &amp; keep the int… "
Glad @JoeBiden could join us in the Senate for a critical discussion on the importance of federal investments to pr… 
"Hospital &amp; Health Provider CEOs: #Trumpcare will cause premiums to ""increase for those that need coverage the most” "
My heart goes out to the families &amp; friends of the 16 Marines who lost their lives in this tragic Mississippi plane crash
.@GrandHotelMI is a Mackinac landmark that my family &amp; I always enjoy visiting. Congrats on 130 years of memories!  
Under #Trumpcare health care premiums will rise for most families &amp; some older Americans could see their costs rise… 
"@MINationalGuard Shared my experiences from my recent visit to Latvia &amp; Lithuania w/ MI Estonian, Polish, Lithuania… "
Last month I traveled to Latvia and Lithuania to meet w/ @MINationalGuard units &amp; observe anti-Russian aggression training exercise
This story is a chilling reminder of how #Trumpcare Medicaid cuts will have a major impact on seniors &amp; their famil… 
Proud to see Michigander Col. Kennedy &amp; his family honored for serving our country with valor 
My office can work with federal agencies to help seniors receive Medicare benefits - call my office toll free at (8… 
#Trumpcare will have a major impact on Michiganders w/ pre-existing conditions like Amy. Read her story 
"#Trumpcare cuts Medicaid by $772 billion, dismantling school telemedicine programs that kids in rural MI depend on "
Had a great time celebrating #FourthofJuly at Traverse City’s @cherryfestival &amp; taking part in @ConsumersEnergy Her… 
Amazing celebration of Northern Michigan’s heritage &amp; history at today’s Grand Traverse Band of Ottawa &amp; Chippewa I… 
Today America celebrates its independence &amp; the birth of our great country. Hope everyone has a safe &amp; fun… 
Met w/ realtors from Northern Michigan for an important discussion on how to help more Michiganders become homeowne… 
#Trumpcare will have a major impact on Michigan children like Erin who need Medicaid to afford care. Grateful I can… 
Proud my amendments to strengthen security &amp; protect travelers outside of TSA-screened areas in local airports pass… 
Michiganders are sharing their health care stories w/ me &amp; telling me they are fearful that #Trumpcare could jeopar… 
#Trumpcare will have a major impact on Michiganders like Stefanie who need affordable health insurance. Proud to sh… 
No one should ever go bankrupt because they are sick and no one should ever die because they can’t afford quality i… 
Headed to the floor to talk about the many Michiganders impacted by the GOP health care bill - tune in!… 
This #PTSDAwarenessDay join me in learning more about how PTSD impacts lives. Find resources &amp; learn more: 
These provisions will allow airports to use FAA funds to protect against incidents outside of TSA-screened areas
Airports remain a common target &amp; I have intro’d provisions to strengthen security to protect travelers &amp; visitors… 
It’s time to come together &amp; do what is best for the American people - make quality health care affordable for all Americans
"Instead of buying time to twist arms &amp; secure votes, Senate GOP should start over &amp; work w/ Democrats on bipartisan solutions"
Good news - Senate GOP delayed health care vote! But this fight isn’t over yet. 
"On 2nd anniversary of the SCOTUS decision to recognize same-sex marriages, I’m proud to celebrate their victory for… "
April &amp; Jayne of MI wanted to raise their children w/o fear of their family being torn apart if something happened to one of them
"60% of MI seniors living in nursing homes rely on Medicaid, #Trumpcare cuts could force retirees out on the streets. "
Proud to join @101wrif &amp; @ABC_Harley to honor veterans &amp; thank them for their service by taking part in the Harley'… 
Warmest wishes to Muslims across Michigan and America on the joyous holiday of Eid al-Fitr! #EidMubarak
Happy 78th birthday @USCGAux &amp; thank you for helping to keep the Great Lakes &amp; the rest of America’s waterways safe 
"It’s outrageous GOP is jamming their health care bill through the Senate! I agree w/ @AARPMichigan, there should be… "
This reaffirms urgent need to act &amp; prevent Asian carp from reaching the Great Lakes basin 
Planning to visit DC? My office can assist Michiganders interested in touring national landmarks. For more info:… 
Great to talk with &amp; congratulate @int_acad students on placing in the top 10 of @SIFMAFoundation Stock Market Game… 
Congrats to the Michigan winners of the Congressional Award Gold Medal! Honored to recognize your incredible hard w… 
"Senate GOP wrote a health care bill in secret &amp; w/o input from the public, now they are rushing a vote w/o hearings… "
This is not about if or how the GOP can count to 51 votes. This is about people’s lives &amp; Americans deserve answers… 
"As a lifelong motorcycle lover, I'm proud to join my co-chair @SenJoniErnst &amp; @harleydavidson to launch our first M… "
"I’m happy to attend any meeting on the secret #Trumpcare bill, just waiting on Republicans to give us a time and pl… "
"Thoughts are w/ injured officer &amp; family in Flint, I wish him a speedy recovery &amp; will monitor the situation closely "
""
Expanded Medicaid helped save the lives of many Michiganders battling opioid addiction. #Trumpcare could end that 
Excellent to observe @NATO &amp; @USArmy exercise Saber Strike in Lithuania that is essential to supporting our allies… 
Visited Latvia to see partnership between @MINationalGuard &amp; Latvia’s military to learn how they are combating Russ… 
"Veterans had our back—now we must have theirs. My office can help w/ disability benefits, access to VA care, milita… "
"#Trumpcare could skyrocket coverage costs for countless MI seniors, yet Senate GOP refuses to hold public hearings "
"#Juneteenth reminds us how far we've come toward healing the wounds of slavery over the last 150 yrs, but the strug… "
"Saddened by deaths of 7 @USNavy sailors of USS Fitzgerald. My thoughts go out to families, friends &amp; fellow sailors dealing w tragic loss"
#OTD Sally Ride became 1st American woman in space! She continues to be an inspiration for women &amp; girls to pursue… 
Happy #FathersDay to all our Dads! Today I’m honored to celebrate the memory of my dad &amp; thankful to be a father to… 
"Medicaid covers 3 in 10 Americans battling opioid addiction, #Trumpcare slashes substance abuse assistance &amp; puts m… "
Proud to stand w/ @AARPMichigan against #AHCA which will force Michigan seniors to pay thousands more for health ca… 
Congrats to students from @BerkleySchools for placing 4th at World Robofest w/ a robot that fixes potholes! 
Senate came together w near unanimous vote for Iran &amp; Russia sanctions - clear message to bad actors who sow instab… 
"If you’re a Michigander needing help accessing your Social Security benefits, call my office toll free (844) 506-74… "
"W/ Great Lakes funding &amp; environmental protections under attack, groups like @MichiganLCV are vital in the fight fo… "
#OTD in 1775 the Continental Army was formed. Proud to celebrate @USArmy on this 242nd #ArmyBDay w/ a hooah to our… 
@SenateCommerce ACM’s groundbreaking research &amp; expertise will help ensure this lifesaving tech will be safely and… 
@SenateCommerce MI is leading development &amp; testing of self-driving vehicles that will keep U.S. a leader in innovation &amp; create jobs
Honored to have John Maddox represent Michigan’s American Center for Mobility at today’s @SenateCommerce hearing on… 
"Shocked by attack on GOP members of Congress, staff. Prayers for my colleagues, others who are injured &amp; thankful for USCP, first responders"
Congrats to @griffinshockey on winning their second Calder Cup! #GoGRG
Great meeting w/ Steve Kroll @ThunderBayNMS about their work to preserve historic shipwrecks in the Bay and protect… 
"During the Vietnam War, McCloughan risked his life to save his fellow soldiers. Proud to recognize his valor w/ nation’s highest honor"
Congratulations to South Haven’s James McCloughan on receiving the Medal of Honor! 
Honored to receive Detroit Veterans Tribute Award from @voami. Thank you to VOA for your incredible advocacy on beh… 
"Behind closed doors, GOP is drafting a health care bill that looks a lot like the bad version passed by the House "
"Joined @SenStabenow, @CoryBooker at @techtowndetroit to talk with local small businesses that are leading innovatio… "
""
"Honored to be a part of @michigansierra 50th anniversary celebration, thank you for your committed service to prote… "
It's time to invest in our country &amp; ensure economic security for future generations by upgrading the Soo Locks. 
Thanks for having me in the studio in Ann Arbor 
ICYMI via @NBC24WNWO: “Peters Talks Trade and American Manufacturing in Monroe” 
Proud to celebrate #WorldOceansDay &amp; thank the @USCG for the important role they play protecting our oceans &amp; security
We cannot continue to rely on infrastructure investments made by our grandparents and great-grandparents. We must u… 
"Americans deserve to know the truth about Russia’s efforts to undermine our democracy, this investigation is too important to be stymied"
Today's #ComeyHearing is even further evidence that we must get to the bottom of the facts behind Russian interfere… 
Thank you @AARPMichigan for opposing #AHCA &amp; pounding the pavement on Capitol Hill in defense of Michigan seniors &amp;… 
@SenCapito Investing in preventative care for diabetes will save taxpayer $ by reducing Medicare costs &amp; help senio… 
"My new bill w @SenCapito expands Medicare’s nutritional programs to help prevent costly, chronic condition of diabe… "
Honored to join @CoastGuardFound for a Tribute to @USCG. Thank you for keeping the Great Lakes &amp; our coast safe &amp; s… 
"Trump &amp; Betsy DeVos want to slash @usedgov budget, inflicting painful cuts in after school programs for MI kids &amp; t… "
Today we honor the members of the Allied Forces who stormed the beaches of Normandy &amp; began the liberation of Nazi-… 
".@MonroeMIChamber is a valuable resource for many small business, great opportunity to speak w local business leade… "
@VENTOWER I'll always stand up for Michigan workers &amp; fight for level playing field to help US manufacturers compet… 
"@VENTOWER We also discussed unfair trade practices - like Chinese steel dumping - that harm Michigan manufacturers,… "
Enjoyed visiting @Ventower - Michigan’s first wind tower manufacturing facility - meeting w employees &amp; seeing firs… 
Thinking of London &amp; all those injured or killed in tonight's horrific attacks. US stands w the United Kingdom in the face of this tragedy
"As the Ranking Member of the subcommittee that oversees federal spending, it's hard to save taxpayers money if Trump won’t provide info"
"By ignoring lawmakers' oversight requests, Trump Administration is ignoring the concerns of millions of Michiganders "
Great visit w the @USCG in Sault St. Marie! I’m proud to work with the Coast Guard to advance commercial shipping &amp;… 
Thanks @AmeriCorps for supporting Michigan &amp; helping to make a difference for countless Michiganders 
"Proud to celebrate #Pride2017 to support, honor &amp; celebrate the #LGBTQ community! "
"The Soo Locks need an upgrade to support the needs of the 21st century, we cannot build our future on the investmen… "
MI’s unique combination of defense &amp; automotive manufacturers have allowed @TARDEC_PAO &amp; MI to lead the way in self… 
Proud to join @SenStabenow &amp; MI delegation in intro’ing a bill to help advance the process of upgrading the Soo Loc… 
"Trump’s decision to leave #ParisAgreement means America loses economic opportunities to foreign businesses, countries focused on the future"
Glad to join @GLBN_L5 to discuss how we can work together to protect the Great Lakes for future generations 
"I strongly support Selfridge as a host for the F-35 mission, &amp; I'm working to build support for the base &amp; the servicemembers who work there"
Selfridge Air National Guard Base has the talent &amp; support of MI's defense manufacturing industry needed to host th… 
"America should be global leader in tackling climate change for good of our environment, our economy &amp; our national security #ParisAgreement"
Nearly 200 nations &amp; global business community see the need to address climate change through #ParisAgreement - why can’t President Trump?
A new missile defense site at Fort Custer in Battle Creek would help protect homeland &amp; create new job opportunities 
ICYMI via @ABC12WJ
Honored to join Michigan Veterans Foundation to show my respect for those who died protecting our nation.… 
Today we pay tribute to our fallen servicermembers. We owe them &amp; their families debt of gratitude that can never b… 
Rode along Lake Huron shoreline today - stopped in Lexington and enjoyed the views. A great ride usually includes a… 
#RamadanMubarak as Muslims in Michigan and across the country begin a special time of reflection and prayer during the Holy Month of Ramadan
"Thank you to all our soldiers, sailors, airmen &amp; Marines for your service &amp; to the families who support them.… "
Honored to receive the Spirit of Service Award from the @gpwarmemorial &amp; congrats to @JustinVerlander for also bein… 
"ICYMI via @WLNS: “Peters, Stabenow introduce bills to protect the Great Lakes from pipeline oil spills” "
"Proud to celebrate &amp; honor the enormous impact of #JewishAmericans on U.S. history, culture &amp; society during Jewish American Heritage Month"
"Agree w @LSJNews - cuts to FRIB doesn't just harm the local economy, it also stifles U.S. scientific discovery. "
#TrumpCare will raise premiums on many older Michiganders and out of pocket cost for others  
These bills will help to ensure both the environmental and economic health of the Great Lakes. 
@SenStabenow &amp; I are intro’ing bills to ensure pipeline regulations &amp; oversight take into account unique needs of the Great Lakes
The Great Lakes ecosystem is unlike any other in the world &amp; must be protected from the possibility of devastating oil spills from pipeline
"The numbers don’t lie, this is a bad bill for Michiganders!"
Now we know now the true impact of #TrumpCare &amp; it’s enormous! 14 million people will be w/o coverage in 2018 &amp; 23 million by 2026
"House Republicans pushed through a bad health care bill before knowing how many
people would be without health coverage"
FBI &amp; America’s intel agencies should be free from political interference. Trump either doesn’t know or doesn’t care 
"We should invest in manufacturing, small businesses &amp; education, but this budget only offers cuts that would stifle economic growth"
Trump’s proposed budget makes significant cuts to critical programs that boost Michigan’s working families
"Tragic &amp; heartbreaking news from #Manchester tonight. Our thoughts and prayers go out to victims, their loved ones &amp; entire United Kingdom"
"Thrilled to be at the grand opening of @mi_sci 4D Theater, which will help to inspire young innovators to use their… "
"Health insurers agree - Trump is sabotaging the individual markets, not #ACA. "
Joined @GM &amp; @NextEnergyMi for great chat on the future of mobility &amp; how it is creating new opportunities for loca… 
""
Thank you to @IndivisibleMich for putting on this great event &amp; helping to ignite this unprecedented grassroots engagement!
"With your help we can make good-paying jobs, affordable health care, quality education, &amp; secure retirements a reality for all Michiganders"
Great speaking w energized crowd at #IndivisibleFair &amp; encouraging them to continue to fight to make their voices h… 
"Honored to celebrate the legacy of David DiChiera, thanks for using your passion for opera to help revitalize Detro… "
ICYMI via @WZZM13: “Peters introduces bill to make it easier to promote part-time firefighters &amp; save fire departme… 
Cosponsored a bill that uses revenue raised on public land &amp; water to preserve MI &amp; US natural treasures. 
Enjoyed meeting w Michigan realtors from @nardotrealtor to discuss how we can help more Michiganders become homeown… 
Special counsel investigation &amp; Senate oversight are about 1 thing: our nat’l security. Watch my @MSNBC interview o… 
Proud to support Michigan’s booming beer industry! 
Happy 100th Anniversary to @AmericanConey – a Detroit original! 
@SenStabenow @SenAlexander Proud to say MI &amp; the U.S. are leading the way in development of automotive tech &amp; Vehic… 
"Intro’d bill w @SenStabenow &amp; @SenAlexander to support R&amp;D for advanced, clean vehicle tech  "
Congratulations to our Detroit chess teams for winning big at the national championships! 
"Appointment of special counsel is a good first step toward a non-political, fact-driven Russia investigation… "
The American people deserve to know the facts about Russian interference &amp; we must ensure the FBI remains free from… 
Glad to hear surgery went well! Wishing you the best as you recover. 
Proud to welcome Michigan police officers to Washington for #NationalPoliceWeek. Thank you for protecting and servi… 
Proud to support the Helping Veterans Exposed to Burn Pits Act so VA can develop better treatment for Post-9/11 vet… 
"When U.S. servicemembers suffer from exposure to toxic burn pits in Iraq &amp; Afghanistan, we must be prepared to treat them"
Glad to hear that @SenThomTillis is feeling better. Look forward to seeing you back at the Capitol soon! 
This is further evidence of need for DOJ Inspector General to look into political interference of FBI Russian inves… 
"If Trump asked FBI to end Flynn, Russia investigation, that undermines our independent system of justice "
Intro’d bill w @SenatorCollins to help fire departments save money &amp; retain skilled first responders. Read more:… 
Great news that TEALS program will be adding 11 MI schools next school year to help increase computer &amp; technology… 
Wonderful lunch discussion w student leaders from my alma mater @almacollege about our shared experiences &amp; leaders… 
Russia is not our friend. It’s alarming if President Trump is exposing highly sensitive classified info to adversary 
A heartfelt thank you to all fallen &amp; injured peace officers who sacrificed to protect their communities… 
"Happy Mother’s Day to all our wonderful MI mothers! Glad to be w 3 great mothers in my life - my mother, my wife &amp;… "
ICYMI via @wzzm13: “Peters calls for a special prosecutor to investigate Trump’s Russia ties &amp; asks Senators to put… 
Tune in to @smerconish on @CNN this morning where I’ll discuss Trump's firing of Comey &amp; need for independent investigation
"""People are asking a lot tougher questions about trade deals."" Read more about my views on trade via @washingtonpost "
Joined @SenatorCarper @SenKamalaHarris @SenatorHassan to request DOJ IG look into political interference w FBI probe 
"Congrats to Sarah and Ewan, MI’s @PruSpirit youth volunteer award winners! Thanks for your commitment to helping ot… "
Proud to support Michigan family farmers by leading the charge for strong @usdafsa loan program funding.… 
Detroit #QLINE shows power of what can be accomplished when we come together to make investments that benefit our e… 
Inaugural ride on the #QLINE today! Come on down to Detroit to take a ride &amp; join the grand opening celebration. 
The questions keep mounting on Trump’s ties to Russia &amp; the American people deserve transparency &amp; answers on Russi… 
Glad to join @Microsoft this morning to discuss how we can foster self-driving car innovation &amp; development. 
"Happy birthday @NSF! Thanks for promoting scientific research to advance our economy, enhance our security &amp; sustain our global leadership."
"Trump’s Russian ties are festering, foreign infection &amp; could weaken our democratic system. Special prosecutor is n… "
Happening soon: I’ll speak on Senate Floor re: Comey’s firing &amp; Trump’s gross conflict of interest appointing next… 
Trump meeting w Russian diplomats a day after firing Jim Comey only raises more question about his ties to Russia 
Trump can now hand pick the person charged w leading investigation into his campaign ties w Russia. No chance of im… 
Trump firing FBI Director investigating his ties to Russia is just latest in long list of reasons why we need special prosecutor re: Russia
#Trumpcare would strip away tax credits 8 million veterans rely on for affordable care. We should #CareForVets not give them a tax hike
Teachers play an integral role in preparing our children for the future. Proud to celebrate &amp; thank you for your wo… 
Thank you @RFKChildren &amp; @NCYL_FosterEd for your support of the #CONNECTAct
""
""
A key to America’s economic success in the future is critical investments in scientific research now. Read more in… 
Looking forward to joining @MildredGaddis on @am1200wchb soon to discuss my bill to help at-risk children in Michigan &amp; across the country.
"Thank you to all WWII veterans, including my father Herb, who served in Europe &amp; helped carry the Allies to victory… "
Proud to join members of the metro Detroit community &amp; @walkforisrael in celebrating the establishment of the moder… 
Visited Detroit International Academy to check out their great computer education program &amp; their upcoming partners… 
Honored to attend the @NatUrbanLeague Leadership Breakfast &amp; catch up with MI leaders Joseph Jones &amp; N. Charles And… 
Great discussion with 60 @UMich MBA students who represent the next generation of business leaders &amp; entrepreneurs 
"#AHCA will cause more than 20 million Americans to lose coverage. Even in its latest form, this is still a bad bill! "
"Even with the additional subsidy, Americans w preexisting conditions are likely to face higher cost plans &amp; less coverage options."
The latest version of #Trumpcare #AHCA doesn’t guarantee care for Americans who need it most 
Pleased the Senate approved my bill to predict space weather that could cripple infrastructure &amp; disrupt daily life 
One piece of the American Dream is the ability to retire w dignity &amp; save enough to pass something along to the nex… 
Women deserve equal pay for equal work. Proud to cosponsor the Paycheck Fairness Act &amp; support the fight for… 
""
GOPs disastrous #Trumpcare #AHCA bill would jeopardize care for people w preexisting conditions &amp; cut essential benefits like mental health
"Glad to see the GLRI will get the funding it needs in government spending deal, but the fight to protect Great Lake… "
"Proud of Andrew Gikas who I nominated to @AF_Academy. Although I am a Navy fan, I'm glad to see he's enjoying so mu… "
Small businesses are driving our economy &amp; employing millions of Americans. Proud to celebrate small businesses dur… 
"This is great news for the Great Lakes, but we must continue to fight against Trump’s proposed cuts &amp; protect Great Lakes funding"
Glad to see funding to protect the Great Lakes is included in the bipartisan agreement to fund the government.
Congrats to all the 2017 @UMich grads - especially my daughter Madeleine. We love you and couldn't be prouder of yo… 
"Trump promised a lot to American workers, but after #100DaysOfTrump we still have no plan to boost manufacturing &amp;… "
Happy Birthday to my good friend &amp; partner in the U.S. Senate @SenStabenow
Trump promised to name China a currency manipulator his first day in office. It's day 99 &amp; he hasn’t kept his word… 
Proud to return to my alma mater @_WayneLaw to receive the Distinguished Alumni Award. Thank you for this wonderful… 
Ever wonder what a day in the life of a U.S. Senator is like? @NickMinock had the chance to find out. Watch: 
""
"Pres. Trump promised to #DraintheSwamp, then appointed big oil ally Scott Pruitt as head of the EPA. "
Pres Trump’s Ed Sec Betsy DeVos is putting loan debt collectors ahead of students. So much for #DrainTheSwamp. 
I may root for the Spartans but @CoachJim4UM and I stand together in support of the Legal Services Corp. 
