TUNE IN: I'm on @KFOR Flash Point w/@kforkevinogle @MikeCTurpen &amp; Kirk Humphreys tomorrow at 9:30am to talk nationa… https://t.co/8L6S2Sj0GH
"RT @rtmradio: #TownHall with Sen James #Lankford last night. The video, and my exclusive interview with him on race, tax reform https://t.c…"
Great to see so many of you at my #CommunityConversation last night in Tulsa. Special thanks to Doc Shaw &amp;… https://t.co/1pa5O6oRW7
Happy Birthday @USNavy! Thank you for 242 years of exceptional service &amp; sacrifice. #NavyBirthday https://t.co/yiyruQieFM
RT @tulsaworld: .@SenatorLankford holds town hall meeting at historic Big 10 Ballroom in north Tulsa https://t.co/D9aB07mLMD https://t.co/Y…
"Great music &amp; great conversation at the #Big10Ballroom in Tulsa. If you couldn’t make it, tune in HERE:… https://t.co/TfJdDRiMz0"
"If you couldn’t make it to my #CommunityConversation in Tulsa tonight, tune in to the #FacebookLIVE: https://t.co/EKM0orHxAm"
Today's #healthcare Executive Order is good. Congress should still pass reforms to provide stability &amp; lower costs. https://t.co/ty3jVnTWOe
"Great to spend some time in #Muskogee today, at the @GriffinFoods manufacturing plant, Muskogee Rotary Club &amp; Boule… https://t.co/FPvys7sppH"
Watch tonight's #CommunityConversation in #Tulsa live at 6pm CT on @FOX23's website or on my Facebook page. https://t.co/winSgVWGTf
Kirstjen Nielsen's long history at DHS &amp; work on cybersecurity will serve the Department well. Nielsen is a solid pick for DHS Secretary.
"Outstanding work being done at our #Oklahoma universities. 

#GoPokes https://t.co/3HEHyFMQEn"
Hope to see you tomorrow for a #CommunityConversation at the historic Big 10 Ballroom in North Tulsa. More info:… https://t.co/imbWdVUdeK
Great to catch up w/ some of our nation's very best. Thank you for your service &amp; commitment to national security. https://t.co/dwvCcsoSmS
Has your family ever invited a family of another race to your home for a meal? Check out #SolutionSunday w/… https://t.co/UB7qIxwgew
Truly exemplifying the #OklahomaStandard. Well done @507arw. https://t.co/uSVLw6R78c
RT @NewsOK: Oklahoma Catholic bishops praise @SenatorLankford's Succeed Act for children of immigrants https://t.co/m9zTvepoCy https://t.co…
Join us Thurs. for a #CommunityConversation at the historic Big10 Ballroom. Performances by @pocketofhope &amp; others… https://t.co/mFQaEIQ3fc
"Thanks @JeremyCRadio &amp; @plarsen7 for having me on @crossoveronline to discuss #Dreamers &amp; bipartisanship in Congress
https://t.co/nn9BfNK9FB"
No one thinks our #immigration system works well. I appreciate the White House's input on reforming our system. https://t.co/gmw3Y6jj6w
Today marks an unfortunate anniversary - one year since #AndrewBrunson was unjustly imprisoned in #Turkey without c… https://t.co/8UOMsR2KcT
Today our bipartisan Congressional-Executive Commission on China issued the 2017 Annual Report. It details… https://t.co/ZxPajI81os
"Ability to live your faith, or have no faith, is an American right. I applaud today’s actions on #ReligiousFreedom. https://t.co/NIfqeOXrrN"
It’s completely unacceptable for a NATO ally like #Turkey to unjustly imprison an innocent American. #AndrewBrunson https://t.co/fj1xOGxJT3
"RT @Students4LifeHQ: .@KristanHawkins  The country supports pain-capable limits on abortion. The Senate needs to act now. #prolifegen 

htt…"
RT @AUL: .@cateici on new Senate bill: #Paincapable bill is a common-sense humanitarian law that 8 in 10 Americans support! https://t.co/HZ…
"RT @NRO: Senators, Pass the Ban on the #Abortion of Fetuses Capable of Feeling Pain https://t.co/5EzTuO228z via @xan_desanctis #PainCapable…"
RT @nrlc: Wonderful statement by NRL President @CarolTobias1 this morning at a press conference to introduce the PCUCPA into the Senate! #T…
RT @SBAList: Our message is simple: Our country is so much better than allowing late-term abortions when children can feel pain -@mallorytq…
"U.S. is 1 of only 7 countries, like North Korea, that allow abortion at 5-months pregnancy. We should stop this inh… https://t.co/UfmxaDmZV4"
The Johnson O’Malley Act is a critical program that provides academic assistance to Native American students. Glad… https://t.co/4hpasOb2bk
I joined #MTPDaily with @ChuckTodd today to discuss the Senate Intel Cmte's #Russia investigation &amp; also Secretary… https://t.co/YvmqaZntId
"I'm pleased that these 3 bipartisan bills, to help federal agencies hire the best workforce &amp; reorganize agencies,… https://t.co/lmZk8jEe2Z"
.@SenatorBurr &amp; @MarkWarner to give an update on our Senate Intel Cmte #Russia investigation today at 12:15pm ET.   https://t.co/YhiSSUZa0G
Great to see so many Okies on the Hill yesterday. Glad I could spend some time and catch up w/ @MWCChamber &amp;… https://t.co/8lsPVzIjMM
Thank you House for passing #MicahsLaw &amp; protecting the unborn. It's time for the Senate to do the same.… https://t.co/6b6A8BnS4Y
"Congress voted down #DreamAct in 2007,2010 &amp; 2013. It's time to work together on an alternative to protect #Dreamers https://t.co/QEsQcH6Z47"
"ICYMI: I spoke w/ @kilmeade on @foxnewsradio to discuss the shooting in #LasVegas &amp; my #DACA reform proposal, the… https://t.co/mYwen94TMv"
Congrats to Frank M. Coffman &amp; Johnny Lee Kuhlman of OK on their nominations to serve as US Marshals. Thank you for your continued service!
"#SUCCEEDAct is a fair solution to #DACA, while prohibiting chain migration &amp; discouraging future illegal immigration https://t.co/tlESuUoo3h"
Our prayers are with the victims &amp; their families of the despicable act of terror in Las Vegas. This was pure evil.
.@GovMaryFallin's #FeedingOklahoma food drive starts off today. Learn more about how to help &amp; where to donate → https://t.co/9BiaobHQwi
"RT @SenThomTillis: I joined @SenatorLankford to discuss the #SUCCEEDAct on @FoxNews, a merit-based solution to address uncertainty facing u…"
@BenSasse Don't hate 😏
"...Grove Valley Elementary, Dove Science Academy &amp; Westwood Elementary. Well done! #oklaed (2/2)"
"Congrats to our OK 2017 National Blue Ribbon Schools: Earl Harris Elementary, Centennial Elementary, Cheyenne Middle School... (1/2)"
Officially h0me. #WHYNOT https://t.co/bbZ7DqDNL2
I applaud the administration for prioritizing the safety and security of our US personnel abroad. https://t.co/2dv4RcUzzH
"Y'all have been warned...

Don't mess with @BenSasse! 👀

https://t.co/TwD4qtjJUj"
Turkey Pres.Erdogan’s suggestion that we should make a hostage-style prisoner swap for #AndrewBrunson is appalling. https://t.co/SY2mNHnDBU
"I’ve co-sponsored a bill w/McCain &amp; Lee to permanently exempt #PuertoRico from #JonesAct, to help long-term recovery https://t.co/0EsD8z6doR"
"RT @SenThomTillis: Editorial via @washingtonpost on the #SUCCEEDAct I introduced with @SenatorLankford and @senorrinhatch.
https://t.co/Jrg…"
"Amen! Welcome back, @SteveScalise. What an answer to prayer. https://t.co/blaPlf2Tro"
"Russia meddles in American elections &amp; issues to create chaos &amp; division in our society, even using the NFL debate.… https://t.co/ZmJO5RICxG"
Very encouraged by direction of #taxreform talks to alleviate some of the tax burden on both hardworking American families &amp; job creators.
We haven’t had meaningful #taxreform since the 80s. It's past time to update &amp; simplify our complicated code to reflect the 21st century.
Great to see you @AspasiaCarlson and congrats on OK HS Principal of the Year! https://t.co/vBTW0CxV01
"ICYMI: I spoke w/ @kilmeade on @foxandfriends to discuss the #SUCCEEDAct, my conservative alternative to the Dream… https://t.co/ba9GtW0VZi"
Great to see so many young people observing #SYATP this morning. 1st amendment protects the right to pray just as much as to not participate
RT @NewAmericanEcon: Local Oklahoma leaders applaud @SenatorLankford for legislation supporting DREAMers &amp; economy. https://t.co/9JTxVFxLNE
"An unborn child feels pain at 20 weeks. At a minimum, we should protect this life. Thanks @RepTrentFranks for your… https://t.co/gQzgFeOlW7"
Skyped w/ @swosu freshman &amp; sophomores this morning from my DC office. Great questions on #healthcare. #GoDawgs https://t.co/IhxzMQjHw9
"REALITY CHECK: The #DreamAct was voted down in 2007, 2010 &amp; 2013. Since it cannot pass Congress, let’s come togethe… https://t.co/90Xhx06i02"
RT @WashTimes: Sens James Lankford and Thom Tillis want immigration bill to be part of a bigger immigration overhaul https://t.co/iefzcLnuO6
RT @hughhewitt: Today: @DavidMDrucker @ThomTillis @Senator @SenatorLankford @SenTomCotton @costareports @JohnDonvan @pw_cunningham and @Kat…
RT @SenThomTillis: .@SenatorDurbin's staff let him down by not giving him the right facts. Undocumented children cannot be arbitrarily depo…
"RT @FoxNews: .@GOP senators offer conservative alternative to #DREAMAct
 https://t.co/hOQeSEmixE"
I'll just leave this here. #THUNDERUP https://t.co/uU3KP81Ycn
"Introducing immigration legislation w/ @SenThomTillis, @senorrinhatch at 12pm CT. Watch LIVE here → https://t.co/nXmHy1X2XM #SUCCEEDAct"
"Nonprofits are eligible for FEMA disaster aid (libraries,shelters,hospitals,etc) but not houses of worship. Not fair https://t.co/0nLwIkyLcT"
"What an amazing beatification mass today for Oklahoman Rev. Stanley Rother, the Roman Catholic Church's first U.S.-… https://t.co/7tgIkPFjPE"
"WOW! 

Didn't see that coming.... 

#WhyNot 
#ThunderUP https://t.co/at6n87tSKK"
The #Russians are a determined adversary. We must all secure our election systems &amp; work together. We cannot be cau… https://t.co/8Ba1WvrEIk
RT @JuvLaw1975: Thank you so much! We greatly appreciate your coverage of this issue! We also urge folks to support @CoryBooker @SenatorLan…
Congress has about 6 months to fix #DACA. Next week I'll introduce a bill to protect Dreamers. Here is a preview: https://t.co/cwrkhOxorj
I applaud POTUS' N.Korea sanctions. It's necessary to cut off addt’l sources of financing for the despotic &amp; reckless regime of Kim Jung-un
US ag exports are on the rise. The ability for our farmers to sell goods abroad is important for Oklahoma &amp; the US… https://t.co/VXgs6qyh0O
.@ItsDarciLynne takes the cake! Congrats to Oklahoma's favorite ventriloquist! #AGT #DarciLynneWins https://t.co/dWKYsJjJcR
Wishing the Jewish communities of Oklahoma and across our nation a sweet new year. Happy Rosh Hashanah! https://t.co/Bt44KZZ2lT
.@President_Boren is an Oklahoma institution. Thank you for your faithful service! #DBo #BoomerSooner
It's #NavyWeek in OKC. Great to honor those who serve and see how they spread messages of service &amp; sacrifice aroun… https://t.co/7QjORsNQVY
"RT @FoxNews: .@SenatorLankford: Wiretap reports are ""reason we need oversight"" over our intel operations. #TheStory https://t.co/xgGl18Z8Gv"
My thoughts &amp; prayers are with the people of Mexico as they deal with this devastating earthquake. America is with you.
"Heartbreaking testimony, but very important to hear. Thank you Yvonne for showing us why Congress must pass #SESTA.

https://t.co/LdISQB6aFj"
Houses of worship should be able to apply for #FEMA grants after natural disasters just like other entities. MORE: https://t.co/VRP3AcVdhO
"Tonight, we passed the bipartisan National Defense Authorization Act to ensure our troops have what they need for national security. #NDAA"
"POTUS is right. The UN has become a bloated bureaucracy. The focus should be on results &amp; helping people, not simpl… https://t.co/CRgNPVQi2m"
Happy birthday @usairforce! Thank you to all the #airmen for 70 years of service! #AimHigh #AFbday https://t.co/kuxMPOGNCf
"The London attack is a reminder that we must not only remain vigilant, but also proactive in border security &amp; defe… https://t.co/8kd4yH7KHJ"
"RT @FoxNews: James Lankford on travel ban: ""We do have people around the world that do mean to do us harm and they would like to get into t…"
Cuba’s neglect of its duty to protect American diplomats &amp; their families cannot go unchallenged. https://t.co/lc1R6R61aK
Congrats to Okie Shane Jett on his appointment as Native American Tribal Representative on POTUS's Community Development Advisory Board!
Kim Jong-un's missile launches show how much he doesn't care about his own people. Each new provocation increases likelihood of lost lives.
"Great news! By unanimous consent Senate just confirmed Brian Kuester, Trent Shores as US Attorneys for Eastern,Northern District of Oklahoma"
".@SenThomTillis &amp; I are working on a DACA bill. As POTUS said, these are educated &amp; accomplished young people, prod… https://t.co/sxqX9sXExT"
"It was great to talk #TaxReform, #RegulatoryReform &amp; immigration this morning with #Oklahoma job creators.… https://t.co/at9MGOlOIQ"
I always appreciate the time I have to catch up with @ArchbishopOKC when he's in DC. Great to see you today Archbis… https://t.co/ZXWODfRpsx
Very good news. https://t.co/GNuDbMJdpq
Great hearing today on the federal workforce. We will be more efficient when we cut down on waste &amp; duplication amo… https://t.co/DO68WKwPDJ
Chairing a hearing on reorganizing the federal workforce this morning. Tune in NOW: https://t.co/JBwju7VPEZ
Great to connect with @AFRFarmOrg today! https://t.co/rtAI0Smvo4
"Busy day today w/ hearings &amp; policy meetings, but I was glad have time to sit down w/ @AIPAC President Lillian Pink… https://t.co/aEiWs0hGq4"
"BREAKING: The U.S. federal #debt just surpassed $20 trillion. What a travesty. #DebtCeiling #FederalFumbles 
https://t.co/WtVKSVtZoe"
"RT @SenateGOP: They wanted us to fear. Instead, they got courage, strength, compassion, unity, hope, and resolve. We will always remember.…"
"Terrorists tried to divide &amp; destroy us 16 years ago, but we came together as a nation more united than ever.… https://t.co/jZaf0gMHeW"
Cindy &amp; I join Americans across the nation in prayer for Florida as they face #HurrcaneIrma. 🇺🇸
"Another great Military Academy Day event, this time in Lawton. I'm thankful for all of the Service Academy recruite… https://t.co/Y2Gy3ZgezK"
Let's go guys! #Boomer #BeatOhioState https://t.co/dw3KPFBMVi
This morning's Military Academy Day in Muskogee was a great success. We have many young Oklahomans interested in at… https://t.co/aVi0JTbUp9
For those interested in applying to a Service Academy: Service Academy Information Day is TOMORROW! More info here → https://t.co/gcBT9tpGH9
Here’s my plan to fix the #filibuster &amp; enact process reform to get the Senate working. #GridlockReform https://t.co/zbQ0RPT6PC
"Good news for the 1st Amendment. Federal court affirms #prayers offered by legislators don't violate Constitution
https://t.co/3JGeTQgn2A"
"In another 3 months, we will debate the #debtceiling again; hopefully, we'll consider serious reforms &amp; debt reductions at that time. (7/7)"
"Months ago, I laid out a plan for the #debtceiling that would focus on addressing the debt &amp; providing predictability to the markets. (6/7)"
"Just a reminder that in FY16 alone, we had a $587 billion deficit &amp; our federal debt is now an outrageous $19.8 trillion. (5/7)"
It has become clear that Washington no longer sees the debt limit as a chance to actually tackle our runaway debt problems. (4/7)
Disaster relief &amp; the debt ceiling should have been completely separate. Period. (3/7)
"2nd option combined #Harvey relief, a #debtceiling increase, &amp; short-term funding until December 8, which I did not support. (2/7)"
We had 2 options to address disaster relief for #HurricaneHarvey today: a stand-alone bill that I fully supported &amp; a 2nd option... (1/7)
.@SenJudiciary today approved Brian Kuester &amp; Trent Shores for US Attorney for Eastern &amp; Northern District of #Oklahoma. Next step: Senate
I applaud @BetsyDeVosED's decision today. The @usedgov is taking a positive regulatory step to address the problem. https://t.co/5yLXjPmjHn
We shouldn't raise #DebtCeiling w/o reform or cuts. That's the purpose of a debt limit. 3-mo. deal doesn't do either https://t.co/pgid3LqMck
"If Congress comes through on #TaxReform, it will be to the long-term benefit of the nation. 

via @TheOklahoman → https://t.co/mpeK1zO5WQ"
RT @FoxNewsOpinion: .@SenatorLankford: Here comes debt ceiling madness all over again. This time Congress must get serious about reform htt…
Looking forward to our Oklahoma judicial nominees getting a vote this week in Senate Judiciary Committee → https://t.co/OhJ5b0Cv72
The #DebtCeiling tends to produce more crisis theatre than actual debt reduction. It's time to consider reform. https://t.co/ZmoHh89jA0
RT @thehill: GOP senator on Dreamers: We don't hold children responsible for their parents' actions https://t.co/dDjQ5ozVsz https://t.co/Lu…
North Korea: it makes no sense to further isolate yourself. We all want peace. The U.S. will always stand up for ourselves &amp; our allies.
RT @GregAbbott_TX: Remember today is a Day of Prayer in Texas to pray for the victims &amp; responders of #HurricaneHarvey. https://t.co/EkZw0U…
"On this #NationalDayofPrayer, please keep #HurricaneHarvey victims &amp; responders in your thoughts &amp; prayers. https://t.co/0F4RLJFFzt"
#Oklahoma is way ahead of the curve on election machine security &amp; ballot integrity. https://t.co/zdP28NsR18
I applaud the nomination of Rep. Jim Bridenstine to be the next NASA administrator. My full statement → https://t.co/G2UZjgUFTB
The #DebtCeiling debate should be an opportunity for budget reforms. Our $20 trillion debt (and growing) will event… https://t.co/6OFCIFjl8N
"In the face of a corruption investigation in #Guatemala, the rule of law must prevail https://t.co/hkN4c00LNW"
"So good to finally have college football back! 

#OKState #GoPokes

#UTulsa #ReignCane"
"Thank you, @RepTrentFranks for this incredibly moving testament to life.

Take 5 minutes and read this today: https://t.co/WlQerxYS9b"
"More ways to help #Harvey victims. 

#OklahomaStandard https://t.co/wMVt14xP0D"
RT @GregAbbott_TX: Oklahoma has been helping. Governor Fallin has contacted me multiple times with aid &amp; support. You are great neighbors.…
"OG&amp;E crews arrive in Texas to serve #HurricaneHarvery victims. First stop: staging at the airport in Rockport, TX.… https://t.co/wvsdumnPyM"
So many Oklahomans have lived out the #OklahomaStandard by helping #Harvey victims. Here are more ways to help: https://t.co/Xv9ifkSEa2
Taking #JavawithJames on the road this morning at The Lokal Okmulgee. Great to connect over a cup of coffee. https://t.co/G9gPSHGLMe
Tune in to my community conversation via #FacebookLIVE NOW: https://t.co/pBXYX0lKU6
Hosting a community conversation tonight at @okchristian from 5-6pm. Looking forward to the conversation! https://t.co/PV03XGhrMC
Japan is our ally. The U.S. &amp; the international community must stand firm with them against this very serious threat.
The North Korean missile launch over Japan is a very dangerous provocation and a major step in the wrong direction for Kim Jong-un.
"This day in 1963, MLK dreamed that all would not be judged by the color of their skin but the content of their char… https://t.co/DPNYgElVqu"
"Great to catch up w/ @EdmondChamber at their membership lunch, talking healthcare, federal debt, &amp; national securit… https://t.co/loOAAFTYat"
"Thank you to OK organizations doing all they can to help victims of #HurricaneHarvery → @OGandE @USGS_Oklahoma @OKCFD 
@SalArmyAOKEDS"
"OG&amp;E, state search &amp; rescue crews, Central OK Salvation Army staff respond to hurricane flooding relief efforts: https://t.co/KdLUWqjbkq"
"My colleague @BenSasse shared great insights here on parenting, work ethic in America, &amp; love for our neighbors. https://t.co/rxJ6dfb8lo"
I know red heads are supposed to stick together &amp; all but..... I just don't see an upset tonight. #MayweathervMcgregor
Praying for our neighbors to the South across the Red River as they deal with #HurricaneHarvey
"We should keep the 60-vote filibuster, but change other rules to make the Senate work again. #GridlockReform https://t.co/IsQgntrJeb"
"#DebtCeiling exists so Congress can address growing debt, not so we can automatically raise it w/o cuts or reform https://t.co/LhSRc59z81"
"#OKState tops the nation in Native Americans earning bachelor degrees in engineering. #GoPokes 
https://t.co/EcYIYpKbmN"
"To get through the basic operations of the Senate, we need to enact  #GridlockReform. My idea for ""How to Make the… https://t.co/ZgoHrF2xPZ"
RT @TWOpinion: .@SenatorLankford: Hatred is not a political issue https://t.co/0obv9fzleH https://t.co/1D8vEDJByB
Glad the administration is working on an #AfghanStrategy that will lead to an #Afghanistan that can defend itself &amp; root out extremism.
The Upper Chamber has become too inefficient at performing the basic tasks of the Senate. The time for… https://t.co/dSjvyqb6bK
"Contrary to popular belief, you can look at my hair without #EclipseGlasses! #Eclipse2017"
When was the last time your family had dinner in your home with a family of another race? #SolutionSunday https://t.co/zNhiFbBEDo
We should engage each other &amp; celebrate ethnic diversity instead of using it as a wedge to divide. #SolutionSunday https://t.co/IlVQJqQ5Pv
It’s been a divisive week for America. I want to encourage you to consider me &amp; @SenatorTimScott’s #SolutionSunday… https://t.co/CfFzrbhQuo
Devastating to see such hate and violence carried out on innocents. My prayers are with all those affected in #Barcelona.
.@kenblackwell is absolutely right. The Time Has Come For #GridlockReform. We must make the #Senate work again. https://t.co/cc35xy2ibl
"Our words must not create confusion. The supremacy of any race is abhorrent, unAmerican &amp; should be condemned by everyone. Full stop."
"Updating #NAFTA makes sense, but cutting the trade deficit through barriers &amp; taxes on imports would hurt US worker… https://t.co/7e6REwyety"
Check out my op-ed in today's @washingtonpost: The Truth About the #Trade Deficit → https://t.co/x7376S07l2
"MUST READ from @SenatorTimScott → Fight hatred, fear &amp; domestic terror with American ideals. 

#SolutionSundays https://t.co/hqyyWWLRER"
"In a city all too familiar with this, we are once again incredibly grateful for @FBIOklahomaCity &amp; local law enforc… https://t.co/8IQIyJG1X2"
"As a nation, we must recommit to build respectful unity together &amp; honor the human dignity of all people. https://t.co/xan2MSCsPv"
"While some may want to remain divided, we cannot and must not ignore the dissension in our culture."
"The supremacy of any race over another is not only immoral, it's contradictory to our Constitution and the idea of America."
I'm incredibly grieved by the violence &amp; hate that is taking place in Charlottesville.
"The Senate has much work to get done, but we will deliver for the American people behind @SenateMajLdr McConnell."
"On unity and respect... this op-ed is just as relevant today as it was a month ago.
https://t.co/UafYkVX0N8"
"Praying for your surgery and for a speedy recovery. I'll see you soon, @JohnBoozman! https://t.co/gwWilWcXay"
Ever wonder what a typical day in DC looks like? Here's an inside look → https://t.co/lJfRKY1WW4
The world wants to see the N.Korean people prosperous &amp; living in peace. World must also be firm &amp; united in holding Kim Jong-un accountable
Kim Jong-un wants the world to respect N.Korea as a responsible member of the int'l community. His actions create the exact opposite dynamic
"Be sure to check out storm clean-up aid available through @BAChamber &amp; @TulsaChamber → https://t.co/T6M3jORnfD, https://t.co/zjaN8jtjvE"
Thank-you @chickfila Southroads for serving 600 clean up workers &amp; volunteers w/free food today. One of many servin… https://t.co/c5QSWpT7zB
"If your workplace/job was affected by the storms in #Tulsa, check out the resources at @WorkforceTulsa → https://t.co/XMLdLhV14l"
"We pray for the many who are impacted, including those in the hospital &amp; the many who still don't have power. https://t.co/nmeNcQRcUz"
I'm grateful that it doesn't appear that last night's tornado in #Tulsa caused any fatalities.
"Great jobs report today. 4.3% rate is a 16yr low. The regulatory halt is leading to a 16yr high in confidence.

https://t.co/kswcPzjMYA"
"It just feels right that the #Cowboys open the preseason... since they'll probably end the season on Feb 3. 

#HallofFameGame to #SuperBowl"
Important reforms to provide the support our #veterans deserve to better transition to civilian industry headed to… https://t.co/87bLDQh6Dk
Congrats to OK's Director of Aging Lance Robertson for being unanimously confirmed by the Senate to be HHS Assistan… https://t.co/K5okS6l7KO
"Talked #immigrationreform, gridlock in Washington on @FoxNews @AmericaNewsroom this morning. Check it out: https://t.co/DA55P8Fmpk"
"TUNE IN: I'll be on Fox News @AmericaNewsroom at about 8:30am CT (9:30am ET) to discuss #immigration &amp; Russia, Iran, &amp; North Korea sanctions"
ICYMI: I joined @JakeTapper on @CNN to talk #RussiaSanctions &amp; Senate gridlock. WATCH → https://t.co/AjuEX0vKPG
"We should keep the 60-vote filibuster, but change other rules. Senate is the only entity in fed gov’t where the min… https://t.co/QZNmp8KYZb"
"I applaud the @POTUS for signing a sanctions bill today to reign in the reckless regimes of Russia, N. Korea &amp; Iran https://t.co/JQoJi8TSyb"
Here's How to Make the Senate Work Again. Keep the 60-vote filibuster but change these rules → https://t.co/KUeMDwNDH4
"This legislation is needed to help protect vulnerable people, #EndHumanTrafficking &amp; support the work of organizati… https://t.co/O59mI9WEIM"
I’m pleased Christopher Wray has been confirmed FBI Director. His experience in private &amp; public service will serve… https://t.co/fQLoUXu9qu
