Little bug = big problem. Here's the latest report on the American burying beetle &amp; the need for oversight at #FWS. https://t.co/4Kgu24JLE4
I’m pleased that #MikePompeo has finally been confirmed as #CIA Director. He's one of the most qualified people to… https://t.co/313WkNYaor
"I support #SchoolChoice because every child in America deserves a quality #education, no matter their zip code.… https://t.co/oH7YCuq0kX"
"I applaud #POTUS #MexicoCityPolicy EO. For yrs, U.S. has debated abortion. At least we can agree no taxpayer should be forced to pay for it."
"We're endowed by the Creator with certain unalienable rights, including life. U.S. must be a nation that protects ALL children. #RoeVWade"
My thoughts on Pres. Trump's #Inauguration speech on @MSNBC. It was an amazing day to watch the transition of power… https://t.co/rdnKdxrdmE
It's days like today that I am again reminded that America is and always will be the greatest nation in the world.… https://t.co/mF5o3YZoEt
"1 of Obama's final acts as #POTUS today was signing the #TALENTAct, a bill I worked on w/@MarkWarner &amp; @CoryBooker… https://t.co/L9vIj8ujOF"
On #InaugurationDay we come together to celebrate our democracy as the UNITED States of America. Congratulations Pr… https://t.co/xuUpFROW7V
It's an honor to be a part of this 58th #InaugurationDay to officially swear-in the 45th President. Here is my view… https://t.co/BgCosY39qW
"As America celebrates this peaceful transfer of power, Cindy &amp; I pray for @realDonaldTrump &amp; his family on Day 1. #Inauguration2017"
"Had a good convo w/#RexTillerson about foreign aid, reasserting U.S. leadership globally &amp; promoting American value… https://t.co/aU1Kz6s0ao"
#Turkey should deport #AndrewBrunson. A pastor &amp; humanitarian worker for 20yrs is not a threat. #ReligiousFreedom https://t.co/duP2XY72wx
"#ScottPruitt is a statesman, a dedicated public servant, &amp; an ardent defender of the rule of law. #ConfirmPruitt… https://t.co/55ojMOOTXb"
#ScottPruitt will lead the #EPA to follow every environmental law &amp; partner w/states &amp; tribes to do what is best fo… https://t.co/bEDEfImeKi
I'm introducing #ScottPruitt at his nomination hearing at 9aCT (10aET). It's time to #ConfirmPruitt. Watch live: https://t.co/0ZrP5deESX
"Today, I joined the @NewsRadioKTOK @JasonDoyle Show to discuss #BenCarson, #ScottPruitt &amp;  #ChelseaManning. LISTEN: https://t.co/eB0ErY9uCL"
"What #ChelseaManning did was espionage. She released thousands of classified documents, sensitive secrets for America &amp; our allies."
Commuting someone who stole thousands of classified documents? What about accountability &amp; protecting #nationalsecurity? #ChelseaManning
MUST READ--the Oklahoma delegation on the devastating effects of #Obamacare in Oklahoma. https://t.co/VXt4xbpiv7
"Great to hear Dr. Carson’s focus is on transitioning #HUD into an agency that helps people escape poverty, rather t… https://t.co/QyCHrj6RQg"
The tickets have arrived! We're ready to see all the Okies coming up for #inauguration2017. https://t.co/HKdC1K7Rh6
"On this #ReligiousFreedomDay, join me in celebrating the fundamental right of free exercise of religion. Our nation… https://t.co/qZN3QlpgXm"
Today we honor the life and legacy of the incomparable Dr. King. Be inspired today by his courage and determination… https://t.co/cQ5jefIKQ8
"I'm calling for a #RussianHacking investigation into this #Cowboys loss. Unbelievable! 

Congrats @SenRonJohnson"
"Be safe out there, Okies! Check road conditions before getting out. https://t.co/ItEkvU29AH"
ICYMI: I talked #Russia &amp; #confirmationhearings on @FoxNews this morning. Watch our conversation → https://t.co/IogJ7ofe4Q
"Congrats #JoeBiden on the Presidential Medal of Freedom, the nation's highest civilian honor. Your commitment to pu… https://t.co/ko13MnvKaH"
"MUST READ -- #AssistedSuicide #DeathwithDignity laws are harmful to the medical society &amp; culture of America

https://t.co/hO8rlqh6kW"
.@RepBradWenstrup &amp; I have intro’d resolutions to block anti-life DC #AssistedSuicide law. It's too broad &amp; illegal. https://t.co/X07EQhoGRc
#MikePompeo has military &amp; private-sector experience and a great reputation w/ intel community. He'll lead the #CIA… https://t.co/nQi75y8GxY
Confirmation hearing for @RepMikePompeo for #CIA director in the Intel Committee starting NOW: https://t.co/CWFW1WAR3V
"Overnight, the Senate passed a budget resolution, the 1st step to repeal &amp; replace #Obamacare w/a better solution. https://t.co/WXhQNT3VtK"
"I need to hear more from #RexTillerson on a variety of issues, but some of today's comments on #Russia were encoura… https://t.co/LGVOrMI4w6"
I fully expect Gen. John Kelly &amp; Rep. Mike Pompeo to sail through confirmation as Secretaries of #DHS &amp; #CIA.… https://t.co/NecGscUsf1
"As Dir.Clapper testified, goal of #RussiaHacking is to divide our country &amp; sow doubt in our political integrity. We can't let them succeed."
We accomplished a lot in 2016 &amp; I'm looking forward to all we can do in 2017. Check out my 2016 activity report: https://t.co/XUVpvOAIpa
Proud to have a teammate in @JeffFlake in exposing gov't waste &amp; prioritizing the budget. Check out his #Wastebook → https://t.co/TwgEYEyNTT
"With such instability around the world &amp; experience in #nationalsecurity needed at #DHS, I'm confident Gen. Kelly i… https://t.co/7uNrB5jbp4"
"Despite our many policy disagreements, I appreciate that #PresidentObama is a good family man &amp; good father. #FarewellAddress #Fatherhood"
RT @SenRonJohnson: LIVE: #HSGAC holding hearing for DHS Secretary nominee Gen. John Kelly. Watch here https://t.co/vyKrP6KXz9
"In case you missed it → here is my conversation w/ Directors of National Intelligence, CIA, NSA, &amp; FBI on Russian h… https://t.co/Qc2hOSASwJ"
OPEN #Intel Hearing on Russian intelligence activities starting in 15 min. Watch online HERE: https://t.co/L9EYXQpa6p
It's back and more unbelievable than you can imagine. @JeffFlake's annual #Wastebook is out today. Check it out → https://t.co/TwgEYEhd2l
"Lots of confirmation hearings going on today, but don't forget about the open #Intel hearing on #cyberattacks, #Russia at 1pmET/12pmCT"
#MickMulvaney shares my commitment to address the debt &amp; reduce burdensome regulations that plague economic growth.… https://t.co/WbvqyCm5Hp
Thank you to all those who put on the uniform every day &amp; sacrifice for our communities!… https://t.co/cXASr9Jh5c
"Honored to welcome advocate for #religiousfreedom, @RepMarkWalker as co-chairman of the #CongressionalPrayerCaucus. https://t.co/1mD5nIuALK"
"Praying for everyone at the #FortLauderdale airport. My heart breaks for the victims, their families, &amp; those still at the airport."
Open Intel hearing on #Russia &amp; #cybersecurity next Tues → https://t.co/YEckJXo35O
"The world is getting up-to-speed on #Trump. When in SKorea, I saw the National Assembly made a room for legislators… https://t.co/hH5fKe5yFE"
"Just talked w/ @JimSciutto about #intelligence hearings, #cyber threats, &amp; #Russia. Check out our conversation → https://t.co/I2Q1vHU7Eb"
I wrote Pres-elect Trump in November asking him to prioritize the #DNI nomination. Outstanding pick in #DanCoats → experienced &amp; respected.
"#REINSAct provides for necessary oversight on federal regulations. ""No major regulation without representation."" --… https://t.co/BouJHTMssq"
We need a strong leader at #DHS who will protect America against #terrorism &amp; #securetheborder. Looking forward to… https://t.co/8Xmkaw1Awq
The Taxpayers Right to Know Act passed the House unanimously yesterday. This is a big step toward greater #transparency &amp; #accountability.
Last year POTUS announced a 25% premium increase across the nation but Oklahoma gets 76% increase w/ only 1 insurer option. #RepealObamacare
"RT @SenateGOP: Health care decisions should be made by patients, their families, and their doctors. #RepealObamacare https://t.co/MWIJxK3hgq"
Ran into @AGScottPruitt in DC earlier. Looking forward to that being a more common occurrence w/ him at #EPA. #ConfirmPruitt
#Obamacare is a disaster that is hurting more than it is helping. We are starting work today to deliver on the promise to #RepealObamacare.
I am grateful for the honor to represent Oklahoma &amp; I hope to make all Oklahomans proud of this office for the next… https://t.co/JCikIOS1wY
I do solemnly swear that I will support and defend the Constitution of the United States. https://t.co/RmFEf8j7wr
"(2/2) But fear shouldn’t lead to unexplained imprisonment, like American Pastor #AndrewBrunson. #ReligiousFreedom https://t.co/QtJBkzwCkn"
"(1/2) During my time in #Turkey last month, it was clear that the Turkish people face many threats. https://t.co/DqoMuLhyeQ"
TUNE IN NOW to C-SPAN 2 to watch the Senate swearing-in for the 115th Congress → https://t.co/LQE6fZhQj6
We're back in action in DC this week. Be sure to follow me on @instagram @SenatorLankford to catch behind-the-scenes pics of swearing-in!
"#BoomerSooner! Way to go,@OU_Football! #SugarBowl Champs 👆🏼"
"Pres.Obama's sanctions on #RussiaHacking wasn't premature, it was late. We've had lots of hacks but there isn't a c… https://t.co/CVWqP2JyUV"
May God bless you this new year! #2017 #HappyNewYear https://t.co/AKNDwK8qzc
These are things we can solve if we fix the broken #budget process. Let's get it done in 2017. #FederalFumbles… https://t.co/IN4LrdLSjl
Orange Power! #GoPokes #PistolsFiring #AlamoBowl https://t.co/FPt60TjvWr
It is time to return to the appropriations process &amp; start to tackle our federal debt. We cannot leave this burden… https://t.co/l5pHtEdpoc
"As 2016 comes to an end, I'm hoping for a lasting peace for the people of #Syria, especially those facing violence &amp; terrorism.  #Aleppo"
#ScottPruitt understands the need for a proper balance between state responsibilities &amp; federal responsibilities at #EPA. #ConfirmPruitt
The right to pray &amp; practice your faith freely or to have no faith at all is the reason this nation exists.… https://t.co/UBCnsyJGf5
Remember today those who have sacrificed so that we may be safe and join me in thanking those who continue to fight… https://t.co/Us9ZnkIhM5
The United States has always set the tone for liberty and #religiousliberty around the world. We must continue to b… https://t.co/TkWp61h2nO
"It may be the season of giving, but can you believe your tax dollars paid for THIS → https://t.co/v79oGxElON #FederalFumbles"
Americans deserve an #EPA that rejects extreme activism &amp; returns to proper interpretation of law. #ScottPruitt will do that. #ConfirmPruitt
"""For unto us a child is born… And he will be called Wonderful Counselor, Mighty God, Everlasting Father, Prince of… https://t.co/Nq85Capesh"
Wishing you joy as you celebrate the #FestivalofLights this year. #HappyHanukkah! https://t.co/XB5q8gNm46
Anti #Israel resolutions like the one passed today at the #UNSC do nothing but hurt the prospects for peace in the region.
I am very disappointed to see the Obama Administration's lack of leadership at the #UNSecurityCouncil today. #Israel
"This Christmas, we celebrate what God has done in our lives, and in our nation. I pray you enjoy this holiday weeke… https://t.co/Oe2n5cb0Wj"
"As a member of the ForeignOps Subcmte on Approps, I agree. UN funding should be up for discussion if the anti… https://t.co/k3Xp38Ynfu"
Congrats to @NavyFB @ArmyWP_Football &amp; @AFFootball for reaching bowl games this year. Good luck to each of you over the next week!
"The Constitution is clear on this → we have the freedom to exercise our religion, the freedom to live our faith out… https://t.co/HJ788ifU5s"
"Traveling to S Korea, Kosovo, &amp; Turkey fortified my belief that we need to advocate for #religiousfreedom &amp;… https://t.co/Ux8bfWIqUx"
"Pruitt at #EPA will ""put Americans' economic well-being &amp; environmental health on equal footing."" #ConfirmPruitt https://t.co/fAC5mNLsEy"
Your tax dollars hard at work → $2 million to learn if kids will eat food that's been sneezed on. #FederalFumbles https://t.co/r4LykfLVsi
"U.S. must oppose anti #Israel #UNSCR. Israelis &amp; Palestinians are the only ones who can resolve the core issues that divide them, not the UN"
"Great to meet Gen. Vincent Brooks, Commander of US Forces Korea, Combined Forces Command &amp; talk America’s security… https://t.co/zOIIlnvpnA"
Merry Christmas to all of our troops abroad. Our families are safe this holiday season because of your sacrifice. T… https://t.co/EWszwM3z1f
All @RepRussell &amp; I want for Christmas is for the government to stop wasting taxpayer money. Check out #WasteWatch → https://t.co/44VMVcCJ4O
Congrats to @TulsaFootball for the big #MiamiBeachBowl win over Central Michigan 55-10.   #ReignCane @utulsa #Tulsa
Terror will not win. I am praying for the victims and families affected by the horrific attack in #Berlin. #PrayForBerlin
"RT @Protectaxpayers: Listen to the latest #TPA #podcast w/ @SenatorLankford talking about  his #federalfumbles report
https://t.co/RB3PUQq7…"
"To root out #govtwaste, #cutredtape &amp; #debt, Congress needs a partner in the administration. I look forward to working with #MickMulvaney"
1/3rd of world lives where religious freedom is restricted. FrankWolf Int'l #ReligiousFreedom Act will combat religious minority persecution
I applaud @MarcoRubio @RepChrisSmith @SenBobCorker &amp; @RepEdRoyce for their work on the Frank Wolf International #ReligiousFreedom Act
I'm grateful that Pres. Obama has signed the Frank Wolf International #ReligiousFreedom Act into law. #HumanRights https://t.co/7zXOAjOCZ2
"Here are just a few highlights from the #FederalFumbles release. If you haven't read the report yet, read it HERE:… https://t.co/njoQf0u3Ap"
GAO spent 19 months conducting an independent analysis of the #RFS. Its conclusions should not be ignored. @NewsOK https://t.co/apHdV59IW3
Congrats to the graduating class of the @OKCPD Police Academy. Thank you for sacrificing to protect our community! https://t.co/eaQVfG3ej0
"""Believe in love. Trust in each other. And be resolute in our determination to move forward together."" -@SenatorTimScott #Emanuel9"
Very proud of the continued work of the #SenateOpportunityCoalition → Part II highlights @PeppersRanch. Read HERE: https://t.co/zBxaLKjocY
12 examples of #govtwaste for 12 days of Christmas! #FederalFumbles @AFPhq https://t.co/zMibitu2OZ
"If #RickPerry can admit #Oklahoma has better football &amp; BBQ than #Texas, his confirmation process may go smoother. JK #BoomerSooner #GoPokes"
#PlannedParenthood's tissue harvesting operation is barbaric. Thanks @ChuckGrassley for requesting an investigation. https://t.co/MgIlHcRWDG
#PlannedParenthood has engaged in inhumane procedures that are possibly illegal &amp; must be held accountable. #ProLife https://t.co/S5gVtVjU8v
My prayers are with the Bellatti &amp; @StwNewsPress family. Jim's contributions to OK news will always be remembered. https://t.co/iLGoQQThfX
I look forward to hearing from #RexTillerson regarding critical diplomatic issues &amp; his overseas business dealings. https://t.co/b2bDFHHQXX
"#RexTillerson's views on #religiousfreedom, #MiddleEast instability, &amp; relations w/ #Russia must be closely examined before confirmation."
Happy birthday @USNationalGuard! Thank you for 380 years of dedicated service. #AlwaysReadyAlwaysThere https://t.co/ISpohvrM7A
"RT @Protectaxpayers: Latest #TPA podcast welcomes @SenatorLankford on his #federalfumbles report &amp; @HeartlandInst on #IL #nuke #bailout
htt…"
"Yes, we should investigate #cyberattacks &amp; it should be bipartisan. But there is still no evidence that #Russia influenced election results."
I support further investigation into #cyberattacks but there is no evidence of #RussianInterference into election-c… https://t.co/H2sXhwOMpF
TUNE IN: I'll be on Fox News tonight around 6:15pm ET to discuss Russian interference in the election. #russianhacking #cybersecurity
"There's evidence of Russian attempted interference &amp; campaign hacks, but no evidence that they influenced election… https://t.co/sc43qox3OO"
I agree w/@SenSchumer @SenJohnMcCain @SenJackReed &amp; @LindseyGrahamSC. #CyberSecurity investigation of Russian interference can't be partisan
RT @cnsnews: .@SenatorLankford : 'I Will Vote Against the Continuing Resolution' https://t.co/s5t8ihSjFY
Happy birthday @GovMaryFallin! Wishing you a blessed day.
Why I will vote NO on the CR → https://t.co/fw5TB4MmWQ
Let's spread joy this season and help @OKFosterWishes with Christmas presents for @OklahomaFosters kids → https://t.co/VlxxNjyxsa
"#ScottPruitt hasn’t tried to get rid of #EPA environmental regulation, he tries to ensure a proper balance of gov’t… https://t.co/WiGTpDwhor"
RT @wolfblitzer: Republican @SenatorLankford of Intelligence and Homeland Security Committees joins me live today in @CNNSitRoom 5-7PM ET
"As #JohnGlenn's capsule turned to display Earth he said, ""Oh, that view is tremendous!""

Rest in peace, John. I hope the view is tremendous."
RT @SenateGOP: The #NDAA protects the homeland by ensuring that America has the strongest fighting force in the world. https://t.co/MWrxjkc…
Just voted for #NDAA Conference report. It provides funding for our military and prevents the closure of #GITMO.
RT @SpeakerRyan: Great news → #CuresNow is officially on its way to the president's desk. https://t.co/RMOxjlIkdJ
#ScottPruitt is a proven leader who doesn't believe we should create law out of regulations. He'll do a great job c… https://t.co/WVFO4c3qsB
I will oppose the #CR. Our budget process has been broken for years. CR's don't bring any reform or spending cuts to waste. #FederalFumbles
TUNE IN: Going on @cspanwj now to discuss #FederalFumbles #GovtWaste #Oklahoma AG Scott Pruitt &amp; #EPA https://t.co/a74B8M19wj
"Congrats, @AGScottPruitt! Great pick for @EPA. I'm looking forward to working with you to restore a balanced approach to regulations."
21st Century Cures lays the foundation to continue the momentum we have built in medical innovation &amp; discovery for years to come. #CuresNow
Great news from the Senate: the 21st Century Cures Act is headed to the President's desk. #CuresNow
RT @SenatorTimScott: Excited to join the #SenateOpportunityCoalition this afternoon as we continue our fight against poverty
Today marks the 75th anniversary of the attack on #PearlHarbor. We remember forever the sacrifices of the… https://t.co/3zb1OEVRJC
Good report from @FOX23 on the new #TulsaRaceRiot exhibit at the @NMAAHC in DC. #APeoplesJourney #Tulsa https://t.co/UPtPqt0hUA
Disappointed to not see anything about Justice Clarence Thomas at @NMAAHC. I agree w/ @SenatorTimScott--Justice Tho… https://t.co/RAQU2ccsy7
"Every Oklahoman should get to see the #TulsaRaceRiot exhibit at @NMAAHC, so I thought I'd bring parts of it to you → https://t.co/wMvoJv849B"
"Today, I visited the new @NMAAHC in DC &amp; viewed the Tulsa Race Riot exhibit. They did an incredible job telling the… https://t.co/fNPZjIhKTj"
Talk about a #FederalFumble... https://t.co/U4M7yHjn7m
Beautiful story about #USSOklahoma survivor's ashes being returned to #PearlHarbor to be near his fallen shipmates. https://t.co/f2KrBxEg4t
The OU fans in my office did a little redecorating in the conference room before our staff meeting today... #Bedlam… https://t.co/L7IfoYjvmY
My Taxpayers Right to Know Act provides basic accountability and transparency in federal spending. It is past time to pass it in the Senate.
Very proud of what my class has accomplished over the past 2 years. Looking forward to the 115th! https://t.co/JzLyZtg4fk
Congrats @OU_Football #Sooners on another #BIG12Championship. Congrats #OKState on a great 9-3 regular season.… https://t.co/RYEofMfr7d
"This isn't just any game for the state of #Oklahoma. 
This isn't just a rivalry. 
THIS is #Bedlam
#BoomerSooner #OKState #BIG12Championship"
.@SquawkCNBC Host: Why do we need to be concerned about the $19.5T #federaldebt &amp; #GovtWaste? Here is why: https://t.co/Fh6NG0jC70
"TUNE IN: At 2:30pm CT, I'll be on the #ESPN @robdibble49 radio show to talk #FederalFumbles &amp; #Bedlam! https://t.co/sHutTOvyvZ"
Had a great convo about #FederalFumbles this AM at @OCPAThink in #OKC. On my way to #Tulsa to speak at @OklahomaAFP… https://t.co/9fxcjHsz86
It was great to talk #FederalFumbles w/ @CatoInstitute this week in DC. We have to start prioritizing cutting waste. https://t.co/3LKcSwpDEk
The Senate just passed the #IranSanctionsAct. We must do everything we can to keep the world's largest state sponsor of terrorism in check.
I'll be in OKC &amp; Tulsa tomorrow to talk #FederalFumbles w/ @OCPAThink &amp; @OklahomaAFP. Public is welcome! RSVP HERE:… https://t.co/0SsFGApkqi
"To address our outrageous $19.5T #debt &amp; $587B #deficit, we need to grow the economy &amp; cut wasteful spending.… https://t.co/oF8fj1LJl6"
Thank you @EleanorNorton for your advocacy for this bipartisan bill. #Transparency throughout gov't is a very good… https://t.co/h5tEA6Iicp
"Now, that's funny! #FederalFumbles #GovtWaste #CutRedTape https://t.co/BlfK99SKDq"
"Taxpayers fund many ""research"" grants that sometimes do not support the agency's original mission #FederalFumbles
https://t.co/1ubsyS5bWl"
Talking #FederalFumbles and #govtwaste w/ @CatoInstitute at 12pm ET/11am CT. WATCH LIVE on my Facebook page: https://t.co/kGkES0TABD
Really enjoyed tonight's #GWU panel w/ @DanaBashCNN @ChrisCoons &amp; @amyklobuchar about what's next for congress.… https://t.co/LqbLh9kVv6
Know how your tax dollars are spent? Check out #FederalFumbles to find out. You may want to sit down for this... https://t.co/v79oGxElON
RT @GovWaste: Take a look inside @SenatorLankford’s  comprehensive report on #GovernmentWaste --&gt; https://t.co/dpaJ92ZhwL
"Grave Digging in Iceland, Tofu in Convenience Stores: Your Tax Dollars at Work. @DailySignal https://t.co/5UVDJCRkit"
RT @HeritageOTH: WATCH LIVE: @SenatorLankford on Federal Fumbles: 100 Ways Government has Dropped the Ball. Tune in! https://t.co/sxyo1O14Bo
"I discussed some outrageous examples of gov't waste &amp; duplication in my #FederalFumbles report on @FoxNews ""Tucker… https://t.co/dxZPzVzkxa"
About to go LIVE on @FoxNews Tucker Carlson Tonight w/@TuckerCarlson. Tune in now. https://t.co/ONumpI6Mik
RT @FoxNews: Okla Sen. Lankford releases new 'Federal Fumbles' report on gov't waste  https://t.co/hECH8d1tze https://t.co/Kw3NxMtDIO
About to go LIVE on @CNNSitRoom. Tune in now! https://t.co/R9JJ6Xvcva
RT @HeritageOTH: FEDERAL FUMBLES: 100 Ways the Government Dropped the Ball. Join us tomorrow as @SenatorLankford speaks @Heritage. https://…
"In case you missed it, I talked about some of the most ridiculous waste examples from #FederalFumbles on… https://t.co/5zauq5Xpge"
RT @TheIJR: Here Are the Six Most Bizarre Things From @SenatorLankford's Report of 'Federal Fumbles' https://t.co/8BfPxfClg4
#FederalFumbles Vol. 2 is out NOW! Check it out on my website HERE: https://t.co/v79oGxVWGl https://t.co/OhffJPacjM
Today's the day... #FederalFumbles https://t.co/Vc6n1yBySa
On #CyberMonday join me for a discussion about gov't waste &amp; how to address our $19.5 trillion debt! #FederalFumbles https://t.co/G2szVWMFsM
"Tomorrow, I'll release my report #FederalFumbles: 100 ways the gov't dropped the ball. You won't believe the waste! https://t.co/G2szVWv44c"
The death of #FidelCastro will hopefully spur new dialogue about Cuba's poor #religiousfreedom &amp; #humanrights record https://t.co/qICLnuui8l
Some view the election as a mandate for #deficit spending. A “stimulus” would not help our sluggish economy. #debt https://t.co/4TrUfd2Nrj
"While America focused on a presidential election, the #federaldebt increased $587 billion in FY2016 alone. #deficit https://t.co/4TrUfd2Nrj"
"An American soldier died today from an IED in #Syria. On a day when we give thanks, we mourn a fallen hero who was fighting to defeat #ISIS"
Give thanks with a grateful heart! Enjoy the day with family and friends. #HappyThanksgiving! https://t.co/C9AEPg4gus
Dept. of Ed has been notorious for #executiveoverreach &amp; regulatory abuse. I'm very hopeful @BetsyDeVos can put a end to it. Congrats!
Hot off the presses! My new waste report #FederalFumbles: 100 Ways The Gov't Dropped The Ball. Get your digital cop… https://t.co/aw3Ugc2NFh
"The 58th Presidential #Inauguration is Friday, January 20, 2017. Here is info on tickets for #Oklahoma residents: https://t.co/KMFCeVNkfX"
"#Iran has not upheld their end of the bargain re: #IranDeal. United Nations, US should consider reimposing sanctions https://t.co/4JhK2qj0jX"
#OvertimeRule salary threshold is too high for #Oklahoma. Rule should be redone to take cost-of-living into account. https://t.co/CqkoBze9cg
"#Oklahoma #smallbusiness owners, colleges &amp; charities say #overtimerule leads to job loss, increased tuition &amp; less charitable services."
Amen! https://t.co/JfE3DdxxBf
My speech before the Heritage Foundation #Antipoverty Forum last week. It's long but worth the listen: https://t.co/dVknWjH4OM #poverty
Sorry to hear of the passing of former #Oklahoma AG Larry Derryberry. Grateful for his service to our state. He was a true statesman.
.@SenCapito @WVUfootball played well but @OU_Football is on a roll right now. Hope @WVUfootball wins out &amp; makes it to a good bowl. #Boomer
"US has 400K foster kids. 110K need adoptive families. @CCAInstitute advocates for them in DC. #NationalAdoptionDay 
https://t.co/Biw5sW3dQb"
".@SenCapito oh no! @OU_Football will win today &amp; in 2 wks, the #Big12 champ will again be a team from #Oklahoma.… https://t.co/yWagfgiy31"
Today is #NationalAdoptionDay! Congrats to all the adoptions being celebrated today. #NationalAdoptionMonth https://t.co/gtSjzcrgpw
