"On #NationalAgDay, enjoyed hearing how #WV @NationalFFA members help prepare WVians for careers in the science, biz… https://t.co/OAKYBzWS0b"
Proud of these #STEM scholars from Pineville Middle School for being named #SamsungSolvePVMS national finalists! https://t.co/nOqeH60GSr
Honored to be w/ female advocates today on #RosietheRiveterDay. Thank you to all of the Rosies for your hard work! https://t.co/HKhlf35fUi
ICYMI: Co-sponsored a bill to measure economic impact on #broadband - an important step in connecting communities: https://t.co/SH7KJXVPRm
Good editorial by @DM_opinion on why #SCOTUS nominee Judge Neil Gorsuch should be confirmed in the Senate: https://t.co/6Dn8nSDPRw
Met with Hoops Family Children’s Hospital director Melanie Akers today to discuss Medicaid coverage and pediatric c… https://t.co/32YCr6XbBW
"RT @SenateMajLdr: ""#Gorsuch Right for High Court"" - @SenCapito on why @GorsuchFacts is ready for #SCOTUS https://t.co/QNFdgFJPIb"
Had a great time discussing leadership &amp; #WomensHistoryMonth w/ students at @PPHSUpdates this morning! https://t.co/s1faAgK1jb
Last week I spoke w/ @Your4State about #SCOTUS nominee Judge Gorsuch’s confirmation hearings that began today. MORE: https://t.co/ewUemCLDoe
Outlined Judge Neil Gorsuch’s #SCOTUS qualifications in @IntelligencerWV to kick off today's @senjudiciary hearing:… https://t.co/GQEsJlNJZ0
#Broadband has the power to unleash jobs &amp; fuel economic growth. @thehill has more on my efforts w/ @amyklobuchar: https://t.co/bvg29mD0tY
"#STEM careers have the power to transform our economy, especially in economically distressed communities:  https://t.co/vkDTxD9stU"
Rooting for @WVUWBB in their #ncaaW second round game vs. @umdwbb! Let’s go #Mountaineers! #HailWV
"Signed, sealed, delivered! Take a look at a few highlights from the Senate in my weekly newsletter:… https://t.co/fsawL7LCrB"
ICYMI: Glad to have @WVCTCS's Dr. Tucker join me in Washington this wk to discuss #STEM. @wvgazettemail has more: https://t.co/7cVFwEVFdb
Who’s ready to watch @WVUhoops take on @NDmbb today at 12:10? I know I am! #HailWV #PressVirginia
Judge Gorsuch heads to #CapitolHill on Monday to begin his confirmation process. Here are a few of my thoughts: https://t.co/DWXy2uyxs9
"Honored to be a part of @WVStateU's Inaugural ceremonies today for the newest President, Dr. @JenkinsWVSU11. Congra… https://t.co/wWtIpMIf6i"
Congrats to @wvucobe's SwifTag system team! https://t.co/4QfDEn3tZ7
In Charleston today to bring attention to my Senate efforts aimed at combatting eating disorders – a disease that h… https://t.co/AX7uXrtGSN
Met w/ Ravenswood Mayor Miller yesterday to chat about #infrastructure &amp; #broadband – both critical to economic dev… https://t.co/byprJLnvj1
Good luck to @WVUWBB in the #ncaaW Championship First Round this afternoon! #LetsGo #Mountaineers!
Check out my weekly video update for a quick recap before the weekend: https://t.co/9yzpReQCOp
In Ripley today to catch up with Mayor Rader about the progress being made on #infrastructure projects. https://t.co/YHUeWbXUGV
Good luck to @WVUhoops as they kick off #MarchMadness this afternoon. Let’s go #Mountaineers! #PressVirginia
Intro’d a bill to ensure Nat'l Guard &amp; Reserve Troops receive the same benefits as their active duty counterparts: https://t.co/OGCyvNHGam
Jim Donovan is a principled conservative and well qualified to serve as Deputy @USTreasury Secretary. He will do an excellent job.
Improving WV’s #infrastructure can help encourage economic growth &amp; create new opportunities. Thx to… https://t.co/qeQzvgrxj1
#STEM education holds such promise &amp; possibility for WV. Learn more about today’s hearing w/ @WVCTCS's Dr. Tucker:… https://t.co/HsHWu09UOM
Intro’d a #broadband bill today to measure the economic impact of broadband on U.S. economy. Learn more here: https://t.co/TJvw4A8u4D
Announced more @fema funding to assist w #wvflood recovery efforts for local school &amp; infrastructure projects. MORE: https://t.co/3YACi9Gm6R
Plsed to have @WVCTCS's Dr. Tucker join today’s Appropriations subcommittee hearing on #STEM education. WATCH LIVE: https://t.co/SyjRjgEAjj
Thank you to the WV pastors who braved the snowy weather to visit my office and pray with me today. https://t.co/17bxhWXsZn
Intro’d a bill to give doctors full knowledge of patient’s previous opioid addiction. @Register_Herald has more: https://t.co/uTa673BAtr
Participating in @SenateCommerce hearing focused on truck safety. Learn more here: https://t.co/5ZBJYZL9E1
Honored to meet WV members of the @PVA1946 last week and personally thank them for their service. 🇺🇸 https://t.co/8DYlGH4oRS
.@heralddispatch editorial: “Jessie’s Law would close an important gap.” Read the piece here: https://t.co/ayTpoFzBlh
.@Register_Herald editorial showcases #JessiesLaw &amp; how it can prevent future opioid deaths:  https://t.co/5wBQhLIQyN
My weekly newsletter is hitting inboxes now. Check it out &amp; share with a friend here: https://t.co/Zfa6i0P858 https://t.co/XspPLoaUXv
I intro’d a resolution designating March 21 as National Rosie the Riveter Day to recognize the Rosies who supported the WWII effort at home
"Proud of Glen Dale 4th graders Ella, Averey &amp; Emaleigh for showcasing strong women in their Rosie the Riveter schoo… https://t.co/ZRhyjSsZ17"
Wishing @WVUhoops &amp; @HerdMBB good luck in their conference championship games tonight. Big night for WV! #ChampionshipSaturday
Another National Championship in the books for @WVURifle! Congrats on your 19th title! https://t.co/AUJm8YNoLq #HailWV
"By providing medical professionals w their patient’s history, we can help save lives. That’s the goal of #JessiesLaw https://t.co/QJrfNeCPNZ"
Had a good discussion w/ Lou Delatore about creating more jobs here at home for American steelworkers and manufactu… https://t.co/TQcABFiQXg
My staff participated in the annual wreath laying ceremony to honor the life of WV WWI #veteran Frank Buckles. Grat… https://t.co/pod7wpLPAY
Always enjoy meeting w/ WVians visiting Washington. Check out a few highlights from this wk in my #Facebook album:… https://t.co/acIECPlAZ1
Take a minute to watch this week’s update from the Senate: https://t.co/jLtMrBdF21
Heard about the great work being done at @NASAIVV Center in Fairmont &amp; the exciting times ahead for @NASA! https://t.co/joNPPB9Poz
My prayers are with the families of those impacted. I will keep fighting on their behalf to grow jobs in WV.
We must continue working to strengthen our economy so that our people &amp; businesses can thrive.
"Very disappointed to learn that Mohawk Industries is closing its plant in Holden, putting 111 people out of work."
"Caught up w/ @HuntingtonCorps' Col. Secrist this week about projects like the construction at Bluestone Dam, which… https://t.co/S17xE503QB"
Shooting sports are important to WV's economy &amp; our proud hunting heritage. That’s why I reintro'd this bill today: https://t.co/NZknWupczA
WV’s @SenateYouth delegates Antonella &amp; Joseph are 2 shining examples of what the future holds for our state:… https://t.co/u4wWntDeTT
Tune in to @WVMetroNews at 10:30 to hear my discussion w/ @HoppyKercheval about health care &amp; miners protection: https://t.co/jehbgFfRY8
Caught up on the happenings at @marshallu w/ @MarshalluPres Dr. Gilbert. Great to see you! https://t.co/ASmxAAggiP
Interested in attending a U.S. Service Academy? Find out how to apply on my website: https://t.co/MTDHF4GS82 https://t.co/g2ioWKSeHM
It was an honor to join @FLOTUS &amp; other female leaders at the White House today to celebrate #InternationalWomensDay https://t.co/WFoDTSKXa0
Reintroduced #JessiesLaw to help save lives &amp; make a lasting impact in the fight against the drug epidemic. https://t.co/juNElhAP5S
Walt Filipek proudly displayed his medals at Hansford Sr Center last wk. Honored to present him the #PurpleHeart &amp;… https://t.co/AImUNFfMa7
Today’s @EPWGOP hearing will examine a bill I intro'd last wk to promote nuclear #energy innovation. WATCH: https://t.co/j6veLRuq0R
New funding headed to southern WV to provide economic recovery support in central #Appalachia. MORE: https://t.co/3b4tpkDdLF
Participating in a @SenateCommerce hearing focusing on @FCC oversight. WATCH live at 10 here: https://t.co/1eco8wFQfV
ICYMI: The @Register_Herald reported on my support for programs that assist victims of abuse. More here: https://t.co/UCHjGloSHx
WV #veteran Preston Brown won 1st &amp; 2nd place awards at last week’s Creative Arts Festival at the @MartinsburgVAMC.… https://t.co/lsZHafEpxl
Thanks for having me! Enjoyed discussing how the tech industry can spur economic growth &amp; create jobs. https://t.co/hVkKGlozcx
Congrats to @CoachMikeCarey &amp; @WVUWBB for winning first @Big12Conference tournament championship! #HailWV #Big12WBB
Spoke at my Church in Charleston yesterday about WVians struggling w addiction &amp; legislation like #CARA that seeks… https://t.co/XLS1VzbqJ1
ICYMI: @Your4State has more on my efforts to support programs assisting victims of sexual &amp; domestic abuse: https://t.co/lCmohdktM6
.@POTUS understands the frustrations WVians feel. Here’s my takeaway from his first #jointaddress: https://t.co/JRBrBDNbon
Tomorrow is the deadline to vote for WVian Tarannom Rajaee’s Doodle 4 Google. Help support her &amp; cast your vote her… https://t.co/lRaBuAiRI2
Read my newsletter for the highlights from another productive week in the U.S. Senate: https://t.co/g0IUTfMFU4 https://t.co/T9lMa0v5y7
.@POTUS’ 1st #JointAddress to Congress delivered a message of optimism in WV: https://t.co/YHsQmFN804
Ensuring quality healthcare for kids is important to me &amp; I was glad to have the chance to discuss this priority w… https://t.co/a3oON8eeRb
Designated March 21 National Rosie the Riveter Day to recognize the vital contributions of women during WWII: https://t.co/9RXiqdBgg8
.@JohnBoozman &amp; I received a briefing at the @CustomsBorder Training Center in Harpers Ferry today on critical trai… https://t.co/xyNusr5hel
Met with @MichaelPhelps this week about his work w/ @usantidoping to promote fair &amp; clean athletic competition. https://t.co/cYMXKkYmEI
WATCH my weekly message to learn how I’m recognizing #WomensHistoryMonth : https://t.co/i6VpqXFmWs
Always good to see Lt. Col. Dodrill &amp; the WV Wing Cadets. Enjoyed hearing about how they’ve helped w/ #wvflood reli… https://t.co/kjLwWbgpGh
HAPPENING SOON: Tune in to @CNN @NewDay at 7:00 AM. I’ll be LIVE talking #energy jobs &amp; more!
Good chatting w/ this group from Adventures on the Gorge &amp; America Outdoors Assoc. about enhancing WV’s endless rec… https://t.co/PFnlMfWS11
Joined @EPWGOP chairman @SenJohnBarrasso &amp; others to intro a bill that promotes innovation in the nuclear sector: https://t.co/GbhKhxoIRD
"WVians rely on roads, bridges &amp; highways to fuel our economy. I’m committed to improving #infrastructure &amp; glad… https://t.co/8GDJ1N5x1E"
Join me this #NEDAwareness week to shine a spotlight on eating disorders: https://t.co/2FAmLekmGM
I will continue fighting for these #WV @MineWorkers retirees until Congress fulfills the promise that was made to o… https://t.co/UGUUNoneiK
.@GovernorPerry will be a strong partner w/ #WV as we seek to strengthen our #energy sector &amp; protect jobs. My full… https://t.co/JWiwpwsmXS
Spoke at @EPSCoR_IDeA's reception about how important these programs are to research taking place in #WV. https://t.co/kIMEXD6ngy
Tune in to @WVMetroNews this morning at 11:45. I’ll be speaking w/ @HoppyKercheval about @POTUS’ 1st #JointAddress. https://t.co/Vd4PsYMYbW
Voted to confirm Dr. Carson as @HUDgov sec. He will listen to the needs of rural America &amp; work to make housing affordable &amp; accessible.
Congrats @GWHS_patriots' Karen Donathan for winning @csteachersorg award. My kids learned from her skill &amp; talent. https://t.co/NGxPTgLfo5
"Had a productive mtg w/ WV health care providers in my Charleston office last wk about providing accessible, afford… https://t.co/jdzr8jIjA3"
WV’s miners worked hard in dangerous situations to power this country. I am fighting to protect their hard-earned health benefits.
Enjoyed hearing about how @DAVHQ is providing a lifetime of support for our veterans &amp; their families. Grateful for… https://t.co/KIYPhMlaRA
Good mtg w/ @AANPublic WV members about furthering access to telemedicine so patients can be quickly &amp; properly tre… https://t.co/VYZhGuZaiQ
Just voted for @RepRyanZinke to lead @Interior. https://t.co/MZSiZhEqZl
#Broadband is a resource our communities simply must have. Glad #WV #Broadband Day at the state Capitol helped elev… https://t.co/j7y74P6gVN
Looking forward to asking #wvflood Q’s during @EPWGOP flood control #infrastructure hearing at 10:30. WATCH: https://t.co/vtozjikpwo
Important @SenateCommerce hearing at 10 on #broadband &amp; connecting America - One of my top priorities for WV. WATCH: https://t.co/QZZR9eOafB
"Glad to hear support for WV priorities like job growth, reg reform, infrastructure &amp; fighting the drug epidemic in… https://t.co/GMDAw5CBjW"
My thoughts and prayers are with the friends and family of Jason Matthews who lost his life while working at a McDowell County mine.
"From veteran-owned businesses to a strong national defense, had a wide-ranging discussion with West Virginia… https://t.co/Y4G1jpysFm"
My #WVGirlsRiseUp program empowers WV girls to become the leaders of tomorrow. Read more from @WVTelegram: https://t.co/cpmkqMwqSh
"Read @lizbeavers1's report on my #WVGirlsRiseUp event encouraging #girlpower through education, fitness, confidence: https://t.co/FARYjkZgNS"
My statement on tonight’s vote to confirm Wilbur Ross as @CommerceGov secretary: https://t.co/YHmOsiVOf8
March 6 is the deadline to vote for WV student Tarannom Rajaee’s Doodle 4 Google. Help support her by voting here: https://t.co/gQehc9FViJ
Was in Richwood last wk for an announcement that will help put the community back on track after #wvflood. WATCH: https://t.co/tJFPAMLikm
Community pharmacies are important to our small towns. @SenatorTester &amp; I are working to make them more accessible: https://t.co/pTtIaoxQuH
.@WVRecord has more details on why I was at the #WhiteHouse last week: https://t.co/4KlPoHE3o8
Honored to be included in this @WVTelegram article highlighting women who are committed to serving West Virginia: https://t.co/hyfV8Jw1Vx
I’m working hard to ensure adequate health care is provided in rural communities. Details here: https://t.co/8joDQ8BRrM via @Register_Herald
Don't forget to vote for WVian Tarannom's Doodle 4 Google! Cast your vote before March 6: https://t.co/gQehc9FViJ https://t.co/wHfCVz1vYm
These Keyser Middle School students are members of their Local School Improvement Council. Great to have them as to… https://t.co/f3BiD0cjjX
Richwood was devastated by the #wvflood last summer. This week I was on-hand to announce new recovery efforts: https://t.co/RcX7weM6Dl
Visited #veterans at the Charleston @DeptVetAffairs CBOC to see how they are being cared for: https://t.co/7jUKixcGWq
"Education, fitness &amp; confidence building - 3 pillars of my #WVGirlsRiseUp event at Keyser Middle yesterday: https://t.co/JOTsCvD2ML"
"Sat down w/ @WVaChamber's Steve Roberts to discuss job creation, education and ways we can encourage prosperity. https://t.co/IwpAihYjCy"
Joined @Sen_JoeManchin to announce more financial assistance in Nicholas Co. to help w/ #wvflood recovery efforts: https://t.co/0iosLRN7Ui
"Covered coal, education &amp; the budget crisis w/ @DanThorn_ on @WVTonight. Check it out here: https://t.co/scpBv2EmYm"
Always impressed by the driven girls I meet while visiting local schools for my WV Girls Rise Up program. Thx for h… https://t.co/wAozZwG4Vv
Good editorial in @IntelligencerWV about ensuring our retired miners aren’t left behind. Read it here: https://t.co/8fJBaMr5pE
"Congratulations to Tarannom Rajaee, this year’s WV Doodle 4 Google winner! Your Life on Mars doodle is out of this… https://t.co/RNzc5y9qV7"
@quitemarybeth I'm not able to be in Buckhannon tonight. I respect &amp; encourage your right to make your voice heard &amp; welcome your feedback.
ICYMI: Stood with WV coal miners to watch @POTUS sign a measure I intro’d to roll back an Obama-era anti-coal reg: https://t.co/KKoSoUnnbJ
Had a productive meeting today w/ @WVGovernor Jim Justice about ways we can improve #WV together. https://t.co/xLeUghRR5o
Great meeting you @joepayton1!
Visited Friends-R-Fun Child Development Center to see the finished gym &amp; educational wing funded by a grant I helpe… https://t.co/lzTFHTKJyI
Proud of @Fairmont_Hoops for taking the #1 spot for 1st time since 1974 &amp; since joining @NCAA. Congratulations! https://t.co/B9K4BdFoPU
Had the opportunity to thank WV veterans today at the Charleston @DeptVetAffairs CBOC. https://t.co/JWWl9JslKv
Spoke at the @WV_coal1 symposium this AM about what the new administration means for our energy economy &amp; my effort… https://t.co/cohL6Qoxj6
"I'll join @HoppyKercheval on @WVMetroNews at 11:06 to talk energy, jobs &amp; my visits w/ WVians this week. Tune in: https://t.co/jehbgFxtmI"
Inspired by the flood recovery efforts taking place in Richwood-glad to join Mayor Baber &amp; other groups aiding reco… https://t.co/sfEZu1tbLq
Today I visited the Cabin Creek Health Clinic’s Pulmonary Deptartment that provides needed services for WV miners https://t.co/GGc4oHcJtU
The road to recovery following last summer’s #wvflood has been long. Together we continue to rebuild &amp; prove we are… https://t.co/mJ17qEK2P6
Happy #PresidentsDay! Take a moment today to honor some of our nation’s great presidents who have served our nation.
Informative meeting w/ WVians this week about the research happening at @NIH for migraine &amp; headache disorders. https://t.co/GhK5mgj7HT
Read about my visit to the Oval Office in this week's newsletter: https://t.co/90Vsk7K0uW https://t.co/2YaGcA4iu7
".@wvstatejournal explains why I think overturning Obama’s last minute, anti #2A rule was the right step: https://t.co/euiWFAsXpl"
Looking forward to working with @POTUS’ cabinet members to strengthen WV: https://t.co/WtW6JDwlKx
Have a minute? Watch my weekly West Virginia video message: https://t.co/awHjNk8NV8
Another great constituent coffee with West Virginians visiting my DC office this week. Check out the photos: https://t.co/0LdIdyIEqD
My statement on @AGScottPruitt's confirmation as @EPA administrator: https://t.co/MhxUlnG8js https://t.co/W2wDGo3pZJ
"My condolences to the family of Congressman Bob Michel. He was a kind man, a great leader and a friend to our family."
Reintroduced a bill w/ @SenatorTester to help stabilize #Medicare Part D drug pricing for community pharmacies: https://t.co/qwfBlzfMR4
Spoke w/ @Your4State this week about @POTUS’ cabinet nominees. Watch the interview here: https://t.co/Ni87CpJ8qY
Can’t think of a better nominee for @usairforce secretary than my friend &amp; former colleague @HeatherAnWilson. Glad… https://t.co/vnHpvi2BcS
ICYMI: I spoke at the White House today about my measure that @POTUS signed to protect WV coal jobs: https://t.co/I7jYDIa85E
HAPPENING SOON: Watch me join @POTUS at the White House to sign my CRA overturning an Obama-era anti-coal rule:  https://t.co/Ep7VVfG90y
Sent a letter to @HHSGov @SecPriceMD on the need for quality health care in #WV &amp; rural America. Read it here: https://t.co/r433rcy1uE
I am confident @AGScottPruitt embodies the leadership we need to restore balance &amp; accountability to the @EPA.
".@AGScottPruitt is committed to returning @EPA to its core mission of protecting clean air, water &amp; land, without undercutting the economy."
"The loss of good-paying coal jobs means less commercial activity &amp; less tax revenue to support education, public works and law enforcement."
Regulatory overreach in Washington has cost billions of $ &amp; tens of thousands of jobs. @EPA has become the poster child of this overreach.
Speaking on the @SenateFloor shortly in support of @AGScottPruitt as our next @EPA admin. Watch live: https://t.co/0CVu7GuKOi
Learn about my bill to designate the Appalachian Forest Heritage Area &amp; help more people enjoy WV's natural beauty: https://t.co/SpX5apgbCH
Great to see #WV @MineWorkers &amp; discuss protecting the healthcare benefits of retired coal miners:… https://t.co/kddwiOwzFk
HAPPENING NOW: @SenateCommerce Surface Transportation subcommittee hearing on multimodal transportation system: https://t.co/j63E5vrcQp
Just voted to protect the #SecondAmendment rights of law-abiding Americans: https://t.co/PUfLAeXRA8 #2A
RT @EPWMaj: At 10 AM: Hearing on strengthening &amp; modernizing the Endangered Species Act. Watch live here: https://t.co/LAaFGrjpTr
.@Your4State has the details about my meeting w/ @POTUS last week. More here: https://t.co/BVdJIIuIUI
"Wonderful to see #WWII Medal of Honor recipient, proud West Virginian, and my dear friend @WoodyWilliams45 in Washi… https://t.co/pLVAxRwUJM"
.@Linda_McMahon is the right choice to lead @SBAgov &amp; advocate for #WV’s small businesses. My full statement:… https://t.co/8PkcCDv5QZ
Proud to continue leading @EPWMaj's Clean Air &amp; Nuclear Safety Subcommittee. @heralddispatch has the details: https://t.co/rm8Ox3rphD
Also voted to confirm Dr. David Shulkin for Department of Veterans Affairs Secretary. My statement:… https://t.co/zsXClcfCDp
Voted tonight to confirm Steven Mnuchin for Secretary of the @USTreasury. Full statement: https://t.co/JV98FIcmGN
Glad to announce funding from the @NSF to support @WestVirgniaU efforts to recruit &amp; train #STEM teachers: https://t.co/OSJFcw0rCq
Congrats to @ONEMHS &amp; @NiceSuncrest for winning their regional competitions &amp; advancing to @DOE_SC_NSB. You make WV proud!
Thanks for the opportunity to provide an update on my work in the Senate to strengthen #WV. https://t.co/LxRFTLHlrH
ICYMI: Watch my interview with @WVNS59News about repealing #Obamacare &amp; replacing it with the Patient Freedom Act: https://t.co/DTnjpPzQF3
Don’t miss this week’s big 3: https://t.co/IJJV8Dg762 https://t.co/BO7D36KVoG
I am glad Century Aluminum will fulfill commitments made to its Ravenswood retirees &amp; applaud all who fought for their hard-earned benefits.
Met with WV @CADCA members this week in the Senate to talk about creating a #drugfreeWV. https://t.co/qa5glF0xla
I am hopeful for the future of West Virginia if the Patient Freedom Act of 2017 is enacted: https://t.co/Rx86DXxYLY
Watch for a quick update on this week in the Senate &amp; my meeting with @POTUS: https://t.co/BWzGQ0YtQf
.@juliakgilpin I enjoyed speaking with you all. Great questions! https://t.co/6rjCHR6aR9
"Honored to continue serving as chairman of the @EPWMaj subcommittee overseeing @EPA air regulations. Thank you,… https://t.co/rZml0cyJc9"
My full statement on my vote to confirm @RepTomPrice to lead @HHSGov: https://t.co/2tNlviOFbF
#Tbt #Trivia: Found this photo of my parents at the Sadie Hawkins Dance at @WestVirginiaU years ago. Can anyone ide… https://t.co/5cRkjeqxAP
"Encouraged by my meeting with @POTUS at the White House today. We discussed #SCOTUS, #broadband, #opioidepidemic &amp;… https://t.co/gD6xStaMB5"
"If you missed @Talkradiowrnr earlier, I’ll be speaking w @TomRoten at 8:35 about cabinet nominees &amp; more. Listen in: https://t.co/8junlGJz4m"
Tune into @Talkradiowrnr this morning at 8:15. I’ll be speaking about the latest news from the Senate. https://t.co/CGFaCskwFB
My statement on tonight’s vote to confirm @SenatorSessions as Attorney General: https://t.co/iL8w9JspZu
Enjoyed hearing from West Virginians during my constituent coffee this morning. https://t.co/K0dYLibnEU
"In honor of @huntingtoncity native, Feb 1 is now Carter G. Woodson Day in WV. Glad my staff was on hand to celebrat… https://t.co/dzRjfR6uCS"
Happy birthday to our very own @WestVirginiaU! Here’s to 150 more years of #Mountaineer pride! #WVU150 https://t.co/kXMGN9HRl9
I’ll be talking about today’s votes in the Senate with @TeamCavuto at noon. Tune in to @FoxBusiness now. https://t.co/S03diD6or8
ICYMI: Outlined a replacement plan for #Obamacare in an op-ed for @wvgazettemail. Read it here: https://t.co/FhXptAIrKF
Met with the Islamic Association of West Virginia &amp; Rabbi Victor Urecki today in Charleston. Appreciate the opportu… https://t.co/1DmTUieKz7
The #PatientFreedomAct provides much-needed healthcare choices. https://t.co/lHJsua5RWV
My op-ed in today’s @gazette_opinion explains how we’re going to replace #Obamacare: https://t.co/t62CdEDcRa
MUST-READ: My top 3 takeaways from this week in Washington: https://t.co/yfCXGMIejT https://t.co/BWqngNdDkf
.@POTUS’ Supreme Court nominee Judge Gorsuch is an excellent choice. Here’s why: https://t.co/sigFheMxco
"Know someone with heart disease? This #HeartMonth, share heart-healthy lifestyle changes with friends &amp; family.… https://t.co/LFLttbWZqH"
"Learn how I’m working to expand broadband, overturn harmful regs &amp; fight for WV in my weekly update: https://t.co/Tlkfp3Iqaw"
Talked #jobs &amp; #broadband w/ @SBAgov nominee @Linda_McMahon. She'll be great advocate for WV's small businesses:… https://t.co/NmBlh1Slxk
It’s National #WearRedDay! Join me and @nih_nhlbi in raising awareness to prevent heart disease. #HeartMonth https://t.co/7ioBLp7rEW
The #STARAct will advance pediatric cancer research &amp; treatments. Proud to re-introduce this important legislation: https://t.co/ZAJ8ugDwTp
Re-intro'd a bill this week that will strengthen the domestic steel industry &amp; support jobs. MORE: https://t.co/Ky8Tb8SOGy
#CapitoConnect Update: Encouraged @AjitPaiFCC will move forward with Phase II of Mobility Fund to expand rural #broadband access.
