Best way for Congress to support our troops is provide necessary resources for victory &amp; pass an AUMF. https://t.co/nJrzeIXPNj @RCDefense
Great talking w/ Kennedy-Lugar Youth Exchange students @ Hoosier Huddle today. They're calling the Hoosier state ho… https://t.co/yzpNByG10H
Thank you for stopping by. I'm looking forward to working with you all on issues important to Hoosiers. https://t.co/wnCr7KGlN0
"Thanks for stopping by, Mayor. Look forward to working with you. https://t.co/xlif02jrJP"
An honor to have MSG Anna Lloyd of Michigan City as my guest tonight. She serves our country honorably &amp; has done H… https://t.co/P2qDLEszUr
Stay safe and aware tonight as severe weather is possible across parts of Indiana. https://t.co/jyfXwzFIwK
I'm looking forward to an optimistic message from @POTUS that lays out a plan for bold conservative action. https://t.co/ls4wHvZAm5
It's always great to meet with you! I'm looking forward to continuing to work together on important veterans' issue… https://t.co/SnTotQMfYs
Honored to have breakfast with General Neller--Commandant of the Marine Corps. Semper Fi! https://t.co/n7QqBhj28s
"Higher education shouldn't be out-of-reach for students &amp; their families. Debt-free college is realistic. My plan:
https://t.co/fGET0ZN8Md"
Hoosiers won't tolerate the recent rash of anti-Semitism toward our friends &amp; neighbors in the Jewish community. We support @JCCIndianapolis
My state offices will be closed Monday and Tuesday as the staff will be undergoing software training. You can continue to reach us by phone
"ICYMI: I was in Allen Co. to consider collaborative ways to fight the opioid epidemic. https://t.co/NJBs03i7wT
https://t.co/R0M1goE3go"
"Met w/ Mayor Copeland in E. Chicago to discuss the lead crisis and what I can do to support city and state efforts. 
https://t.co/450xP1zqYG"
"Met lots of amazing students &amp; teachers at Lake Central High, including Veronica, who is a finalist for the Doodle… https://t.co/TmvaEY3rwg"
"RT @USMC: On this day, 72 years ago, uncommon valor was a common virtue when Marines raised the American flag on top of Iwo Jima. https://t…"
Mayor @karenaboutgary gave me a full tour of Gary this morning including the gorgeous Lake Street Beach https://t.co/XtKXILuuQy
"I was in Allen Co. to discuss how we can use proven interventions to fight the opioid epidemic.  
https://t.co/R0M1goE3go"
"Swung by a Fort Wayne VFW and met some good folks, including Dave. https://t.co/tZyGILB6Jg"
"Visited PHP, an Indiana health insurance company that had to drop out of the Obamacare marketplace last year. https://t.co/8HyGRbBHvN"
In Fort Wayne with community leaders who are trying to stem the heroin crisis. https://t.co/X8bCexmFWT
Lots of opportunities for our state and federal governments to partner and support one another. https://t.co/V7MnobsAY3
"Ran into @AvivEzra today, Israeli Consul General to the Midwest. Proud to stand with Israel. https://t.co/VXB8fwSijd"
I sat down w/ @matthewltully to discuss issues before the Senate and how Indiana stands to benefit. https://t.co/7X2YCErZ1l
Congratulations to @IndianaUniv Army ROTC on earning the 2016 General Douglas MacArthur Award! https://t.co/cUCMZgbB6s
"These grants will help Indy's most vulnerable. I was glad to attend the event &amp; look forward to continued progress. 
https://t.co/O0xQbch3Iu"
"RT @uwci: Thank you @IndyMayorJoe, @RepAndreCarson, @SenDonnelly and @SenToddYoung for attending the #GreatFamilies2020 press event! #SIFun…"
Great gathering @uwci as we celebrate the Great Families 2020 grant recipients. https://t.co/ELzNYyApwH
"Great news: AT&amp;T ultrafast internet service starts today in @NewAlbanyIN and @CityofJeff. 
https://t.co/9gnbkUbqJt"
I introduced commonsense &amp; bipartisan legislation to promote reform and hold the @StateDept and @USAID accountable… https://t.co/ZRUegA44ea
Seema Verma put mission above politics and her innovatives ideas are working. She is a tremendous choice for CMS Ad… https://t.co/OpuYiRHyAb
I'll be joining @SenDonnelly in introducing CMS Admin-nominee Seema Verma before @GOPSenFinance Committee. Tune in: https://t.co/DK1VN7yWUE
Human trafficking must be fought at every level of gov't w/ the help of private initiatives. Proud our state is lea… https://t.co/jcRP4Fdte5
Thank you @aplusk for your testimony today on ending human trafficking. #EndItMovement❌ Watch our full exchange: https://t.co/Esix9w6phq
"It was great meeting you, Bones. Good luck in your game this weekend! https://t.co/RRqCrpBveR"
I recently met with Judge Neil Gorsuch. He is a mainstream choice and faithful constitutionalist. #SCOTUS https://t.co/NokGsHJHiX
"'Sen. Young Meets with Nominee Gorsuch' #SCOTUS
More: https://t.co/EVFcaC0NQr https://t.co/m6xGe9cGCu"
"The job of a judge is not to write laws, but instead to interpret &amp; apply them to any given case. #SCOTUS More on m… https://t.co/xwuYTfnknd"
"This is great news for Ft. Wayne and is reflective of the healthy business climate in the state of Indiana. 
https://t.co/OScutYf2P5"
Young Part of 'Constructive' Talks With Key Trading Partner via @IIB https://t.co/TljLgWw9iT
I met w/ Adm. Richardson to press that @DeptofDefense protects jobs at Crane that are critical to nat'l security. https://t.co/FYD3CdS3UI
I joined my colleagues in sending a letter to @POTUS urging enforcement of a tough-minded policy towards #Russia. https://t.co/CS1Xd7O7Wi
I joined my colleagues in asking @POTUS to keep pressure on the Russian government through serious sanctions. https://t.co/SeIYSAC6Iu
I'm pleased to see @GovHolcomb addressing this issue head on. I stand ready to continue assisting from the federal… https://t.co/K5Zk2kpXOp
"Thank you for your service, Maj. Gen. Denton. Your continued dedication to our country is an example for us all. 
https://t.co/NUSsTeGrhz"
How do we measure success in the propaganda war against ISIS? I pressed for answers. https://t.co/2wszzHRujT
Congratulations to Grace &amp; Tara for being recognized as top youth volunteers in the @Prudential Spirit of Community… https://t.co/oNOnl23GsE
Judge Gorsuch's distinguished record and previous Senate confirmation prove he deserves fair consideration and an u… https://t.co/KfNejW1wYN
"ICYMI: We need additional and severe pressure put on Iran in response to its ballistic missile program. 
https://t.co/r56rwcLNRd"
Neil Gorsuch is a mainstream choice and faithful constitutionalist. I look forward to thoroughly vetting him for SC… https://t.co/dCEaRO8uud
"I applaud the Trump administration for imposing new sanctions on Iran. 

See more: https://t.co/awnMgIDOsl https://t.co/UuItetRpLf"
"We are ending the era of overregulation. Read more from my op-ed in the Evansville Courier and Press. 
https://t.co/DaL6RFvRuQ"
".@JohnCornyn, @marcorubio, and I wrote an op-ed calling for severe sanctions on Iran's ballistic missile program. 
https://t.co/r56rwcucsD"
I'm thrilled to work with @marcorubio &amp; @purduemitch to make higher education more affordable and accessible. https://t.co/fJ8gMMiQfm
"I'm thrilled to work with @marcorubio &amp; @purduemitch to make higher education more affordable and accessible. 
https://t.co/Iadeq8YEH4"
Rex Tillerson will be an excellent Secretary of State and a staunch advocate for our country’s national security in… https://t.co/gR2x0pJYry
ICYMI: I shared my thoughts on Judge Neil Gorsuch. I feel he is a mainstream pick and faithful constitutionalist.… https://t.co/kqDMTsMBdO
"The President has nominated a mainstream and faithful constitutionalist to serve on the Supreme Court. 

My thought… https://t.co/kpqQ9LUP6o"
RT @SenRubioPress: Congress &amp; admin should enact the #Iran Non-Nuclear Sanctions Act I coauthored with @SenToddYoung &amp; @JohnCornyn https://…
.@ElaineChao will help ensure Indiana remains the 'Crossroads of America' in her new post as Secretary of @USDOT. https://t.co/9mOYhfeB9R
"Crane is critical to our national security. I asked Secretary Mattis to exempt it from the hiring freeze.
https://t.co/0gdKpllVH3"
"3/3 That’s why @MarcoRubio, @JohnCornyn, and I reintroduced the Iran Non-nuclear Sanctions Act last week. https://t.co/CIJ1H6aj6T"
2/3 Tehran’s ballistic missile test this weekend underscores yet again the need to impose tough sectoral sanctions.
"1/3 Iran’s ballistic missile program threatens our forward deployed troops, our allies, and eventually our homeland."
Hoosiers who need assistance w/ casework can now reach my Constituent Services Centers. Find contact info here: https://t.co/pIDABpXPD0
"As thousands gather for #Marchforlife, we pray for the unborn, the birth parents who choose life &amp; families who wel… https://t.co/Nklv3YbFtl"
"@SenDonnelly, @RepVisclosky, &amp; I sent a letter to the administration to seek clarity on E. Chicago cleanup efforts. 
https://t.co/onWz5c3rC8"
Families of East Chicago deserve transparency. It's critical they are kept up to date on progress of cleanup effort… https://t.co/MVDpZJuux9
"I'm fighting for opportunities to put children like Amori Curiel, a student in Indy, in the best position to succee… https://t.co/VEBAxmkNeR"
I look forward to working with @nikkihaley to reform the U.N. and promote our national security interests abroad. https://t.co/WpaDJf7O3M
I was proud to join @marcorubio and @JohnCornyn in introducing the Iran Non-Nuclear Sanctions Act.… https://t.co/67oYlXwMIM
I'm thrilled to see @ToyotaIndiana investing in our state and hardworking Hoosier families. https://t.co/iqZYWellcA
My statement on supporting Rex Tillerson in committee to be Secretary of State: https://t.co/gHTbzaZDNG https://t.co/nC1bn2c0WT
It was an honor to vote to confirm Gen. Mattis as our country’s 26th Defense Secretary. From one Marine to another:… https://t.co/fG0mW0rwHb
Release: Young Weighs in on Confirmations and #Inauguration https://t.co/rc7hm05qmX https://t.co/PoIf8t8cFn
RT @JessicaASmith8: .@ScottJSander and @SenToddYoung LIVE on @WISH_TV NOW! https://t.co/ktRwDnZpl6
.@HHSGov Secretary-nominee Tom Price called Indiana’s HIP 2.0 approach a “best practice” for other states. Watch ou… https://t.co/34Dtyq78gf
"From WFIE 14 in Evansville: ""The federal government is now officially referring to Indiana residents as Hoosiers.""… https://t.co/8wB6e37J4X"
ICYMI: Finally the federal government agrees: We're Hoosiers https://t.co/giZqyx8KV8 https://t.co/DykXWBJYN3
"The litmus test for having spent considerable time in Indiana is referring to us as ""Hoosiers"", not ""Indianans"" / c… https://t.co/2zRwSU6iBZ"
GPO to Use ‘Hoosiers’ Because No One Says ‘Indianan’ - See more at: https://t.co/ltsq33OiPd
"The GPO has established ""Hoosier"" as the official designation for inhabitants of our state of Indiana --&gt;… https://t.co/RpkT9wEVBJ"
“It's not just a classic movie. It’s not just the nickname for IU athletics. It’s who we are.” https://t.co/637c4ofo82
'Crossroads of America' is more than a moniker. It's critical to the economic health of our state and to our future. https://t.co/7g7oGn94wB
"I took 5 mins. to talk w/ @rollcall about Hoosiers in the White House, my 4 kids &amp; my illustrious ""soccer career""--&gt; https://t.co/EiQxYXNW4T"
.@WilburRoss told me he worked as a census worker in college – fitting experience for Sec. I look fwd to learning m… https://t.co/PwGFhgcfSa
.@WilburRoss told me he worked as a census worker in college – fitting experience for Sec. I look fwd to learning more in @SenateCommerce.
Thank you to our men and women in blue who protect and serve our communities every day.… https://t.co/UbQQO3ieym
A few photos you haven't yet seen from this week's swearing-in. See more on my just launched Instagram page!… https://t.co/zVMny8MJwI
"2/2 His personal views on Russia, sanctions &amp; other issues matter - I look forward to hearing addtl specifics from him in the hearing."
1/2 I had an informative &amp; wide-ranging discussion on nat'l security issues w/ PEOTUS @realDonaldTrump's SecState nominee Rex Tillerson.
He deserves all the accolades he will receive in the coming days. This is an excellent pick by President-elect Trump (2/2)
I can’t think of an individual I trust more to advise the president and direct our intelligence operations than Senator Coats.  (1/2)
Congratulations to my friend @RepWalorski! Hoosiers will have a strong voice fighting for them on @WaysandMeansGOP. https://t.co/7Z0Y7b7wtx
"""The Obama administration’s refusal to veto the one-sided U.N. resolution was troubling, misguided, and counter-pro… https://t.co/uphwH24hYR"
"It's official. Thank you, Hoosier families, for the honor to serve you in the U.S. Senate. https://t.co/rUZsJsOGqj"
A true American hero. https://t.co/TsfycViEsE
You can follow the historical timeline of the Pearl Harbor attack at @USSArizona. #PearlHarborRemembranceDay https://t.co/jmgNudvQF2
"Over the years, the @indystar has spoken to survivors of the attack. I encourage you to read their thoughts. https://t.co/YQh5GFfKj9"
"Today we remember those lost on December 7th, 1941 at Pearl Harbor. Their sacrifice will never be forgotten. #PearlHarborRemembranceDay"
I'm looking forward to working with this accomplished class. We have a lot to build off of due to their success. https://t.co/5LidfqVYKc
"Yesterday, the Senate passed a bill I've worked on in the House to make government more efficient &amp; effective. More: https://t.co/ZYJIDSbQpD"
"This evening, the House voted in support of a long-term extension of the Iran Sanctions Act...
https://t.co/dHaTTrg1m2"
.@bejmorri #Hoosiers deserve relief. Premiums &amp; deductibles unaffordable; rise in subsidies will drive tax increases https://t.co/GpLrAMsnZS
RT @ifbkyle: Congratulations to @RepToddYoung on receiving the Friend of @FarmBureau award &amp; thanks for your support of Indiana #Ag https:/…
"1.4 million in #Obamacare will lose their health plans; new plan options expected to be ""fewer"" &amp; ""more expensive."" https://t.co/cc0wPtgtpQ"
RT @HouseForeign: .@RepEdRoyce @RepToddYoung via @thehill: We must confront world’s terrorists &amp; rogue regimes w overwhelming pressure http…
Need help working w/ a federal agency? Join us tomorrow for Mobile Office Hours in #Crothersville. Full details here→https://t.co/UZhYDwZ2bE
"'Democratic governor: Health law 'no longer affordable' https://t.co/PGw69fkJCr From one of #Obamacare's strongest supporters, per the @AP"
"Just posted dates &amp; locations for October Mobile Office Hours. No appointment necessary, all #Hoosiers are welcome:… https://t.co/HahXDVigim"
"RT @RiponAdvance: .@RepToddYoung bill would grow affordable #housing, helping those being forced to relocate due to lead contamination http…"
Leg Update: Young introduces bill to spur development of affordable housing for those affected by lead contaminat...https://t.co/IvRXVbxzvq
RT @Nature_Indiana: House passes #WRDA! Great step for projects &amp; policies good for #nature and natural solutions. Thank you @RepToddYoung!…
"ICYMI: House approves Young bill to improve federal management of programs, projects..https://t.co/SgTDtRopCg"
Thanks to all who joined us Saturday. Prospective students' applications are due by Oct 14. Click for all the info:… https://t.co/leOCdOiYDF
"House just passed our #bipartisan bill to reduce gov't waste, ensure programs/projects conclude on time &amp; on budget: https://t.co/z4lITiFwqs"
RT @SusanWBrooks: W/ @RepToddYoung &amp; @RepLarryBucshon called on DHS to explain agency failures uncovered in recent IG report: https://t.co/…
Immediate release: #Hoosier lawmakers question DHS Secretary over #deportation records &amp; failures found in IG report https://t.co/ke922WQx06
RT @RiponAdvance: .@RepToddYoung bill would expand affordability exemption under #ACA to protect people from rising deductibles https://t.c…
"During #NationalChildhoodCancerAwarenessMonth, I encourage you to read &amp; learn more about the ongoing need for bett… https://t.co/LRm5vJuwNY"
Hosting Morgan County Mobile Office on Weds to make my office accessible to more #Hoosiers. Click for hours/location https://t.co/yG2hDC0jvc
This week: #Hoosier Delegation Files Legislation To Assist Veterans Harmed By #ITTTech Closure https://t.co/nDCP2gZcxH
"55+ Hoosier manufacturers making parts for 1st submarine in history named after our state, USS Indiana https://t.co/99uHI5CCo2 #HoosierProud"
RT @IIB: ICYMI: #Hoosier Schools Among 'Best Colleges'. https://t.co/sa9rbizyxb @usnews @IndianaUniv @Purdue @NotreDame @RoseHulman
#Veterans who expended GI Bill benefits @ ITT Tech must have benefits restored. Our bill ensures they're made whole: https://t.co/Lsks3E7Dn3
#Hoosier delegation just filed legislation to assist #veterans harmed by #ITTTech closures https://t.co/NOQyCXSzsp
.@DukeMaximum Agree vets need immediate resolution. We [IN delegation] worked up a fix. Ensures they receive-in full-education they earned.
JUST OUT: GOP lawmakers introduce bill to enhance exemption from #Obamacare penalty @dcexaminer https://t.co/i2BSMyPnAA
Hear firsthand what life's like as a #dialysis patient https://t.co/7PcOjINeAQ Learn more about my PATIENTS Demo Act https://t.co/RrPFhvjyJy
"IMMEDIATE RELEASE: @SenTomCotton, @RepToddYoung lead bicameral Obamacare mandate relief legislation...https://t.co/3UFfSvGUfq #Mandate"
We're setting up a Mobile Office for local #Hoosiers in @CityofSalemIN on Sept 15. Full details available here: https://t.co/cgMSrz1Ff0
Any @NAFCSuccess #Bulldogs interested in a US Military Academy should join me Sept 24 for #AcademyDay. Full details: https://t.co/WriugZudLG
Big news for #Hoosiers suffering from kidney disease &amp; #ESRD. https://t.co/7PeyPH8awx We're 1 step closer to innovative care coordination...
"For #Medicare patients on fixed incomes, coordination saves time/money, reduces hassle/anxiety, improves outcomes https://t.co/kHL2SefaKW"
#KidneyDisease is increasing among seniors 65+. @WaysandMeansGOP just passed my bill to help these patients get  treatment &amp; care they need.
TOMORROW: We're hosting office hours for residents in #Bloomington &amp; surrounding communities. Full details here - https://t.co/ya2cO8Gj2R
I'm hosting an Academy Day for #Hoosiers interested in a military academy. Click for details https://t.co/8Hq1dib8jn https://t.co/gPG5NOHJ4f
WWII #Veteran Howard Kline shares memories of the psych ward in our Veteran Voices interview https://t.co/yl1GrA5JhU https://t.co/HHHBSSkYsJ
RT @govtracker: Young’s office to host mobile office hours at housing authority: Staff from U.S. Rep. Todd Young’s office wil... https://t.…
Need help with a federal agency? We host Mobile Office Hrs for #Hoosiers across Southern #IN. Check upcoming dates: https://t.co/l1JYFdilLh
Hoosiers impacted by yesterday's severe storms should report damage to #IN Dept. of Homeland Security at: https://t.co/onbXHiYYpr #Kokomo
Affected families can seek shelter &amp; get help at #Kokomo Conference Center (1500 N Reed Rd) &amp; Walnut Elementary (3548 S 775 E) in #NewRoss.
RT @CityofKokomo: Anyone needing transport to dialysis or non-emergency medical treatment can call or text 765-438-4683.
RT @CityofKokomo: City of Kokomo Transit will be running emergency transit only today. Please phone 438-4683 if you need assistance.
Hoosiers in @CityofKokomo &amp; affected communities can report storm damage to the #IN Dept of Homeland Security at: https://t.co/onbXHiYYpr
Prayers go out to @CityofKokomo and all of the affected families &amp; surrounding communities after severe weather swept central #IN yesterday.
RT @KCP_tweets: Thanks @RepToddYoung for supporting the #ESRDChoiceAct! https://t.co/rGiYwzL8Ky https://t.co/Dl2PbHiYKl
@CowCreek On June 23 I voted for $1.1 billion to fight/prevent spread of #Zika (HR 2577). See https://t.co/vj0hpF5CtF for more of the story.
Negligent #Iran diplomacy &amp; Obama WH's actions encourage bad actors to threaten American lives w/ goal of extortion..https://t.co/QbnbO1WwOV
"Sad day when to free a U.S. pastor, Marine &amp; journalist Obama concedes largest terror sponsor #Iran $400 million cash &amp; dozens of criminals."
"On top of cash payment, Obama WH conceded #Iran 21 Iranians facing criminal charges as part of the hostage exchange https://t.co/XjXBnEeJRN"
"Obama WH caught in lie. After @WSJ confirmed link, State admits cash exchanged for hostages https://t.co/HznWC1qGRo https://t.co/tJlHgBiOuj"
The #REINS Act I authored w/ Sen Paul allows Americans to hold gov't accountable for regs w/ a major economic impact https://t.co/EK4vok3wFS
We're preserving vets' stories through our #Hoosier Veteran Voices series. To get involved or share your story visit https://t.co/fE8NEKIS0R
View the latest episode of our #Hoosier #Veteran Voices series w/ interview from U.S. Navy Veteran CPO Gene Peters: https://t.co/iRAgTuQmu9
I believe a Select Committee is best mechanism to track nuclear deal compliance &amp; hold Obama WH &amp; Iran accountable: https://t.co/zXSIzqkHtH
"After revelation WH flew cash to Iran, this article renews call for effort Im leading to hold WH &amp; Iran accountable: https://t.co/zXSIzqkHtH"
Irans lesson post-$ exchange? Per @BloombergView: Great Satan is paying you for citizens you should have never taken https://t.co/duZNQKmUTn
Troubled by reports Obama WH concealed $400 million (in cash) sent to Iran via unmarked planes. More details here: https://t.co/apWggR0n3C
RT @RiponAdvance: Bipartisan bill lead by @RepToddYoung and @RepJoeHeck would bring oversight to a counter-terror task force https://t.co/Q…
Pleased our bipartisan bill to combat 1 of the worst epidemics in our nations history was signed into law https://t.co/FDV62sAulu #opioids
"My latest column in the @newsandtribune: ""Our global imperative must be a concerted campaign to end ISIS"" https://t.co/CQUYI6He0Y"
ISIS won't stop conducting &amp; inspiring outrages. We must accept burden of leadership &amp; meet this challenge head on: https://t.co/CQUYI6He0Y
"After the Marines, I know we must identify, understand its true nature &amp; then adjust strategy to defeat this enemy: https://t.co/jst9IIXQNZ"
"With my bipartisan #SIPs bill, we help more Americans overcome the root causes of poverty &amp; we only #PayforResults: https://t.co/FqpEehgRmv"
"""This is the new way to serve the next generation of #Hoosiers"" @GoodwillIndy @NFP_nursefamily https://t.co/ZQUFcGSksi #SIPs #PayforResults"
Hoosier orgs helping families across Indiana will benefit from my House-passed #SIPs bill. Here's how→https://t.co/ZQUFcGSksi #PayforResults
TODAY 2:30–4:30PM: Residents who need assistance can come by Brown Cnty Library. Cant make it? More dates/locations: https://t.co/k9fqwP9b3q
"On behalf of all Hoosiers, I send our condolences to the victims, their families, the wounded, and to all of France."
We consider #Nice an attack on all of us &amp; are prepared to use every instrument of nat'l power to end the terrorization of civilized people.
ICYMI: Last night Congress sent bipartisan legislation addressing nationwide #opioidepidemic to President's desk: https://t.co/FDV62sAulu
"""It takes all of us, working together, to..serve the best interests of those in need."" #SIPs https://t.co/FqpEehgRmv https://t.co/KwuqjkwGCp"
Devastating outcome &amp; news no parent wants to receive while a child is serving overseas. https://t.co/Wy49dY83cA https://t.co/xM7xmIGUrS
RT @Results4America: .@RepToddYoung @RepJohnDelaney bill passes US House to #invest in #WhatWorks. RFA Statement on Pay for Results Act: ht…
"#SIPs would help city fight toughest problems ""legislation passed with bipartisan support —a rare achievement...""  https://t.co/FqpEehgRmv"
RT @GoodwillKAK: Innovative funding opportunity for social programs that work https://t.co/V2dfO4qO7q Well done @ToddYoungIN @GoodwillIndy…
@PeterRoskam @afpfr  Auth regimes like Iran are the largest long-term security threat we face. Proud to support &amp; appreciate your leadership
RT @PeterRoskam: US House passes bill to block Iran aircraft sales https://t.co/Ex6vd5r99G via @afpfr
"After attacks on 4 allied nations, time has come to deploy all instruments of nat'l power https://t.co/YjkpAhqTLR #NATO #WarsawSummit #ISIS"
RT @LTCrevolution: SHC of Muncie &amp; @RepToddYoung celebrated #July4th weekend by hosting a flag retirement ceremony. https://t.co/6f7SzPkylT…
The @indystar covers Social Impact Partnerships: How a bipartisan effort could help social programs pay off https://t.co/97cZtfxU76 #SIPs
".@GoodwillIndy @NFP_nursefamily CEO calls my #SIPs bill a game-changer: ""It appeals to everyone.” https://t.co/97cZtfxU76 #PayforResults"
"Under #Obama's deal, #Iran Air gets off sanctions list &amp; brand new fleet of #Boeing planes https://t.co/37KCApN89G https://t.co/cWDFHILkhP"
RT @PeterRoskam: Thank you @BradSherman for speaking out against the #Boeing/#Iran deal. National security is not a partisan issue. https:/…
"Iran Air sanctioned 4 supporting terror/ferrying arms to Assad, Syria. #Iran flew resupply recent as June 15 https://t.co/186BG6WD3s #Boeing"
Top Democrat wants Boeing deal w/ #Iran blocked: 'no reason' to believe conduct Iran Air sanctioned for has stopped https://t.co/gipa8OkDku
"Learn about #SIPs in this column via the @theheraldtimes ""Rep. Todd Young has a good question that's rarely asked"" https://t.co/WanvBFBfJ5"
RT @PatientCitizen: Thank you @RepToddYoung @repblumenauer @cathymcmorris and @RepCardenas  for introducing the #dialysisPATIENTact!
RT @Moneyball4Gov: @RepToddYoung   @RepJohnDelaney   hit a #HomeRun on #Moneyball legislation: Pay for Results Act: https://t.co/4wYHwRCoOl
RT @KCP_tweets: We appreciate @RepToddYoung &amp; @repblumenauer exploring policies that would improve the lives of individuals w/ ESRD! https:…
"Pickering peddled WH ""deal or war"" narrative wout disclosing financial tie to company making billions off #IranDeal: https://t.co/1mZbleZmH3"
