"Great to visit Irving Sawmill in Dixfield, the 4th largest sawmill in Maine -- employing 280 hardworking men and wo… "
Pleased @DeptofDefense has exempted most civilian employees at #PNSY in Kittery from recently announced federal civilian hiring freeze.
"Because when we talk about stats, we’re talking about people. We’re talking about their families. About our neighbors &amp; our communities."
"The fight against the drug epidemic is far from over, &amp; the Senate cannot lose sight of the work left to do to help those who need it."
"&amp; it should be a wake-up call to those in Congress who simply thought they could pass a bill, move along, and this crisis would solve itself"
"In Maine, more than one person a day died from a drug-related overdose last year. That’s a troubling, staggering figure –"
""
""
.@SenatorHeitkamp just launched her new podcast “The Hotdish”! A hardworking friend and colleague. Listen HERE: 
"Great to co-host the bicameral, bipartisan caucus discussion on 2017 broadband infrastructure priorities… "
HAPPENING SOON: I'll be joining @wolfblitzer in the @CNNSitRoom around 6 pm. Hope you can tune in!
Watch LIVE: 2017 Broadband Infrastructure Priorities w/ members of Senate Broadband Caucus &amp; industry leaders: 
A great story of hard work and determination from a Maine small business. @CEIMaine #DoveTailBats #ruraleconomy… 
Joined @CNN @NewDay this morning to discuss my opposition to @POTUS’s Executive Order on Immigration: 
ICYMI: @FoxABCMaine discusses my Jan Inside Maine Podcast: 
"Ready to get to work w/ @JeffFlake to provide access to affordable, clean energy that allows ME ppl, small businesses, &amp; farmers to succeed"
Honored to be named Ranking Member of Energy and Natural Resources Subcommittee on Water &amp; Power #mepolitics
Your input is an essential part of our democratic process #mepolitics
"If you’d like to be in touch with my office, please follow this link: "
"Thank you to the thousands of people across Maine reaching out to share your opinions, thoughts and concerns w/ me &amp; my office #mepolitics"
"Unfortunately, President Trump has taken the bait – and the fight against ISIS just got a lot harder."
...to bait us into converting our opposition to their isolated brand of radical terrorism into a war of America against the Muslim world.
"Worse this order focuses exclusively upon majority Muslim countries, &amp; plays right into the hands of ISIS which has been trying for years…"
It is inconsistent with who we are as a country.
"They only isolate America frm our allies, marginalize US Muslim population who are often the source for info that helps prevent terrorism."
"The latest actions taken by this Administration, however, don't protect us, but actually compromise our nation's security."
…which is why I voted for the extensive border security provisions in comprehensive immigration reform bill passed by the Senate in 2013.
I believe we must pursue solutions that will actually protect our homeland...
No ME harvester should be denied access to resources that have supported their livelihoods &amp; families 4 generations: 
.@RepPoliquin and I are committed to ensuring that these longstanding local rights are respected by the federal government
That tradition has allowed ME harvesters to work the flats of the intertidal zone at Acadia for nearly 100 yrs.
In Maine there is a time-honored tradition of open access to tidal land #mepolitics
Listen live on Inside Maine HERE: 
"HEADS UP: I'll be on @WGANNews in the 10 am hour to discuss impact of #ACA on small businesses, rural hospitals and ME people #mepolitics"
…Executive Branch officials involved in the formation of detention and interrogation policy review the full Committee Study.
It is of the utmost importance the President familiarize himself with this report and ensure that…
I joined my Intel Committee colleagues to urge @POTUS to read classified version of Committee’s 2014 torture report: 
".@UMaine &amp; @ORNL are world-class research institutions, &amp; this partnership will attract biobased industries and support rural ME communities"
Impt first step in implementing the recommendations from the EDAT @SenatorCollins &amp; I requested last march to support ME forest industry
Today @UMaine and @ORNL launched an innovative partnership to grow Maine’s forest economy #mepolitics 
Fun visit w/ Madawaska High Band who were in DC to play at Inauguration. Here they are crammed into my office for m… 
Bill Mook of @MookSeaFarm in Walpole is addressing ocean acidification head on with a “black box” #mepolitics: 
""
"After a disabling injury, no veteran should return home &amp; have to pay back a federal student loan #mepolitics: "
Glad @DeptVetAffairs &amp; @usedgov have taken important steps to help qualified disabled vets pay back federal student loans #mepolitics
Met w/ Educare Central Maine Parent Ambassadors to discuss importance of @NatlHeadStart. Great to see Mainers in DC… 
That’s why I oppose the nomination of Betsy Devos to lead @usedgov. Read more from the @PressHerald #mepolitics: 
My dad used to say that public schools are the idea at the heart of democracy. #mepolitics
I’m a product of public schools. My parents went to public schools. My kids went to public schools.
Wintah weathah today in Maine. Please drive safely! 
"PACE Act w/ @SenatorBurr will support children, working families, and the Maine economy #mepolitics: "
Maine’s forest products industry is an integral part of our state’s heritage &amp; essential to our economic future: 
"I believe Gen. Mattis and Gen. Kelly will serve the country well, and, importantly, speak truth to power: "
"…restore confidence in our government, and deliver positive results for the American people."
"As we undertake the important task of governing, I hope President Trump and Congress can work together to heal the divisions in America…"
"… cut federal red tape, defend affordable &amp; accessible health care, &amp; promote economic growth &amp; job creation, particularly in rural Maine."
"In the Senate, I will continue to fight for Maine’s interests – to expand access to broadband, combat the opioid crisis…"
"As President Trump begins his new Administration, I wish him the best, because if he succeeds, then our country succeeds."
"Today, we witnessed a hallmark of American democracy: the peaceful transition of power from one Administration to the next."
Joined @mainepublic to discuss my take on Scott Pruitt to head the @EPA. No evidence enforce enviro laws #mepolitics 
The beginning of wisdom is to know what you don’t know and learn it. Thanks to @CNN @NewDay for having me on today: 
Honored to be named Ranking Member of #SASC Airland Subcommittee. I look forward to working w/ @SenTomCotton to support our servicemembers
Wishing the best to @GeorgeHWBush &amp; Barbara. You inspire us all through your dedication to our country &amp; the world.
"…due to illegally subsidized and dumped Chinese imports, then I believe China essentially stole those jobs from Maine #mepolitics"
If the Commission makes an affirmative final determination of material injury to Auburn Manufacturing…
"When our trading partners violate rules, placing US businesses at an unfair competitive disadvantage, we must respond swiftly and decisively"
Small businesses that play by the rules and work hard to keep good-paying jobs in US ought to be supported by our trade enforcement agencies
"I testified at #USITC in support of Auburn Manufacturing, its employees, &amp; a robust trade enforcement system that w… "
Auburn Manufacturing employs hardworking Maine people &amp; should not be disadvantaged by unfair imports from China #mepolitics
I look forward to testifying on behalf of Auburn Manufacturing &amp; #MadeInUSA textiles and products at the #USITC this morning #mepolitics
Campobello is the only park in the world owned by two countries &amp; administered by a commission w/ reps from each country #mepolitics
It was an honor to be appointed to the Roosevelt Campobello International Park Commission by @POTUS today!… 
I joined @ABC’s Powerhouse Politics Podcast and discussed the hardworking Mainers @LLBean employs. Listen HERE:… 
.@OurKatahdin's purchase of Great Northern Paper Mill will allow innovators to build a bright future for the region: 
WATCH LIVE: On my FB page at Bridgton Hospital to discuss impact of #ACA repeal on rural hospitals #mepolitics: 
By not approving this amendment Senate has failed to meet its obligation to help them. But I will not. @sunjournal: 
"Disappointed the Senate did not pass my amendment to protect Mainers working in higher risk, often rural jobs #mepolitics"
Great to hear testimony from former Maine Senator &amp; DefSec Bill Cohen today in #SASC hearing on Gen. Mattis. TY for your service #mepolitics
Going to be a late one tonight! The Senate will be voting into the early hours of the morning on amendments to the annual budget resolution.
I'll continue 2 do everything within my power 2 preserve impt ACA protections. Every person in Maine deserves quality affordable health care
"It’s a blow to people who work in rural communities across Maine – our forestry workers, our fishermen, and our farmers, to name a few."
I’m disappointed that the Senate failed to pass my amendment protecting health insurance for rural Maine workers.
.@SenatorCollins and I have written to PE Trump urging him to exempt @DeptVetAffairs from federal hiring freeze: 
Congratulations to Jon Brockway of Westbrook for being named to the @TRUCKINGdotORG America’s Road Team! #mepolitics 
Impt we pass Securing Energy Infrastructure Act to stop #cyberattacks like those in Ukraine. @EENewsUpdates: 
""
Important to hear testimony firsthand 
That’s life on live television after a busy day on Capitol Hill! Look forward to catching you next time @wolfblitzer
HEADS UP: Joining @wolfblitzer in @CNNSitRoom soon to discuss Russian hacking &amp; protecting US national security
"""Without the #ACA and its protections, even our screening costs would eat away at our financial stability.”"
"""That's 4 instances of cancer just between my parents. 1 of my grandparents died from cancer. Cancer is a very high risk for my sisters &amp; I"""
"""My father was just treated for colo-rectal cancer. He can afford treatment because cancer is no longer considered a pre-existing condition"""
"Spencer from Ellsworth: ""My sisters &amp; I watched my mom die..Before the #ACA, most of her illnesses were considered pre-existing conditions."""
"""We were fortunate to obtain coverage for her through the Affordable Care Act."" #ACA #mepolitics"
"""Because of these heath issues she had to reduce her work hours. Consequently, her employer dropped her heath care coverage."""
Donald from Poland: My wife is 63 &amp; she is no longer able to work full time. She has had major back surgery and has arthritis in her neck.
"""With the #ACA &amp; the tax credit, I could afford a silver plan, I could get dental for my teeth, could go to the doctor again, get flu shots"""
"""Before the #ACA we worked dangerous outdoor jobs that only provided minimum worker’s comp..."""
"Whitney from Smithfield, ME: ""I graduated from the University of Maine in 2013 with a degree in wildlife ecology."""
HAPPENING SOON: I’ll speak on Senate floor to share individual stories &amp; highlight how the #ACA has helped save lives in Maine #mepolitics
Watch my full remarks abt how my health insurance saved my life as a young Senate staffer 43 years ago #mepolitics: 
.@SenatorRisch &amp; I renewed our call to protect US energy infrastructure from potentially catastrophic cyber-attacks: 
"TUNE IN at 1 pm for open Intel hearing on Russian hacking in US election w/ heads of DNI, CIA, NSA &amp; FBI HERE: "
Look forward to continuing this conversation on Senate floor tomorrow &amp; sharing stories of how the #ACA has helped people in ME #mepolitics
Watch my remarks on the #ACA and health insurance coverage live HERE: 
Speaking on the Senate floor abt how having health insurance saved my life when I was younger &amp; the importance of being covered #mepolitics
"I joined @CNN @NewDay this morning to discuss our country’s cyber-security, border security &amp; the #ACA. Watch HERE: "
"Watch my remarks from #SASC hearing on Russia &amp; US election w/ James Clapper, Marcel Lettre &amp; Adm Michael Rogers: "
"The people of ME deserve to know the facts, which is why the #SASC public hearing today on Russia’s role in the US election was so important"
"
"
May we all renew our commitment to the brave men and women serving in our military and work to support them as they… 
It was an honor to receive the Navy’s Distinguished Public Service Award from Admiral Faller today in my office… 
Thanks for letting me join you to speak on this critical issue. 
Proud to nominate an impressive group of ME students to our nation’s distinguished service academies #mepolitics: 
Looks like a great time at @fenwaypark! And good luck to the @UMaine men’s hockey team &amp; @GoUBears women who will s… 
Wishing you all the best in 2017. Happy New Year! 
"US must consider ""retro"" approach to protect electric grid from cyber attacks. In Jan. I will reintro bill to do so… "
Happy holidays from my family to yours! 
Pleased to announce the @USNavy has awarded Cianbro $27M for construction &amp; dock repairs at PNSY #mepolitics: 
That's why I urge new Congress to pass my bipartisan bill to bolster cyber defenses &amp; protect infrastructure 
Congress should learn from what happened in Ukraine &amp; take action to prevent it from happening here in the U.S. (2/3)
Today is the one year anniversary of a dangerous cyber attack in Ukraine that cut electricity to hundreds of thousands of people (1/3)
Northern Maine Veterans Cemetery Corp. in Caribou has done incredible work to honor Aroostook County veterans… 
"In Maine, preserving our environment &amp; building our economy go hand-in-hand. More from the @PressHerald #mepolitics: "
"I love Gronk, but there’s no tougher teammate than @SenatorCollins. Wishing her a speedy recovery! "
Serenity House in Portland is doing important work to help Maine people struggling with substance abuse and addicti… 
Proud of my staff for all their wonderful work on behalf of Maine! If you’re in The County &amp; need help w/ a federal… 
Harrigan Learning Center and Museum in Milo is a great way to bring visitors to Piscataquis County and educate loca… 
We should learn from Milo PD &amp; work to inform our communities &amp; help those struggling with addiction get the help they need #mepolitics
Milo Police Dept is working to combat the heroin and opioid crisis by exploring innovative ways to tackle this epidemic #mepolitics
""
Congrats to BIW for $126M contract modification to ensure ME continues to manufacture the most-advanced destroyers in our Navy #mepolitics
Great to be with the wonderful staff at @govsrestaurant in Presque Isle this weekend. Thanks for the warm company! 
Encouraged @SocialSecurity Admin has incorporated my proposals to support people in Maine living w/ disabilities: 
"A big thanks to the faculty, staff and students at Mt. Blue and Mt. Abram for letting me join them to speak about m… "
"The Bill of Rights was ratified on Dec 15, 1791. 225 years later, may we uphold these venerable amendments &amp; the fr… "
The Be a Santa to a Senior program is a wonderful way to show your love for community! Learn more HERE: 
Agree w/ @PressHerald Editorial Board that expanding broadband in rural Maine is critical to growing our economy: 
"I will continue to work w/ ME law enforcement, federal partners, &amp; other border community members to keep Maine safe and secure #mepolitics"
Pleased the President has signed Northern Border Security Review Act into law. This will help combat drug &amp; human trafficking #mepolitics
"W/ Made-in-USA provision included in the NDAA, we have secured a concrete victory for American-made athletic shoe m… "
Joined w/ @SenatorCollins @RepPoliquin for an exciting visit to the New Balance factory in Skowhegan today… 
Thank you to staff at the Sanford Vet Center for hosting today’s Holiday Luncheon (and #UglySweater competition)! 
BIW has been awarded nearly $11M in funding. Welcome news for the highly-skilled men &amp; women in Bath #mepolitics: 
Pleased $500M has been devoted to combat opioid crisis &amp; help save lives. It is imperative that HHS work quickly to implement this funding
"Honored to join w/ @SenatorCollins to announce the Senate has designated Dec 17, 2016 as Wreaths Across America Day… "
Thanks to @CNN @NewDay for inviting me to speak on this critical issue. 
Congrats to Norm Higgins for your recognition by PCEDC. Let's work together to expand broadband &amp; create opportunit… 
HAPPENING NOW: I’m joining @wolfblitzer in @CNNSitRoom to discuss POTUS order to review Russia’s involvement in U.S. elections #mepolitics
Great to visit with my longtime friend Bob Jorgensen and other veterans in Augusta #MaineVeterans… 
Maine’s papermakers can compete with anyone on a level playing field @SenatorCollins @MainePublic #mepolitics 
Welcome news for the hardworking men and women of Bath Iron Works who deliver the highest-quality ships to our Navy! 
.@AP reports on my bill providing a pathway to public sector for tech innovators via Presidential Innovation Fellows 
"Today, our country lost a pioneer in space exploration and a true American hero. You will be missed. "
Made-in-USA shoe provision not possible without @SenatorCollins &amp; @RepPoliquin. Thanks to my colleagues in Maine Congressional delegation.
Proud to wear Made-in-Maine @NewBalance as I cast my vote in favor of Made-in-USA shoe provision 
I urge the President to sign the 2017 NDAA into law quickly and will track its implementation closely #mepolitics: 
I’m thrilled this bill will reward American companies that prioritize keeping good-paying jobs here in the United S… 
In my @newbalance shoes for final passage of NDAA! This hard-fought measure is a landmark victory for American shoe… 
"On Dec 7, 1941 the Pearl Harbor attack shook our country. May we never forget those lives lost &amp; uphold the freedom… "
3/3 This is about saving peoples’ lives. #CuresNow #mepolitics
2/3 Congress had for too long failed to meet its obligation to provide this desperately-needed money. This is welcome step forward #CuresNow
1/3 I am encouraged #CuresAct includes significant funding that will help the fight drug epidemic in communities across Maine #mepolitics
Proud to support 21st Century Cures Act! This historic bill helps fight opioid crisis &amp; mental health &amp; bolsters medical research #CuresNow
Thanks to Sebastian Bell of Maine Aquaculture Assoc for an impt discussion on economic diversity for our coastal co… 
Great morning at @BuildingMuseum Timber City exhibit on CLTs. Lets build a robust &amp; enduring economy for rural Main… 
Congrats @StMarysMaine in Lewiston &amp; Stephens Memorial Hospital in Norway for 2016 @LeapfrogGroup awards! TY to our… 
Thanks again to @GW_CVN73 for having me aboard this weekend. Proud of our servicemembers! #USNavy #F18… 
A great shot of an F/A-18 landing aboard the #USSGW. Be sure and watch this with sound #carrierlanding #tailhook 
Impressed by the pride &amp; professionalism of the sailors aboard @GW_CVN73. We are so lucky to have these great peopl… 
".@USouthernMaine has an experienced leader in President Glenn Cummings! Congrats to Glenn, his family &amp; the USM com… "
"Maine is blessed w/ bountiful fiber &amp; thx to @UMaine ASCC, ME can strengthen forest product sector &amp; support our ri… "
Great to join @MEFoodStrategy for #MFNG2016. We're sitting in one of the world's great brands: It's called Maine. 
Excited to join the 2016 Maine Food Network Gathering @UMaine to discuss ME’s thriving local food movement #buylocal #eatlocal #mepolitics
More big news for Maine! Several NDAA provisions will support ME economy &amp; help keep us safe. More HERE: 
2017 NDAA will support jobs in ME and make the DoD apply the Berry Amendment to athletic footwear for new recruits:… 
"In ‘14, Maine surpassed the nat’l goal for linking ppl newly dx’d w/ HIV to care. Goal = 85%; ME = 96.4% #WAD2016  "
Let us stand in solidarity w/ all those across the globe living w/ HIV/AIDS &amp; may we recommit ourselves to an AIDS-free world #WorldAIDSDay
Thanks to @NextCentCit for inviting me to speak on the importance of rural broadband and closing the #digitaldivide… 
Proud to join my Maine colleagues in standing up for Sanford company in trade appeal: More HERE: 
Sat down with Amb. to Saudi Arabia Joseph Westphal about how we must work closely w/ our regional partners to creat… 
Stay connected w/ family when deployed &amp; download @RedCross Hero Care App for emergency &amp; non-emergency Red Cross services #SupportOurTroops
Often times during the holidays our military personnel are in distant places – far from their loved ones &amp; the comf… 
It was an honor to join w/ @SenatorCollins to write to US servicemembers in Kuwait through the @RedCross… 
Proud to launch the @USNavy Caucus with @CNORichardson! Our battle fleet is the most advanced in the world thx to m… 
Congratulations again! 
Impt @nytimes editorial on use of hackers to strengthen cyberdefense @MartinHeinrich &amp; I called for prgm expansion: 
Thanks @chuckigo @Rewind_1009 @PrebleStreet for working to Stuff the Bus and support Maine families in need 
"Great time w/ local folks, Amtrak officials &amp; state business leaders celebrating new Downeaster schedule today… "
Maine veteran Bill Marinelli took his powerful story to the @WhiteHouse. More from @KJ_Online @OnlineSentinel: 
My letter to leadership blasting potential CR as abdication of one of our most fundamental responsibilities: 
"Today is #RuralHealthDay, a reminder of the invaluable services from rural health providers in Maine and across America"
My letter to @POTUS urging him to support efforts to help employers and phase in overtime rule over several years: 
My letter with @SenatorLankford urging President-elect Trump to quickly nominate an experienced DNI: 
I’d like to see Maine families enjoy the health care services provided by IAH Demonstration prgrm.  @PenBayPilot: 
Proud to stand w/ @SenRobPortman and @ChrisCoons in support of America’s disabled veterans dealing with unnecessary student loan payments
Below is my statement on President-elect Trump's appointment of Stephen Bannon as Chief Strategist: 
Today we honor the selfless service of our Veterans and recognize the eternal debt we owe them and their families 
Hopeful that President-elect &amp; Congress can work together to write new chapter in American history. My full stateme… 
Important discussion with Bucksport officials about redevelopment of the former Verso mill 
Belfast’s Surge Hydro is 1 of 4 regional winners of the @CleantechOpenNE. Best of luck in Feb during national competition
In Belfast learning about Surge Hydro’s innovative approach to an important source of clean energy in Maine 
Thanks Robbins Lumber family for meeting to discuss steps being taken to strengthen the forest industry 
Fantastic Q &amp; A with impressive students from Boothbay Region High School today about civility in American politics 
The Darling Marine Center is doing critical work to understand effects of climate change in Gulf of Maine… 
Thanks to the Linkletters for yesterday’s great tour at Maine Woods Pellet Company in Athens! 
Great visit to Cousineau Wood Products in N. Anson yesterday where they make impressive wooden gun stocks 
Maine Stitching Specialties also makes pet visibility vests for @LLBean. Max here makes a pretty good mascot 
"Fantastic team @ Maine Stitching Specialties in Skowhegan makes draperies, window treatments, flags &amp; other textiles "
With David Emery at @TLG_Leather yesterday in Hartland. Great visit! 
"Thank you to Alice Tasman, Glenn Coxon &amp; everyone at @TLG_Leather for yesterday’s tour in Hartland "
Congratulations to @wellsreserve Director Paul Dest for winning @NOAA conservation award! Well-deserved recognition for your important work
"Honored to join @SenatorCollins, Bill Cohen, George Mitchell, and Olympia Snowe in Bangor last night @MaineChamber "
Congrats to Maine’s Robin Alden for being named a Champion of Change by @WhiteHouse for work on sustainable seafood: 
Had a wicked good talk with @growsmartmaine recently: 
Congratulations to Waterville’s Theresa Secord for winning a prestigious @NEAarts National Heritage Fellowship! 
Great to join Maine-Arctic Forum events at @USouthernMaine today as we welcome Arctic Council to Maine 
#CARA funding in CR is welcome 1st step forward in effort to finally put our money where our mouths are when it comes to fighting addiction
Congrats to Maine company Unitel for being recognized as 1 of 12 @NTCAconnect Smart Rural Community Showcase award winners across the US
Good news for Maine forest products and @UMaineNews @USouthernMaine from @US_EDA: 
Thanks to Dr. Bob Corell and Bill DeLong from @DHSGov for today’s discussion on the impacts of #ClimateChange 
Thanks to everyone who came to Capitol Coffee the last two weeks! 
Joining me on @WGANNews tomorrow AM will be climate scientist Dr. Bob Corell and Bill DeLong from @DHSGov
"I’ll be on @WGANNews tomorrow morning to discuss my recent trip to Greenland, #climatechange and how it will impact Maine"
Thank you @BPC_Bipartisan for hosting today’s senior health and housing forum. An important issue for Maine. 
Report from @PressHerald on my bill with @SenatorCollins to approve VA leases in ME and across US: 
Important discussion in today’s Senate Broadband Caucus event about connecting rural communities to info and opport… 
My full #POWMIARecognitionDay statement: 
