"Will be joining Wolf Blitzer on CNN shortly, hope you can tune in!"
"There are some things that everyone can agree on, like ribs. Fun talking BBQ and bipartisanship w/ @nielslesniewski. "
"Earlier this month, I talked about ACA sabotage.  

Last night, the admin announced no CSRs.

This won't help Ameri… "
The folks at the York County Shelters Program are doing incredible work. Grateful for their efforts on behalf of Ma… 
Great morning celebrating Maine manufacturing with HS students at Pratt and Whitney in North Berwick! 
Music to my ears – congrats to Dover-Foxcroft music teacher Kaitlin Young for being named Maine’s teacher of the ye… 
""
“George Washington Carver figured 106 things to do with peanuts. What we need is 106 things to do with wood fiber.” – Sen. King
Dr. Mark Johnson says we’re in the midst of “a long term effort to explore new uses for forest products” #mepolitics #RobbinsLumber
"""I consider this an exciting opportunity for Maine and the country... I think we're talking about the future here"" - Sen. King"
Chairing an Energy Committee Field Hearing in Searsmont on how to maximize Maine's natural resources. Watch live: 
Great to talk w/ George Hale and @RicTyler this AM about today’s field hearing and boosting rural Maine. Listen:  
"Tomorrow, I’m chairing a Senate Committee on Energy and Natural Resources Field Hearing in Searsmont. A preview of… "
"A bipartisan, bicameral bill to help secure our electric grid against devastating attack. Hopeful Congress will mov… "
"In my opening statement to the Budget Committee, I quoted a very smart hardware store clerk in Brunswick. Watch: "
""
The Affordable Care Act isn’t collapsing – it’s being mugged. #mepolitics 
Happening now: Live on the Senate floor to talk about healthcare.
Met with reps from the National Council for Behavioral Health to discuss treatment for mental health issues and the… 
"Congrats to Dr. Jeffrey Hall of Cambridge, Maine – I would have sent well wishes sooner, but my circadian rhythm mu… "
Devastating news out of Las Vegas. Praying for the victims and loved ones affected by this tragedy.
"This month's Inside Maine podcast is about the lobster industry! If only there were an emoji I could use...

Listen… "
"@secnav76 To @SECNAV76, I say: you’re welcome back any time, especially if you keep bringing two destroyers with yo… "
I was honored to join Secretary Spencer (@SECNAV76) and show him the incredible work that happens every day at BIW. 
"@secnav76 In advance of @SECNAV76's visit, Sen. Collins, Rep. Pingree and I proud to announce agreement btwn BIW an… "
"This honor recognizes the hard work from educators, students and families – grateful for your efforts to build a bright future for Maine."
3 Blue Ribbon Schools in ME! Congrats to Fourteenth Street School (Bangor) Connors-Emerson School (Bar Harbor) &amp; Falmouth Elementary School!
"Excited to welcome @SECNAV76 to BIW, and show him the important contributions of Maine workers to national security. "
"@SteveDaines National Parks are true treasures – by modernizing the ticketing process, we can introduce new generations to their wonder."
"The program is a major success – in fact, the process is so easy that I bought a ticket to Acadia during the hearin… "
"In yesterday’s National Parks hearing, we heard results from the pilot program I pushed for allowing online sales o… "
"Drug addiction is a disease, but it’s not a death sentence. Watch my speech on the Senate floor: "
@AmericanTelemed Any conversation about healthcare must make sure rural areas have access to affordable care – tele… 
Met some great innovators this afternoon at Telehealth Expo hosted by the Senate Broadband Caucus and… 
Speaking on the Senate floor shortly about National Recovery Month – tune in.
"Bob is a great public servant, and a great friend. The Senate will miss him. "
"Great to meet with Maine Principal of the Year Daniel Welch, from Boothbay Region High School. Thanks for your dedi… "
American citizens are hurting -- we need to do more to help them.
Proud of Maine for answering the call. Maine National Guard in USVI: 
My statement on the Congressional Budget Office's preliminary score of Graham-Cassidy: 
"I'm pushing to grow the profile of lobsters, any way I can – including emojis. "
Today is a very special day for our state: Happy #NationalLobsterDay!
Today we celebrate two proud Maine traditions -- happy National Hunting and Fishing Day! 
Opioid abuse kills more than 1 person/day in Maine; we need all hands on deck. Grateful to CVS for taking action. 
One more photo from Jackman yesterday – a staffer caught a Senator plying his craft. 
Some photos from my day in Jackman yesterday: 
".…and our next steps on healthcare must to provide them with the aid that they need, not shortchange them. END"
"I’ll continue to say clearly, and loudly, that our rural hospitals need our help…"
"So, when I go back to Washington next week to discuss healthcare, I’ll carry the concerns and challenges of Jackman/rural Maine with me."
This impacts everything – a CBP officer told me today they struggle to recruit/keep border patrol personnel due to limited healthcare.
"That means that the a mill worker on the late shift, or an elderly citizen who slips and falls, would have to drive over an hour for care."
"At the moment, Jackman stands to lose overnight emergency medical services at the end of the year."
Communities need access to close and affordable healthcare in order to thrive.
THREAD: Spent the day talking healthcare in Jackman today. There was one thought that was present in all of my conversations:
Cybercrime costs the global economy hundreds of billions of dollars a year – it’s critical that we protect our networks.
Concerned to hear SEC's database was breached. This is another example of why we need strong cyber defenses.
Jackman is one of many towns with these challenges – they need bipartisan help. Look forward to hearing more tomorrow. (3/3)
"Jackman could lose overnight emergency/ambulance care at the end of 2017, forcing residents to drive more than an hour for care. (2/3)"
"Tomorrow, I’ll be meeting with local leaders in Jackman to discuss the healthcare crisis they, and other rural towns, face. (1/3)"
@EdSuperHighway Connectivity is so important to preparing our students for the future– grateful to all who’ve helpe… 
@EdSuperHighway Proud to have supported modernizing the #erate which funds these efforts. We’re now seeing the resu… 
"Great numbers from @EdSuperHighway : nearly 170k Maine students, in 99% of school districts, have high speed intern… "
This healthcare process is simply irresponsible. 
Full video of my speech on the Senate floor on #thegreathealthcareskedaddle: 
"""The great healthcare skedaddle."" -Angus King #thegreathealthcareskedaddle"
On the Senate floor right now talking healthcare -- tune in! #mepolitics
Spent some time this AM talking to constituents about healthcare. I'm a no on Graham-Cassidy. #mepolitics 
@westgov I’m hopeful that the Senate will take a positive step towards securing our grid and pass this bill quickly. (3/3)
@westgov This bill would protect our electric grid from cyber-attacks by looking to employ low-tech redundancies to… 
Grateful to the Western Governors’ Association (@westgov) for their support of my Securing Energy Infrastructure Act. (1/3)
"Heading back to Washington this afternoon – always wish I could stay a bit longer in Maine, but lots of important work to be done."
A pleasure to meet with the United Farmer Veterans of Maine earlier this week. 
…and your Nation is here to support you.  #POWMIARecognitionDay 7/7
"To those families who have borne the borne the pain of a missing love one, please know: your loved ones will never be forgotten… 6/7"
"Today, we come together to express our gratitude to our missing heroes and to offer support to their loved ones #POWMIARecognitionDay 5/7"
…by joining together in our unyielding efforts to leave no one behind. #POWMIARecognitionDay 4/7
"Each time a lawmaker or visitor walks by that flag, it is reminds us to honor the sacrifice of those still unaccounted for… 3/7"
That flag is at the center of our Nation’s capital to illustrate the truth in these words: #YouAreNotForgotten 2/7
There are two flags that grace the halls of our Capitol Rotunda: the American flag and the POW/MIA flag.… 
""
Equifax has some questions to answer. 
Heart disease is the #1 cause of death in Maine – great to meet with the cardiologists who work hard to keep our st… 
"Thrilled to announce my new spokesmen, @JackOFaherty1 &amp; @JeffSobotko. Excited to see the work they’ll do for the people of Maine #mepolitics"
""
We will #NeverForget. My statement on the 16th anniversary of #September11: 
Thank you all for the incredible work you do every day to care for our nation’s veterans. (3/3) #mepolitics 
"Including a reunion with Ellie Newell, who’s worked at the facility since we broke ground in ’95 – my first year as… "
Had an excellent meeting this morning with the dedicated staff at the Maine Veterans’ Home in South Paris… 1/3 #mepolitics
""
A shot from backstage at @hardball with @SenBlumenthal -- hope you were able to tune in! 
Senate unanimously passed my bipartisan bill to help states/localities fight mosquito-borne diseases. Details: 
"Heartbreaking – once again on track for more than one overdose death per day. Not just numbers: family, friends, ne… "
"Spent morning hearing from state officials re: stabilizing healthcare market. Now more than ever, need a bipartisan… "
"Just made my cosponsorship of the #FAMILYAct official. Agree w/ @sherylsandberg, #paidleave is a key economic issue: "
HEADS UP: I'll be joining @wolfblitzer on @CNN shortly. Hope you can tune in! 
Please see my statement on the Administration's DACA announcement: 
"A busy August in Maine, meeting w/ ppl from Sanford to Fort Fairfield &amp; everywhere in between. Your insights prepar… "
Expanded access to high-speed cell service is great news for businesses and communities in Maine @TMobile… 
Tune in to my Facebook page to watch live 
Look forward to joining Jesup Memorial Library's speaker series on civil discourse and democracy in Bar Harbor toni… 
I presented Bar Harbor Bank and Trust Co. w/ a Congressional Record statement congratulating them on 130 years of s… 
Toured Hinkley Yachts manufacturing facility in Trenton today to discuss their work and strategies to strengthen Ma… 
"Jennifer Neptune, a Head Basketmaker from the Penobscot Nation, was in Acadia today for a basketry and beadwork dem… "
"In Acadia to discuss research, education, and prevention initiatives for tick- and mosquito-borne diseases… "
""
Joined the Ellsworth community 4 the launch of its open access fiber network which will help provide high-speed int… 
"A busy day in the Bangor region! Visited @penquisCAP childcare center, Somic America, @BangorFireDept, @MaineVets &amp;… "
"@penquisCAP Spoke w/ parents &amp; childcare professionals abt PACE Act, bill I introed w/ @SenatorBurr to make childca… "
Fun to sit down and read to kids at @penquisCAP childcare center in Bangor 
@UMPIowls Welcome news for the hardworking students across our state #mepolitics
"Please to announce @umpiowls has received two Upward Bound Program grant awards totaling $639,257!"
Finished the trip this afternoon after a ride through Mount Vernon and Manchester. Here's a pic of the group… 
Last day of the ride today. Thanks to all the good Maine people who stopped and talked to me along the road!… 
Great day for a bike ride and an #eclipse #SolarEclipse2017 
Keeping American sailors and servicemembers aboard the USS John S McCain in my thoughts &amp; thankful to all those lea… 
""
Wonderful evening at Bell Hill Meetinghouse in Otisfield. Had the pleasure to introduce fellow biker &amp; comedian Gar… 
@boyscouts Garrett fixed up a 1929 Model A for his Eagle Scout project and took me for a spin in it. Hard work pays… 
Honored join the South Paris community to congratulate Garrett Haslett at his Eagle Scout ceremony @boyscouts… 
Beautiful ride down Route 142 to Dixfield &amp; Route 2 over to Bethel. Stopped in at the Sunday River Brewing Co. for… 
"Had a great ride through Augusta, Winslow, Skowhegan, Monson, Bingham &amp; Kingfield yesterday. Looking forward to mor… "
"Rounded out the day at the High Peaks Community Picnic in Kingfield. Great times, great people! #angusontheroad… "
Fun start to my bike ride through Maine at The Red Barn in Augusta this morning. Hope to see you on Maine's back ro… 
Maine is a state of neighbors. This is not who we are. The KKK is not welcome here. 
""
Visited Waterville Public Library to hear about its digital literacy and career development efforts @JRosenworcel… 
Pleasure to join the Kennebec Valley Chamber this morning! Looking forward to a packed day w/ @JRosenworcel to talk… 
""
Spent time at Trafton Senior Center in Sanford today &amp; discussed how home modification can help ME seniors age comf… 
Racism in all forms is wrong. Let's hope the President's words begin to unite what white supremacists and bigotry in VA aimed to divide.
Actions of hate groups in Virginia are unacceptable and unAmerican and have no place anywhere in our country.
A national emergency declaration could make both a psychological and practical difference. Must back with good poli… 
Spoke at the @PIRotary luncheon about strategies to grow Maine’s rural economy. 
Visited home of Jeannine Charette to discuss importance of home weatherization programs with the Aroostook County A… 
Throwback Thursday to earlier this week up in Aroostook County! @ICarePharmacy #tbt #mepolitics 
Great to stop into the Appalachian Trail Cafe in Millinocket on Tuesday and hear from local people in the Katahdin… 
A wonderful example of people helping people!
The Kids @AuburnPD PAL center work with mentors &amp; Master Gardner of the @UMaine Cooperative Extension to maintain a… 
"Moving visit at @TJCLewiston, I served lunch for people in the L/A area &amp; w/ @AuburnPD Police Activity League (PAL) "
Great visits to Aroostook and Penobscot Counties on Mon. &amp; Tues. &amp; thanks to all the hardworking people looking to… 
Happy workers are more productive workers. This bill will both support Maine people and is a positive payback that's good for the economy.
At Lamey Wellehan in Auburn to outline my support for #FAMILYAct and paid family and medical leave #paidleave… 
The work taking place at the former mill site is a ray of positivity &amp; hope in Millinocket! 
Today I joined @OurKatahdin &amp; local leaders to discuss strategies to create jobs in Millinocket &amp; Katahdin region. 
""
Fun day in Wilton for the 35th Annual Blueberry Festival Parade! #mepolitics @DailyBulldog: 
Pleased by today's confirmation of @JRosenworcel as #FCC Commissioner. Looking fwd to working w/her to close the digital divide #homeworkgap
Joined bipartisan group to write to @TheJusticeDept abt protection of 5th Amendment rights. Read @RandPaul’s op-ed: 
Doing what I can to look out for @Smokey_Bear in today’s #ENR hearing #NotSmokeyTheBear 
"Great story on Erin French's hard work at the Lost Kitchen in Freedom, ME. More from the @nytimes: "
@SenatorCollins The appeals process has not been updated since the 1930s &amp; this bill will consolidate this process.… 
@SenatorCollins Veteran Appeals Improvement and Modernization Act will help veterans receive a fair and timely review of their appeals.
@SenatorCollins ...and also authorizes funding for a medical clinic for veterans in the Portland area: 
"VA Choice &amp; Quality Employment Act, which @SenatorCollins &amp; I worked closely on will help veterans receive care within their communities..."
The Senate passed two important pieces of legislation I cosponsored that will support Maine veterans and improve their access to health care
"@SenatorCollins What better way to celebrate Nat’l Lobster Day than with the 7th @MELobsterFest, which kicked off i… "
"Pleased to join w/ @SenatorCollins to announce Senate unanimously passed a resolution naming Sept 25, 2017 National… "
Great to join in the Loring House Apartments ribbon cutting yesterday! Let’s help seniors age with the independence… 
"On this month’s Inside Maine Podcast, I discuss ME’s vibrant arts culture &amp; its impact on our local economy. Listen: "
"@SenJohnMcCain @SenatorCollins @lisamurkowski It's easy to stand up to your opponents, but it's hard to stand up to… "
Thx to @SenJohnMcCain @SenatorCollins &amp; @lisamurkowski. Those were some of the bravest votes I’ve ever seen in politics.
Here’s the Glamorous Life of a US Senator. That’s me holding @timkaine’s poster. You can tell by my lobster tie… 
HEADS UP: Holding a press conference 11:45-12 @ Portland Int’l Jetport to discuss the Senate health care vote early this morning #mepolitics
"LIVE ON FB @ 11:30: At Mercy Hospital to discuss path forward for comprehensive, bipartisan health care policy: "
"I love John McCain. I've traveled with him, I've been tongue lashed by him, I've worked with him, and I wish I could be with him tonight."
"Great to speak w/ Rebecca Tapley, 2017 Maine Teacher of the Year Finalist from Brooklin &amp; Karen MacDonald 2014 Main… "
""
Proud Sebastian Belle of the ME Aquaculture Assoc has been appointed to @NOAA Marine Fisheries Advisory Committee: 
""
"Please see my statement on my meeting today with Christopher Wray, President Trump's nominee to serve as Director o… "
We’re going to spend a lot of money building walls – they may not be in Mexico – but they’re going to be seawalls a… 
"In the #ENR hearing today, I pressed energy experts on the costs of climate change and the impact of LNG exports for Maine consumers."
Let’s get to work on a bipartisan basis to expand access to health care and make it less expensive for the American… 
"There are many ideas out there that we can all agree on to improve our health care system, such as lowering prescription drug prices."
"Pleasure to join you to discuss this important issue! In case anyone missed it, you can catch up on my remarks here… "
Congrats to @pphbkeyes for being 1 of 8 journalists selected for the inaugural Dorothea and Leo Rabkin Prize… 
It's time for Congress to commit to making meaningful &amp; bipartisan improvements to the ACA to make health care more affordable #mepolitics
Great to meet w/ @CleanAirMoms from Maine and their families today. You are protecting the health and safety of our… 
We need to hold hearings &amp; listen to insurance &amp; medical professionals &amp; hear frm hospitals &amp; constituents to under… 
Proud of the work of men &amp; women in the ME National Guard whose close partnership w/ Montenegro helped its ascensio… 
Great to join @CNN @NewDay to discuss Russia’s interference in the 2016 election and the health care debate. WATCH: 
The internet is a powerful engine for economic and social opportunity and it must remain open to all – not just the… 
Today is the #NetNeutrality day of action. Let’s work together to protect the open internet that supports free speech and innovation.
Great to meet you and thanks for your dedication to ending Alzheimer's! 
My staffer summed up the aftermath @ her desk. Nothing is too on brand when it comes to Maine IMO @LLBean #Renys… 
"If you’re in town visiting DC from Maine, stop by my office for some coffee and homemade blueberry cake at 9 am on Wednesdays #mepolitics"
Excited @connctwithaxiom &amp; @Microsoft @AAIGrantFund will collaborate to close the #DigitalDivide in rural Maine w/ #TVWS technology
"Thx to @machiasnews for covering my visit Down East last week. I want to work to provide affordable, accessible hea… "
Read my ideas on securing America's critical infrastructure from Sept 2016 op-ed w/ @SenatorRisch: 
That's why I've introduced a bill that aims to protect America's electric grid from cyber-attacks.
News of attempts to hack nuclear power plants underscores need for US to develop comprehensive cyber strategy: 
…that it will make health insurance more expensive for them and that it will endanger community hospitals in rural parts of the state.
I am very concerned that people in communities like Eastport and Machias will get hammered by this bill...
We discussed the impact the proposed Senate health care bill would have on rural Maine communities 
I also visited w/ health professionals from across Washington County @ Eastport Health Care Clinic &amp; Down East Community Hospital in Machias
Wonderful few days Down East this week! The streets were packed w/ patriotic onlookers for the Grand Independence D… 
See my statement in honor of Independence Day below #FourthofJuly #mepolitics: 
Looking forward to marching in the Grand Independence Day Parade in Eastport today! Happy #FourthofJuly and God Bless America 🇺🇸🇺🇸🇺🇸
""
This exciting announcement will help bolster Saddleback’s place in the region &amp; strengthen the economy @wlbz2 
"Saddleback has long been an impt pillar of Rangeley Lakes Region, attracting outdoor enthusiasts &amp; families &amp; helping grow the local economy"
""
Important hearing yesterday in Intel Committee about Russian attempts to influence elections in Europe and what we… 
.@nytimes The Daily Podcast spoke w/ @HFHC_Maine of Harrington abt what the health bill means for Maine. LISTEN: 
You can consider this retweet an endorsement. 
Great story from @DeptofDefense on Maine National Guard's work to help the Raymond community #mepolitics: 
@AARPMaine Over 10k ppl dialed into @AARPMaine tele town hall. This is a serious issue &amp; we need serious community… 
@AARPMaine Allowing Medicare to negotiate the price of drugs would save $25 B a year. Fixing this would save taxpay… 
@AARPMaine I've visited w/ rural hospitals throughout our state. This bill will deal a blow to these hospitals and… 
@AARPMaine Maine is the oldest state in the country. We cannot let a bill like this hurt our seniors @AARPMaine 
Hosting a tele town hall with @aarpmaine on health care proposal. Listen to some of my thoughts #mepolitics: 
"On this month's podcast, I discuss summer outdoor activities in ME. Listen to some tips from the pros @mainehuts:… "
@WIRED That's why @SenatorRisch &amp; I introed bill that would use retro approach 2 safeguard against cyberattacks. Mo… 
Impt piece in @WIRED on Russian cyberattacks in Ukraine. America must be better prepared against cyber threats: 
Fun to join @SenatorCollins today to speak with over 300 @girlscouts from around Maine on the steps of the Capitol… 
All this week we’ve hunted around here for the health care bill. This morning we found it &amp; I’m kind of sorry we di… 
""
ICYMI: I spoke recently w/ @AlHuntDC about my work on the Intel Committee. Check out the Q&amp;A @bv 
"When the it was founded, Glacier National Park had 150 glaciers. Today it has 26. 🤔🤔 "
"3/ I am grateful to all who serve &amp; offer deepest condolences to the families, friends &amp; teammates of those who made the ultimate sacrifice."
2/ are a sobering reminder of the sacrifices our servicemembers and their families make to defend our country.
"1/ Recent US casualties, including servicemembers killed in Iraq, Somalia, Syria &amp; Afghanistan, and the 7 sailors lost on the USS Fitzgerald"
""
Let us recommit ourselves to assisting the seniors in our community and help them live with the distinction and dig… 
"we must be increasingly aware of potential elder abuse, whether it be physically or through financial manipulation like phone scams."
Today is World #ElderAbuse Awareness Day. Maine has the oldest population in the country – and with an aging population –
"@USArmy General Allyn served the country with integrity and courage, and his leadership in the @USArmy will be miss… "
"Honored to present General Allyn, a Berwick native, w/ an American flag flown over the Capitol ahead of his retirem… "
Great to join @CNN @NewDay this morning to discuss my thoughts on yesterday’s #SessionsHearing: 
Encouraged @POTUS has renominated @JRosenworcel as FCC Commissioner. Her leadership has helped address #HomeworkGap and digital equity.
Read my op-ed in the @bangordailynews abt economic impact of Katahdin Woods &amp; Waters Nat’l monument for the region: 
"Praying for my colleagues, Capitol Police, staff and all those at the Congressional baseball practice this morning."
WATCH my questions for Attorney General Sessions during today’s Senate Intelligence Committee hearing: 
Fun to speak @ graduation @ Islesboro Central School. Only 7 graduates &amp; the entire community came out. This is wha… 
Joined @RepPoliquin to commend the brave men &amp; women of Maine @VFWHQ at their convention in Bangor. TY for all you… 
WATCH more of my questions from the #ComeyHearing HERE: 
ICYMI: Watch my remarks from yesterday’s #ComeyHearing. I don’t think Putin is a Republican or a Democrat. He is an… 
Great to meet with Maine Boren Scholarship winners Kathleen Donovan and Isabel Udell! 
ICYMI: Heartbreaking @nytimes story on impact of drug crisis. We must do all we can to support our communities: 
"Humbled to join w/ ppl in France and US to honor Charles, his Native American comrades, &amp; all those who advanced in defense of freedom #DDay"
"Charles, a medic during the war, is a member of the Penobscot Nation from Indian Island."
"In France today, Charles Shay Indian Park, overlooking Omaha Beach, will be dedicated as a lasting tribute to Nativ… "
These many years later we remember the lives lost and honor the immense bravery and courage on the beaches of France that day.
"73 yrs ago today, the Allied Forces stormed the beaches at Normandy &amp; began the liberation of Western Europe during… "
