"On the anniversary of Robert Kennedy’s death, I am reminded of my favorite speech of his, delivered in South Africa… "
"
"
HAPPENING SOON: Hosting my Inside Maine Podcast on @WGANNews about importance of H-2B visas for ME economy. Tune in: 
Great to make a surprise visit to Longfellow’s Greenhouse in Manchester to celebrate the family business’ 40th anni… 
@DeptVetAffairs …to those who helped clean up Enewetok Atoll and other sites on the Marshall Islands. #mepolitics: 
"To underscore my support for Paul &amp; 100’s of vets like him, I announced support for bill to extend key @DeptVetAffairs health benefits…"
Honored to present veteran Paul Laird w/ Humanitarian Service Medal in my Augusta office to honor his work at Enewe… 
Helping seniors age safely at home is a critical part of the health care debate @SenBrianSchatz @SenatorCollins: 
Please see my statement on the @USCBO score on the #AHCA: 
"After months of prodding, it is encouraging to see that @usedgov has agreed to review @UMPIowls Upward Bound grant: "
"Pre-existing conditions can happen to anyone, which is why we’ve got to address this terrible bill that passed in t… "
"@ 12:30 I’ll join @SenatorDurbin, @SenBrianSchatz &amp; cancer survivors to discuss impact of #AHCA on people with pre-existing conditions"
"In the last yr, ME took back 27,140 lbs of drugs. Thx to law enforcement &amp; communities for critical accomplishment in fight against opioids"
""
""
".@DeptVetAffairs has awarded $479,155.51 to Maine Veterans’ Homes to provide veterans w/ the high-quality care and support they deserve"
Tune at 6 pm on @WCSH6 and @WLBZ2 to hear @SenatorCollins and I discuss our work in the Senate #mepolitics 
"WATCH LIVE: A discussion with @AARPMaine @bangorlibrary about how #AHCA will affect older, rural Maine people: "
""
""
@Interior Let @Interior know your opinion on the review HERE If you have trouble submitti… 
I questioned nominee for Deputy Secretary of @Interior about review of Katahdin Woods and Waters National Monument… 
Proud to join my colleagues to honor law enforcement across the US with National Police Week Resolution #PoliceWeek #PoliceWeek17
Please see my statement on former FBI Director Robert Mueller's appointment as special counsel to oversee Russia in… 
3/ What happens to Lidia? What happens to Dan? Who will speak for them? I will – and I hope this body will. 
2/ I took to the Senate floor to share their stories with the nation and speak out against the House-passed health care bill
"1/ After hearing from the mothers of Daniel Humphrey of Lewiston and Lidia Woofenden of Bowdoinham, two young adults with disabilities"
Funding for @jacksonlab will help to better understand Alzheimer’s &amp; develop strategies that will help find a cure: 
This bill would help law enforcement stop illegal drugs from entering US &amp; fight off the grip of addiction before it begins. #mepolitics
Protecting communities in ME from the influx of powerful opioids like fentanyl is a critical part of strategy to co… 
"I view this as a very serious matter, and it is my intention to obtain the facts before arriving at any conclusions. "
HAPPENING SOON: I'll join @wolfblitzer in the @CNNSitRoom. Hope you can tune in!
"(3/3) Furthermore, it could result in the loss of important intelligence sources and the cooperation of partners."
"(2/3) Jeopardizing the sources and methods that support our intelligence gathering apparatus or those of an ally, are of grave concern."
"(1/3) If true, this report is very troubling."
"Great to meet with members of the Maine Warden Service, who were in town for National Peace Officers Memorial Day "
Funding for @islandinstitute critical to address threats resulting from climate change #mepolitics @PenBayPilot: 
Worldwide cyber-attacks underscore need for U.S. to develop comprehensive cyber strategy to strengthen our national security
.@Interior is accepting comments for its review of the Katahdin Woods &amp; Waters National Monument. Be heard here: 
"WATCH my full remarks from Intel hearing w/ Acting FBI Director, DNI, CIA Director &amp; Director of the NSA: "
#AHCA is a foolishly misnamed bill that would hurt people across Maine. @sunjournal #mepolitics: 
I joined @MSNBC’s @Morning_Joe to discuss the President’s firing of Director Comey and the ongoing Intel Committee… 
"Watch my remarks on #AHCA’s impact on the opioid crisis. This bill is ill-conceived, damaging, and downright cruel: "
On Senate floor today: Proposed cuts to ONDCP like abolishing DOD in in the middle of World War II #mepolitics
"
"
WATCH LIVE HERE: 
HEADS UP: Speaking on the Senate Floor abt 12 pm to discuss consequences of #AHCA for drug epidemic and proposed cuts to #ONDCP #mepolitics
Please see my statement on the President's firing of FBI Director James Comey: 
I'll be on @npratc tonight to discuss breaking news on FBI Director Comey
Fun to join @SenatorCollins to visit w/ Biddeford Middle School students who are in Washington this week to learn a… 
".@MainePublic If we can check a paper trail, we can secure the integrity of our elections."
Letter is in response to Russian hackers probing state elections systems during 2016 election @MainePublic: 
"Today, I wrote to Senate Approps urging them to help local &amp; state gov’ts safeguard against attempts to alter election results"
Please see my statement on @Interior's announcement today that it will review Katahdin Woods and Waters National Mo… 
.@CBSNews Over 360 Maine people died due to a drug overdose in 2016. This crisis affects everyone. #ONDCP must remain fully funded.
".@CBSNews About 1 in 12 babies in Maine are born with drugs or alcohol in their systems, this is not the time to ma… "
#ONDCP is critical to combat the opioid epidemic &amp; save lives in ME communities @CBSNews: 
Administration’s proposal to slash Office of Nat’l Drug Control Policy by nearly 95% is misguided and dangerous #mepolitics
Read more about the two bipartisan bills I introduced today to support hydropower HERE: 
"In Maine, nearly a quarter of the total power we produce is hydropower – a renewable, clean, and homegrown form of energy. #mepolitics"
That’s why @SenatorCollins and I urge Senate Approps to support robust funding for State Veterans’ Homes: 
State Veterans’ Homes have a long history of helping ensure that disabled veterans receive the respect and dignity they have earned
Live look at the House health care bill: 
#Tbt to my #StarWars reference on @Morning_Joe. #StarWarsDay #MayTheFourthBeWithYou… 
""
The bottom line is the House health care bill is a shift and shaft and it's going to cost Maine people their health… 
Fun to read Blueberries for Sal for the digital collection at Skidompha Library in Damariscotta #mepolitics 
Spoke on Senate floor abt @usedgov division on @UMPIowls FY2017 grant app for Upward Bound. Watch via @MainePublic: 
WATCH LIVE: Speaking on the Senate floor around 12 pm about @usedgov line spacing decision that harms ME students: 
H-2B visa provision is a positive step forward for Maine small businesses #mepoltics @KJ_Online @OnlineSentinel: 
"Met a brave young boy today, Kellan Tilton of Detroit, ME. Kellan is a cancer survivor in DC to raise awareness for… "
""
.@MeetThePress You can watch my full interview with @SenatorCollins on @MeetThePress HERE: 
"On @MeetThePress yesterday, I discussed an often overlooked problem with the gridlock in Congress. WATCH: "
"On this month’s Inside Maine Podcast, I discuss investing in manufacturing communities to help grow ME’s economy: "
""
""
.@MeetThePress .@SenatorCollins and I will be LIVE in studio on @MeetThePress w/ @chucktodd around 9:20 am 
.@MeetThePress ...There's a punchline in there somewhere #mepolitics
Two Maine Senators walk into the @MeetThePress studio...
""
.@usedgov Then let's start by allowing for consideration of UMPI app now. ME students deserve better &amp; I'll keep fi… 
".@usedgov In fact, if @usedgov really believes ""needless red-tape should never interfere with helping students""..."
It's clear from the @usedgov statement that Sec. DeVos can fix this problem immediately. 
.@bangordailynews Ed Board underscores ridiculous bureaucracy that jeopardizes opportunities for ME HS students: 
Look forward to joining @SenatorCollins on @MeetThePress! 
"Last days for the spring interns! All congressional offices have interns, but mine are always the coolest, as you c… "
It is essential that the US continue to press China to recognize that a nuclear armed NK is not in their interest: 
I believe it is critical that there be an increase in diplomatic &amp; economic pressure – particularly from China – to help address this threat
North Korea is a serious threat to the United States and to our allies and partners.
Spoke with Lake Region High School World Quest Team today &amp; @SenJohnMcCain was kind enough to visit with them as we… 
I joined @wolfblizter in the @CNNSitRoom to discuss the situation in North Korea. WATCH HERE: 
"Encouraged that, in conjunction w/ #LabWeek, Senate HELP Committee unanimously approved #SMASH Act, bill I authored to combat #Zika"
Look forward to talking to you at 6 pm @wolfblitzer 
Issue w/ @UMPIowls grant app for Upward Bound Program is what people hate about government. We need to get it fixed… 
.@UMPIowls @usedgov We strongly urge @usedgov to reconsider its decision &amp; allow UMPI’s application to be read and… 
".@UMPIowls @usedgov …over the next five years, denying 960 disadvantaged high school students the chance to fulfill… "
".@UMPIowls @usedgov This is a minor formatting oversight, and @usedgov decision risks…"
.@UMPIowls .@usedgov determined the grant apps are ineligible b/c two infographics in @UMPIowls proposal R depicted… 
"Along w/ the entire Maine Delegation, I wrote to Secretary DeVos in support of @UMPIowls grant applications for the Upward Bound Program"
Joined @CNN to discuss ongoing investigation on Russian’s role in US election &amp; upcoming briefing on North Korea: 
I'll join @CNN @NewDay around 7:30 this morning. Hope you can tune in!
Happy #nationalhighfiveday! 
Last night I discussed US foreign policy &amp; the lessons I’ve learned on #SASC and #Intel Committees @OnlineSentinel: 
""
Looking forward to the George Mitchell Distinguished International Lecture at @ColbyCollege tonight at 7 to discuss US foreign policy
Joined @ColbyCollege President David Greene in downtown Waterville to survey Colby’s economic revitalization work w… 
That’s why I’ve joined w/ @SenatorBurr to re-introduce the PACE Act to update the Child &amp; Dependent Care Tax Credit: 
"While I was there, I spoke with parents and childcare professionals about the importance of affordable childcare #mepolitics"
It was a real treat sitting down with group of pre-schoolers for a little reading at Educare Central Maine in Water… 
".@AmericanLegion @DeptVetAffairs As I said when the bill was first introduced, justice delayed is justice denied.… "
I joined veterans at the @AmericanLegion post in Auburn to call on Congress to pass the @DeptVetAffairs Appeals Mod… 
It was great to speak w/ students from Wiscasset Middle High School via Skype for my Capitol Class! @MidcoastNews: 
"100 years later, we commemorate this solemn occasion &amp; memorialize the servicemembers who laid their lives on the line so we may live free."
"On April 6, 1917, the US entered the First World War. Over 32,000 Maine people served, and more than 1,000 paid the ultimate sacrifice."
Thank you @SenatorBaldwin for your leadership on the #DairyPride Act 
""
Joined with @SenatorShaheen to introduce #SAFEBridges Act to upgrade bridges &amp; help support jobs in ME: 
Met w/ members of the Maine Motor Transport Assoc to discuss strategies to build the workforce &amp; invest in our road… 
Great to join @SenatorRisch to advance the interests of forest workers and strengthen rural communities… 
Please see my statement on the reported chemical weapon attack in Syria: 
Invest in Rural America Act will support Maine's forest products sector and help train the next generation of logge… 
"In conjunction with my plan, I announced a bill proposal, the Invest in Rural America Act, to grow Maine’s workforce "
"This morning in Mexico, I outlined my economic agenda “You Can Get There From Here: Growing Maine’s Rural Economy”: "
""
.@SenatorCollins Bipartisan bill makes permanent the Investing in Manufacturing Communities Partnership: 
Joined w/ @SenatorCollins to introduce the Make it in America Manufacturing Communities Act #mepolitics
Thanks for your hard work on behalf of the American people @SenatorLankford! 
.@SenThomTillis Bureaucratic failures w/ H-2B are standing in the way of ME businesses succeeding or even keeping t… 
.@SenThomTillis &amp; I introduced the Save our Small and Seasonal Businesses Act to help seasonal employers better navigate H-2B visa program
Joined @SenatorLankford on @Morning_Joe to discuss importance of Senate Intel conducting non-partisan investigation: 
"Proud to have @RepJoeBarton &amp; @repjohnlewis introduce the DELIVER Act in the House today! CC: @JohnCornyn, @_MealsOnWheels #mepolitics"
Maine @USNationalGuard critical in preparing Montenegro for accession to @NATO #mepolitics: 
Discussed importance of transparent Senate Intel investigation on Russian influence in election w/ @MSNBC. WATCH: 
Joined w/ @CoryBooker to reintroduce bill to preserve &amp; protect rights of cities &amp; towns to invest in local broadband infrastructure
Looking forward to joining @11thHour tonight to discuss Senate Intel Cmte's investigation into Russia &amp; our election. Hope you can tune in!
HAPPENING NOW: Hosting Inside Maine podcast on @WGANNews abt importance of open &amp; transparent gov't. Listen LIVE: 
You can watch the discussion LIVE on my Facebook page at 1:30 pm HERE: 
HEADS UP: Hosting a discussion at a hospital in Skowhegan on how #ACA replacement bill will set back the battle against the opioid epidemic
"
"
Scott &amp; Sarah from my staff packed @_MealsonWheels for homebound Lincoln County in Damariscotta yesterday!… 
Introduced bill w/ @JohnCornyn to promote volunteerism within meal delivery programs &amp; help provide meals to more s… 
"Questioned Gen. Scaparrotti, @US_EUCOM Commander, abt Russian overreach &amp; importance of comprehensive cyber strategy "
Met w/ students from Cape Elizabeth HS &amp; Telstar HS in Bethel yesterday. Great to see young people engaged in our l… 
Retreating from global economy is not an option when other developed countries press forward w/o us @PressHerald: 
"The trade agreement between Canada &amp; EU is extremely problematic for Maine’s lobster dealers, processors, and commercial fishermen."
Met with Dayna McCrum &amp; Natalie Hodgman who were in DC talking about the future of Maine agriculture during @agday… 
""
Read my full letter outlining trade priorities HERE: 
"1) Negotiate smarter, more transparent trade agreements 
2) Strengthen trade enforcement capabilities 
3) Support domestic industries"
"Last week, I wrote a letter to @POTUS outlining several trade priorities that must be addressed to support Maine people and industries."
Flight Deck Brewing ribbon cutting yesterday underscores powerful economic potential for Maine’s craft brewing indu… 
Spoke w/ Oxford Hill Chamber of Commerce abt rural development in Maine’s communities. More from the @SunJournal: 
""
Congrats to Cape Elizabeth High School for advancing to the National Science Bowl Finals this April! @ENERGY @DOE_SC_NSB #STEM #mepolitics
Honored to join @SenTomCotton yesterday for my inaugural hearing as Ranking Member of #SASC Airland Subcomittee. WA… 
You can WATCH LIVE HERE: 
HAPPENING SOON: I’ll be LIVE on FB at People Plus to discuss the impact ACA replacement bill will have on older Mainers
Great calling in yesterday during your #bipartisanroadtrip. Look forward to working w/ you to move this through Con… 
"Ban hurts national security, risks pushing more recruits to ISIS &amp; is not needed 4 better vetting. Indy judges one of Framers best ideas."
Bill was introduced in conjunction w/ #SunshineWeek – an initiative led by @NewsEditors to emphasize an open government #mepolitics
Reintroduced bill to increase transparency in campaign contributions &amp; help voters know who is funding candidates: 
Joined @CNN last night to discuss #ACA replacement bill &amp; the recently released @USCBO score #shiftandshaft: 
Happy 197th Birthday to the greatest state in the Union! #mepolitics #PineTreeState #Dirigo 
WATCH LIVE TOWN HALL: Calling @BetoORourke &amp; @HurdontheHill to discuss bill to increase transparency in campaigns: 
HEADS UP: I'll join @wolfblitzer in the @CNNSitRoom around 6 pm. Hope you can tune in!
Stay safe and drive with caution if you’re on the roads! #StellaBlizzard 
""
HAPPENING SOON: I'll join @msnbc to discuss the #ACA Replacement and the recently released CBO score
"Timber Innovation Act will accelerate R&amp;D of engineered wood for use in construction, focusing on construction of b… "
Read Bill's op-ed in the @PressHerald HERE: 
It is specific stories like this from our fishermen and farmers that can affect change in Washington. @EPA
Thanks to Bill Mook of @MookSeaFarm for highlighting the impact of climate change on Maine aquaculture #mepolitics
"Great to meet with Lily Tedford of South Portland and Katie Waeldner of Yarmouth, Maine’s 2017 delegates to the… "
Joined @Greta last night to discuss continued investigation into Russia’s role in the 2016 election. Watch HERE: 
HAPPENING SOON: I'll join @greta on @MSNBC around 6 pm. Hope you can tune in!
On #ACA Replacement: The pattern is shift &amp; shaft. Shift the cost &amp; shaft the people who need coverage. Watch HERE: 
HEADS UP: I’ll be speaking on the Senate floor around 11:45 re: recently released proposal to replace the Affordable Care Act #mepolitics
Maine @VFWHQ members stopped by my office last week to underscore issues critical to Maine #veterans. TY for your s… 
Last night's event on #SCOTUS nominee Judge Gorsuch is what democracy should look like. More from @WCSH6: 
Thanks to @NPR @MorningEdition and @NPRInskeep for having me on today! 
Thanks to Maine @AmericanLegion members for all you do for veterans in Maine and across our country… 
TY to all those who came out tonight! If you'd like to share your thoughts &amp; opinions please be in touch #mepolitics 
"I hope to see you there for this critical discussion. If you are unable to attend the event, watch it live HERE: "
It will be held in Hannaford Hall in the Abromson Community Education Center on the USM campus from 5 pm to 7 pm: 
The session is sponsored by @UMaineLaw &amp; @USouthernMaine
I look forward to hearing directly from Maine people tonight at my listening session on #SCOTUS nominee Judge Neil Gorsuch #mepolitics
Great to meet with members of the Maine @DAVHQ to discuss issues important to Maine disabled #veterans #mepolitics 
My statement in response to reports concerning Attorney General Jeff Sessions’ meetings with the Russian Ambassador: 
I joined representatives from Maine’s credit unions this week to discuss common-sense regulatory relief to grow our… 
"But it’s a crisis that can be avoided too, &amp; that’s why this legislation is so impt. More from @bangordailynews: "
…and it’s one that people in Maine confront every day when they walk into a drug store or when they get their bill.
The rising costs of prescription drugs in this country is a crisis –
I joined w/ colleagues in the Senate &amp; House to introduce a bill to allow the safe importation of prescription drugs into the United States
Thanks to @BillMaher &amp; @RealTimers for having me on the show last week! 
""
You can watch tonight's #JointSession LIVE HERE: 
Sat down w/ Kevin Lewis of ME Community Health Options who is my guest for the #JointSession. Honored to have him h… 
You can vote for finalists in the #Doodle4Google competition HERE: 
Congrats to Ruth Havener of Medomak Middle School for qualifying as a finalist in the #Doodle4Google contest. You m… 
Thanks to @CNN @NewDay for having me on this morning. 
Join me LIVE w/ @SenSanders @ 12:30 to discuss new bill to allow safe importation of prescription drugs into the US: 
Listen LIVE to Inside Maine radio show with Dana Doran of PLC of Maine &amp; Sean DeWitt of @OurKatahdin HERE: 
HEADS UP: Tune in to Inside Maine on @WGANNews in the 10 am hour to hear more about the importance of ME’s rural economy #mepolitics
Look forward to joining @billmaher tonight on @HBO! 
"“We must disenthrall ourselves, and then we shall save our country.”"
"“The occasion is piled high with difficulty, and we must rise with the occasion. As our case is new, so we must think anew, and act anew…"
"Lincoln said, “The dogmas of the quiet past, are inadequate to the stormy present…"
"In the process he spoke what I think is the most eloquent, concise and best advice to any of us dealing with the challenge of change."
"Lincoln addressed Congress in the midst of our terribly destructive Civil War, about a month before signing the Emancipation Proclamation."
"On this #PresidentsDay, one of the most profound quotes from President Abraham Lincoln comes to mind."
Thanks to @HardballChris for having me on this evening 
HEADS UP: I’ll be on @MSNBC’s @Hardball around 7:15 pm. Hope you can tune in!
Strengthening rural high speed broadband will support Maine economy &amp; bring good jobs to our state #mepolitics 
…with our friends and trading partners across our northern border. #mepolitics More from @Mainebiz: 
All trade rules must be properly adhered to so that we can continue our healthy and beneficial relationship…
Joined ME delegation to write to USTR re: reports of subsidies that may have been illegally offered to company in Quebec
.@WCSH6 last year reported on the Brennen family whose tragic story inspired this bill. I hope we can act for them: 
No one in America should have to endure the pain or financial hardship caused by such a senseless policy. This bill is the right thing to do
"Inspired by a Maine family, our bill would end a student loan tax penalty levied on parents after a child's death or permanent disability."
Joined @SenRobPortman &amp; @ChrisCoons today to reintro the bipartisan Stop Taxing Death and Disability Act: 
"Thanks to @MaineCalling for a great discussion earlier! ICYMI, you can listen here: "
Interested in connecting with me on @MaineCalling today at 1pm? Visit here to find out more: 
Excited to join @MaineCalling today at 1 pm. Hope you can listen-in &amp; be in touch with your Qs. Look forward to hearing from you #mepolitics
2017 James Beard Semifinalists show how strong Maine’s food industry is! Check them out here: #mepolitics: 
Thanks to @NPRinskeep for having me on Morning Edition this AM. Listen HERE: 
I urge @POTUS to work w/ Congress to pass the Medicare Prescription Drug Price Negotiation Act as soon as possible: 
HEADS UP: I’ll join @KatyTurNBC on @MSNBC around 2:15. Hope you can tune in!
Great to see a genuine outpouring from Mainers contacting my office. Please continue to be engaged. @SunJournal: 
"Please stay safe, stay home and stay warm today! A blizzard like this is good time to be by the fire with family "
HEADS UP: I'll be on @MSNBC's @Morning_Joe around 7. Hope you can tune in!
"
Check out these 📸on Instagram feed:

▶️"
.@CharlesPPierce on my speech late last night on the Senate floor voicing my concern abt Tom Price heading @HHSGov: 
"We need to increase access to this life-saving drug, not make it harder to get #mepolitics @WLBZ2: "
Naloxone is a critical tool in the fight against opioid deaths. That’s why the approx 500% price hike on the Evzio injector is so dangerous.
"It was great to see ppl from all over Maine in my office! If you’re ever in DC, come by @ 9 am on Wednesdays for co… "
Thanks to @mainecalling for letting me call in this afternoon @MainePublic #mepolitics
UP NEXT: I'll be on @hardball on @MSNBC
HAPPENING NOW: I'm speaking with @ErinBurnett on @OutFrontCNN. Hope you can tune in!
"Pitched in on the phones this morning. We’re listening! Keep engaged, keep involved, keep in touch #mepolitics "
Sappi’s investment in Skowhegan will continue to help the forest industry be a source of good jobs in ME. @Mainebiz: 
Improving Rural Call Quality &amp; Reliability Act will improve telecommunications &amp; help rural Maine communities grow: 
"In an ever-interconnected world, reliable, quality phone service is a necessity for families and businesses in rural Maine #mepolitics"
HAPPENING SOON: I'll speak with @greta on @MSNBC. Hope you can tune in!
Mary teamed up with my staff in Maine today to answer calls. Thankful to have such a wonderful partner dedicated to… 
…and that Maine students will be guaranteed an equal opportunity to a quality education #mepolitics
...Maine public schools will be provided adequate and appropriate funding…
"I continue to harbor those concerns, and in light of her confirmation, now consider it my responsibility to fight to ensure that…"
"…and indeed, that she was hostile to the fundamental mission of the Department"
"I was concerned that she wouldn't be a strong advocate for public education, that she lacked the necessary knowledge to lead the Dept..."
"After following her confirmation hearing closely &amp; after a great deal of consideration, last month I concluded I could not support Ms. DeVos"
DoD 2016 Arctic strategy is an important &amp; necessary step forward in defining our national security interests in th… 
Congrats to Tom Brady and the @Patriots for a comeback win for the history books! #oneforthethumb #SuperBowl… 
My grandson sending a message to Houston! #Patriots #SuperBowl #SuperBowl51 
