"@SenateGOP This is not a #HealthcareBill. It’s a tax cut for wealthy, Medicaid cut for vulnerable &amp; an insult to pp… https://t.co/cITTKJj5qg"
"Fundamental problem is that @SenateGOP didn’t set out to fix the health care system, they set out to repeal the ACA. #HealthcareBill"
"But GOP bill does nothing to address any problems Americans want us to fix. Coloradans are furious, and rightly so. #BetterCare is worse."
It's shameful that people in our country have to lay awake at night wondering if their kid is going to receive #healthcare if they get sick.
On the Senate floor tonight discussing the GOP #HeathcareBill. Tune in to hear why #BetterCare is worse. LIVE NOW: https://t.co/4UJn6IO38E
"On #EqualityDay we’re reminded that GOP #HealthcareBill will affect all communities. As Sam says, quality care is e… https://t.co/iKGkhAyBqt"
@POTUS #SCOTUS order doesn't change fact that #TravelBan contradicts history of welcoming ppl of all religions &amp; do… https://t.co/0jvMFXkPgq
Today's #SCOTUS order recognizes that @POTUS's travel ban unjustifiably harms people with a bona fide connection to the United States 1/2
Marched with @One_Colorado Executive Director Daniel Ramos last week at Denver #Pride. Remembering this great celeb… https://t.co/6jo3fQcbM4
Committed to voting NO on #HealthcareBill that threatens coverage for thousands &amp; makes it more difficult for women… https://t.co/uzw3kJkhRV
.@csgazette Editorial Board is right: #BetterCare does nothing to lower prices &amp; increase access to health care. https://t.co/R9N0ik66hn
"@SenateGOP Instead of rushing to pass GOP #HealthcareBill, we should work together on a bill that gives Coloradans… https://t.co/T1VHSi77V1"
The @SenateGOP #BetterCare health care bill is worse than the House bill and could not be less responsive to Americ… https://t.co/YWzktQcaQG
.@POTUS promised more predictable/affordable health insurance. Senate #HealthcareBill falls far short &amp; is just as… https://t.co/bQnG76mN2Q
The Senate #HeatlhcareBill is a tax cut for the wealthiest Americans that will throw millions of people off of thei… https://t.co/it04FxXaY9
Experts are sounding alarms on GOP #HealthcareBill. We need more resources—not #Medicaid cuts—to combat the #opioid… https://t.co/YqyLM2UI8a
"As father of 3 daughters, 45th #TitleIX anniv reminds us of progress made &amp; work to do so all young women have equal opportunities in school"
"RT @TheCorpsNetwork: Spread the word! Bipartisan, bicameral #21CSC Act introduced! Great news for public lands, young adults &amp; veterans htt…"
Would be a bipartisan win-win: Youth &amp; veterans gain job skills while restoring &amp; maintaining #publiclands https://t.co/pAbuuP4WuR
This trade-off makes no sense: We cannot cut critical domestic programs to fund @POTUS deportation force/border wall https://t.co/0202xOcIRw
Senate bill is just as bad as—if not worse than—House #HealthcareBill. Coloradans deserve full &amp; open debate to imp… https://t.co/nZYN06Tbyx
RT @SenMarkey: Calling on @SecretaryZinke to protect #ArcticRefuge &amp; ecosystems of Natl Pet. Reserve–AK from oil &amp; gas drilling https://t.c…
Memorable night giving tour of the @uscapitol with @SenCoryGardner to Coloradans from all over the state in town fo… https://t.co/zoug1Q6J4F
It's time we work together on a health care bill and an agenda that are responsive to the American people's priorit… https://t.co/CrmKZ1BTNZ
".@SenateGOP are so ashamed of health care bill, they won’t even share it with GOP colleagues—much less Dems or Amer… https://t.co/uk6900j4Xm"
"On #WorldRefugeeDay, thinking of my recent trip to Jordan and the important stories of these courageous, resourcefu… https://t.co/c5R0nuPoFx"
Half the world’s refugees are children. This is heartbreaking. We're committed to fight admin’s attack on humanitar… https://t.co/7w0SqcAbza
Even @POTUS said GOP health care bill is “mean.” CO would be one of the states harmed most. So why are Republicans… https://t.co/YPb4cy9J8m
"Met patients, advocates &amp; health officials with @GovofCO to discuss harm GOP health care bill would do &amp; find real… https://t.co/WS8IiPwvmJ"
Nearly half of Coloradans on #Medicaid are children. @POTUS has one thing right: Republican health care bill that s… https://t.co/7WH6gm8zDo
Congratulations to Colorado's #PresidentialScholars for receiving one of the highest honors for high school graduat… https://t.co/l3LwV1jpwM
#PancreaticCancer advocates concerned about GOP's health care bill. #Preexistingconditions should not be a barrier… https://t.co/76fBRlBr2x
Standing with over 100 CO biz to protect #ArcticRefuge. It’s why we intro'd a bill to preserve the Coastal Plain. https://t.co/AAmFScV0Wr
"In March, #wind &amp; #solar produced 24% of Colorado's energy. We're powering our economy &amp; protecting our environment. https://t.co/gr83sOb6K2"
"On #Juneteenth we recall the injustice of slavery, the stain it leaves on our nation &amp; the work we must keep doing to ensure justice for all"
"Only in this administration is it “wise"" or ""intellectually engaged” to ignore facts and deny climate reality.… https://t.co/PsMEudTrnX"
This doctor explains why patients in Colorado’s rural communities will be worse off under the GOP healthcare plan → https://t.co/1Um6vRC28I
".@SenateGOP are so ashamed of health care bill, they won’t even share it with GOP colleagues—much less Dems or American ppl #NoHearingNoVote"
Slashing #Medicaid is an outrageous step backward from providing addiction treatment &amp; combating the #opioidcrisis. https://t.co/WdBYxSBmTr
Our prayers are with the families of the seven @USNavy sailors of #USSFitzgerald. Their patriotism &amp; service will not be forgotten.
Spent #FathersDay at Denver's #Pride2017 parade. No better lesson I could teach my daughters than the importance of… https://t.co/79honbbxgs
Shame on @BetsyDeVosED for abdicating core responsibility to protect &amp; secure the civil rights of all students. https://t.co/Cv0AIpgCL1
Important record for #cleanenergy &amp; future of US economy. Good to know CO is helping lead the way as #1 wind manufa… https://t.co/TzfLSc7xp3
Critical bill passed sends message to Russia &amp; ensures Admin can't roll back sanctions without Congressional review: https://t.co/GPRmC63lp6
"Holding roundtable w/ @GovofCO, @LtGovofCO &amp; health care advocates to discuss how we can improve &amp; protect health c… https://t.co/UlI46sjgSJ"
"RT @SenateAgDems: Today, @SenStabenow &amp; @SenBennetCO asked USDA about their role in the Trump Admin review of national monuments: https://t…"
"⚡️ #VoicesOfCO: Health Care Stories
https://t.co/HSVuw2JubD
Keep sending us stories. They are why fixing our health care system matters."
"In past 5 yrs under DACA, over 780,000 #DREAMers—17,000 in Colorado—had a chance to work &amp; study without the fear of deportation #SaveDACA"
"We must never take for granted the heroism of @CapitolPolice, who risk their lives every day to protect our nation’… https://t.co/DILccAqasE"
"Still awaiting details, but my thoughts and prayers are with Steve Scalise, Capitol police officers, and all those who were injured."
Republicans could not have designed a LESS responsive health care bill to what the American people need.… https://t.co/1rVSW49hQ6
"You mean ""more generous"" than cutting Medicaid by 25%, risking coverage for 23M, &amp; allowing discrimination against… https://t.co/jo5B3YRRiu"
"@SenateMajLdr At the very least, we should meet standards set by @SenateMajLdr for ACA and hold hearings on @POTUS's health care bill."
"As @SenateMajLdr said in 2010, Americans tired of bills ""negotiated in secret...jammed thru on a party-line vote in the middle of the night"""
23 mil people may lose health insurance bc of GOP health care bill. They deserve to know what’s in the bill. Their well-being is at stake.
Watch LIVE now: Staking out with @SenateDems to discuss harmful GOP health care bill &amp; hypocrisy of no hearings: https://t.co/GDmx8h1kPu
Attacking the free press &amp; banning reporters is at war with who we are as Americans. This can't stand. #FreePress https://t.co/pazY8gUgMU
"If Capitol press are not allowed in hallways, you're welcome to set-up shop in our office. We'll make our conferenc… https://t.co/LwhUwWfsPX"
Today’s recommendation reflects Washington interests &amp; ignores input from tribes &amp; citizens across West. #BearsEars… https://t.co/OV4fBFlH2W
Congratulations @GabbyGiffords. There is no one more deserving of this honor. Thank you for your courage &amp; patrioti… https://t.co/jw9r8Ffe8U
"Today, we remember the 49 lives lost &amp; #HonorThemWithAction by supporting the Equality Act &amp; other protections of L… https://t.co/q1PmNQmD6w"
Disappointed to see @EPAScottPruitt stand on the sidelines. A footnote will not make up for our carbon footprint.  https://t.co/S5hRYc25sp
9th Circuit confirms that @POTUS’s travel ban violates the law &amp; our proud tradition of welcoming people regardless of nationality/religion.
We must ensure laws provide best chance for kids with cancer to live full lives by passing #RACE4Kids. @marcorubio https://t.co/yi1fJeGuRS
"Watch our #townhall in Frisco, CO LIVE NOW: https://t.co/ge5bl8f1fb"
"Make no mistake: A 25% cut to Medicaid cannot be done without harming Colorado's kids, disabled, and elderly. https://t.co/V3ThWTf9pc"
"RT @next100cltn: Longtime #Next100Coalition ally @SenBennetCO tells public lands advocates to keep fighting. That we will, Senator. #Defend…"
Statement on #ComeyHearing: Testimony makes clear @POTUS is more concerned about his own self-interest than safegua… https://t.co/inEofrpfEn
"@POTUS Instead of self-interested rants about election results, @POTUS should hold Russians accountable for interfering with our democracy."
The legal case for obstruction of justice is critical. Let’s also remember need for @POTUS to restore trust in our institutions. #ComeyDay
The GOP health care bill would disproportionately harm older and sicker Americans. #VoteNoAHCA https://t.co/s3ZLwHVSeB
We must protect #publiclands so all future generations of Americans can experience our natural and cultural treasur… https://t.co/ELNxJdPAHA
"ANNOUNCEMENT: Holding 3 central mountain #townhalls this Friday in Frisco, Edwards, and Glenwood Springs. https://t.co/z86KoJzK5N"
"73 years ago, Allied soldiers landed on the Normandy beaches. On #DDay, we honor their sacrifice &amp; bravery in the fight to protect freedom."
"70 years ago, #MarshallPlan speech changed the course of U.S. diplomacy, laying foundation for transatlantic alliance &amp; economic stability."
"Taking time to celebrate #WorldEnvironmentDay — a reminder that we share one Earth, and we all have a role to play… https://t.co/eRCtJhkZ5F"
Terrorism will not win. We stand w/ UK &amp; all those affected by yesterday's horrific acts. Our prayers are w/ the victims &amp; their families.
Celebrating #NationalDairyMonth at @noosayoghurt w/ co-founder &amp; 4th gen dairy farmer Rob Graves. Great CO company… https://t.co/dV5i7WEhtS
"Round table discussion at Fresca Foods in Louisville, CO focused on food entrepreneurship &amp; regional #FoodSystems. https://t.co/XTki4nQ4u5"
In the freezer during #FoodSystems tour of @USDA_ARS seed preservation facility w/ former Agriculture Secretary Tom… https://t.co/XpWOBExz6h
Great regional #FoodSystems tour this week. First stop was @USDA_ARS to learn about supporting resilient agricultur… https://t.co/HdxP3lG8tt
"We must tackle #opioid crisis, but #Medicaid cuts in GOP budget &amp; health care bill would make this harder than it a… https://t.co/QdNRDSYQEX"
Thank you to the health officials &amp; community centers who spoke w/ us about how we can work together as CO faces cr… https://t.co/hLjXWBU8Dv
Meeting w/ Jason Chippeaux at @Hea1thSolutions in Pueblo about treating the whole patient when we address #opioid a… https://t.co/iiyhMJuc28
".@VP Climate change affects everyone regardless of party. Just ask @realdonaldtrump circa 2009, @Secy_State_US, 17… https://t.co/NB1DCPIPHf"
"Spent last 2 days w/ recovery center, law enforcement &amp; health officials learning how communities are working to im… https://t.co/FmjfuzWXT2"
@POTUS @EIAgov Fact: The #ParisAgreement would lead to a $19 trillion increase in the global economy. https://t.co/lIskGaAADS
@POTUS @EIAgov Trump Myth #3: Losses would be $3 trillion GDP &amp; 6.5 million industrial jobs &amp; households would have… https://t.co/75ILQ6XRfb
@POTUS @EIAgov Fact: The United States can use clean coal technology to meet its #ParisAgreement target. https://t.co/A87Gs8tcV5
"@POTUS @EIAgov Trump Myth #2: “The current agreement effectively blocks the development of clean coal in America, which it does.” - @POTUS"
"@POTUS Fact: Low natural gas prices are threatening the coal industry, not the #ParisAgreement. @EIAgov https://t.co/hozOHbrxOe"
"@POTUS Trump Myth #1: #ParisAgreement would effectively decapitate our coal industry, which now supplies about one-… https://t.co/b4c0Kb0g6v"
.@POTUS used many myths today to justify his withdrawal from the #ParisAgreement. Here are 3 we can debunk right off the bat.
.@POTUS made catastrophic mistake by putting a misguided campaign promise before needs of our economy &amp; credibility… https://t.co/mq2URxNmpA
Great showing tonight in Otero County for a La Junta #townhall. https://t.co/9lzZ8j27hA
@SenMarkey @USFWSRefuges .@SecretaryZinke signed order to boost oil development in AK. Our bill would protect the R… https://t.co/i6KzNXyzpL
"Elon Musk knows the #ParisAgreement is good for our economy, and @POTUS should too. https://t.co/gdFGVaynUZ"
"Today's VFW stop in Hugo, CO turned into a great discussion with questions ranging from education to trade to healt… https://t.co/92dWgVumLi"
Withdrawing from #ParisAgreement would represent abdication of American values &amp; another example of Trump's 'Puttin… https://t.co/Q142W3r8nF
Holding a #townhall in La Junta tomorrow at 6pm MT. Look forward to hearing from Coloradans on the Eastern Plains. https://t.co/7TMnms5MDt
Remembering all those who sacrificed for our country. We are forever in their debt &amp; grateful to them &amp; their loved ones. #MemorialDay
Our thoughts are with all those affected by the Anadarko oil tank explosion. https://t.co/XDBwsSWAyB
Important to see some leaders in @POTUS admin recognize what CO knows: clean energy is future of our economy. https://t.co/O1VfZ4bOmN
It's like the Grinch himself wrote this budget. #TrumpBudget https://t.co/99YqWMsNwA
Speaking LIVE NOW on the Senate floor about @POTUS's budget proposal. Watch here: https://t.co/dgkhkNqNbU
"Why won’t Trump Admin state they won’t accept a tax reform bill that violates the ""Mnuchin Rule?"" @stevenmnuchin1 r… https://t.co/o8DEEEWIuW"
Bill would name 2 San Juan Mtn peaks for world-class CO climbers to serve as reminder of their extraordinary lives. https://t.co/UMEr9Z5xqR
"While @stevenmnuchin1 claims ""children will be taken care of,"" @POTUS budget says otherwise. Slashing Medicaid like… https://t.co/eucDz6SM3P"
We must stay in #ParisAgreement for American jobs/innovation &amp; to protect health &amp; security of the next generation. https://t.co/jRb3ZEl5oh
Unfortunate my colleagues don't see leaving #ParisAgreement is wrong move as rest of world grows more competitive i… https://t.co/3aG9hzqrrw
Today’s #CBOSCORE confirms what we knew: The Republican health care bill is yet another broken promise to the Ameri… https://t.co/eBYZcU5M6O
Budgets reflect values &amp; priorities. What message does a $9 billion cut to education send? #Questions4Betsy
"Leaving the #ParisAgreement will harm our kids’ health, national security, &amp; clean energy economy. We cannot let @POTUS walk away."
".@Pontifex knows human-caused climate change is real. Encourage @POTUS to read Pope’s encyclical, stay in… https://t.co/SmuFA1Vgnx"
"Over the past several months, I've not heard a single Coloradan ask for cuts to health care, education, or clean en… https://t.co/mwrQidOKRM"
Statement on the incident in Manchester: https://t.co/NFKLmZVLu9
.@SecretaryZinke: Sustainably manage public lands instead of modifying monuments in CO. @GovOfCO #MonumentalMonday https://t.co/ZRVNx1ByfX
"RT @ConservationCO: Thank you @SenBennetCO @ElephantRevival for your words, music, &amp; work to protect our #publiclands! #resist https://t.co…"
Andrea asked the last Q at Fort Collins #townhall on immigration &amp; discrimination her family has faced. Read more:… https://t.co/GD0vaB6UAE
Arturo has worked in CO for years &amp; should not have been a priority target for deportation. We must fix our broken immigration system.
Met with Arturo Hernandez &amp; family in Fort Collins after he received stay of deportation &amp; was able to attend his d… https://t.co/SfQAcZx5aW
Had a fun time last night with my family at #RedRocksCO. No better place to celebrate our state's public lands &amp; na… https://t.co/i8wC0JqHFD
Backstage with @ElephantRevival &amp; @ConservationCO last night at #RedRocksCO celebrating our iconic public lands. https://t.co/Pm8dnl4ZRa
"Watch interview w/ @CBS4Shaun tonight at 10pm MT to hear about our recent work helping kids with cancer, public lan… https://t.co/6rXt7InHUJ"
On first-ever #copubliclandsday we're celebrating our iconic landscapes &amp; all the Coloradans who built this great t… https://t.co/TH0A1sX15k
Full house in Denver tonight for our #townhall. WATCH LIVE: https://t.co/d7Bma1Y2zc https://t.co/QByNVZURCK
LIVE NOW at our third &amp; final #townhall today in Denver. Watch here: https://t.co/2p6FQxyFdQ https://t.co/DrB7Qy7KQF
WATCH LIVE NOW: Holding a #townhall in Boulder → https://t.co/0hQm3LSKzk https://t.co/ZG0PUyDAhF
Great turn out at Fort Collins #townhall. Watch LIVE NOW: https://t.co/Mf7Bi2U7Eh https://t.co/OrGoqjIxBA
.@BetsyDeVosED: Vouchers are not the answer to a quality education for all kids. We need a serious budget that inve… https://t.co/rep9eymPIU
"Heading out to 1st of 3 town halls. Hope you can join: Fort Collins 11:30am, Boulder 2:30pm, Denver 5:15pm

Details: https://t.co/7w53ugqlHZ"
CHRONIC Care Act unanimously passed in Finance Committee today &amp; includes our bill to expand Independence at Home → https://t.co/2cwP2h37rZ
Intro'd bill to ban members of Congress from becoming lobbyists. It's time we close the revolving door in Washington→https://t.co/rXzgOKEynj
"Robert Mueller's appointment as #SpecialCounsel is critical first step, but independent commission &amp; Congressional… https://t.co/RD11Ta35z7"
ANNOUNCEMENT: Holding Town Hall in Denver on Friday 5/19. Find out more details here → https://t.co/IskVtuuEH7
ANNOUNCEMENT: Holding Town Hall in Boulder on Friday 5/19. Find out more details here → https://t.co/eYsBmwvrcm
ANNOUNCEMENT: Holding Town Hall in Fort Collins on Friday 5/19. Find out more details here → https://t.co/fAudlesEYy
I'm fighting for kids like Evelyn who depend on Medicaid to receive life-saving treatment. #VoteNoAHCA #VoicesOfCO https://t.co/XXHPzlhDnT
"To other congressional leaders, this is what basic oversight looks like. At a minimum, we should have access to “ta… https://t.co/K9Sew9Xbo5"
"Congress needs more information, including access to memos from Comey &amp; any tapes / transcripts from @WhiteHouse. C… https://t.co/oPIx72sNC3"
"Families should never feel like a “pile of pre-existing conditions."" The AHCA is an affront to families like Sarah’… https://t.co/HwyJpf5m0u"
Health care has the power to prolong time people have with their loved ones. Coloradans like Peggy know we can’t ta… https://t.co/yqf7nuGIEN
Being “high-risk” should not determine whether you can obtain health care. Kids like Gracie depend on ACA &amp; Medicai… https://t.co/vH4ztIe6HL
RT @CSUAgSci: .@SenBennetCO &amp; @SenCoryGardner announce $500K @usda grant to @ColoradoStateU to study Farm to School program https://t.co/kb…
Spoke to @USCRossier graduating class about the urgency of transforming how we educate all of America's children:… https://t.co/EQyoGhEcOI
"If the @washingtonpost report is true, the President should explain why he divulged classified information to the P… https://t.co/OViVVwmB4N"
Health care costs shouldn’t prevent people from starting a business. Let’s protect parts of ACA that work &amp; fix par… https://t.co/UmJAEFg25R
Max has overcome many challenges. Being denied health care due to a pre-existing condition should not have to be on… https://t.co/o0fgvcWocU
"Adam shouldn't have to worry that his medical treatment could bankrupt his family. We must fix, not repeal, the ACA… https://t.co/QC5ecmcf30"
Thousands of Coloradans sent us stories after @housegop voted to repeal ACA. Keep sharing your stories #VoicesOfCO… https://t.co/JJ1gbAeXEt
Thanks to these CO moms for standing up for our climate on #MothersDay. I’m standing with you &amp; committing to… https://t.co/Fx2rQSfKsn
Wishing a #HappyMothersDay to my wife Susan—mother of our three wonderful daughters. Grateful you are in my life to… https://t.co/Th5Kj78Cxj
Looking forward to delivering commencement address @USCRossier to our country's future educators. Watch LIVE now: https://t.co/lzxEltpmFC
"RT @USCRossier: Our master's ceremony begins at 3:30, with @SenBennetCO, @allysonfelix and @lenaaloumari. Can't make it? Livestream: https:…"
We must continue fighting to keep families like Jeanette &amp; Arturo's together.
They've lived in Colorado for years &amp; contributed to economy. Their stories are another example of Admin's misguided immigration policies.
"Good news last night, after months of uncertainty. Jeanette &amp; Arturo should not have been targets for deportation i… https://t.co/pU0l21dDj0"
Elections are at heart of our democracy. Administration should focus on supporting &amp; encouraging policies to improv… https://t.co/7ru4dXsViA
"Just wowing climber @tommycaldwell1 w/ stories of my own summer camp climbing glory days...

Thank you for your adv… https://t.co/s8hXkru6Lk"
.@uscensusbureau must have strong leadership &amp; resources to conduct census w/ precision &amp; be inclusive of all. → https://t.co/yEvC2ahUVR
WATCH LIVE NOW Speaking on Senate floor about FBI Director Comey's firing &amp; need for independent special prosecutor: https://t.co/BmfvV2UA6y
Thank you Noyes Elementary &amp; @DCPSChancellor for letting me tag along this morning &amp; learn more about your school. https://t.co/KguyPAJMOr
LIVE NOW: Speaking on the Senate floor about today's victory protecting the BLM #methane rule → https://t.co/oCrg90dGAW
Honored that I could cast the 51st vote instead of the @VP. Next time call ahead...could have saved you the trip.… https://t.co/SmL3BytrvC
Just cast the deciding vote to block BLM methane CRA &amp; continue protecting Colorado communities from harmful methan… https://t.co/xdb7AtPGfw
.@POTUS .@DAGRosenstein must appoint an independent special prosecutor immediately. The integrity of our institutions is at stake.
.@POTUS The Senate must stand firm: We will only confirm an FBI Director who pledges a vigorous investigation of Ru… https://t.co/lx3yBRA6zD
.@POTUS It’s unbelievable that @POTUS woke up one morning &amp; fired Comey for actions from 10 months ago. The America… https://t.co/naj5CgjfRX
It's clear @POTUS cannot withstand the scrutiny. #ComeyFiring is extremely unsettling and the explanation is not believable.
"Amid the #BreakingNews, the Senate is now voting on the important BLM #cutmethane CRA. Here's why I'm voting no: https://t.co/qy0Agr2PQb"
Comey's firing raises many questions. One thing is clear: an independent special prosecutor is necessary to investigate Russian connections.
Thank you to all of the Colorado teachers for working hard each day to provide our children with a better future. #NationalTeachersDay
Kids with cancer—like Evie's sister Sadie—deserve life-saving drugs. That's what the bill we wrote with… https://t.co/9FMP07ICkr
.@SenCoryGardner &amp; I have tried to ignore DC's dysfunction for the good of our state. Coloradans expect no less. https://t.co/mBRzdXrX6T
More evidence for why we must protect our natl monuments: @DinosaurNPS generated $20M+ in economic benefits in 2016 https://t.co/Iwp7uHUyMX
"Dinner at Maria Empanada w/ owner Lorena, Colorado's #SmallBusiness Person of the Year. Celebrating… https://t.co/z0onHzA4Py"
"On #CincodeMayo, we recognize the large &amp; proud Mexican-American community that has played an integral role in Colorado's history."
Supporting innovative strategies to increase college completion for low-income &amp; first gen students w/@senorrinhatch https://t.co/42ZGt257BR
Helping @AmeriCorps public servants afford college w/ tax relief for Segal Education Award. @SenatorIsakson → https://t.co/XRJapKEeO8
"Keep sharing your stories &amp; tell us why we need to fight to fix, not repeal, the Affordable Care Act. #VoicesOfCO https://t.co/h02tQIDlxo"
"Kelley, thank you for sharing your story. We are fighting for Coloradans like you &amp; will do everything to block thi… https://t.co/fwOggisGB8"
My statement on House passage of GOP health care bill. #VoteNoACHA https://t.co/wFo0ldL5t7
It's not clear what we've won since @POTUS's inauguration. But it's clear what we lost. The next #100Days must be b… https://t.co/sWwzs1d3L0
The bill in the House is not a real health care fix. It's a tax cut for the wealthy that would throw 24 million peo… https://t.co/dAAOU2y3Yh
Great meeting Will! You have a bright future ahead. Thanks for visiting us in Washington. https://t.co/0tthHF9or1
The vote is at 5 PM. We can’t let Congress make it harder for Americans to save. Spread the word. #SaveRetirement https://t.co/DHR9kyQfhi
