Today Joe met with the Campbell Family &amp; discussed their efforts to educate consumers about the value of farming. http://t.co/VJk8Lb0miJ
(3/3) We discussed two of the most significant national security threats we face today – ISIS and the North Korean regime. –Joe
"(2/3) This trip provided an important opportunity to meet with key leaders in Iraq, South Korea, and China. –Joe http://t.co/waFRXxkKpA"
"(1/3) Joe recently went on a Senate Armed Services Committee trip to Iraq, Kuwait, South Korea, &amp; China. http://t.co/93AciygE8y"
"Being successful is about your character, persistence, education, and leadership. – Joe speaking to @FWUrbanLeague. http://t.co/CcWuuU1V41"
"The border btwn IN &amp; IL runs through State Line City, which is in the Eastern &amp; Central time zones. http://t.co/AAzvNrDNDf #INtownoftheday"
RT @INCornFarmers: Sen Joe Donnelly seeing impact of rain damaged corn with Miami Co farmer Rusty Merritt this morning. #FarmsMatter http:/…
Joe visited the Merritt farm in Peru where he surveyed rain damage and saw impact on crops and Hoosier farmers. http://t.co/f5nOIHS3O2
http://t.co/klmLdrGFYz
Read Joe's statement on the passing of longtime Hoosier public servant Wayne Townsend here: https://t.co/fuhXnaaToL
"#ICYMI: @DeptVetAffairs Natl Ctr for #PTSD launched 1st ""brain bank"" to support research on #PTSD affecting vets. http://t.co/ood7qdJ5rL"
Dublin was the site of the first Women’s Rights Convention held in Indiana in 1851. http://t.co/lNWnz3ZyMo #INtownoftheday
"(2/2) Watch Joe’s recent speech on the Senate floor, emphasizing the importance of the @EximBankUS for Indiana. http://t.co/oMLse2Qs86"
(1/2) @EximBankUS’ charter is set to expire tonight Joe has continuously advocated for Congress to reauthorize it. http://t.co/8qtgv06RFV
"Borden Valley Days, featuring fun events, vendors and live entertainment, occur annually in Borden http://t.co/j1BBmU47Yd #INtownoftheday"
"(2/2) We are a stronger state in Indiana and a stronger country when we support inclusion, respect, and equality for all Americans. -Joe"
(1/2) I welcome today’s #SCOTUS ruling that all Americans are now free to marry whom they love. – Joe
"Today, Joe enjoyed meeting with 42 student members of @IndianaFFA on the Capitol steps. http://t.co/Q7yl4W8y34"
Correction: Joe co-sponsored a bipartisan Senate resolution to designate June 2015 as Natl #PTSD Awareness Month.
Joe co-sponsored &amp; helped pass a bipartisan Senate resolution to designate June 2015 as Natl #PTSD Awareness Month.http://t.co/uH478VGmMd
This project was too critical...None of us were willing to accept it not occurring. –Joe on @GaryChiAirport expansion http://t.co/7JlT4ZFdN3
(2/2) One of the most valuable ways we can end #veteran #homelessness is through job training and other job placement initiatives. -Joe
(1/2) Joe welcomed @USDOL federal grants for 4 IN orgs to help support programs that provide #vets w/ job training. http://t.co/UtAQIe70OX
Waveland was home to famous American impressionist painter T.C. Steele http://t.co/FXKMq18xKq #INtownoftheday
(2/2) Thank you Rachel for your hard work on the #SextonAct and to help end the scourge of vet/military #suicide. -Joe #AFSPForum15
"(1/2) Congrats Rachel Lipsey, our Military LA ,on receiving the #AlliesInActionAward @ #AFSPForum15 last night.-Joe http://t.co/k5TuMgriir"
"RT @afspnational: Rachel Lipsey, of @SenDonnelly's office, receives the Staff Award for vet/military #suicideprevention. #AFSPForum15 http:…"
Springport is home to White Tail Tree Farm which hosts an annual Pumpkin Fest in September http://t.co/B9s3Z44BEw #INtownoftheday
RT @PanCANIndy: Thanks @SenDonnelly for meeting with us to #WageHope @PanCAN - we appreciate your Hoosier common sense! http://t.co/MYvJqI0…
"Glad staff visited IOM Grain in Portland today, as part of the Annual Purdue Farm Management Tour. –Joe http://t.co/nz0N6OyIzX"
"It doesn’t get more common sense than creating more American jobs in a fiscally responsible way, that’s what @EximBankUS does. –Joe"
It seems like up is down and down is up in this discussion.-Joe on @EximBank debate in Congress
These aren’t in most part not huge corporations—they are small companies that would not find financing elsewhere.-Joe
@EximBankUS costs zero taxpayer dollars. -Joe
"In my home state the Hoosier state, since 2010, @EximBankUS has directly helped &gt; 100 companies export &gt; $3 billion in goods &amp; services.-Joe"
I have heard over and over again from Indiana small business owners and workers about the importance of the @EximBankUS.-Joe
This is not a Democratic or Republican program—this is about American businesses. -Joe
"On 6/30, the charter for @EximBankUS will expire. During its 80-plus yr existence, the Bank has garnered support from every president.-Joe"
Most Americans think Congress can do something to help create jobs and strengthen our economy—even if it’s simply not doing any harm.-Joe
Joe is speaking now on the Senate floor about the importance of @EximBankUS to Indiana and U.S. economy. Watch live:http://t.co/r90S5TOORH
"Joe’s headed to the Senate flr to speak about the importance of the @EximBankUS, set to expire on 6/30. Watch here: http://t.co/r90S5TOORH"
RT @FarmerCoop: Happy to have @SenDonnelly open up our general session this morning! Discussing #WOTUS &amp; #GMO labeling #ncfcmtg http://t.co…
"For summer outdoor family fun, check out Roanoke’s Friday Night Street Fair on 1st Friday each month http://t.co/UsafCjREGO #INtownoftheday"
RT @afspnational: From #Indiana? Help us #EndSuicide in IN by RTing. Education is key to #SuicidePrevention. #AFSPAdvocacy15 http://t.co/6i…
Congratulations to the @INGuardsman for being awarded second place for the 2015 Army Communities of Excellence Award.-Joe
RT @afspnational: A video message from @SenDonnelly. A powerful advocate for military #SuicidePrevention! #AFSPForum15 http://t.co/zw7txO04…
"Today, Joe received the Legislator of the Year award at the Disabled American Veterans State Convention in Indy. http://t.co/LV8bUGuIa4"
"Earlier today, Joe spoke to 500 high school junior boys participating in @HBSorg at @TrineUniversity. http://t.co/k9ErHp2REH"
"Joe’s office will host its next Veterans History Project event on Thursday, June 25 in Corydon. Learn more here: http://t.co/LruxZth7ot."
Whitewater State Park in Whitewater was originally purchased to honor WWII veterans http://t.co/eFUnG6RElR #INtownoftheday
Danielle is a worthy recipient of this award given her excellence in service to vets &amp; her standout basketball career. – Joe
"Congrats to @ndwbb alum, veteran &amp; Purple Heart recipient, Danielle Green receiving the Pat Tillman Award for Service at the 2015 @ESPYS."
RT @FarmPodcaster: #ASTAAnnual meeting with @SenDonnelly talking #seed http://t.co/C2PyLWe7NG
Springport is home to White Tail Tree Farm which hosts an annual Pumpkin Fest in September http://t.co/B9s3Z44BEw #INtownoftheday
"W/ the Senate passing #NDAA, military provisions of the #CarePackage  have a good chance of becoming law this year. –Joe"
Today the Senate passed the military mental health provisions from Joe’s #CarePackage as part of #NDAA.http://t.co/1CUbjQLWaC
"For summer outdoor family fun, check out Roanoke’s Friday Night Street Fair on 1st Friday each month http://t.co/UsafCjREGO #INtownoftheday"
RT @NHDIndiana: Fun meeting with former @NationalHistory parent @SenDonnelly this morning! #nhd2015 @IndianaHistory http://t.co/uTDRCjFtA3
"RT @NEHgov: Last Lesson of the year: The #Capitol, teacher: @SenDonnelly, class: #Indiana @NationalHistory students  @NEHgov http://t.co/Ek…"
(2/2) Our coffee was served courtesy of @mscoffeeroaster &amp; our creamer was served courtesy of Schwoeppe Family Farm. http://t.co/fgfSqqFRJK
"(1/2) This morning, Joe hosted a constituent coffee for Hoosiers visiting D.C. http://t.co/eYIwrP1s5d"
Williamsport is home to one of the tallest waterfall in Indiana. #INtownoftheday http://t.co/ezSAwYT4KO
Ferdinand was named after Emperor Ferdinand I of Austria &amp; the town will soon mark its 175th anniv. http://t.co/pdfHL3GwlW #Intownoftheday
RT @WHAS11Joe: Lugar Center &amp; McCourt School of Public Policy rate @SenDonnelly      3rd-most bipartisan U.S. Senator. @Whas11 5:30 http://…
ICYMI: @WTHRcom coverage of Joe questioning panel at Senate hearing about harassing calls targeting seniors. http://t.co/LWnsVOIktH
"Earlier today, Joe met with Korean War veterans in Carroll County http://t.co/8ytNISUuvs"
"The Apple Works in Trafalgar, IN boasts over 55 varieties of apples for customers to pick. http://t.co/GrzOz4luem #INtownoftheday"
@bpolitics highlights Joe's great play at first base last night during #cbg2015. http://t.co/KbbVlMwot0 http://t.co/gFNXUI0QJN
Glad staff attended the ribbon cutting ceremony yesterday for the new @EntegraCoach facility in Elkhart Co. –Joe http://t.co/ikksCAsiAS
Joe is at bat at the #CBG2015 wearing his @JasperBaseball jersey. http://t.co/pXEajSlZwp
"In tonight's Congressional Baseball Game, Joe will be wearing jerseys from @JasperBaseball &amp; @IUSoutheast."
(2/2) The game will be played tonight at Nats Park. http://t.co/cGS5aWSvd5
(1/2) This morning Joe had practice for The Congressional Baseball Game at Washington Nationals Ballpark. http://t.co/dBlwLoPsai
"We thank our servicemembers, vets, &amp; their families for keeping us #ArmyStrong for 240 years. -Joe http://t.co/6iwjOrYwSz"
This week kicks off the celebration of the 240th Birthday of the @USArmy.
The town of Ulen was named after industrialist Henry Ulen. http://t.co/bjzoMPpcHZ #INtownoftheday
RT @AngRSchafer: Fantastic talk with Lauren Varga in @SenDonnelly office on Summer Meals &amp; Global Food Security Acts. #BreadActs http://t.c…
"#GoodNews:14 yr old Hoosier Surf Sadowey of Elkhart won the @MLB Pitch, Hit &amp; Run sectional for 2nd yr in a row. http://t.co/7JNPcvH0fn"
Wakarusa is home to Wakarusa Dime Store &amp; its “famous jumbo jelly beans.” About 75 tons of the beans are sold a year. #INtownoftheday
Good Luck to IN native @laurenholiday12 &amp; @NotreDame alumni @ShannonBoxx7 &amp; all @ussoccer_wnt in their 1st game of the #FIFAWWC tonight.–Joe
(3/3) I am grateful for all Secretary McHugh has done for our Hoosier soldiers and our country in these challenging times. –Joe
(2/3) Secretary McHugh has done our nation a great service leading the @USArmy for the past 6yrs. –Joe
"(1/3) Today, Joe released a statement regarding the news that Army Secretary John McHugh will retire. http://t.co/Hl4CuD1Yz9"
RT @IndyChamber: Thank you @SenDonnelly for your message to #indycivichack participants in the final hour of coding. It's crunch time! #hac…
The movie “Hoosiers” is based on the 1954 state championship basketball team from Milan http://t.co/z0wX1AkpLB #INtownoftheday
"Earlier today in Lakeville, Joe delivered a Commencement address at Laville High School's graduation ceremony. http://t.co/hk06OCAbWL"
RT @kristinbevil: Thank you @SenDonnelly for meeting with Indiana railroads on #railday2015 #freightrail @IndianaRailRoad @ASLRRA http://t.…
"RT @IndyThisWeek: NEW: @sendonnelly announces he will ""fight non-stop"" to save Ex-Im Bank http://t.co/zRmQ3ZLmq8"
"As Ranking Member on Strategic Forces Subcommittee #SASC, Joe is continuing former Sen. Lugar’s mission towards nuclear non-proliferation."
#ICYMI: Joe gave remarks abt the @DeptofDefense #CRTprogram yesterday. http://t.co/PqQ4DqwZn0
LaFontaine is the hometown of legendary sportscaster and U.S. hockey hall of famer Mike “Doc” Emrick http://t.co/8kYwC2rcAO #INtownoftheday
"Yesterday, Joe met with members of the RV Association &amp; gave remarks at the 2015 Senate RV Caucus Kickoff Reception. http://t.co/YtjGtEr8nO"
RT @PikeSchools: Thank you to @SenDonnelly for visiting Fishback Creek to enjoy lunch with us last week! http://t.co/ucKDTargTG
"Yesterday, Joe thanked northern IN vets for their service at the WWII Memorial in D.C. http://t.co/TfJpEKaiih http://t.co/l3M4CDP6Uu"
"The Goethe Link Observatory, in the town of Brooklyn, is the site of many asteroid discoveries. http://t.co/6RPpvAE0t6 #INtownoftheday"
"Today Joe said hello to the Recreation Vehicle Industry Association in D.C. on a 2016 Newmar Canyon Star, 3922. http://t.co/5146Zj11t3"
Joe hosted a constituent coffee this morning with Hoosiers from across our state. http://t.co/8oaLxOWXK1
"Home to Indiana’s largest natural lake, Lake Wawasee in Syracuse is a popular vacation spot. http://t.co/6aBGil7dDV #INtownoftheday"
"#GoodNews:@IUBloomington,@BallState,@PurdueUnivNews were nationally ranked for online grad programs for #vets.@usnews http://t.co/ydpHIx7ri0"
"Chesterton boasts not only sand dunes, but also the top-ranked men’s volleyball team in the state. http://t.co/jAEzc7Fy7c #INtownoftheday"
"We welcome new adjutant gen., BG Carr &amp; thank MG Umbarger for his service &amp; dedication to protecting Hoosiers &amp; our nation.–Joe #HoosierTAG"
"Saturday, Joe’s staff attended @INGuardsman Change of Command Ceremony &amp; welcomed new adjutant general, BG Carr. http://t.co/1PLjEtaP2j"
"RT @Amoswtlcindy: ICYMI: In Interview @SenDonnelly talks Wages, Trade Hurting Indiana Jobs, Renewing Patriot Act http://t.co/6JQj2mAELk htt…"
RT @GoshenMiddleSch: With @sendonnelly #8thgradeDC http://t.co/hOY4Sw7asU
Glad staff greeted our 68 Hoosier veterans who visited D.C. as part of the southern IN #HonorFlight on Saturday.–Joe http://t.co/qqEpWvgzON
"The Exotic Feline Rescue Center, a safe haven to exotic felines, is located in Center Point. http://t.co/FNwRcKqTaw #INtownoftheday"
Joe sat down yesterday with @GerryDick at #IIBTV to discuss key economic issues across Indiana. http://t.co/XTMxGe0Reg
The longest spanning historic covered bridge in the nation can be found in Medora. http://t.co/FMfcK318WK #INtownoftheday
Plymouth native &amp; Navy Lt. Tom Flynn piloted a FA-18 Super Hornet during @NASCAR #CocaCola600 natl anthem flyover. http://t.co/37Wezd6U7P
"Read @IndyStar on Joe’s #CarePackage, his latest effort to improve mental health care options for troops &amp; veterans. http://t.co/MVURqxNvbK"
"Orleans, Dogwood Capital of IN, was founded 2 mo. after Andrew Jackson’s NOLA victory over British. http://t.co/sOr0hVKB6v #INtownoftheday"
Glad staff attended the #MilitaryAppreciationNight with the Fort Wayne @TinCaps at Parkview Field last night. -Joe http://t.co/JyONFIcNob
"Mitchell is home to a memorial honoring astronaut Gus Grissom, the second American to fly in space. http://t.co/2OG3Iep6lt #INtownoftheday"
"Joe is hosting a round table discussion with vets, mental health providers, &amp; families to discuss his Care Package. http://t.co/3U5rZ9AuLq"
#GoodNews: @GM announced $1.2B investment at Fort Wayne’s truck plant. Joe’s staff was on hand for the announcement. http://t.co/SEO08Cljue
Glad staff attended #MemorialDay service at Hoosier Patriot Memorial in Washington Park East Cemetery yesterday. -Joe http://t.co/11JvPtEpwB
"Joe presented the Bronze Star &amp; other medals to Linda Wingard, daughter of late WWII vet Frank Fries in South Bend. http://t.co/yQUOIAq1VB"
"This #MemorialDay, we recognize those who served in our military &amp; pay tribute to those who lost their life in defense of our country. -Joe"
Congrats to #Indy500 winner @jpmontoya. -Joe
The @CityofSouthBend reflects our Hoosier values &amp; its citizens are an example of how hard work and dedication leads to success.–Joe #SB150
Glad staff could attend #SB150 &amp; present a congressional record statement recognizing South Bend.– Joe
"Unfortunately due to Senate votes in DC, Joe could not attend the #SB150 celebration."
Glad staff could attend the #500MemService at the IN War Memorial today in Indy. – Joe http://t.co/WWvV51V6di
"Dr. Adams said,” “@SenDonnelly &amp; Sen. @KellyAyotte have a bipartisan bill that has a lot of good ideas in it.” http://t.co/LKsG0JqBlX"
#ICYMI: Joe’s #bipartisan bill to combat heroin use and prescription drug abuse epidemics was praised by IN State Health Commissioner.
#Happy to hear the Royerton Elementary Choir from Muncie sing @Pharrell Williams' #Happy outside the Capitol. -Joe http://t.co/5Q6mJx3Gbu
#GoodNews: @USDA recently announced $14 mil. loan for Johnson Co. Rural Electric Membership Corp. to build/improve 345 miles of line.
Reminder: Joe’s staff will host Veterans History Project in Greenfield Tuesday 5/26 from 11AM-1PM. For more details: http://t.co/7CtpLbeq36
"IN grieves the loss of 2 extraordinary Hoosiers, &amp; our country aches at the loss of many more spouses, dads, moms, sons, and daughters.–Joe"
Army Staff Sergeant Matthew Ryan Ammerman &amp; Marine Corporal Jordan Spears chose service to their country &amp; gave the ultimate sacrifice. –Joe
"In advance of #MemorialDay, Joe spoke on the Senate floor in honor of 2 Hoosier servicemen we’ve lost this past year. http://t.co/9J7EIhYgeA"
Joe hosted a constituent coffee in DC today and featured Indy’s @mscoffeeroaster Hammer and Anvil Coffee Blend. http://t.co/nNSpV0GYAG
RT @moledwh79: @NUCA_National @MidwestMole #NUCASummit #NUCA-Indiana with Senator Joe Donnelly. http://t.co/qKTVBEzy7b
It was an honor to meet Hoosier vet Mary “Polly” Lipscomb who is 101. She was an Army nurse during WWII. – Joe http://t.co/N0OKmbJZk8
Great to meet our Fort Wayne IN WWII &amp; Korean War #vets w/ the N.E. IN #HonorFlight. Thank you for your service. –Joe http://t.co/z4F1OOU6XF
"Today, Joe greeted and thanked Northeast Indiana #veterans for their service at the World War II Memorial in D.C. http://t.co/mbf8tx5M8H"
"From one Hoosier to another, congratulations on a great career, David @Letterman. – Joe #ThanksDave"
I am willing to work with anyone of any party who has  common sense ideas that would improve lives of Hoosiers – Joe http://t.co/xSEJFytQoq
"Joe was rated the 3rd-most #bipartisan U.S. Senator for the 113th Congress, according to @TheLugarCenter &amp; @GUPublicPolicy #BipartisanIndex"
Joe will speak soon on Senate floor to honor fallen Hoosier servicemembers ahead of #MemorialDay. Watch it live: http://t.co/mUBmQsBQct
On @HeadStartgov's 50th anniversary we recognize the opportunity the program provides for Hoosiers.-Joe #HeadStart50 http://t.co/htgYe9EtD6
"Indiana groups announced support for Joe’s bipartisan bill to combat heroin use &amp; prescription drug abuse epidemics.
http://t.co/hi9JUWfWze"
"Joe participated in the #Indy500 swearing-in ceremony @IMS, joining @INGuardsman Adjutant Gen. Umbarger. http://t.co/uVx8KlEk3M"
"Joe visited USS Silversides veterans in North Webster yesterday, and met WWII veteran Ed Biesemeyer among others. http://t.co/NIicN9R5Pe"
"Joe spoke at the #IndyWalktoCureArthritis this morning and met Carson, who is three and diagnosed with arthritis. http://t.co/2UXqpj2IPo"
Learn more about the bipartisan Children of Fallen Heroes Scholarship Act that Joe helped introduce this week. http://t.co/BpeXoQl2PG
We must do all we can to help the families of fallen 1st responders &amp; this should include ensuring their kids can get a good education. -Joe
.@JGfortwayne coverage of Joe's #CarePackage #NDAA: “Donnelly mental health legislation part of defense bill” http://t.co/J1nvBDLVRy
The national defense bill passed by #SASC with bipartisan support will advance key Indiana priorities.-Joe #NDAA http://t.co/SEuM6mOO2c
"Via @WBIW, Joe’s #CarePackage that would improve servicemember mental health care is in Senate national defense bill. http://t.co/rQJJl2EDIR"
#GoodNews: @BaseballAmerica named the @TinCaps Parkview Field in #FortWayne as one of the top 5 ballparks in @MiLB http://t.co/okeOnwdMdv
RT @kmo50Moyer: 🇺🇸HUGE GOOD NEWS for military kids we help thru our camps @moyerfoundation #blessing 💜 @SenDonnelly @KellyAyotte  https://t…
RT @military_family: Thank you @SenDonnelly! We are thrilled to see the “Care Package” included in the #SASC defense bill. http://t.co/MPbK…
"RT @AARPIndiana: ""Just ask Joe,"" says Sheral w/ @SenDonnelly's office if you need help."
"I will continue to work to ensure we are improving access to quality mental health care not only for servicemembers, but also for vets. -Joe"
"Building on the success of the #SextonAct last year, this is another critical step forward to combat military suicide. –Joe on #CarePackage"
This legislation will improve mental health care for servicemembers in Indiana &amp; across the country. - Joe on #CarePackage #SASC #NDAA
Joe's #CarePackage was approved by #SASC as part of #NDAA and would strengthen mental health care for servicemembers. http://t.co/GRCk0yKevQ
It is only fitting we passed this resolution shortly after the 80th anniversary of the Soil Conservation Act being signed into law.-Joe
Their work is important to both the ag industry and our environment as a whole.-Joe
Local conservation leaders in communities across Indiana and around the country are working hard to keep our soils and waters clean.-Joe
"Joe &amp; @JohnBoozman’s  ""International Year of Soils"" &amp; locally-led soil &amp; water conservation efforts resolution passed.http://t.co/KEhXk2gZLr"
"Join Joe’s office, @AARPIndiana, @MCProsecutors &amp; @INATTYGENERAL for “Outsmart the Scam Artist” event tmmrw @butleru http://t.co/xQKZuIR7UK"
RT @IMPD_News: Getting ready to honor Off. Milburn as one of the nations Top Cops @IMPD_Chief @RickFOP86 @SenDonnelly http://t.co/YeTzRJNZYY
RT @RickFOP86: MANY THANKS to @SenDonnelly for his unwavering support of Indiana Law Enforcement #CopsRemember #PoliceWeek http://t.co/X8y2…
"Congrats to Officer Milburn for his service &amp; sacrifice, going above &amp; beyond the call of duty.-Joe #TOPCOPs http://t.co/Pl7uaKYlSq"
Joe had the opportunity last night to recognize TOP COPS Award winner @IMPD_News Officer Greg Milburn. http://t.co/lXZD19UxtC
Joe delivered the commencement address to @IvyTechCC graduating class in Fort Wayne recently. #Ivytechgrad http://t.co/7nrjSbcGEZ
We thank all Hoosier police officers for their service and honor fallen Hoosier officers who have made the ultimate sacrifice. –Joe
"Joe helped the Senate pass a resolution that designates, this week as #NationalPoliceWeek."
"Joe’s staff will host a Veterans History Project in Greenfield on Tuesday May 26th, 11AM–1PM. For more details: http://t.co/7CtpLbeq36"
Congrats to @SBAgov Indiana Small Business Person of the Year Shane Conner of ATEC #DreamSmallBiz
Today Joe honored fallen Hoosier police officers at the La Porte Peace Officers Memorial. #peaceofficers http://t.co/x28zlNlsFD
Today Joe questioned Senate Ag Committee panel on best practices to improve child nutrition. http://t.co/5OPhqz5hSI
Glad staff attended #EA6B Prowler Retirement Ceremony at Monroe County Airport earlier this week.-Joe @NAVSEACrane http://t.co/eYBvCc7Tp4
Joe helped pass legislation that would require congressional review of any comprehensive nuclear agreement with Iran. http://t.co/i4n1YV7WxJ
RT @GrowthEnergy: Thank you @SenDonnelly @ChuckGrassley &amp; @SenatorFischer for introducing legislation to extend the RVP waiver to #E15. htt…
We should be pursuing an all-in approach toward American energy production that includes ethanol &amp; other biofuels. -Joe
"Biofuels like ethanol are renewable domestic energy sources,create more economic opportunities &amp; give consumers more options @ gas pump.-Joe"
"Joe, Sen. @ChuckGrassley &amp; @SenatorFischer introduced a bipartisan bill that would expand market for biofuels. http://t.co/JtNr5eInHs"
"Hoosier workers are among the best in the world, &amp; IN has a long tradition of small business &amp; manufacturing success. – Joe #DreamSmallBiz"
Happy National Small Business Week! #DreamSmallBiz http://t.co/fVjOe1Vmxx
Great to meet yesterday with 8th graders from the Holy Cross Central School in Indy. – Joe http://t.co/Mt4Uo1hiUo
Students/recent grads:interested in gaining experience in public service beyond a traditional internship? Learn more: http://t.co/AGik1PXfDH
"Given a level field, Hoosier workers and companies can compete with anyone in the world.-Joe"
Good trade policies help create jobs and fuel economic growth. – Joe
It is important that we keep Hoosiers—and all American—businesses and industries competitive through the promotion of exports.-Joe
Joe announced his support for the bipartisan Leveling the Playing Field Act. http://t.co/ovZ0LTFzU2
Great to meet our northern IN WWII #vets w/ the Chicago Honor Flight in D.C. today. Thank you for your service. – Joe http://t.co/JpzZQ8zaIA
Investing in our energy economy is an essential part of our country’s economic successes &amp; is critical to our national security. -Joe
Joe &amp; @SenJohnHoeven re-introduced bipartisan bill to help prevent long delays to energy infrastructure projects.http://t.co/MBh8wMR3oz
Thank you #Indiana teachers for empowering our students to learn &amp; succeed.-Joe #ThankATeacher #NationalTeacherDay http://t.co/nakQc1Hrcy
"Joe's office is participating in ""Outsmart the Scam Artist!"" event w/ @AARPIndiana, @MCProsecutors &amp; @INATTYGENERAL. http://t.co/gnNnnAMqw8"
"(4/4) Thanks @NGAUS1878, @MilitaryOfficer, @ReserveOfficer, @afspnational &amp; @military_family for a great meeting on the #CarePackage. -Joe"
(3/4) Grateful for strong support from organizations on the front lines advocating for improved mental health care for our troops &amp;vets.-Joe
"(2/4) In the coming weeks, I am hopeful we can advance critical elements of the #CarePackage in the Senate. -Joe http://t.co/dFQ3z3PQJ4"
"(1/4) Joe met with organizations supporting his ""Servicemember and Veteran Mental Health Care Package"". #CarePackage http://t.co/tfeQV5Neqf"
"Tonight: Join Joe’s office, @AARPIndiana, @MCProsecutors &amp; @INATTYGENERAL @uindy “Outsmart the Scam Artist!” event. https://t.co/JYtHb7MdP3"
(2/2) This event let leaders in Congress &amp; the Pentagon know what a valuable asset our nation has in NSA Crane.-Joe http://t.co/CfvRQNQdJk
