"Unused prescription medicines must be disposed of in a safe, responsible way to prevent them from falling into the wrong hands. -SB"
Joined law enforcement in Youngstown today to highlight the upcoming National Prescription Drug Take Back Day on Oc… https://t.co/BHheCiqlMe
Congrats to my friend @senjohnmccain for being awarded the @ConstitutionCtr's #LibertyMedal - a well-deserved honor for a true patriot. -SB
"@SenatorHeitkamp And don't forget to listen to the first episode of my podcast, ""Nobody's Rust Belt,"" here on iTune… https://t.co/uwHMvi5pbD"
"Full-time senators, part-time podcast hosts. Learn about my show ""Canarycast"" and @SenatorHeitkamp's ""The Hotdish"":… https://t.co/zc8PhFQsGn"
"@CFPB The @CFPB payday lending rule is good for our country, and good for Ohio. Learn more here: https://t.co/yBYrStFcQB"
@CFPB Payday lenders have exploited loophole after loophole to trap working people in debt. This will help put an e… https://t.co/Od2yK8z89E
@CFPB The @CFPB rule prevents shady lenders from taking control of your checking account &amp; offers Ohioans a path to… https://t.co/4aQ6lLCFxY
"Recently, @CFPB finalized payday lending rule, to rein in predatory payday loans that often keep working people trapped in a cycle of debt."
These payday lenders saddle borrowers with triple-digit interest rates &amp; cost Ohioans over $500 million/year in fees alone.
Why did Ohio try to cap these rates? Shady payday lenders have only their own interests at heart.
Ohio has the highest payday loan prices in the US - despite the fact that almost 2/3 of Ohioans voted to cap payday loan rates.
"Now more than ever, Congress should come together and prevent prices from spiking for Ohio families. -SB"
President Trump’s actions threaten to raise healthcare costs and jeopardize insurance coverage for Ohioans.
Pulling the rug out from under efforts to make Ohioans’ health insurance more affordable is not the way to make healthcare work better.
"RT @USNavy: Happy #242NavyBday! 🎂🎈

RT to celebrate America's seapower to protect and promote! 🇺🇸⚓ https://t.co/VtiscDgDj3"
Thank you to police and first responders. Thinking of all involved. https://t.co/BCaobLIi4M
My statement on @POTUS decertifying the Iran Nuclear Agreement → https://t.co/y0j6YM9qn2
@Equifax Called on @USTreasury earlier this week to bar @Equifax from eligibility for contracts with the government: https://t.co/7lAXTuawXF
Suspending IRS contract is only the first step. We cannot know taxpayers are protected until @Equifax is banned fro… https://t.co/wq22FLcnRx
"This #NationalFarmersDay, I’m focused on how we can help connect farmers to their communities. My Local FARMS Act: https://t.co/dCSmo909Pj"
Why should we buy apples from Washington when we could get them from the Hirsch Fruit Farm in Chillicothe?
It’s been 8 wks since POTUS promised an emergency declaration for opioids &amp; still nothing. OH can’t afford to wait. https://t.co/BsjV6S0nRY
Puerto Ricans are American citizens and deserve the same compassion and support as other Americans after a natural… https://t.co/kDeCdKTv4T
@Equifax Called on @USTreasury earlier this week to bar @Equifax from eligibility for government contracts: https://t.co/7lAXTuawXF
More proof of what we already knew: @Equifax is not worthy of taxpayer dollars. https://t.co/pg9Hj3TQ8u
In CLE we work for every victory &amp; take nothing for granted - #ALDS is no exception. @Indians are ready to bring Game 5 home. #RallyTogether
The First Amendment protects freedom of the press - which means news networks should be able to report freely w/o f… https://t.co/rMUk0HwQIh
"Kaitlyn, we Clevelanders all feel your pain. But Rule 1 of Cleveland sports fandom: we never give up hope! -SB https://t.co/LojBFdfad3"
@Equifax Called on @USTreasury today to bar @Equifax from eligibility for new or renewed government contracts. https://t.co/6V4Ajqfqn5
.@Equifax is simply is not a company that deserves to be trusted with Americans’ personal data or taxpayer dollars.
"As we start work on the next Farm Bill, I want to hear directly from Ohio farmers. Great to hear ideas from farmers… https://t.co/G7l1BXRB5p"
Don't worry. Made it home to watch by the 5th. https://t.co/s1WT9DMUvk
"When the crowd demands Pulitzer Prize winning @ConnieSchultz, you give them @ConnieSchultz. https://t.co/XerccwbJPu"
Taking in the scene from backstage with @ConnieSchultz before going on with the @PodSaveAmerica crew. https://t.co/eEEiqJyVoq
"Before going on @PodSaveAmerica, it’s important to know what you’re getting into. Asking everyone here what basebal… https://t.co/fMp5TuSxr7"
"Welcome to the Buckeye State. Here we say OH-IO. Hope you left those shirts in ❌ichigan where they belong. 
cc:… https://t.co/GpoU8uyG7P"
Couldn't agree more. Proud to work with @senrobportman to get this done for Ohio kids. #CHIP https://t.co/aaWPNuzl2n
"Our celebration of manufacturing doesn't have to end after #MFGDay17. Check out Canarycast Ep1, ""Nobody's Rust Belt"" https://t.co/c52hEMzh4m"
Stop #3 on #MFGDay17: a great roundtable in Muskingum County. Muskingum's also home to one of our Summer Mfg Camps:… https://t.co/uCdhTUNrU1
It’s about time @USTradeRep took the pen away from corporate lobbyists &amp; started writing trade policy that puts Ame… https://t.co/EUVHv7dsPH
"Instead of turning industry wish lists into reports, Treasury shd focus on protecting ppl from banks like Wells Far… https://t.co/Hi5FZPAmDW"
When 1 man can slaughter 50+ in mins it’s clear something has to be done to protect Americans from gun violence. -SB https://t.co/sqDD4tLeZ2
"Healthcare decisions should be between you and your doctor, not the government and your boss. https://t.co/bWX5S2wKI0"
"Stop #2 on #MFGDay17: Cambridge, for a roundtable discussion with manufacturers and community leaders. https://t.co/qNxfJCoItc"
"Stop 1 on #MFGDay17: Canfield, for a manufacturing roundtable and a chance to meet students learning about manufact… https://t.co/Dg0acP5H5W"
"Manufacturing has the strongest multiplier effect of any industry–for every $1 we invest in mfg, we add an additional $1.48 to our economy."
No better way to spend #MFGDay17 than traveling around our state to talk to Ohioans about the importance of manufacturing.
@Indians @Yankees Watching on TV tonight from our Cleveland home shouldn’t break Dad’s rule. Let’s show ‘em how we… https://t.co/iyVagjliKJ
Dad &amp; I went to many @Indians games. But never against @Yankees. Dad didn't want Mickey Mantle &amp; Moose Skowron to get 15¢ of his tix price.
@WhirlpoolCorp Spoke to Paula and two other workers from Clyde @WhirlpoolCorp plant about exactly this on my podcas… https://t.co/lxoX0pxhhf
Paula is right: a level playing field is necessary for @WhirlpoolCorp workers to continue their world-class work. https://t.co/5lk8nxECHm
My statement on @CFPB's predatory payday lending rule → https://t.co/LtpCT3yJ8U
"Why should Ohioans buy raspberries from CA, when they could buy them from a farm in Knox County? My Local FARMS Act: https://t.co/dCSmo909Pj"
Learn more about our 3rd annual Propel Ohio Collegiate Leadership Summit for Ohio college students at @uakron:… https://t.co/ZQ8O8vUyZJ
.@Equifax doesn't think people shd control their own financial data—so why shd a company that's had so many securit… https://t.co/B4ljDtxKbd
.@Equifax makes $ off ppl's data THEN charges fees for credit monitoring products after they’ve become identity the… https://t.co/DEflPx5uXt
"What should have been @Equifax's bigger spending priority: compensation for executives, or protection for people's… https://t.co/RSgVMpXhCP"
The 145 million Americans exposed in the @Equifax data breach - including 5.2 million Ohioans - deserve answers.
"@Equifax If @Equifax doesn’t think consumers should control their own data, why should a company with so many secur… https://t.co/AfU1Ykv9qa"
Corps can’t traffic in private medical records. Asked @Equifax why Americans shouldn’t have same ownership over their financial records.
"@Equifax In hindsight, I asked Mr. Smith if he thinks @Equifax should have spent more $$$ protecting peoples’ data… https://t.co/dOq4NNI39E"
"@Equifax And since 2016, Mr. Smith has also made about $69 million dollars."
"According to Mr. Smith's testimony yesterday, over the last three years, @equifax spent $250M on cybersecurity – that’s about $85M a year."
@Equifax So please do not make the same mistake @WellsFargo did – now is the time to give this committee the whole story. -SB
@Equifax Your actions have exposed over half the country’s adults to financial harm. @Equifax has forfeited its right to corporate secrets.
@Equifax All of @Equifax’s actions up to this point demonstrate that this is not a company that deserves to be trus… https://t.co/5O0C7lplKr
@Equifax A big financial institution screws up. Executives walk away with millions of dollars. Tens of millions of… https://t.co/8JvMCVfxCu
The story of the @Equifax data breach is a familiar one.
LIVE: @SenateBanking &amp; @BankingGOP demand answers from fmr @Equifax CEO on data breach that exposed 145M Americans https://t.co/G9vpwoMnYF
@Manyakitty307 @WhirlpoolCorp Hi Julie! Soundcloud has an app for Androids - you can download it here: https://t.co/dBpf9JroT8
Is this from @TheOnion? Equifax should not be trusted with taxpayer dollars. https://t.co/PT3llquEdO
.@WellsFargo CEO refuses to commit to ending use of forced arbitration clauses. The bank will continue to deny cust… https://t.co/gWuAOq8Mhf
In Ep1 - Nobody's Rust Belt - I talk to OH workers from Clyde @WhirlpoolCorp plant about modern manufacturing jobs.… https://t.co/9BU3a0UwsD
"On my new podcast Canarycast, we're going to talk about what we can do to make hard work pay off again.… https://t.co/1WBFFAZw0m"
These brave servicemembers represent the best of Ohio. Grateful to have them helping on the ground in Puerto Rico. https://t.co/cUGKKX1sAg
@WellsFargo We should be supporting @CFPB &amp; other financial watchdogs that stand up for hardworking Americans when… https://t.co/EvAqgypNrY
"@WellsFargo We need rules to guard against abuses in forced arbitration, payday lending, debt collection, mortgage… https://t.co/cB5GZtCQWd"
@WellsFargo And yet @WellsFargo told this committee that fraudulent sales practices were limited to the Community Bank.
@WellsFargo The bank was aware of the problems in its auto loan division in July 2016.
@WellsFargo It also revealed it had stuck 800k customers w/ auto insurance policies – w/o telling them or checking… https://t.co/PnbcPqqIjw
"@WellsFargo In August, @WellsFargo finally disclosed that the number of fraudulent accounts was at least 3.5M -- 70… https://t.co/DPQAKp2JfI"
"@WellsFargo It subjected customers to forced arbitration, preventing them from their day in court, further concealing the fraud."
"@WellsFargo Before being forced to come clean by a multi-agency investigation, @WellsFargo went to great lengths to bury this scandal."
@WellsFargo We have learned over the past year that the problems at @WellsFargo are much larger and more systemic t… https://t.co/w6oLmpAaEX
@WellsFargo The bank’s punitive sales goals had pressured its employees into opening over 2 million fraudulent chec… https://t.co/9CAI4MCz3h
"A year ago, then-@WellsFargo CEO John Stumpf sat in this hearing room attempting to explain the inexplicable."
LIVE NOW: Sherrod &amp; @SenateBanking press @WellsFargo CEO Timothy Sloan for answers for millions of cheated consumers https://t.co/y1SpYur6ID
"@AjitPaiFCC @FCC Without #NetNeutrality, the internet would fall under control of a few companies to tell you what… https://t.co/f2ZmEzNxrP"
.@AjitPaiFCC has been intent on destroying #netneutrality as head of @FCC - he is a danger to free &amp; open internet. https://t.co/Col7xwYz6i
RT @FAFSA: 🚨BREAKING NEWS🚨 The 2018–19 FAFSA is now available! Fill it out ASAP to get as much financial aid as possible: https://t.co/wdDm…
"Thank you to all law enforcement, first responders &amp; medical personnel responding to this horrific tragedy."
We stand with Las Vegas &amp; everyone affected by this senseless violence. https://t.co/PVyUiRLBqF
".@HHSGov's taxpayer dollars should go toward healthcare, not private jets. My full statement: https://t.co/4nI71jFRy1"
Wishing an easy fast to all Ohioans observing #YomKippur. G'mar chatimah tovah.
RT @GlobalCleveland: Thank you for the open conversation and honest dialogue with @sensherrodbrown ! #GlobalCLE https://t.co/xAUWhyPKJw
Partnering with @SenMarkey to ensure accountability in prescription painkiller production - learn more: https://t.co/KAsfVehhC0
Drug companies &amp; DEA have a responsibility to make sure they aren’t over-producing opioids that end up on Ohio streets.
".@DwyaneWade - on behalf of all Clevelanders, welcome to our city. 

A helpful place to start, from the experts: https://t.co/96tIWP8kgJ"
"RT @wosunews: A day after @ColsCitySchools had to end early due to heat, @SenSherrodBrown announced plans to fix school buildings. https://…"
Hoping for speedy recovery for all involved. Thank you to officers who put themselves in harm’s way to keep us safe. https://t.co/tof69K7fLC
Great news. We must continue to expand opportunities for students to graduate without crippling debt &amp; prepare them… https://t.co/W98nBn1Y5D
⚾⚾⚾⚾⚾⚾⚾⚾⚾⚾⚾⚾⚾⚾⚾⚾⚾⚾⚾⚾⚾⚾⚾⚾⚾⚾⚾⚾⚾⚾⚾⚾⚾⚾⚾⚾⚾⚾⚾⚾⚾⚾⚾⚾⚾⚾⚾⚾⚾⚾⚾⚾⚾⚾⚾⚾⚾⚾⚾⚾⚾⚾⚾⚾⚾⚾⚾⚾⚾⚾⚾⚾⚾⚾⚾⚾⚾⚾⚾⚾⚾⚾⚾⚾⚾⚾⚾⚾⚾⚾⚾⚾⚾⚾⚾⚾⚾⚾⚾⚾ #Windians
"Glad to have you back, @SteveScalise! https://t.co/L2VQd50fth"
Even one veteran losing his or her life to suicide is too many. Pressed @SecShulkin on how he plans to address this… https://t.co/dK3Klox4yX
This is an important 1st step. We need to come together to lower prices &amp; make healthcare work better for everyone. https://t.co/QmWN3yn6gd
Working Ohioans deserve tax reform that helps them keep more of the money they’ve earned &amp; creates good-paying jobs… https://t.co/b3F2iTvbhQ
Proud to be one of many #MenForChoice. https://t.co/6SDXEU1Nsu
Sherrod is answering healthcare questions LIVE on Facebook. Tune in here and comment with your questions: https://t.co/cM0xOAdA1n
Looking forward to taking your questions during my Facebook Live town hall on healthcare tonight at 6pm →… https://t.co/TH2lXJMnqX
"@CFPB @CMSGov @usedgov As elected officials, it’s our job to protect the people we serve – not banks and corporatio… https://t.co/W5oB0TODon"
@CFPB @CMSGov @usedgov And I’m urging the Administration to do the right thing and move forward with protections at @usedgov and @CMSGov.
"@CFPB @CMSGov @usedgov I’m supporting @CFPB's rule &amp; fighting efforts to overturn it, making it easier for banks li… https://t.co/1gwgDJvbbL"
@CFPB @CMSGov @usedgov Now the Senate is considering doing the same as early as this week.
"@CFPB @CMSGov @usedgov The House already passed a law overturning @CFPB's rule, voting to leave consumers vulnerabl… https://t.co/HCCxXJUpI0"
@CFPB @CMSGov @usedgov But now action by Congress and the Administration puts those protections in jeopardy.
"Thankfully, the @CFPB, the @CMSGov, and @usedgov took action to protect consumers."
"These clauses, tucked in the fine print, force Ohioans to sign away their rights to access the court system if they are cheated."
The recent fake account scandal at Wells Fargo and the data breach at Equifax have brought to light so-called “forced arbitration.”
"WATCH LIVE: As Congress debates overturning @CFPB’s arbitration rule, Sherrod stands up for working families → https://t.co/1i75eG5saH"
@Equifax @Equifax executives cannot be allowed to wash their hands of this while millions of Americans are left to… https://t.co/caO0n7S0KW
"There’s no easy out for working families that @Equifax exposed to cyber criminals, so there shouldn’t be a big payd… https://t.co/R5Bq2FCUfm"
Making it harder to vote is a direct attack on democracy. Read my amicus brief in SCOTUS' Ohio voter purge case → https://t.co/DHijPKHlcJ
Have you submitted your questions about #GrahamCassidy for my Facebook Live Town Hall tomorrow night? Comment here: https://t.co/cM0xOAdA1n
As we honor Little Rock 9 let’s remember how much work is left to ensure all children have access to = opportunities https://t.co/qaTDKTD5QO
"This move shows @Target understands that investing in workers is not just the right thing to do, it’s good for busi… https://t.co/0f2e8zjuGT"
NEW LINK: We’re continuing to stream today's #GrahamCassidy hearing - watch what's happening right now here → https://t.co/vpnNapaHn2
Entering the hearing earlier with 200 letters from Ohio to enter into the record. https://t.co/Hi3wbYmIwO
TUNE IN NOW: Sherrod begins his line of questioning at today's Senate Finance Committee hearing on #GrahamCassidy https://t.co/3OuOo6zZkb
"RT @CF_Foundation: Jill &amp; Dave, parents to children w/CF, meet w/ @SenSherrodBrown to discuss the importance of adequate, affordable care.…"
"Bottom line: we cannot strip healthcare away from our children, our parents &amp; grandparents, our friends &amp; neighbors… https://t.co/g0ya0Fj0vp"
Keep speaking out. We’re listening. https://t.co/G3f5Q23l42
We are streaming today's hearing on #GrahamCassidy from Senate Finance Committee live on Facebook - tune in here → https://t.co/3OuOo6zZkb
"This hearing should have been held in a much larger room, allowing more Americans to participate.… https://t.co/db5qz9HSQ0"
Thank you to Youngstown Historical Center of Industry &amp; Labor for their efforts to preserve the rich history of manufacturing in the Valley.
It is important that we take time to remember the history of our communities and celebrate the achievements and dedication of our workers.
#BlackMonday devastated the Valley - but the workers who forged the steel that built this country did not give up.
"40 years after #BlackMonday, Youngstown held the inaugural Steel Heritage Week. https://t.co/5qBOYkSznC"
"Join my Facebook Live town hall tmrw, where I'll answer your Qs about the latest attempt to take away healthcare →… https://t.co/qmbY5xOE5m"
Hundreds are already in line to watch today's hearing on #GrahamCassidy - you can watch the full livestream at 2pm… https://t.co/4dpq5h4Z6z
"@HHSGov To ensure that taxpayer money is spent responsibly, urged @MickMulvaneyOMB to investigate taxpayer-funded t… https://t.co/zbpskro9zH"
Every dollar from @HHSGov should go toward keeping Americans healthy - not private jets for Secretary Price. https://t.co/7rWVUf7x9X
@AmerMedicalAssn @AARP @hospitals4kids: “This bill would have devastating consequences for children and families.”
@AmerMedicalAssn @AARP: the bill “would result in an age tax for older Americans who would see their health care co… https://t.co/q5GJcDJf0b
"@AmerMedicalAssn: ""We believe the Graham-Cassidy Amendment would result in millions of Americans losing their health insurance coverage..."""
There’s a lot of conversation about what exactly #GrahamCassidy would do to your health insurance – here’s what the experts are saying:
"WATCH LIVE: Sherrod stands w/ Ohioans against Graham-Cassidy, which takes away our number one tool to fight opioids. https://t.co/S7SlBVmHXG"
"@cbo We cannot let politicians in Washington, with taxpayer-funded healthcare, pull the rug out from under Ohio families and communities."
@cbo And #GrahamCassidy allows insurance companies to charge Ohioans age 50 and older more for their insurance.
"According @CBO, the House GOP plan - nearly identical to #GrahamCassidy - would cause premiums to go up an average of about 20% next year."
"And whether or not you're on Medicaid, you're looking at a premium increase next year if #GrahamCassidy becomes law."
As well as the 3 in 5 nursing home residents in Ohio who rely on Medicaid to cover the cost of their care.
"Also hurt: 71,000 veterans in Ohio who get their coverage through Medicaid, and 150,000 Ohioans getting opioid treatment."
"So who gets hurt by these Medicaid cuts?
To start: 973,000 children in Ohio who rely on Medicaid for their health insurance"
"It cuts a net $20 BILLION from Ohio. For every $1 OH spends on Medicaid on average, 63¢ comes from federal $ that #GrahamCassidy would cut."
#GrahamCassidy is just another name for kicking people off their insurance - it's dangerous and it will do irreparable damage to Ohio.
On #WorldAlzheimersDay we shine a light on a disease that affects many Ohio families - and we recommit ourselves to… https://t.co/CcyvFazjNT
"@SenateBanking @WellsFargo @Equifax Congress needs to stand on the side of working people, not Wall St. These heari… https://t.co/hxDEtlNtIw"
.@SenateBanking will hold two bipartisan hearings in October to press @WellsFargo and @Equifax for answers. https://t.co/UVapuTGLir
Everyone should be able to go to work each day knowing they will come home safe and healthy. Read our full letter t… https://t.co/k1keY7j7zy
"Learn more about my new bill, the Protecting Workers and Improving Standards Act: https://t.co/XU6bWq9cKh"
So-called right-to-work laws give corporations the ability to trample workers’ rights and dismantle unions. I refuse to let that happen.
L'Shana Tova! Wishing a happy and sweet new year to all those celebrating #RoshHashanah tonight.
We cannot let politicians with healthcare paid for by taxpayers throw hundreds of thousands of Ohioans off of their… https://t.co/vaIqcJhY2c
Proud to see this important initiative from Ohio's @kroger. They set an example for us all. #NoHungerNoWaste https://t.co/s6CYfmsvi3
"We cannot let politicians in Washington, with taxpayer funded healthcare, pull the rug out from under Ohio families and communities."
#GrahamCassidy is just another name for kicking people off their insurance.
There is no excuse here - nursing home residents deserve the right to seek justice if they are mistreated. Period. https://t.co/UKRbi8oKVT
We’ve heard far too much talk about what’s good for corporations and not enough talk about what’s best for American… https://t.co/kGEd7LcdDH
"It freezes @PPFA funding, It weakens protections for coverage w/ pre-existing conditions.
 
It's bad for Ohio and it's bad for our country."
"It enables states to redefine what qualifies as an ""essential health benefit"" – taking 10 benefits away from Ohio families."
It allows insurers to slap an age tax on Ohioans 50 + and raises their premiums.
This bill slashes the No. 1 tool we have in the opioid fight — Medicaid treatment.
It will undoubtedly cause premiums to spike.
#GrahamCassidy is just as dangerous as every repeal plan we've seen so far.
RT @WrightPattAFB: Celebrating the 70th #AFBday it's worth noting the journey began much earlier here with two brothers from Dayton. https:…
"If we want to prepare students for 21st century jobs, we need to invest in 21st century classrooms. Good to discuss… https://t.co/27N7kliGl6"
"@WhiteHouse As a member of bipartisan HBCU caucus, looking forward to supporting our nation’s HBCUs together - incl… https://t.co/o1i5iaLjkf"
"Congratulations to Ohio's Johnathan Holifield, the new Executive Director for @WhiteHouse Initiative on HBCUs. https://t.co/e9XMvLxSD9"
"This #MakeWorkPayMonday, read about my plan to fight back against worker misclassification &amp; restore workers' power: https://t.co/3csrCy7mEF"
"Temp workers, contractors &amp; subcontractors are often paid lower wages &amp; provided less job security, fewer benefits &amp; fewer legal protections"
"""The contractor model offers comps lower costs, more flexibility &amp; fewer management headaches. Workers get far less… https://t.co/v7pYqq4V1E"
"There should be no bonuses for @equifax executives. That $ must go to protecting customers.
https://t.co/TYEsPUypUu"
RT @ColsCitySchools: Thanks @SenSherrodBrown for visiting with students at our Cols Alternative HS @cahsmicpower to talk about need for 21s…
A message to @MLB Commissioner Manfred from Sherrod (and Franklin) on the @Indians' historic win streak → https://t.co/F6qqWPOLR6
The best way to appreciate truck drivers is to honor our commitment &amp; ensure they get the pensions they earned. #TruckDriverAppreciationWeek
".@MLB Commissioner Manfred: it's time to set the ""record"" straight. @Indians' 22nd win makes them rightful owners o… https://t.co/rCcWUNgOaQ"
Joined with Senator Cassidy - my co-chair of the Senate Subcommittee on Social Security - to demand answers from… https://t.co/E1mCTmKKdk
We need to know whether SS data is vulnerable to cybercriminals and I intend to find out what’s being done to ensur… https://t.co/tyx6sauB7I
"We honor &amp; remember these brave servicemembers, and we stand w/ their loved ones. Their sacrifice - and their patri… https://t.co/Vxj5S11DDL"
@BetsyDeVosED @CFPB We're asking @BetsyDeVosED to reverse this decision. Students and borrowers cannot afford to se… https://t.co/U6xftLw1ME
@BetsyDeVosED @CFPB @CFPB oversight protects students from predatory lenders &amp; other bad actors - this decision lea… https://t.co/4OWbLynGyC
.@BetsyDeVosED tried to sneak this under the radar before Labor Day Wknd - but she's refusing to share student aid complaint info w/ @cfpb.
"Make that: ⚾️⚾️⚾️⚾️⚾️⚾️⚾️⚾️⚾️⚾️⚾️⚾️⚾️⚾️⚾️⚾️⚾️⚾️⚾️⚾️⚾️⚾️

@Indians - you made Cleveland very proud tonight."
"WATCH LIVE: With NDAA on the floor, Sherrod calls for Equifax protections for servicemembers → https://t.co/tsms5sdLGo"
Washington's best ideas to pay for huge tax cuts for Wall St are to slash SS &amp; then steal from workers' retirement.… https://t.co/EPIeeDhheT
