"#GoodNews: @heartlandrvs plans three new expansion projects in Elkhart County, investing in Hoosier workers. https://t.co/IDWXhUTGZh"
Joe called on POTUS to keep ONDCP intact. ONDCP critical to fight against opioid abuse. https://t.co/NeiZoLrZn8 https://t.co/75iPQYO0qB
Joe’s staff hosted a #VeteransHistoryProject for veterans in Indianapolis to share their stories from serving in th… https://t.co/MNi1kG6zqJ
"During a #VHP in Indy, Joe’s staff interviewed 96-year old Joe Miley who fought in Battle of the Bulge for @USArmy. https://t.co/VSSB3Vj68P"
The @IndianaFFA members are the future of ag in Indiana; their ideas &amp; leadership feed our families &amp; fuel our econ… https://t.co/28l9rOf910
Joe visited @KEMBAindy to see first-hand how the credit union &amp; its members will benefit from access to Federal Hom… https://t.co/Wf9KEIDf4i
"Joe, @SenToddYoung, @RepJimBanks requested @FAANews meet w/ stakeholders to discuss improvements to Warsaw Airport.… https://t.co/k89Z1aAsZo"
"#ICYMI: Tomorrow, Joe’s staff is hosting a Veterans History Project event at Miller’s Senior Living Assistant Livin… https://t.co/JbGou2JDDf"
Joe received @shopfloornam award for manufacturing legislative excellence for efforts to help manufactures like Hil… https://t.co/RGsaB2Rt0A
"Joe toured Hill-Rom in Batesville, where he learned about their innovative products that enhance outcomes for patie… https://t.co/tYSr02ZHZB"
Joe grabbed a quick breakfast at McDonalds in Charlestown before heading to Ripley County. https://t.co/cL41o6ORaV
Joe and Mayor Manus discussed efforts to keep and create jobs in Greensburg. https://t.co/Fym8IAwzQW
Joe greeted Hoosiers while stopping for lunch at @CrackerBarrel in Edinburgh. https://t.co/iVDUikaXda
"Ag is heartbeat of our state. -Joe, speaking w/ Hoosier farmers during farm bill listening session in Edinburgh. https://t.co/dWu56VxVrH"
Joe’s staff attended the @ZvilleChamber Business Breakfast Series featuring the State of Town address from Mayor… https://t.co/we10jY5Y1f
The Great Families 2020 initiative of @uwci will support our friends and neighbors and help them prosper and grow.… https://t.co/51vJdh35PU
Joe met w/ @AARPIndiana &amp; discussed his continued efforts to protect Medicare and health care for Hoosier seniors. https://t.co/Wl9jSfeh8b
Joe made cookies and cream truffles during #DonnellyDay at the production facility of small business @IndyChocolate. https://t.co/ZxeyrGyLPs
"After using Holzma saw, Joe removes plywood that will be used for products manufactured at #RobertWeedPlywood.… https://t.co/CCoeZd16Ly"
Joe secured laminate to plywood for cabinets &amp; countertops that will be installed in RVs during #DonnellyDay at Rob… https://t.co/PEEpI9Retw
#ICYMI: Joe's demanding answers re: price hike of a naloxone injector device used to administer life-saving treatme… https://t.co/BVpaTMQ8mE
Twitter: Joe’s office is hosting a #VeteransHistoryProject on 2/23 in Indy. https://t.co/JiG1M4Xcir
"Joe met today w/ @GovHolcomb, local &amp; federal officials to discuss efforts to assist families impacted by Superfund… https://t.co/dbas79By10"
(2/2) Joe missed final vote bc he’s meeting in E. Chicago w/ IN Gov on USS Lead Superfund Site recently declared a disaster emergency by IN.
(1/2) Joe voted against moving forward with Scott Pruitt’s nomination to lead the EPA yesterday. https://t.co/3QoPzW6cLR
WATCH: Joe spoke earlier on @SenateFloor about why he does not support Scott Pruitt to lead the EPA. https://t.co/3QoPzW6cLR
#ICYMI: Joe opposed price hike of device used to administer life-saving heroin overdose drug naloxone.… https://t.co/7WatrqPuPX
Joe met w/ @ShopFloorNAM to discuss top priorities for Hoosier manufacturers and job creation. https://t.co/ySsRpJRkXh
Joe's staff attended @IUPUI Chancellor’s Report to the Community to hear updates on the IUPUI community &amp; plans for… https://t.co/lPfmiNIGNo
"#GoodNews: @HondaIndiana to kick off the first CR-V production in Greensburg, creating 100 American jobs. https://t.co/LVBUQujT2C"
Joe’s staff attended @MayorTomHenry's State of the City address in Fort Wayne to discuss plans for 2017. https://t.co/5GKN5P9A7S
"Joe hosted a coffee for Hoosiers visiting D.C., this morning. https://t.co/4Oazn1VRHp"
WATCH: Joe highlighted concerns to Federal Reserve Chair Janet Yellen about how outsourcing of jobs impacts Hoosier… https://t.co/rNscpTyuL2
Joe’s statement on National Security Advisor Michael Flynn’s resignation. https://t.co/CjQRpW2q1W
"(2/2) Joe &amp; Judge Gorsuch talked about his experience as a judge, his judicial philosophy, and his thoughts on judi… https://t.co/duPJVjuG2k"
"(1/2) Joe met today with Supreme Court Nominee, Judge Neil Gorsuch. https://t.co/9bvziIexge"
"W/ Joe’s efforts, @generalelectric &amp; Norfolk Southern Railroad reached agreement resulting in redevelopment project… https://t.co/KmtCKlGfW0"
#GoodNews: Indy was announced as a winner of the Smart Cities Council Readiness Challenge Grant Program. https://t.co/6obdzFKdA3
"On Friday, Joe spoke at the Experts Discuss series hosted by @NotreDame. https://t.co/2dLf4CPBT5"
#ICYMI: READ: Joe’s op-ed in @IndyStar about how we can work together to protect American jobs.… https://t.co/LO98SrDb4l
The health care law helps those struggling w/ substance abuse &amp; opioid abuse access the care they need. https://t.co/B9ICdrQUdu
"#ICYMI Joe spoke w/ POTUS at White House this week about his End Outsourcing Act, which would help protect Hoosier… https://t.co/Ybt4s8hVzX"
#GoodNews 13 members of the @122FighterWing force returned home to @flyfwa Monday after seven-month deployment. https://t.co/rkMNiaFw7B
WATCH: Joe highlights his efforts on behalf of Hoosiers over the last year. https://t.co/aJeGHCHw4a
"1 yr since #Carrier &amp; #UTEC said they’d lay off over 2,000 Hoosiers. Read Joe’s @IndyStar op-ed:… https://t.co/dnUXS8eRnS"
"Joe continues pushing to repeal the medical device tax. Indiana medical device companies employ more than 16,000 Ho… https://t.co/P9VTgiyG2C"
Watch Joe’s update after meeting with the President. Joe discussed preventing outsourcing of Hoosier &amp; American jobs.https://t.co/eHgqYuA2YL
Joe is pleased Governor Eric Holcomb announced his intention to declare a disaster emergency for the East Chicago U… https://t.co/iFqh1Ec3Ps
Joe’s staff attended the @GLCommerce State of the Cities and County event to discuss job &amp; economic growth. https://t.co/tgxTTyBDGz
"Joe, colleagues, are demanding answers from Kaleo for dramatic price hike on anti-opioid overdose products. https://t.co/vkqZ42zkM9"
"Joe hosted a coffee for Hoosiers visiting Washington, D.C., this morning. https://t.co/COhPckKGYb"
Great to see Jordan McLinn. He's a fighter &amp; I'll continue pushing to ensure children like Jordan have access to li… https://t.co/ewLsm1EaYQ
#ICYMI: Joe voted against Betsy DeVos’ nomination. He spoke on the Senate floor last night about his opposition. https://t.co/mGEZB7qfXS
#ICYMI: Joe announced more than 90 @CraneArmyAmmo jobs will be exempt from the President’s federal hiring freeze. https://t.co/1zeeBFwnR6
#GoodNews: 13 members of the @122FighterWing force returned home after a seven month deployment in Kuwait. https://t.co/rkMNiaFw7B
Joe is heading to the Senate floor to speak soon about his opposition to Betsy DeVos' nomination. Watch on @cspan: https://t.co/JSr3VlJiIE
2/2 Joe sent a letter to @DeptofDefense calling for @CraneArmyAmmo exemption and met with Army Sec. last week.… https://t.co/LsG7DsEMLf
1/2 Joe announced that 90 @Cranearmyammo jobs will be exempted from federal hiring freeze. https://t.co/bXjtZjQxen
Joe met with new @IMPD_news @impd_Chief Bryan Roach to discuss efforts to improve public safety. https://t.co/X2zGtqOvFI
Joe toured @RileyChildrens and spoke w/ hospital leaders including Chief Med. Officer Dr. Paul Haut to discuss pedi… https://t.co/OTIh5ScrVl
"Joe’s staff attended the @181IW Assumption of Command Ceremony in Terre Haute, where Col. Alderdice became the new… https://t.co/JBPuGkztnn"
#GoodNews: Jayco plans an expansion project in Middlebury that is expected to create over 300 new jobs. https://t.co/26gUGhOsEj
"Great to attend another Purdue Ag Alumni Fish Fry, first one w/out event founder &amp; IN Ag pioneer Mauri Williamson.… https://t.co/LHS5l8FQqD"
Joe supports the expanded sanctions after Iran’s ballistic missile test. https://t.co/faVChzOuDu
#WearRed today to show your support for heart health. https://t.co/9s2G06olbQ
#ICYMI: Joe met w/ @USArmy Sec. Speer to discuss solutions for impact federal hiring freeze will have on… https://t.co/dy86bnUr6S
Joe will vote against Sen. Sessions’ nomination for U.S. Attorney General. See Joe’s full statement here:… https://t.co/tLlEzsUzLP
Joe met w/ @USArmy Sec. Speer to discuss solution for @CraneArmyAmmo employees impacted by President’s hiring freez… https://t.co/kPjNUlqduP
"February is #BlackHistoryMonth, a time to honor and celebrate African American heritage, history, and culture. https://t.co/RrqMfhB6M5"
WATCH: Joe spoke on the Senate floor about his opposition to Rex Tillerson as Sec. of State and voted against him. https://t.co/q7ara17TNe
"Joe’s statement on the passing of Mauri Williamson, an influential role model in Indiana’s agricultural community. https://t.co/2LavZG4YFN"
Joe sent a letter to @DeptofDefense requesting @CraneArmyAmmo employees be exempt from the federal hiring freeze.… https://t.co/ZiLCl3bYhp
Joe successfully got @sbTranspo and @VANIHCS to implement a bus route for vets to access St. Joseph County VA Healt… https://t.co/jCYrQeXJ7p
"Joe, @SenSherrodBrown, and Sen. Gillibrand introduced the 'End Outsourcing Act' to protect American workers. https://t.co/8AplY1MtLL"
#ICYMI: Joe lauded the VA move to exempt health care positions from federal hiring freeze. https://t.co/qSPjVm9BiK
"This weekend, Joe helped @gccwired deliver boxes of food to local food pantries across north central Indiana.… https://t.co/fPsSC1p2X4"
(2/2) Joe has said he does not believe the executive order signed by the President is one of those ways. https://t.co/TCbzGwlmR3
"(1/2) At @INDairport, Joe emphasized that we can make our country even safer and do so in a way that is consistent with our values."
(2/2) The executive order that was signed yesterday by President Trump is not one of those ways. -Joe
(1/2) We can make our country even safer and do so in a way that is consistent with our values. -Joe
"RT @DeptofDefense: From refugee to #Marine. @USMC Cpl Ali J. Mohammed takes the fight to the doorstep of those who cast his family out.
htt…"
Joe met w/ @infarmbureau Farm Bill Taskforce to hear from Hoosier farmers and producers on priorities for the upcom… https://t.co/hCFkl9HpsV
"RT @infarmbureau: Farm bill task force members are able to speak directly to @SenDonnelly about livestock, nutrition and other topics. #INF…"
"Joe, @SenToddYoung &amp; @RepVisclosky sent a letter to President Trump asking EPA continue communications on E. Chicago https://t.co/YnFmL2XkHa"
"Joe asked to meet w/ @POTUS, so they can discuss efforts to address outsourcing of #Hoosier &amp; American #jobs.… https://t.co/YOSHscbSHF"
#GoodNews: Joe announced Rexnord workers eligible for #TAA benefits. Program aids those who lost jobs to outsourcing https://t.co/GAi73ZrncZ
Congratulations to Geoffrey Mearns on being named @BallState’s 17th President. https://t.co/mCrH12YBrs  #chirpchirp https://t.co/ib6s6C5oIi
Joe’s staff attended the Valparaiso Chamber of Commerce annual luncheon to discuss job growth &amp; economic opportunit… https://t.co/X3efacPoLP
Joe announced he will vote against Education Secretary nominee Betsy DeVos. https://t.co/pIDeuACC7X
"#GoodNews: three @LifeAtPurdue alumni will head to space in 2018, part of a @NASA mission to the Intl. Space Station.https://t.co/RJ9qjyX4zn"
"#GoodNews @ToyotaIndiana adding 400 jobs in Princeton, IN, as part of a $600m investment to build Highlanders in US. https://t.co/FdPTCA1fsj"
#ICYMI: Joe will continue to support bipartisan legislation to repeal the medical device tax. https://t.co/uD5xRiF4Cx
"Joe’s been fighting for American workers &amp; for trade agreements that benefit Hoosier workers, for more than a decad… https://t.co/mJx51GNBt7"
Joe’s staff attended the Indiana Military Veterans Legislative Day to honor our vets &amp; discuss legislation importan… https://t.co/UkeURHNEIh
"This morning, Joe spoke at the @IASWCD annual conference in Indy on the importance of Indiana’s Ag communities. https://t.co/iG8HmoPpMs"
Congratulations to Columbus North HS and @CulverAcademies on representing Indiana well in the @TrumpInaugural Parade.
Joe voted to confirm Ret. Gen. James Mattis for #SecDef and Ret. Gen. John Kelly for @DHSgov. https://t.co/BK5XDz4NvL
"2/2 - ...strengthen our economy for Hoosier families, and protect jobs here at home—issues I've been focused on for years. - Joe"
"1/2 - I congratulate President Trump and look forward to working with him to keep our country safe, ... - Joe"
Joe hosted a Hoosier Hospitality coffee today to welcome Hoosiers who are in town for the Presidential Inauguration… https://t.co/Luzxa51gXe
Joe believes the Miners Protection Act is critical to Hoosier miners &amp; he'll work to make sure miners receive the b… https://t.co/9sboay3H8t
"As #HHS nominee Tom Price had his confirmation hearing today, Joe again voiced his opposition to Price’s nomination. https://t.co/wFj21ApGkU"
Joe continues to support bipartisan legislation that would repeal the medical device tax. https://t.co/8Zmj2G8UIV
Saddened to hear former state rep. Mae Dickinson passed away. Mae was a leader who fought to protect children. –Joe https://t.co/21VPiZHqHE
"Joe calling on Senate to pass bipartisan Miners Protection Act, ensure retired Hoosier miners receive the benefits… https://t.co/lJNAFzBuci"
"New non-partisan @USCBO report: partial ACA repeal wld cause higher premiums, 18 mill. to lose insurance in 1st yr. https://t.co/IHCWlC3iXr"
"Joe named Ranking Member of Senate Banking National Security subcommittee, opportunity to focus on financial sancti… https://t.co/WYaN2hS55q"
Joe joined the Indiana Christian Leadership Conference for their 48th #MLKDAY Celebration at St John's Missionary B… https://t.co/c1o1eOXwul
Joe attended @SBHeritage #MLKDay Community Service Recognition Breakfast. https://t.co/aXfK1rT8BU
"Today, Joe joined in honoring the legacy of Dr. Martin Luther King Jr. #MLKDAY https://t.co/GzNQsXbKml"
#GoodNews: @NatlParkService named #Indiana Soldiers and Sailors Monument a national landmark. https://t.co/4udd1It45Q
Hoosier K -12 educators: @librarycongress holding summer course on using primary sources in K-12 classrooms.… https://t.co/HXaV85HCUO
Great to be in Gary this morning for the 38th annual Dr. Martin Luther King Jr. Memorial Breakfast. -Joe https://t.co/YtP5CVzd3N
"Carrier, Rexnord &amp; UTEC workers joined Joe as he discussed new legislation he’s introducing to fight outsourcing of… https://t.co/wKZ27K4hJK"
"We mourn the loss of South Bend’s Barbara Vance Brandy, a role model in the region’s civil rights movement. -Joe https://t.co/I89sFHtwe9"
"(2/2)After Joe asked abt HUD continuing relocation effort @realbencarson said, “Absolutely…we will push very hard to complete that process.”"
(1/2) Joe asked @HUDgov nom.@realbencarson if he’d commit to prioritizing relocation of families from lead-contamin… https://t.co/9MLi2MC9sd
WATCH: Joe&amp; @SenToddYoung discuss @USGPO change they successfully pushed for. Indianans are out &amp; #Hoosiers are in. https://t.co/4Tq5oh3ZrR
"#Hoosiers are in &amp; Indianans are out of @USGPO's style guide. Thanks to Joe, we're officially Hoosiers. https://t.co/0tlIJGHqH9"
Repealing the health care law would undermine progress made to fight the opioid abuse and heroin use epidemic. https://t.co/LS38xSAZ3d
Joe met with Vice President-elect Pence and discussed job creation and concerns over Russia.https://t.co/r417VfplgI https://t.co/wBh1nJVmwr
Congrats @IMPD_Chief Bryan Roach. Look forward to working w/ you to build on efforts to improve public safety.– Joe https://t.co/lxHSskcB3D
#ICYMI Joe spoke on the Senate floor last night reiterating his willingness to work w/ anyone to strengthen Medicar… https://t.co/soASU5E96p
"Saddened to hear the news on @LNHSwildcats alum, Jordan Hankins. My prayers go out to her family. –Joe https://t.co/rFJMUIBiWE"
Thank you to all of our police officers who serve and protect Hoosiers every day. #ThankaCop https://t.co/h25Gci0D08
"WATCH: Joe continues effort to protect seniors, Hoosier families from cuts to Medicare or Medicaid. #ProtectOurCare https://t.co/2zRHMDV9M9"
...my colleagues on both sides of the aisle can demonstrate their commitment to this principle by supporting our amendment. –Joe
...but we’re not going take away the health care that people have come to rely on. -Joe
I’m happy to work w/ anyone to strengthen the health care law...
I agree w/ Vice President-elect Pence that HIP 2.0 is something we can be very proud of bc it’s helping Hoosier families every day. -Joe
"Don’t just take my word for it. In his farewell message as Governor to Hoosiers yesterday, Mr. Pence said, and I qu… https://t.co/OwtHbu9BUq"
HIP 2.0 program has been critical in our ongoing effort to provide treatment to those struggling with opioid abuse and heroin use… -Joe
…we will protect insurance coverage for those who get their care through the Medicaid program. –Joe
The Hirono-Donnelly amendment would make clear that we will not privatize Medicare. -Joe
"Joe introduced amendment to budget resolution w/ Sen. @maziehirono that would protect #Medicare &amp; Medicaid, includi… https://t.co/0Rpiy6y8VW"
"This morning, Joe’s staff attended Mayor @GregGoodnight Prayer and Action breakfast in Kokomo. https://t.co/9qnVg0XwtC"
#ICYMI: Joe received @DeptofDefense Medal of Distinguished Public Service for helping servicemembers succeed on &amp; o… https://t.co/xepKEpkxE3
Joe released the following statement about Dan Coats nomination to lead the US intelligence community. https://t.co/6GMxesQDaX
Joe pressed for further details on Russian cyber attacks during #SASC hearing on #cybersecurity threats.… https://t.co/RTtwFLem1U
Joe receiving @DeptofDefense Medal of Distinguished Public Service from Rear Admiral Faller. https://t.co/ZOxbEmJYnX https://t.co/1EOlxahROe
.@USNavy awarded Joe @DeptofDefense Medal for Distinguished Public Service for his dedication to the readiness &amp; sa… https://t.co/4dNWB8oagQ
"(2/2) As Joe's said, he believes way to achieve lasting peace, 2-state solution is through direct negotiations btwn Israelis &amp; Palestinians."
(1/2) Joe helped intro a bipartisan resolution objecting to passage of UN Sec. Council resolution condemning Israel. https://t.co/vr9jSizKHi
"Joe continues to work on combating the rising opioid epidemic, including the #CuresAct which he helped pass. https://t.co/ed6bPR4NH7"
"WATCH: Joe says Congress should improve health care system, abandon efforts to take away coverage from Hoosiers. https://t.co/oPq49WJLb9"
"#GoodNews: The Marching Pride of Lawrence Township will perform at the @RoseParade in Pasadena, CA.  https://t.co/Tt858Z611c"
Wishing you a happy and healthy new year. –Joe
"This year, Joe has continued to lead the charge to address opioid addiction in Indiana. https://t.co/6Tmz1I3ZSm"
Joe welcomed sanctions vs. Russia &amp; again called on Senate to establish a select committee to undertake bipartisan… https://t.co/52pXxirFd5
Are you interested in an internship in Joe’s D.C. office? Apply here for the spring 2017 session:… https://t.co/PnEpTEosu1
#ICYMI: Final provision of Joe’s #CarePackage was signed into law as part of #NDAA. https://t.co/GhTFbkq6n4
"During a recent visit to Zimmer Biomet, Joe talked about repealing the medical device tax. https://t.co/eBBy6dTAu5"
#GoodNews: Penn High School graduate to join USA bowling team. https://t.co/phmotPVljU
Merry Christmas and Happy Holidays from my family to yours. God bless our troops and God bless Indiana. –Joe https://t.co/qFwRz8WkSp
Joe served hot meals at the @CFH_Difference this morning. https://t.co/4rkNF1b1H7
Happy first night of Hanukkah to all celebrating. -Joe
Joe visited @MemorialHealth to hand out gifts w/ @ToysForTots_USA to children spending the holiday weekend in the h… https://t.co/o9iUl1Xmd6
Joe released the following statement regarding U.S. abstention from UN vote condemning Israeli settlement expansion… https://t.co/yG1FWbTwzc
The final provision of Joe’s #CarePackage was signed into law as part of #NDAA. https://t.co/9KbvUMBGxD
Posey Co. Vietnam vet is grateful to Joe for helping secure his passport from U.S. Department of State. https://t.co/tmktQpzXLN
"While in Fort Wayne this week, Joe toured Star Bank’s service center &amp; met w/ employees. https://t.co/kGxhIxBRyw"
Joe continues pressing Wells Fargo for answers on bank’s fraudulent business practices. https://t.co/DsW98PGxkt
"Joe met with Bartholomew Co. Sheriff, to discuss efforts to improve public safety and address drug epidemics.… https://t.co/JCGUOtrG2y"
Joe is calling on the Senate to establish a select committee to thoroughly investigate Russia’s hacking and interfe… https://t.co/wgEISPkqPU
"“A great moment last night at @ndmbb game. We think of our servicemembers serving our country every day, &amp; especial… https://t.co/bdlBKkq7T3"
"Joe stopped to talk to a few Hoosiers at a local Indianapolis McDonalds, including a Hoosier Veteran. https://t.co/1mN9JWLgig"
"This morning, Joe toured @zimmerbiomet. Joe helped suspend the medical device tax for two years, allowing them to i… https://t.co/8zSdG3ZAlI"
"Joe’s staff attended @EastEndCrossing dedication &amp; ribbon cutting. The bridge is now open, connecting Southern Indi… https://t.co/VFAuSzHTJ2"
"We mourn the loss of my friend, former Mayor Hudnut. He will be remembered for his great leadership and contributions to Indianapolis. -Joe"
Joe spoke at the @uindy graduation ceremony this afternoon in Indy. Congratulations to all of the graduates! https://t.co/gB59AHh2JP
Joe &amp; group of Senators plan to introduce anti-offshoring legislation in 2017 based on Joe’s proposals. https://t.co/zu2QZ5KxrW
.@U_S_Steel investing in mill at Gary Works. https://t.co/SAdSW4Nm2h #GoodNews
#ICYMI: The Senate passed Joe and @SenDanCoats resolution honoring Indiana’s Bicentennial. https://t.co/S26BmJQ4F7 https://t.co/S4vavH82Av
Joe stopped by @wrbiradio in Batesville to discuss his #CarePackage provision &amp; funding to fight opioid abuse both… https://t.co/vuGxrdXbe4
"Thank you for 380 years of dedicated service to our country, @nationalguard. @INNationalGuard is the 4th largest Gu… https://t.co/mlv8vfTfor"
The bipartisan 21st Century #CuresAct was signed into law today. Includes Joe’s efforts to provide necessary fundin… https://t.co/l1dBgMe2j7
I'm in Rushville this morning. There is snow falling here and in many parts of Indiana today. Please drive carefull… https://t.co/kjUYGFfr8y
Twitter: #ICYMI: Final provision of Joe's #CarePackage passed Senate. https://t.co/rtEeGBkX3Z https://t.co/uGfKlcJTzw
"Happy 200th Birthday, Indiana. #Indiana200 https://t.co/lblHOzGyB6"
Joe spoke about his efforts to support the Hoosier ag community at #INFB16 in Fort Wayne. https://t.co/HAtqS9Knfb
#ICYMI Joe helped Senate pass critical funding to address opioid abuse and heroin epidemics. https://t.co/JmcOLYVXLS https://t.co/TfTgl0py9e
WATCH: #JustAskJoe video about how Joe’s office helped Knox resident &amp; Navy vet receive 4 missing military medals. https://t.co/4ZAeFnsUy8
"Joe participated in Nunn-Lugar 25th anniversary event at @IUSGIS, said it’s an honor to carry on work of Sen. Lugar. https://t.co/1DAE41HEGY"
Joe spoke on the Senate floor pushing for Congress to act to ensure retired miners get benefits they earned. https://t.co/01zGGkRDtR
"In honor of #Indiana200 Sunday, Joe recognized Indiana’s rich history &amp; accomplishments of Hoosiers. https://t.co/JMfL4MZxTA"
Senate passed final piece of Joe’s #CarePackage &amp; 4th military mental health provision as part of #NDAA in 4 yrs… https://t.co/YT1kgXPeTB
"Joe on standing w/ Carrier workers, represented by @steelworkers Local 1999 and hardworking Hoosiers across Indiana. https://t.co/bbtaE35xKp"
Joe helped Senate pass bipartisan 21st Century Cures Act. Has critical funding to fight opioid abuse. #CuresNow… https://t.co/5R1OptuAlU
"Joe met with @notredame students interning on Capitol Hill to hear about their experiences working in Washington, D… https://t.co/M6DroupLAJ"
"Joe and @LindseyGrahamSC introduced the bipartisan INVEST Act to help reduce crime, support local solutions.… https://t.co/DT2Wpe3Z8K"
"On the 75th Anniversary of Pearl Harbor, we honor and remember the American soldiers who lost their lives. https://t.co/DO0b2oEbzd"
"Joe spoke in the Senate honoring @SenDanCoats' service to Indiana &amp; our country, wishing him well in retirement. https://t.co/OUeBNiDHAv"
#GoodNews: @TravelLeisure named Indianapolis one of the best places to travel in 2017. https://t.co/bpll3KqWoj
Joe &amp; senators announce principles of legislation they’ll intro next yr rewarding companies investing in U.S. https://t.co/ldaDzfWU2B
Joe led a group of Senators in urging congressional leaders to take swift action to address outsourcing of U.S. jobs https://t.co/tsXlPDY4rQ
Joe spoke at the Economic Outlook event in Muncie &amp; talked about expanding economic opportunity and investing in pr… https://t.co/e1dPwCzmXV
We welcome back Justin Phillips of Indy for a #WHChamps reunion. She is a strong advocate against opioid abuse. https://t.co/K8AHt4NZNQ
American products should be used to build U.S. infrastructure. We must support American jobs. #BuyAmerica https://t.co/MMJlK3xwfI
