Joe &amp; Sen. @lisamurkowski introduced a bipartisan bill to incentivize providers to treat people w/ drug addiction i… https://t.co/faGv8NUK95
#ICYMI: Joe shared the stories of Hoosiers who wrote to him out of concern about the Senate #healthcare bill. https://t.co/4Xso94ArKI
@HCIonline While visiting @HCIonline Joe also discussed his efforts to combat opioid abuse and his new legislation… https://t.co/TutPlimAAA
"Joe visited @HCIonline in Terre Haute &amp; saw first-hand the work being done to treat substance use disorders, includ… https://t.co/GVaPC3qRqr"
#ICYMI: Joe spoke on the Senate floor about how this #healthcare debate is first and foremost about people &amp; famili… https://t.co/JF3o7d0eYh
Special thanks to all of the Hoosier moms &amp; dads who came to our Indy office to voice concerns about the Senate… https://t.co/k68xbvWMDh
Joe talked w/ central IN families about how proposed drastic cuts in Senate health care bill would harm their kids. https://t.co/ONvWYSkwby
Thanks to the vets &amp; volunteers who participated in our VHP in @CityofElkhartIN &amp; thanks to @ElkhartBlazers… https://t.co/gThGrwlkuv
Thanks for stopping by to talk about the importance of #mentalhealth. #NAMICon17 https://t.co/gduDnBvgoe
Joe introduced bipartisan bill with @lisamurkowski to help address workforce shortage to confront opioid epidemic.… https://t.co/8R1CyoIGEj
Joe spoke on Senate floor about ensuring health care is affordable &amp; accessible so every Hoosier can live up to the… https://t.co/lnnJOpPqvb
Joe met w/ @IndianaFFA students @uscapitol &amp; discussed his Farm Bill listening tour to get input from Hoosier farme… https://t.co/No4TUWrCci
Thanks for having me @AARPIndiana &amp; thanks to Hoosiers who joined. I'll continue work to make #healthcare more affo… https://t.co/oHoK4n6nSx
"W/ Joe’s help, construction resumed on U.S. 20 in New Carlisle. The construction negatively impacted downtown busin… https://t.co/j4B3cVTNwp"
"On @AARPIndiana teletownhall Joe spoke abt working together to make #healthcare more accessible for Hoosiers, inclu… https://t.co/coxNyccqSm"
Joe is pleased the @EPA &amp; Trump Administration is planning to develop a new #WOTUS rule that is more workable for H… https://t.co/bBdQ6NguJK
WATCH: Joe is live on the Senate floor highlighting Hoosiers who would be harmed by Senate health care bill. https://t.co/bpSkB5bUWV
Joe is headed to the floor to highlight stories from Hoosiers on the Senate health care bill. Watch his speech live: https://t.co/0rujnf4jCE
"Joe asked IN Governor how the Senate health care bill would impact Hoosiers, including those with HIP 2.0. https://t.co/QAacJmHDiT"
READ: Joe’s statement after Senate GOP announced it would delay a vote on their health care proposal. https://t.co/L4NXR2Be9m
"#ICYMI: Joe supports the Voting Rights Advancement Act, which would restore voter protections undermined by the She… https://t.co/QKqlSPXZDv"
REMINDER: Joe’s staff will host a Veterans History Project 6/29 in Elkhart. https://t.co/UMNXSjHItP https://t.co/q81dcI1qmx
Read Joe’s statement after the non-partisan @USCBO released its analysis of the Senate health care bill. https://t.co/Mdw07zaCHz
"ICYMI: Joe believes if we want to improve health care, we must work together, including those who provide health ca… https://t.co/v6Cpmpwudq"
#GoodNews: Students at New Prairie HS are taking action to bring awareness to undetected heart conditions. https://t.co/xaVoSZHuYf
@POTUS signed into law the bipartisan VA Accountability and Whistleblower Protection Act that Joe supported. https://t.co/npoGOQo0jW
1st step to improve health care is for Admin to stop undermining the system. Joe believes we should work together t… https://t.co/axZ8yLLShM
"Joe &amp; @USTreasury Sec. @stevenmnuchin1 had a constructive conversation about protecting Hoosier jobs, including Joe… https://t.co/Dm9pprWK4k"
READ: Joe’s statement after Senate Republicans released their health care plan. https://t.co/VY3A9jEMMc
Congrats to the 2017 Hoosier Jefferson Award Winners for your dedication to public service across Indiana. -Joe https://t.co/zYbo8R0epp
"Joe believes we should do no harm and work in bipartisan way to ensure Hoosiers have access to quality, affordable… https://t.co/CeW5ejrapV"
"Proposed cuts to #Medicaid could impact funding for 24,435 seniors in nursing facilities across the state. https://t.co/dxonOtR2KX"
"If you’re a Hoosier senior or person w/ a disability using #Medicaid, proposed cuts would put your #healthcare in j… https://t.co/g0oy4SZmgV"
"If you are the parent of a Hoosier child who has coverage through #Medicaid, proposed cuts would put your child’s… https://t.co/hPG5S0Qlxl"
(2/2): State of IN would be left with tough choices to cover the cost. https://t.co/ICamMfEAma
(1/2): #AHCA would shift massive costs onto Indiana to maintain the same level of care as now. https://t.co/BA7NXP1FcR
READ: Joe’s statement about @AnthemInc &amp; @MDwiseinc leaving Indiana’s health care marketplace. https://t.co/KhWOTIdKhT
"Joe hosted coffee with the @nature_Indiana, Indiana Cast Metals Association, and other Hoosiers visiting @uscapitol. https://t.co/4u2LUUWJaF"
Joe met w/ @BallState President Mearns to congratulate him on his new role &amp; discuss future plans for Ball State. https://t.co/yk8XdKKWn8
"READ: Joe’s letter to @DeptVetAffairs @SecShulkin opposing cuts to Individual Unemployability program, which assist… https://t.co/BezOT0EGd7"
Joe wore a Delphi jersey to the Congressional Baseball Game to honor Libby and Abby as well as a @LSU hat to suppor… https://t.co/sbcXGBzN6g
WATCH LIVE: Joe speaks on the floor to highlight the Administration’s efforts to undermine health insurance markets. https://t.co/bpSkB4Ujyl
Joe’s staff attended the @CraneArmyAmmo Change of Command ceremony today. https://t.co/IvFy2AMWmu
"(2/2) The event will take place at the Eastlake Terrace in Elkhart, IN from 1:30 PM –3:30 PM EDT. https://t.co/evVIqTa34J"
"(1/2) Joe’s staff will host a Veterans History Project event on Thursday, June 29. https://t.co/UMNXSjHItP"
Saddened by the loss of the 7 sailors aboard the #USSFitzgerald. My thoughts are w/ their families &amp; the entire USS Fitzgerald crew. -Joe
Happy #FathersDay to dads celebrating here in Indiana and across the country. –Joe https://t.co/Y2zF7JgnUI
Joe's staff attended Honoring Women Veterans Conference at @UEvansville to talk to vets about… https://t.co/1Xo8mNCDNz
#GoodNews: Conexus connects Hoosier businesses and manufacturers with veterans entering into the workforce. https://t.co/3pBZ2bX9pQ
#GoodNews:The non-profit @WSP_Vets collaborates with @NotreDame to prepare veterans for success in academic courses. https://t.co/zmhoWEXYxE
#ICYMI: Joe visited the @VAIndianapolis Medical Center to hear directly from veterans about the care they are recei… https://t.co/nptzbUtNMD
Great to play in #congressionalbaseballgame. Always fun to play baseball w/ my friends. Tonight was meaningful for… https://t.co/hnnOYmn1hH
During tonight's @thehillbaseball game Joe is wearing a Delphi softball jersey in honor of Abby and Libby. #CBG17 https://t.co/YsXQ6I2kqZ
I look forward to playing in tonight’s @thehillbaseball game w/ my Republican &amp; Democratic colleagues. –Joe #CBG17 https://t.co/neqpDkmUzJ
READ: Joe’s statement on why he supports the bipartisan Iran/Russia sanctions bill that passed the Senate:… https://t.co/PhnpPFxTTR
"Joe hosted coffee yesterday morning w/ Hoosiers visiting w/ @citizensclimate, @SourceAmericaUS, @KLYESAbroad, &amp; oth… https://t.co/LrzunLhQvX"
Joe met with @AirNatlGuard Lt. Gen. Rice and discussed ensuring a strong future for the @122FighterWing. https://t.co/8Zd3HUYHm6
"Joe spoke at the @amfAR Summit about his commitment to help combat the opioid crisis, HIV/AIDS, and Hepatitis C. https://t.co/vQ5Z3E2TVy"
"On #ArmyDay, we honor and thank those who have served our country in the @USArmy. -Joe https://t.co/bN71JnjUPy"
Joe and @SenToddYoung met with @NHDIndiana participants to talk about our state’s rich history. #NHDI17 https://t.co/8ukZIooGaL
"Today is #NationalFlagDay, a day to celebrate and honor the freedoms of the United States. https://t.co/o3CqyMcm5K"
(2/2) I was practicing at the time with the Democratic team in DC and am okay. -Joe
"(1/2) I am shocked &amp; praying for the safety &amp; recovery of my friend Steve Scalise &amp; all the others shot, including the officers. -Joe"
Joe talked to a big group of @IndianaEC Youth Tour students about education &amp; agriculture issues. https://t.co/UN6Df4IOIB
Joe and @SenToddYoung met and thanked interns who are working in Indiana offices @uscapitol. https://t.co/gaaT5TDvUD
Joe met w/ Rushville Mayor Pavey &amp; Rush County officials to talk about workforce development in the community. https://t.co/HvKu4gp01g
Great to meet w/ @Colts Owner Carlie Irsay-Gordon. #GoHorse. –Joe https://t.co/BD3G2QEVUV
"#ICYMI: Last week Joe called on @SBAgov to provide Salem, IN w/ disaster asst. https://t.co/mjxuZ79GcZ https://t.co/4fDPHpB9CD"
"W/ Joe's support, the Jefferson Township FD was awarded a grant to purchase needed equip. to protect firefighters.… https://t.co/thcrl9Hfk5"
Joe’s staff attended a @jfederations meeting in @CityofFortWayne to hear an update on the organization. https://t.co/V0lTqRtUVd
Joe visited @VAIndianapolis to hear directly from veterans and discuss the center’s mental health services. https://t.co/8boVPQFa1J
Joe attended the Christ Our Shepherd Church veterans program to honor the Hoosier men and women who served our coun… https://t.co/GzTHBNeuI5
#ICYMI: Joe is pleased by FDA’s request to take the addictive #opioid Opana off the market to help combat the opioi… https://t.co/kFeqWTMWn2
WATCH: Joe sat down with Hoosier Rylin Rogers to discuss how the #ACA positively impacted her family.… https://t.co/vtBVYl7au7
#ICYMI: Joe attended @RVIANow’s #RVsMoveAmerica dinner to recognize Hoosier RV manufacturers who fuel jobs across I… https://t.co/a0jjNhVXnF
#GoodNews @LifeatPurdue alumna chosen as @NASA astronaut. https://t.co/ER0kWxRYUU
WATCH: Joe pressed @usairforce @SecAFOfficial for commitment to continue @122fighterwing air combat mission: https://t.co/cRms1ZQ1F1
Joe welcomed FDA’s request to remove prescription opioid medication Opana from the market. https://t.co/XO6cvbRqR5 https://t.co/6TWybQoNKl
WATCH: Joe introduced Dallas Bergl of @inovafcu in Elkhart during @SenateBanking re: role of financial institutions… https://t.co/g3ZSkdbzyA
"Today, Joe met with students from Rushville Consolidated High School’s summer government class @uscapitol. https://t.co/LERTblsaHH"
READ: Joe’s statement on #JamesComey’s testimony before Senate Intel Committee. https://t.co/s2YSxLRxdO
Joe helped pass VA accountability &amp; Whistleblower Protection Act to hold employee wrongdoers at VA accountable for… https://t.co/kib4SGzebp
Joe met w/ Hoosier @RVIANow members to discuss economic benefit RV industry has in Indiana. #RVsMoveAmerica https://t.co/x43UF8BiQD
Joe met with @beefUSA’s Young Cattlemen’s Hoosier Conference participants to discuss important issues for Indiana’s… https://t.co/jHtDDe119J
Joe met with students from Rensselaer Central Middle School @uscapitol. https://t.co/t2VmHWPuDY
"W/ Joe's support, the Vincennes FD was awarded grant to purchase needed radio equipment. https://t.co/X8QZdKZbp7"
Joe received commitment from @SecAFOfficial Wilson that his Sexton Military Suicide Prevention Act is on track to b… https://t.co/Mjyu4bFQRr
"Joe supports the American Law Enforcement Heroes Act, which encourages law enforcement to hire &amp; train veterans as… https://t.co/HDDjnPPSyo"
Joe received a commitment from Dep. Sec. of @HUDgov nom. to dedicate necessary resources for East Chicago residents… https://t.co/yFx6kqVjGl
Joe congratulated 5 Hoosier students who received prestigious @BorenAwards to study abroad in areas critical to US… https://t.co/4KmhEbuRXG
Today is #NationalHigherEducationDay. Joe’s #FoundationForFamilies agenda includes higher education accessibility a… https://t.co/pLJgaN60rG
#GoodNews: @Adams_Eagles is innovating the classroom for students interested in STEM and military careers. https://t.co/YbxOxaqg0f
#ICYMI: Joe is fighting for Hoosier jobs through anti-outsourcing efforts. https://t.co/2iSlDwygro
"Joe stopped in the Grant County Vets’ Service Office to discuss treatment courts, vets issues w/ VSO Mike Houser. https://t.co/MoPIZIsFPj"
#GoodNews @IFD_NEWS awarded Secretary of Defense Freedom Support Award for support of Natl Guard &amp; Reserve employees https://t.co/kGyT45NvO9
.@WestLafayetteIN schools set national standards for working w/ @LifeAtPurdue engineering students. #GoodNews https://t.co/wUWkBSu3yi
#ICYMI: Joe hosted a roundtable w/ @RepJimBanks to discuss ensuring strongest future for Fort Wayne @122fighterwing. https://t.co/0zxnLREIyC
Joe believes we must all work together to address #heroin &amp; #opioid epidemics gripping our families &amp; communities.… https://t.co/YjqZEwrkBg
WATCH: Joe released his #FoundationforFamilies agenda to support caregivers w/ paid family leave. https://t.co/Hl6CfgvpKr
Joe supports federal funding for research to #EndAlzheimers. https://t.co/w6GdjWH3oA
https://t.co/bkd3EVdx3u
Joe &amp; @RepVisclosky recently met with IN #steel industry leaders in NWI to discuss current state of steel industry. https://t.co/N7xO6O5M7n
"#GoodNews: IN again led the nation in #steel production last year,  producing 27% of American-made steel. https://t.co/eEKoG5jZcv"
Congrats and good luck to the two Hoosiers competing in the finals of @ScrippsBee. https://t.co/ylno5HuuvU #spellingbee
#ICYMI: Joe spoke on Senate floor in support of #mentalhealth services for officers like Lebanon’s Taylor Nielsen. https://t.co/dQ6dDS4yZ5
"Thanks for the awesome cut, William. Wasn’t able to make it home to Eddie’s in Mishawaka. –Joe https://t.co/Oacn4YOEX9"
Joe visited @AlzIndiana &amp; spoke w/ Hoosier caregivers about need for paid family &amp; medical leave. https://t.co/aI4NEg9Kcg
"RT @AlzIndiana: Thank you, @SenDonnelly, for consulting with #Hoosier #dementia #caregivers today! We appreciate your support to #ENDALZ. h…"
Great to catch up w/ @INGuardsman MG Carr &amp; @122fighterwing Col. Renwick. We'll continue work supporting 122nd in F… https://t.co/oYPCWRZrcT
"Following discussion on future of @122fighterwing, Joe outlined critical role 122nd plays in FTW and safety &amp; secur… https://t.co/doSJaGyoyk"
"Joe hosted a discussion w/ @RepJimBanks, @INGuardsman MG Carr, Col. Renwick, @mayortomhenry &amp; others re: future of… https://t.co/DR1HCmEYhl"
Joe made a quick stop for an iced coffee at Fortezza Coffee in Fort Wayne. https://t.co/YdLR1hJT24
Joe surveyed the flood damage in Salem this evening with local officials. https://t.co/pagToknyUN
Joe thanked our vets &amp; Gold Star families for their service &amp; paid tribute to servicemembers who gave their lives t… https://t.co/8XK6xM6DK3
Joe delivered remarks at the 149th #MemorialDay ceremony at Crown Hill Cemetery. https://t.co/SzccKfCxkk
Joe interviewed Vietnam-era #veteran who served 28yrs in @USMarineCorps &amp; @USNationalGuard for @librarycongress… https://t.co/AX62PamCcP
On Memorial Day we pause to honor and remember the brave men and women in uniform who lost their lives in service o… https://t.co/6dYqJf9W7o
Congrats to @TakumaSatoRacer for winning the #Indy500 @IndyCar at the @IMS. -Joe
Happy race day at @IMS! #Indy500 https://t.co/7TYWyiaOCL
#ICYMI: Joe and @SenatorToddYoung Law Enforcement Mental Health Act passed the Senate. https://t.co/YBhEfDdF8O
"Joe, @RepVisclosky, @aisisteel &amp; steel industry leaders talked about keeping American steel industry competitive. https://t.co/55idSa5G96"
"Happy 100th Birthday to an incredible leader &amp; former @NotreDame President, the late Fr Hesburgh. His legacy will l… https://t.co/cswzLElj0v"
READ: Joe’s statement after the non-partisan @USCBO released analysis of the American Health Care Act that recently… https://t.co/VCnxkm4n7m
"On @NationalMallNPS, Joe thanked Hoosier veterans traveling w/ the Northeast Indiana Honor Flight for their service… https://t.co/LtUP8ZsZJk"
"Joe met with @SignatureSchool students from Evansville visiting Washington, D.C. https://t.co/In3303uZC1"
"Joe met with the Madison County Chamber of Commerce to discuss the opioid epidemic, workforce development, &amp; improv… https://t.co/5rkMzKML3H"
READ: Joe’s statement on the President’s budget proposal. https://t.co/96nIySkx6E
"We stand with the victims of the Manchester terrorist attack, their friends, and families. We are one with the people of #Manchester. -Joe"
Joe spoke at the @INGuardsman Enlistment Ceremony this weekend to congratulate the enlistees &amp; their families. https://t.co/YGx0baoWf5
#GoodNews: @City_Lafayette firefighters are leading the way in helping their peers receive mental health assistance. https://t.co/Gqt85m24in
We are monitoring the flooding in Salem and across Washington County and stand ready to assist residents.
"In honor of National Red Cross Founder’s Day,  thank you to the @INRedCross for all you do to serve those in need. https://t.co/drTXder0bb"
Joe &amp; @senrobportman’s bipartisan resolution makes 5/18 DoD Laboratory Day and highlights defense labs like IN’s… https://t.co/rXGmscf6Gy
Joe asked @ustreasury Sec. @stevenmnuchin1 how the WH tax reform proposal will help prevent outsourcing of U.S. job… https://t.co/Hwub1Iquak
As POTUS considers @FBI nominees think it's important we have somebody who is independent &amp; w/ significant law enforcement experience. -Joe
"Today, Joe met with Milan Middle School students from Ripley @uscapitol during their visit to Washington, D.C. https://t.co/QVgMqorrVa"
"Joe's staff attended the @NAVSEACrane solar facility ribbon cutting, a project to continue their sustainable energy… https://t.co/I1MMqx0GIV"
#ICYMI: Joe and @SenatorToddYoung Law Enforcement Mental Health and Wellness Act passed the Senate. https://t.co/4LtUVK6nND
Thank you for your support @RickFOP86. https://t.co/5L0QEM5CpE
See Joe’s statement on former-FBI director Robert Mueller being named #SpecialCounsel to oversee the Russia investi… https://t.co/BIhQT1f9F1
It was great seeing the Eastern Greene Schools 8th graders during their visit to D.C. Always be sure to do your… https://t.co/ibjmneQAgH
WATCH LIVE: Joe on @SenateFloor discussing Law Enforcement #MentalHealth legislation. #PoliceWeek #EraseTheStigma https://t.co/rp4BpiROVq
Joe is heading to @SenateFloor to speak about his Law Enforcement Mental Health legislation. #PoliceWeek #EraseTheStigma
"At today’s constituent coffee, Joe met @IvyTechCC students, members of @NUCA_National, and other Hoosiers visiting… https://t.co/fwq2nur9qp"
"As Joe stated earlier, the sharing of classified intel has real world consequences. 
https://t.co/0FJASq73vO https://t.co/CDBoPDaC3S"
It was great to be w/ law enforcement officers and the families of fallen officers at @GLFOP and @indianacops… https://t.co/JYcNTpRpzt
Jill and I wish our friend Sen.@maziehirono a speedy recovery. -Joe
Happy birthday to my friend and former colleague @SenDanCoats. –Joe
@SenToddYoung Joe is hopeful the House will quickly consider &amp; pass the Law Enforcement Mental Health and Wellness… https://t.co/xFWPVlZEEF
Joe &amp; @SenToddYoung’s #mentalhealth legislation for law enforcement officers passed the Senate. #EraseTheStigma… https://t.co/d9h3cwN3xq
See Joe’s statement regarding President Trump sharing classified intel with Russia: https://t.co/tsxcQMyJUB
Joe attended the 36th Annual National Peace Officers Memorial Service today w/ @INSTATEFOP Pres. Owensby. https://t.co/QhFMssvBtG
Joe’s staff attended the LaPorte County Law Enforcement Peace Officer’s Memorial Service to thank those who keep ou… https://t.co/sykrbPzJi9
#GoodNews: @IMPDNews police officer Sergeant Robert Pearsey received the TOP COPS award by NAPO. #PoliceWeek https://t.co/zGYfZTgjAX
#ICYMI: Joe visited w/ retired Hoosier miners to thank them for their advocacy &amp; discussed efforts to help pass a p… https://t.co/tm63e54hPt
"#ICYMI: Joe called on VA to explain plans to close facilities, leave jobs unfilled &amp; how this would impact Hoosier… https://t.co/7X8cVoy6bv"
Joe wants to support working moms w/ paid family &amp; medical leave &amp; #equalpay. #FoundationForFamilies Happy… https://t.co/pZA6FFvmg3
Wishing all Hoosier moms a very happy #MothersDay. -Joe
#ICYMI: Bipartisan legislation Joe supports to protect young athletes from sexual abuse passed out of Senate Judici… https://t.co/HAiVXhpGHZ
Joe wants students planning for college to become financially literate &amp; have access to low interest loans.… https://t.co/dpOSg6rBMH
#ICYMI: Joe believes we need a special prosecutor to handle investigation into Russian meddling in 2016 US election. https://t.co/0DsIomE3pw
Joe thanked hundreds of retired miners in Oakland City for their advocacy &amp; discussed his work to help pass a perma… https://t.co/pp4wzShk0n
Thank you to our military spouses for all that you sacrifice to help protect our country. – Joe… https://t.co/8DLRMh3wKy
Great to meet w/ @IMA1901 &amp; discuss working together to ensure Hoosier workers have necessary skills for good-payin… https://t.co/uySVN4vttR
Joe joined a bipartisan group of senators to introduce a bill that would protect pensions of retired Hoosier miners… https://t.co/rcUhABeX2H
Joe focuses on the need for access to a quality early childhood education in his #FoundationForFamilies agenda:… https://t.co/nicKVZjtZo
"RT @NPWF: ""When our families succeed, so does our economy. And a strong economy strengthens our families."" Yes, @SenDonnelly! https://t.co/…"
Joe spoke w/ #RVindustry Power Breakfast attendees about his continued efforts to help the RV industry prosper. https://t.co/24V41PnbyY
Joe’s #FoundationForFamilies agenda includes paid family &amp; medical leave so workers can bond w/ new child or care f… https://t.co/EetThR0jST
"This morning, Joe met with students from Holy Cross Lutheran School in Indy. https://t.co/WMOaiEaDBz"
It was an honor to meet these Hoosier @PruSpirit Award winners and thank them for volunteering to strengthen our co… https://t.co/fC3xUB1xFU
See Joe’s statement about the firing of FBI Director James Comey: https://t.co/KmHRJZuaIB
#GoodNews: Elkhart’s Nathan Hite recently became the most decorated Scout in @boyscouts history. https://t.co/R2MmuTrill
"Today is #NationalTeacherAppreciationDay, a day to thank our teachers including two outstanding Hoosier teachers, J… https://t.co/f24umOR6n7"
"WATCH: Joe announced his #FoundationforFamilies Agenda, aimed at improving the quality of life for Hoosier families. https://t.co/Qheyrzycon"
Joe met with students from @GeistMontessori during their visit to the @uscapitol. https://t.co/zDk9dQaHk4
Joe helped @EvansvilleFD get an Assistance to Firefighters Grant award from @fema. https://t.co/FzE9We2KhU https://t.co/odyQIMLAw0
"Mr. President, let's fight together for Rexnord and others, and pass my End Outsourcing Act to keep good jobs in In… https://t.co/l802qdYKsv"
#ICYMI: Joe applauded @CrownHillCem &amp; VA reaching agreement that will build cemetery and preserve trees. https://t.co/jJn9KgAg8M
#ICYMI: Joe is the 2nd most bipartisan member in Congress according to the Lugar Center Bipartisan Index. https://t.co/SM5SBpl7Xs
"Small businesses are the cornerstone of our communities across IN. When small business thrives, our communities thr… https://t.co/TqyfCQnecH"
Joe is pleased Dr. Mark Green withdrew his nomination for Secretary of the Army. https://t.co/HBTuLc03pi https://t.co/mQxDBmnMrA
Joe called on #ONDCP to address #opioid &amp; #heroin epidemics &amp; expand access to evidence-based treatment in 2017 nat… https://t.co/l3d6m1nOcj
"Joe supports the #PaycheckFairnessAct, which would empower women to hold employers accountable for pay discriminati… https://t.co/uxAI2k1U9u"
Thank you to all of our firefighters who put their lives on the line every day to protect our communities.… https://t.co/LYfwn5VQW6
Joe will continue fighting to protect 400K Hoosiers insured by HIP2.0 &amp; millions w/ pre-existing conditions who cur… https://t.co/27rtBeBCrp
Joe met with middle school students from Avon’s Kingsway Christian School @uscapitol during their visit to Washingt… https://t.co/JkEwvfAT7S
Joe &amp; @senorrinhatch introduced legislation aimed at reducing suicide rates. #MentalHealthAwarenessMonth https://t.co/8Q1Ehu1O3N
Joe spoke on the Senate floor thanking @Sen_JoeManchin for his leadership fighting for coal miners’ health benefits. https://t.co/TQV3mMsp2h
RT @Sen_JoeManchin: Thank you to my friends @clairecmc @MarkWarner @SenDonnelly @amyklobuchar @SenBobCasey for fighting w/ me on behalf of…
"WATCH: If you need a reminder of the high stakes for Indiana families as GOP pushes #AHCA, listen to Rylin Rodgers. https://t.co/PUBSrWPEX1"
#ICYMI: There are reports of someone scamming Veterans Choice Program users. The correct VCP number is 866-606-8198. https://t.co/zkyzpP5J9X
#ICYMI: Joe voted against the nomination of Jay Clayton for SEC Chair. Read Joe’s op-ed with @SenWarren here:… https://t.co/H4N8ulB7xP
"Great to meet w/ @jdouglas4, President of @IMS. Looking forward to the 101st running of #Indy500 on 5/28. –Joe https://t.co/ju6xjoQmaD"
Joe met with students from @MBHS_news today @uscapitol. https://t.co/vTdIhvgHtI
"After several successful legislative efforts, Joe continues to push to improve mental health care. #EndtheStigma… https://t.co/vkmcJN6Rpz"
"Joe praised funding for CARA, miners’ health care that were included in bipartisan budget agreement. https://t.co/Ir8Lxa9ZH7"
