"@SenateFinance Now, in #Michigan, 97 percent of kids can see a doctor – that’s the highest number ever!"
"@SenateFinance Before #CHIP, too many hardworking families in Michigan couldn’t afford to take their children to a… https://t.co/0GV1DrTkBW"
@SenateFinance You can tune in and watch live here: https://t.co/Qua5KHSvNf
Speaking now in @SenateFinance about need to extend funding for Children's Health Insurance Program before it expires at end of the month!
The #MotorCity gives a warm welcome to the @USMC for @Marine_Week! Thank you for sharing this week with us &amp; for al… https://t.co/IqV0hmMry2
"Last week, I had another chance to see the beauty of MI’s #UP &amp; today residents celebrate a day just for them. Happ… https://t.co/rp4Z4xHLen"
Thinking of all the kids who went #BacktoSchool today and wishing them the best. This is me when I started first gr… https://t.co/RvbKkMjVd0
"Everything you need to know as hunting season starts in #Michigan! @freep
https://t.co/g8mJRwzTYh"
"Glad Battle Creek opened its doors to a family from #Houston who fled #Harvey.  Michigan welcomes you! @bcenquirer
 https://t.co/LfJvHapQVM"
"Impressive &amp; innovative urban ag at work in Grand Rapids! In #FarmBill18, I will support MI's urban farmers who are… https://t.co/vcYvtVrIRC"
Skilled trades training is both a great opportunity and an urgent need for our businesses in Michigan. Our growing… https://t.co/AA5D6hJQVX
Wrong for admin to pull rug out from under children &amp; young people who came to America undocumented through no fault of their own. #DACA
Great to be with so many MI working men &amp; women who have joined a union to fight for good paying jobs. Thx for crea… https://t.co/m41uTkNRhA
Best of luck to @MSU_Football as the #Spartans kick off their season today against the #Falcons! Go Green!
Great lunch at Rare Earth Cafe in #Ishpeming. The quiche was amazing! https://t.co/Z9CXHmAAi9
Another great discussion at @NorthernMichU on ways to encourage career/tech and skilled trades jobs. UP teamwork sh… https://t.co/LtgFRZXEOD
Go @NorthernMichU Baja Team! Impressive work! https://t.co/oXpa4LraVJ
"Congrats to the 4 exceptional @michiganstateu researchers on this list. The future of ag looks extra bright today!
https://t.co/E90RHOfvA8"
Thanks Mike for the tour of @IshpemingFarm in #Ishpeming! Great job! https://t.co/oPVjUoWIvT
"Thx to Great Lakes funding and community partners, Deer Lake has a clean bill of health! Celebrating this successfu… https://t.co/XQReDJBOwN"
Stopped in #Munising at Muldoons Pasties &amp; Gifts- U.P. People's Choice Award winner for their delicious pasties and… https://t.co/7Rbxdo0L2h
Wishing all our Muslim friends Eid Al-Adha Mubarak. Hope your celebrations are filled with happiness and love!
.@picturedrockcru is breathtakingly beautiful. Thanks to John and his team for over 50 years of excellence! https://t.co/4Mbgk67Z0I
Can't beat VanLandschoot &amp; Sons' white fish! 5 generations of hard work and success in #Munising! https://t.co/BrlmX2Ma5b
Sun rising on Lake Superior. Another #PureMichigan day! https://t.co/kMbthl9Tor
Important new effort from @MIManufacturers! Great opportunity for students to learn and develop important skills.  https://t.co/nJKExusyRr
Going forward and getting skills isn’t always about a 4 year degree. MI has a lot of great jobs in skilled trades &amp;… https://t.co/YAS3qoiot2
Talked to biz leaders &amp; educators + met awesome students at @KentISD. From robotics to IT - young people are learni… https://t.co/MTHsZy6hSx
It's important that young people in Michigan know they can get a great job in the skilled trades. Talked to… https://t.co/adsMThrTYI
Just had a great discussion on need for more skilled workers at @MILaborers training center in Perry! Awesome place! https://t.co/0k4axxUeoV
Thanks to all the Michigan businesses who are stepping up to help those affected by #Harvey! https://t.co/taEPPKVbjm
I'll be introducing legislation on workforce development in the fall. Stay tuned for more!
Thank you to all the folks I talked to this morning who are already doing a great job getting the word out! https://t.co/NzIMV9RudV
"We need to talk to young people about great choices other than 4 year college - so many great jobs in welding, IT, as electricians and more!"
Many businesses across Michigan are hiring for good paying jobs but can't find workers with the right skills!
Started today talking with business and labor leaders as well as parents and educators at the Detroit Electrical In… https://t.co/rr7fiEiXQ9
Spartans and everyone in MI will remember Coach Heathcote's passion for MSU basketball and for life. My prayers go… https://t.co/b6un7ay4B3
"Congratulations and thanks to each of our 2017 Shining Light winners!
https://t.co/Q6ajVVu0wR"
"I love it! Shawarma Law! And it tastes delicious!
https://t.co/slkZV2fuDX"
"Congrats to @DetroitPAL Tim Richey on receiving the Unsung Hero Award. Thanks, Tim, for your inspiring work in our… https://t.co/EFZMXdyXTu"
Thx Katmandu for a great evening of Bob Seger music in #Fenton! Can't wait to hear @BobSeger at the @ThePalace! https://t.co/lJ4wgiuzAR
Precision Tooling Systems manufactures tools used to make parts for everything from cars to washing machines! TY To… https://t.co/wtsU7NvkMW
It’s exciting to see so many high school graduates choosing @Michigan_State and other great Michigan schools to fur… https://t.co/ytyJVq8lxc
My deepest condolences go to the loved ones of @USNavy sailor Kenneth Smith. He is a true hero who dedicated his li… https://t.co/IiakJ1A2qN
Thanks to the team at Sam &amp; Ruby's The Corner Deli in Vassar. What a great lunch! https://t.co/1Akc0xq4vc
"Thx to Great Lakes funding and amazing teamwork, the Rock Ramp project is another reason for families and anglers t… https://t.co/X2oVmAuAKr"
Scott &amp; Lisa Coyer have the beautiful @coyercandleco in #Midland filled w/ great scents like McIntosh Apple which I… https://t.co/UCCxJ1FASV
Warmest congratulations to Julie and her team at @serendipityrdmi on their first day of business in downtown… https://t.co/a6SgfsjXsr
I had the pleasure of meeting Nick and Heather from Heather 'n Holly and seeing their sweet #Midland store! https://t.co/W8qBX7W9XC
Renee at @liveoakcoffeemi showed me around her wonderful shop that also hosts craft classes for the #Midland commun… https://t.co/xGruuEIT9s
In @CityofTC shining a light on the rebirth of the Boardman River. What an amazing team effort! https://t.co/cWWtDli4yR
"RT @9and10News: During a stop in #NoMI yesterday, @SenStabenow received a special award from the #MI Association of #Broadcasters https://t…"
I am truly humbled and honored to accept the Lifetime of Distinguished Public Service Award from @MichBroadcaster. https://t.co/Yz5EfxEYH7
Thanks @BorgWarner for having us today as we met with #Cadillac manufacturers to hear how we can continue to improv… https://t.co/uj5qlgvztr
Just had the chance to take an amazing tour of the Biewer Lumber Company's #McBain facility with Aaron and team. Th… https://t.co/PdqOUYxIoe
"Great to meet with community &amp; business leaders from #Clare, #Gladwin &amp; #Harrison. Thanks to the Mid-Michigan Commu… https://t.co/BFl4wYbeQR"
"Today, we get to witness a rare opportunity to see a solar eclipse cover Michigan. See specific times here! https://t.co/Jl8nykJLjB"
"Happy 100 years Team Selfridge! Great to see the F35 here with pilot Tim ""Check"" Six. We're ready to give them a ho… https://t.co/dlJQO12ue2"
100 years at #Selfridge proudly includes training our Tuskegee Airmen! https://t.co/AcosJCXvj5
Warm wishes to USFS Chief Tom Tidwell after 40 yrs on the job! Thanks for your deep-rooted dedication to our forests https://t.co/S1q6Yhjq8g
"Time is of the essence to implement a solution &amp; take steps to stop Asian carp from reaching our Great Lakes. 
https://t.co/pVNiaTd9Zi"
"Now, we have proof that it went through the Brandon Road Lock and Dam."
This is the first time that a live Silver carp has been found this close to Lake Michigan.
Wishing Leah Clapper from Saline the best of luck in the upcoming P&amp;G Championships. Michigan is very proud of you!… https://t.co/aOUvvl64rh
Good luck to the Grosse Pointe Woods-Shores team at the @LittleLeague World Series tonight! We're rooting for you!
"A modernization to NAFTA is long overdue for Michigan’s economy. The goal must be to export our products, not our j… https://t.co/UmNBe1hM9i"
Excited to see @ArethaFranklin will be investing in the Motor City with plans to open a nightclub! https://t.co/NLAdp4yMKh @MLive
"RT @MIAFLCIO: AMEN &gt;&gt; 'Export our products, not our jobs,' says @SenStabenow on NAFTA negotiations https://t.co/8yyNK2lUWB"
RT @DetNewsOpinion: .@SenStabenow: Stop Asian carp for good https://t.co/eN1hepZypK via @detroitnews
"On behalf of our Great Lakes, we need to move quickly to find a permanent solution to stop Asian carp https://t.co/lK9eHXzZWN @detroitnews"
Saddened by the passing of my former colleague Vern Ehlers. He was respected on both sides of the aisle and represented W MI w/ distinction
Pres. Trump's continued refusal to condemn Nazis and white supremacists isn't a partisan issue. It's a moral issue. Hate is hate. Period.
"If the Trump Administration continues to play games with our health insurance, premiums could skyrocket by 20 perce… https://t.co/hdFQM2TIGk"
@wzzm13 Too many MI families &amp; seniors are burdened by high costs of prescription drugs making it harder to get the… https://t.co/BAlb7ZJ5Vg
I announced two bills to crack down on the skyrocketing cost of prescription drugs and increase drug price transpar… https://t.co/DwHL8Tihor
"Congratulations to my dear friend, David Hollister, on receiving this special distinction from the City of Lansing. https://t.co/P6qiUGBt2H"
#ThisIsMuskegon contest showcases creativity and the true spirit of Muskegon. Congrats to all the talented winners! https://t.co/eSmWm5vJzl
"Great news for Pontiac! 

via @detroitnews: Pontiac celebrates as firm breaks ground on new HQ https://t.co/EX1EEO7dQO"
I love this picture of the Lake Michigan shoreline. Our state holds so much beauty! https://t.co/O7nv6NDZDl
"When we help businesses thrive, we create jobs &amp; a stronger MI economy. Read about my Growing Small Businesses Act https://t.co/meFA9kHMdf"
The violence in #Charlottesville is horrifying and does not represent who we are as Americans. We stand united against racism and hatred.
"Sending wishes for an incredible birthday to my friend and colleague in Congress, @RepDanKildee!"
We need to stop any proposal to eliminate this crucial funding.
The projects funded by the GLRI lead to increased economic activity and invest in the health of our lakes and waterways.
"In 2010, I authored the GLRI in an effort to protect our lakes and our Michigan way of life."
"This month, I’m traveling across MI to highlight projects that make GLRI a success like the Kalamazoo Nature Center. https://t.co/R5R5bgRqva"
"RT @MIAFLCIO: ""Health care is a basic human right for people; it's not a privilege."" -@SenStabenow https://t.co/WEnx9zIHjw"
I have visited over 100 small businesses in MI &amp; each visit continues to inspire me. These businesses truly are the… https://t.co/PEt3fCvbag
RT @detroitnews: .@SenStabenow: Proposal that would allow older Americans to buy in to Medicare at age 55 would also be a “win-win” https:/…
Krysta McGee and her husband Mark are a couple of Food Network stars serving delicious food at @marksplace13 in Eat… https://t.co/D4KEC32VhN
Great visit with Mari Lin Pettit- owner of Pettit Hardware. This Eaton Rapids landmark has been in her family for f… https://t.co/IKs4uypOWl
...that’s why I introduced legislation to allow people to buy into Medicare before age 65!  Read more here: https://t.co/EjxA7bqWiC
People between the ages of 55-64 often have higher health care costs and more health problems…
Great visit with Dr. Beth Polito and her handcrafted @cielo_soaps in the @VillageofDundee https://t.co/twx8vKBHXi
"Mima, her husband Dave, and their architectural firm in the @VillageofDundee create and customize beautiful buildin… https://t.co/ICNODYHQlT"
Uncle Lyle's Tavern and Grill is the place to go for great food and entertainment! @VillageofDundee https://t.co/GnKxYDTJfe
Thanks Denny and the Dundee DDA for showing me around the @VillageofDundee. Shopping small at Swan Creek Candle! https://t.co/ggdqgnb8XV
Continuing my small business tour in @ciwaynemi at Icon Computer Solutions. Brian and his team are expert technicia… https://t.co/MuDaCBxbGK
Thank you Karma Coffee Shop and Kitchen owners Jennifer and David for the delicious homemade quiche!… https://t.co/lx2C9WkbU8
This important part of our Flint package makes sure the long term needs of children and families are addressed in F… https://t.co/ko5RwfWMMT
Wonderful to see another story of a great small business expanding their reach! Congrats @peacockroom! https://t.co/kPlEEYxVYv
Another hidden gem in the UP; the Canyon Falls and Gorge is filled with beautiful trails and scenic views of the ri… https://t.co/D2W5nAgsce
"For those of us that enjoy hops, there is no shortage of places to go in Michigan for National IPA Day! https://t.co/98IhtnZ3kU"
"Whether you're working in a factory or on a farm, you deserve to have the confidence in knowing that our country wo… https://t.co/EZTOI1BufR"
Excited to see our Chapel Rock will make it in to pockets &amp; purses everywhere as a part of the America the Beautifu… https://t.co/pd0X2HKHKH
It’s great to hear the USS Gerald Ford is already hitting important milestones less than a week after its commissio… https://t.co/KTWx2CNsyS
This crucial funding secured in last year’s Flint agreement will help doctors monitor the health of people exposed… https://t.co/BTSMFKPCFL
We need to invest in Michigan manufacturing by stopping outsourcing and implementing strong Buy American laws. https://t.co/0ztKFE9lqd
Good that Pre. signed the Russia sanctions bill that passed Senate 98-2. Need to stand strong against countries that aren't our friends!
Important news that the Admin just announced a major disaster declaration for Michigan. Will help families hurt by recent severe flooding.
Joining @SenDonnelly @SenatorBaldwin @SenBobCasey @Senatedems to introduce A Better Deal on Trade &amp; Jobs. Watch here https://t.co/ZA1XVoJ6yF
The Poe Lock is critical to our economy and national security. This upgrade is important until we can construct ano… https://t.co/Q0BWBvoZrb
So glad I had the chance be a part of the festival over the weekend -- what a great way to continue the celebration… https://t.co/GUOLCmYg3H
Dr. John Dorsey has shown remarkable dedication to his profession and to our communities. He truly is an inspiratio… https://t.co/Tme4AEuVnZ
"Warmest congratulations to our own Katie Preston, from Bridgman, on finishing in the top 5 of the #MissAmerica Outs… https://t.co/JoEF9BsK1P"
It was an honor to witness Specialist James McCloughan receive the Medal of Honor. Thank you for your dedication an… https://t.co/43xpXaOncn
Beautiful Medal of Honor ceremony for Jim McCloughan. Michigan is so proud ! https://t.co/3YZmfQTcnd
"What an honor to see Jim ""Doc"" McCloughan receive the Medal of Honor. We all thank this American hero for his servi… https://t.co/Fi1bfv2yFI"
"RT @PeterZampa: Medal of Honor ceremony for James McCloughan set to begin shortly. @SecShulkin, Sec Mattis, @SenStabenow among those in att…"
"Many people don’t realize all the beautiful scenery &amp; exciting activities MI has to offer, especially in the UP! 
https://t.co/OJAcmYOEay"
Excited to be on the way to the White House to see Specialist James McCloughan receive the Medal of Honor he deserves!
I had the chance to visit Golden Shoes on my T. City small business tour. So great to see them as finalists for Ret… https://t.co/1NhvwYDzmO
This partnership is a great opportunity for Michigan workers to get the skills training needed for a good-paying jo… https://t.co/ExjhGc8nUQ
"Last weekend, I continued my small business tour in Coldwater and stopped by @BellsBrewery in Kalamazoo! https://t.co/seG1do12rr"
Thank you to @uscoastguard and all who have served us over the years. We are grateful you have our back! https://t.co/hXg6SKDpja
Fun to jam with Sweet Justice at the Coast Guard picnic. You guys sound great! https://t.co/yzlg54jf2Q
Saturday at @Bellsbrewery. Beautiful day- great beer! https://t.co/0J3b4V2Z7X
Gorgeous arrangements by Kelly and her team at the Tilted Tulip in Coldwater! https://t.co/0ezThRWmye
"Beautiful dresses at @lilahsbridal in Coldwater. Thank you, Dannielle for showing me around! https://t.co/rv0UWU4umG"
Jeannie's Diner in Coldwater is the place to go for good food and the famous diner train! https://t.co/ICKvv6lXcA
Congratulations to Clemens Food on your new processing facility in Coldwater that will create hundreds of jobs!… https://t.co/vfYfsXPRiM
Happy 150th Anniversary to our historic city of Montague! See a full list of celebrations here --&gt; https://t.co/NokFjPhXNk
Great news! The Army Corps just announced it will release critical study in fight against Asian carp. Trump admin had been holding this up!
Honored to have played a role in ensuring this American hero finally receives  recognition he deserves. Read more: https://t.co/Pvhk2ZCl4X
"So honored to meet w/ South Haven native Specialist Jim McCloughan, who receives the Medal of Honor Monday for his… https://t.co/MOktIyRwUz"
"RT @AARPMichigan: Thank you @SenStabenow for voting NO on ""skinny"" health bill. We will remember + inform all 1.4 million AARP Michigan mem…"
It's now important that we work on a bipartisan basis to find solutions that lower health care costs and improve care.
"Because of these actions, the Republican attempts to take away health care from millions of Americans failed tonight!"
"Over the past few months, so many people in Michigan shared their stories, made phone calls, and spoke out against the Republican bill."
"RT @ASlavitt: BREAKING: CBO Score is out! Premiums will be 20% higher in EVERY year 2018-2026 under Senate Freedom bill.

https://t.co/aUF1…"
Every person deserves to know what we are voting on tonight. Republicans need to show us their health care bill!
We as Democrats want to work together to lower costs - especially the outrageous cost of prescription drugs!
Every single Republican health care proposal leads to higher costs and less coverage!
"If you have cancer, you might not be able to get the full treatments you need because of this bill."
"If your mom has Alzheimer's, she might lose her care because of this bill."
"For Republicans, this is a political exercise. But for Michigan families, health care is personal. https://t.co/FWVWxiqvcW"
RT @SSWorks: 3/5 seniors in MI get their nursing home care through Medicaid. They have a right to know what's in the bill- @SenStabenow #Tr…
Why can't we do this on health care? It's after 8pm and we still haven't seen the Republican bill that they want to vote on tonight!
Tonight the Senate overwhelmingly passed new Russia sanctions 98-2. Shows we can work together to get things done!
"100 years ago, @Ford innovation took a new shape in the Model TT truck and forever changed agriculture and manufact… https://t.co/00D7XL4aEp"
Exciting to see a new mural in the works to honor four incredible leaders as the latest addition to Muskegon’s Nels… https://t.co/X6jic2rLpL
"Although today brings a lot of uncertainty, one thing is for sure -- the fight to #ProtectOurCare in Michigan is far from over!"
Latest Republican health care plan is same bad news - drives up costs for Michigan families and makes sure fewer pe… https://t.co/gzTNjugSPn
Proud to see Ann Arbor recognized as the most educated city in the U.S. &amp; Lansing as #14! They play a big part in m… https://t.co/J6qbWmT6o6
"Sending heartfelt condolences to friends and loved ones of Martin Buth, who spent his entire life contributing to t… https://t.co/GqsV1THW20"
What a great learning opportunity for my fellow @Michigan4H -ers. Congrats and enjoy the conference this fall! https://t.co/vsRaONtEWL
So great to meet @JDRF #Type1diabetes advocates during Children's Congress today! https://t.co/VawNPdZoBr
@RonWyden is right; bipartisanship works best. We need to focus on real problems &amp; continue to fight for people in MI &amp; across the country.
We are looking at a situation where everything coming before us will take away health care from millions of people… https://t.co/vwIUYsWne6
RT @farmcreditmid: Thanks @SenStabenow for a wonderful breakfast with women leaders from the @farmcredit! #farmcredit https://t.co/cQdrSYOk…
Spoke at Capitol today on behalf of #Michigan families who will be hurt by #Trumpcare. Deeply disturbing that R’s v… https://t.co/wErKJi7Ncj
RT @AARPMichigan: Thank you @SenStabenow for standing up for Michiganders &amp; voting NO to proceed with the bad health care bill.
RT @SenateDems: We are LIVE following the #healthcare vote - tune in for the latest and what it means for you &amp; your family: https://t.co/r…
"Health care is a basic human right. We ask our GOP colleagues to work with us to lower drug costs &amp; increase coverage, not take it away."
Voting to proceed on the Republican health care bill today is a vote to take away critical health care for families all across Michigan.
"Thank you to our precious @LittleLobbyists, their families &amp; to all of you who continue to speak up against the Rep… https://t.co/CZ7BHVaLWq"
RT @SenateDems: Want to see what it looks like to stand up for #healthcare from the eyes of a child? @LittleLobbyists stormed the Capitol--…
RT @LittleLobbyists: Introducing ourselves to @SenStabenow and @timkaine and telling our stories on #FacebookLIVE - check it out! https://t…
"RT @LittleLobbyists: ""We're fighting for you."" - thank you @SenStabenow and @ChrisVanHollen https://t.co/J2lvUENqNV"
About to join. Tune in! #ProtectOurCare https://t.co/zEdDZ6pfxw
@SenGaryPeters &amp; I requested a mtg w/Trump to discuss supporting manufacturers. Let's work to end outsourcing &amp; imp… https://t.co/kNqYjkk2Zg
Wishing the great city of Detroit a very happy 316th birthday! https://t.co/aZIZGQKYFI
RT @SenateDems: We believe government should work for you &amp; for the millions of hard working Americans who just need #ABetterDeal. Here's o…
Great fun to meet Nichole and Jordan at @MissionTable in #traversecity Congrats! https://t.co/tdSjXdwL7D
An impt step to stopping Asian carp from entering our Great Lakes. Army corps needs to release critical report ASAP! https://t.co/ASlweM6fBF
I talked to @petoskeynews about being laser focused on protecting our Great Lakes &amp; health care for our MI families https://t.co/zywNmmV8Jk
The #NationalBabyFoodFestival is helping celebrate the 90th birthday of @GerberLife &amp; its contributions to our Frem… https://t.co/s1aPc5idWb
Congrats to Mike Conrad from Royal Oak High School on being selected to participate in @cspan educators’ conference… https://t.co/H8C1XKSM8E
.@WorkshopBrewing - great vision and great beer! Thanks Pete! https://t.co/peSOZ1rHqJ
What an inspiring place to grow ideas and turn the entrepreneurial dreams of Michigan women into reality! https://t.co/XERDnLpNYX
Continuing my small business tour at @GoldenShoesTC. Family-owned and operated for 100 years! @TCChamber @DowntownTC https://t.co/UnvftgQF1D
Great visit with Cherry Republic owner Bob Sutherland in @DowntownTC! @TCChamber https://t.co/2RCLXVRERf
"Thank you Denise, Mike and @TCChamber for a great meal at the @GTPie in downtown Traverse City! https://t.co/XgaKJPev5y"
@realDonaldTrump That’s why @SenGaryPeters and I are requesting a meeting with @realDonaldTrump today.  Read our in… https://t.co/LmxEZmaWgX
"I want to work with @RealDonaldTrump to bring jobs home, support our manufacturers, and end outsourcing that hurts #Michigan workers."
RT if you agree that our talented workers and businesses IN THIS COUNTRY can make great products! #MadeInAmerica
"President Trump should lead by example and make all of his products in this country, not in China! https://t.co/06gXtVrH03"
Why are Trump shirts made in Bangladesh when we could make them in this country? https://t.co/EcZ6GsFrHe
"Trump made a promise to Michigan workers that he would bring jobs home. If he’s serious, he should start with his own companies!"
My prayers go out to @SenJohnMcCain and his family. He's a fighter and I wish him the best.
No surprise: repeal is an even worse deal for Michigan families. Premiums would skyrocket and many would lose healt… https://t.co/8mY7gUFFaK
We take a lot of pride in our MI craft beer. The 20th Summer Beer Festival celebrates the industry &amp; its milestones! https://t.co/8YcKC2CqNs
Glad to see pieces of @MSU_Basketball history from the Breslin Student Events Center finding good #Spartan homes! https://t.co/tCM5XofGu7
Great to talk to @bustle about health care and what it's like to serve in the Senate. Watch the interview here! https://t.co/sbeOfhvza3
"Congrats to Rod Kallgren from Dearborn on his eight holes-in-one in dedication to his six sons, wife &amp; even himself! https://t.co/bOsd0Jr3bB"
"Great to welcome Shelley and Laura from Milton Manufacturing, a terrific women owned business #MadeInDetroit https://t.co/7MiW9hNF10"
Thank you to everyone who has engaged in our fight to save our health care! You are awesome! #ProtectOurCare
Congrats to the 19 @crainsdetroit Health Care Heroes winners. Michigan is proud of your dedication and contribution… https://t.co/SIIN6GwkMb
"I grew up in Clare, Michigan, a small town that relies on a rural hospital. The GOP health care bill threatens town… https://t.co/IfVsTLYQ17"
Such breathtaking views earlier this morning from the latest northern lights show over the Mackinac Bridge! https://t.co/ebPwJyfIXC
